URL,Title,Price,Shipping,Dynamic Attribute 1,Dynamic Attribute 2,Dynamic Attribute 3
https://www.ebay.com/itm/Evenflo-Mega-Splash-Exersaucer-Fish-with-Spinning-Rings-Toy-Replacement-Part/163795218451?hash=item2622f4b013:g:ulEAAOSwok1dM5zl,Evenflo Mega Splash Exersaucer Fish with Spinning Rings Toy Replacement Part,$5.99,$4.50,Brand: Evenflo,Color: Multicolor,Age: Infant
https://www.ebay.com/itm/Evenflo-Exersaucer-Replacement-Metal-5-x-1-25-Spring-Part-Piece-Baby/113768192813?hash=item1a7d1cdb2d:g:yBAAAOSwHsRYD3OV,"Evenflo Exersaucer Replacement Metal 5” x 1.25"" Spring Part Piece Baby",$9.95,Free,Brand: Evenflo,N/A,N/A
https://www.ebay.com/c/17017345287,Baby Einstein 10455 Neptunes Ocean Discovery Adjustable Rotating Jumper Blue,$75.87,Free,Brand: Baby Einstein,Color: Blue,N/A
https://www.ebay.com/itm/Baby-Einstein-Exersaucer-Discover-Play-Activity-Replacement-Part-Animals-Book/173937737559?hash=item287f7f3f57:g:OxoAAOSwgGldCUNs,Baby Einstein Exersaucer Discover Play Activity Replacement Part Animals Book,$7.95,Free,Brand: Baby Einstein,Color: Multicolor,N/A
https://www.ebay.com/itm/Evenflo-Ultra-Exersaucer-Castle-Theme-Replacement-Part-Folding-Leg-adjustable-ht/254187455808?hash=item3b2ec0c540:g:yT0AAOSwKVVcpL3g,Evenflo Ultra Exersaucer Castle Theme Replacement Part~Folding Leg-adjustable ht,$6.74,$6.00,Brand: Evenflo,N/A,N/A
https://www.ebay.com/itm/Baby-Foldable-Wooden-Play-Gym-3-Theething-Gym-Toys-Frame-Activity-White/183915169616?hash=item2ad232c750:g:WQcAAOSw4RNdTbTt,Baby Foldable Wooden Play Gym & 3 Theething Gym Toys Frame Activity White,$16.79,Free,Brand: Unbranded,Color: White,N/A
https://www.ebay.com/p/21023853420?iid=293237811415&rt=nc,Tiny Love Meadow Days Here I Grow 4-in-1 Baby Walker and Mobile Activity Center,$67.45,Free,Brand: Tiny Love,Age: Toddler,N/A
https://www.ebay.com/p/1003474397?iid=183940489746&rt=nc,1993 Fisher Price Crib Activity Center Baby Toy Busy Box #1175 Straps Vintage,$10.55,$10.98,Brand: Fisher-Price,Color: Multicolor,N/A
https://www.ebay.com/itm/Evenflo-Exersaucer-Replacement-Part-Toy-Triple-Fun-Fish-Animals-Spinning-Rattles/123905247686?hash=item1cd95409c6:g:xcoAAOSwELpdeuDb,Evenflo Exersaucer Replacement Part Toy Triple Fun Fish Animals Spinning Rattles,$9.99,$5.99,Brand: Evenflo,Color: Yellow,Age: Infant
https://www.ebay.com/itm/Fisher-Price-First-Steps-Jumperoo-Seat-Cover-Replacement-Part-BFB21/223639493244?hash=item3411f3da7c:g:vikAAOSwAVldZQRN,Fisher Price First Steps Jumperoo Seat Cover Replacement  Part BFB21,$15.00,$4.25,Brand: Fisher-Price,N/A,N/A
https://www.ebay.com/itm/Lot-of-4-Stabilizers-for-Evenflo-World-Explorer-Exersaucer-Replacement-Part/283586975452?hash=item420719d6dc:g:wK4AAOSwkwdc~I1L,Lot of 4 Stabilizers for Evenflo World Explorer Exersaucer Replacement Part,$3.99,$3.70,Brand: Evenflo,Color: Red,Age: Infant
https://www.ebay.com/itm/Brand-New-Exersaucer-Gleeful-Sea/153621779283?hash=item23c4925353:g:j14AAOSwy1ddPPaP,Brand New ! Exersaucer Gleeful Sea ,$99.99,$19.99,N/A,N/A,N/A
https://www.ebay.com/itm/Portable-Baby-Playpen-Outdoor-Indoor-Ball-Pool-Toddlers-Play-Tent-Three-Colors/223616159916?hash=item34108fd0ac:m:mCbS8v64JV7wOiq8ZCIOARw&var=522352451086,Portable Baby Playpen Outdoor Indoor Ball Pool Toddlers Play Tent Three Colors,$20.11,Free,Color: Blue,Age: Toddler,N/A
https://www.ebay.com/p/21027542833?iid=233203591712&rt=nc,Evenflo ExerSaucer Baby Gear Baby Activity Center Toy Fun Learn Mega Splash,$66.04,Free,Brand: Evenflo,Color: Blue,Age: Infant
https://www.ebay.com/itm/Evenflo-Ultra-Exersaucer-Castle-Theme-Sounds-Lights-Toy-Replacement-Part/173843851486?hash=item2879e6a8de:g:2wAAAOSwAn9ckklP,Evenflo Ultra Exersaucer Castle Theme Sounds Lights Toy Replacement Part,$13.77,Free,Brand: Evenflo,Color: Green,Age: Infant
https://www.ebay.com/itm/Evenflo-Smart-Steps-ABC-123-Exersaucer-ABC-Puppy-Rattle-Toy-Replacement-Part/254263409129?hash=item3b3347b9e9:g:ig4AAOSwPdNdAxrn,Evenflo Smart Steps ABC/123 Exersaucer ABC Puppy Rattle Toy Replacement Part,$5.99,$4.39,Brand: Evenflo,Age: Infant,N/A
https://www.ebay.com/itm/Tiny-Love-WA077ETT-Meadow-Days-Here-Grow-4-in-1-Baby-Activity-Center-Green/283538775127?hash=item42043a5c57:g:U2UAAOSwffBdH53E,Tiny Love WA077ETT Meadow Days Here Grow 4-in-1 Baby Activity Center Green,$44.57,Free,Brand: Tiny Love,Color: Green,N/A
https://www.ebay.com/itm/Evenflo-Triple-Fun-Fish-Pond-Exersaucer-Flower-Mirror-Toy-Replacement-Part/173887481309?hash=item287c8065dd:g:j7QAAOSw9J9cxfkL,Evenflo Triple Fun Fish Pond Exersaucer Flower Mirror Toy Replacement Part,$9.99,Free,Brand: Evenflo,Color: Multicolor,Age: Infant
https://www.ebay.com/itm/Evenflo-Exersaucer-Switch-A-Roo-Baby-Toy-Replacement-Buzzing-Bumble-Bee-Beehive/113816048824?hash=item1a7ff714b8:g:ZdkAAOSwv9ldKQYv,Evenflo Exersaucer Switch A Roo Baby Toy Replacement Buzzing Bumble Bee Beehive,$10.50,Free,Brand: Evenflo,Color: Brown,Age: Infant
https://www.ebay.com/itm/Evenflo-Jump-Learn-Exersaucer-Jam-Session-Music-Note-Toy-Replacement-Part/183851979181?hash=item2ace6e91ad:g:O3IAAOSwgY5dCPxL,Evenflo Jump & Learn Exersaucer Jam Session Music Note Toy Replacement Part,$7.99,Free,Brand: Evenflo,Color: Red,Age: Infant
https://www.ebay.com/itm/Baby-Einstein-Around-the-World-Exersaucer-Red-Leg-Replacement-Part/172802542207?hash=item283bd58a7f:g:SjYAAOSwskFZgM7e,Baby Einstein Around the World Exersaucer Red Leg Replacement Part,$8.99,Free,Brand: Baby Einstein,Color: Red,Age: Infant
https://www.ebay.com/itm/Baby-Einstein-Exersaucer-Discover-Play-Activity-Spinner-Toy-Replacement-Part/183887956196?hash=item2ad09388e4:g:yKcAAOSw4aRdCUPl,Baby Einstein Exersaucer Discover Play Activity Spinner Toy Replacement Part,$7.95,Free,Brand: Baby Einstein,N/A,N/A
https://www.ebay.com/itm/Baby-Activity-Center-Development-For-Games-and-Learning-Camping-with-Friends/153657832625?hash=item23c6b874b1:g:x1cAAOSwTOZckNji,Baby Activity Center Development For Games and Learning - Camping with Friends,$97.50,Free,Brand: Disney,Color: Multicolor,N/A
https://www.ebay.com/itm/Evenflo-Mega-Jungle-Safari-Exersaucer-Set-of-3-Springs-Replacement-Part/173921562701?hash=item287e88704d:g:DPUAAOSwtkVc9EjU,Evenflo Mega Jungle Safari Exersaucer Set of 3 Springs Replacement Part,$15.99,Free,Brand: Evenflo,Color: Silver,Age: Infant
https://www.ebay.com/itm/Evenflo-Exersaucer-Lion-Tiger-Baby-Toy-Replacement-Part-Switch-A-Roo/264448873179?hash=item3d926192db:g:rScAAOSwEWldapZN,Evenflo Exersaucer Lion Tiger Baby Toy Replacement Part Switch A Roo,$9.99,Free,Brand: Evenflo,N/A,N/A
https://www.ebay.com/itm/Baby-Einstein-Around-the-World-Exersaucer-Pandas-Toy-Replacement-Part/172365346420?hash=item2821c67674:g:JY0AAOSwpLNX9mf3,Baby Einstein Around the World Exersaucer Pandas Toy  Replacement Part,$8.77,Free,Brand: Baby Einstein,Color: Red,Age: Infant
https://www.ebay.com/itm/Summer-Infant-Activity-Booster-Chair-Seat-Replacement-Set-snap-2-Tray-Toys/273789880383?hash=item3fbf26083f:g:ScUAAOSwUR9copHV,Summer Infant Activity Booster Chair Seat Replacement Set snap 2 Tray Toys,$12.95,Free,Brand: Summer Infant,Age: Infant,N/A
https://www.ebay.com/itm/Evenflo-Sweet-Tea-Party-Exersaucer-Cake-Toy-Replacement-Part/173919458331?hash=item287e68541b:g:4kwAAOSw56Vc8VVh,Evenflo Sweet Tea Party Exersaucer Cake Toy Replacement Part,$9.88,Free,Brand: Evenflo,Color: Purple,Age: Infant
https://www.ebay.com/itm/Pebble-Hathay-Bunano-Rainbow-Stripe-Bunny-Rattle-New-With-Tags/293122952661?hash=item443f7d4dd5:g:y08AAOSw4O5dBprF,Pebble Hathay Bunano Rainbow Stripe Bunny Rattle - New With Tags,$9.99,$4.95,N/A,N/A,N/A
https://www.ebay.com/itm/Baby-Einstein-Around-the-World-Exersaucer-Yellow-Cap-Replacement-Part/322570335465?hash=item4b1ab0b4e9:g:u-0AAOSwDrNZUuyN,Baby Einstein Around the World Exersaucer Yellow Cap Replacement Part,$5.99,Free,Brand: Baby Einstein,Color: Yellow,Age: Infant
https://www.ebay.com/p/14031748182?iid=283599409807&rt=nc,Tiny Love Meadow Days Here I Grow 4 In 1 Baby Walker & Mobile Activity Center,$67.18,Free,Brand: Tiny Love,Age: Infant,N/A
https://www.ebay.com/itm/Evenflo-Exersaucer-Replacement-Toys-Parts-Mega-Splash-Teether-Switch-A-Roo-Toy/163890398846?hash=item2628a1067e:g:JLUAAOSwxBldM5RF,Evenflo Exersaucer Replacement Toys Parts - Mega Splash Teether Switch-A-Roo Toy,$5.99,$3.99,Brand: Evenflo,Color: Multicolor,Age: Infant
https://www.ebay.com/itm/Evenflo-Exersaucer-Replacement-Toy-Part-Switch-A-Roo-Smart-Steps-ABC-Apple-Toy/254228333118?hash=item3b3130823e:g:tIoAAOSwi8tc12zc,Evenflo Exersaucer Replacement Toy Part Switch A Roo Smart Steps ABC Apple Toy,$9.99,$5.99,Brand: Evenflo,N/A,N/A
https://www.ebay.com/itm/Lot-of-4-Stabilizers-for-Evenflo-World-Explorer-Exersaucer-Replacement-Part/283510758802?hash=item42028edd92:g:wK4AAOSwkwdc~I1L,Lot of 4 Stabilizers for Evenflo World Explorer Exersaucer Replacement Part,$5.99,$3.70,Brand: Evenflo,Color: Red,Age: Infant
https://www.ebay.com/itm/Evenflo-exersaucer-replacement-toys-three-birds-New-in-packaging/352624039744?hash=item521a07d740:g:I44AAOSwPF9clNdj,Evenflo exersaucer replacement toys three birds New in packaging,$10.99,$3.70,Brand: Evenflo,Age: Infant,N/A
https://www.ebay.com/itm/Baby-Einstein-Baby-Exersaucer-Animal-Flip-Book-Toy-Replacement-Part/232923390928?hash=item363b50e3d0:g:HE0AAOSwZM9aptiV,Baby Einstein Baby Exersaucer Animal Flip Book Toy Replacement Part,$6.00,$5.00,Brand: Baby Einstein,Color: Multicolor,Age: Infant
https://www.ebay.com/itm/Little-Tikes-Activity-Garden-Replacement-Part-Purple-Yellow-Mailbox/183918569058?hash=item2ad266a662:g:3ycAAOSw5f1dUjq-,Little Tikes Activity Garden Replacement Part Purple & Yellow Mailbox,$15.95,Free,Brand: Little Tikes,Color: Yellow,N/A
https://www.ebay.com/p/15032644717?iid=113892793853&rt=nc,"Tiny Love 4-in-1 Here I Grow Baby Walker and Mobile Activity Center, Tiny",$74.99,Free,Brand: Tiny Love,N/A,N/A
https://www.ebay.com/itm/Evenflo-Exersaucer-Beach-baby-Ocean-Replacement-Spinning-Fish-Rattle-Toy-5652/332971124262?hash=item4d86a02626:g:-NYAAOSwol5Y4bIT,Evenflo Exersaucer Beach baby Ocean  Replacement Spinning Fish Rattle Toy  5652,$10.19,Free,Brand: Evenflo,Color: Multicolor,N/A
https://www.ebay.com/itm/Evenflo-123-Sweet-Tea-Party-Exersaucer-Birthday-Cake-Toy-Replacement-Part/153574261465?hash=item23c1bd42d9:g:gCMAAOSwNTNdM6lQ,Evenflo 123  Sweet Tea Party Exersaucer Birthday Cake Toy Replacement Part,$5.99,$3.99,Brand: Evenflo,Age: Infant,N/A
https://www.ebay.com/itm/Wood-Baby-Gym-3-Wooden-Baby-Teething-Toys-Foldable-Frame-Activity-Unpainted/153597476570?hash=item23c31f7eda:g:HRwAAOSw8ttdTaWC,Wood Baby Gym 3 Wooden Baby Teething Toys Foldable Frame Activity Unpainted,$20.30,Free,Brand: Unbranded,N/A,N/A
https://www.ebay.com/itm/Foldable-Play-Gym-Frame-Wooden-Activity-Gym-Hanging-Bar-Baby-Toy-Unpainted/133138231622?hash=item1effa83146:g:yowAAOSwv7BdTaWG,Foldable Play Gym Frame Wooden Activity Gym Hanging Bar Baby Toy Unpainted,$20.12,Free,Brand: Unbranded,N/A,N/A
https://www.ebay.com/itm/Baby-Einstein-Around-the-World-Exersaucer-Purple-Leg-Replacement-Part/323926910073?hash=item4b6b8c6479:g:3L8AAOSwjYxdimiG,Baby Einstein Around the World Exersaucer Purple Leg Replacement Part,$7.25,Free,Brand: Baby Einstein,Color: Purple,Age: Infant
https://www.ebay.com/itm/Evenflo-Sweet-Tea-Party-Exersaucer-Seat-Cover-Replacement-Part/173919433898?hash=item287e67f4aa:g:6noAAOSwfN5c8Ut6,Evenflo Sweet Tea Party Exersaucer Seat Cover Replacement Part,$19.99,Free,Brand: Evenflo,Color: Blue,Age: Infant
https://www.ebay.com/itm/Evenflo-Exersaucer-Replacement-Toy-Parts-Switch-A-Roo-Zoo-Friends-Crinkle-Flower/153663852054?hash=item23c7144e16:g:S7kAAOSwPx5dkNHS,Evenflo Exersaucer Replacement Toy Parts Switch-A-Roo Zoo Friends Crinkle Flower,$5.99,$3.99,Brand: Evenflo,Color: Pink,Age: Infant
https://www.ebay.com/p/13016716652?iid=163020490879&rt=nc,Replacement Part Flat Mirror for Evenflo ExerSaucer Baby Active Learning Center,$5.95,$6.50,Brand: Evenflo,Color: Silver,Age: Infant
https://www.ebay.com/itm/Evenflo-Exersaucer-Replacement-Toys-farm-lot-of-2/163830581518?hash=item262510490e:g:8jkAAOSw9yZdX8lQ,Evenflo Exersaucer  Replacement Toys farm lot of 2,$7.99,$4.99,Brand: Evenflo,Color: Multicolor,N/A
https://www.ebay.com/itm/Evenflo-Exersaucer-Mega-Circus-Replacement-Snack-Tray/392317432162?hash=item5b57f0f162:g:jY0AAOSw1NNdDBMp,Evenflo Exersaucer Mega Circus Replacement Snack Tray,$8.99,Free,Brand: Evenflo,N/A,N/A
https://www.ebay.com/itm/Evenflo-Baby-Infant-ExerSaucer-Activity-Interactive-Playstation-Sweet-Tea-Party/272716036733?hash=item3f7f247a7d:g:VPgAAOSw~rpZQDT1,Evenflo Baby Infant ExerSaucer Activity Interactive Playstation  Sweet Tea Party,$80.00,Free,Brand: Evenflo,Age: Infant,N/A
https://www.ebay.com/itm/Evenflo-Ultra-Exersaucer-Castle-Theme-Sliding-Horse-Knight-Toy-Replacement-Part/323938896804?hash=item4b6c434ba4:g:dxsAAOSwIvddmQRL,Evenflo Ultra Exersaucer Castle Theme Sliding Horse/Knight Toy Replacement Part,$8.99,Free,Brand: Evenflo,Color: Multicolor,Age: Infant
https://www.ebay.com/itm/Evenflo-ExerSaucer-Double-Fun-Saucer-Bumbly/254375884190?hash=item3b39fbf59e:g:mpEAAOSwjhJdk0j5,"Evenflo ExerSaucer Double Fun Saucer, Bumbly",$127.34,Free,Brand: Evenflo,N/A,N/A
https://www.ebay.com/itm/Evenflo-World-Explorer-Exersaucer-Replacement-Part-6-Spring-Set-of-4/113868466722?hash=item1a8316ea22:g:JYQAAOSwgjddZeIU,"Evenflo World Explorer Exersaucer Replacement Part 6"" Spring ~ Set of 4",$13.49,$8.00,Brand: Evenflo,N/A,N/A
https://www.ebay.com/itm/Baby-Einstein-Discover-Play-Exersaucer-Green-Dragon-Puppet-Toy-Replacement-Part/202758965779?hash=item2f35604a13:g:Jj4AAOSwx85dWFil,Baby Einstein Discover Play Exersaucer Green Dragon Puppet Toy Replacement Part,$9.00,Free,Brand: Baby Einstein,Color: Yellow,Age: Infant
https://www.ebay.com/itm/Little-Tikes-Activity-Garden-Replacement-Part-Yellow-Right-R-Window-Shutter/173995350017?hash=item2882ee5801:g:p88AAOSwrI1dUjuo,Little Tikes Activity Garden Replacement Part Yellow Right R Window Shutter ,$13.95,Free,Brand: Little Tikes,Color: Yellow,N/A
https://www.ebay.com/itm/Evenflo-Jump-Learn-Exersaucer-Jam-Session-Fabric-Spring-Replacement-Part/173937435848?hash=item287f7aa4c8:g:AskAAOSwPD5dCnOP,Evenflo Jump & Learn Exersaucer Jam Session Fabric Spring Replacement Part,$10.99,Free,Brand: Evenflo,Color: Blue,Age: Infant
https://www.ebay.com/itm/Evenflo-Exersaucer-Carousel-Horse-Baby-Toy-Replacement-Part-Switch-A-Roo/264485544332?hash=item3d9491218c:g:Vi0AAOSwo5ddapXz,Evenflo Exersaucer Carousel Horse Baby Toy Replacement Part Switch A Roo,$9.99,Free,Brand: Evenflo,N/A,N/A
https://www.ebay.com/itm/Portable-Baby-Playpen-Outdoor-Indoor-Ball-Pool-Toddlers-Play-Tent-Three-Colors/173648059590?hash=item286e3b1cc6:m:mlDceOf2Z1s7hE6uxiHTx4g&var=472324525764,Portable Baby Playpen Outdoor Indoor Ball Pool Toddlers Play Tent Three Colors,$20.69,Free,Color: Yellow,Age: Toddler,N/A
https://www.ebay.com/p/26012323583?iid=372677586188&rt=nc,Baby Activity Center Sit Stand Play Learning Walking Fun 3 in 1 Around We Go Toy,$96.29,Free,Brand: Bright Starts,Color: Multicolor,Age: Infant
https://www.ebay.com/itm/Baby-Einstein-Around-the-World-Exersaucer-SPINNING-DISC-Toy-Replacement-Part/323280505798?hash=item4b45050bc6:g:4l0AAOSw8d5ZUu0Z,Baby Einstein Around the World Exersaucer SPINNING DISC Toy Replacement Part,$6.99,Free,Brand: Baby Einstein,Color: Multicolor,Age: Infant
https://www.ebay.com/itm/Baby-Foldable-Wooden-Play-Gym-3-Theething-Gym-Toys-Frame-Activity-Gym/183907614404?hash=item2ad1bf7ec4:m:m395l1vw05ia6jCi7rvAbGQ&var=691598988965,Baby Foldable Wooden Play Gym & 3 Theething Gym Toys Frame Activity Gym ,$18.31,Free,Brand: Unbranded,Color: Pink,N/A
https://www.ebay.com/p/10026658705?iid=312595075349&rt=nc,3 In 1 Activity Center Walker Baby Around We Go Saucer Interactive Toy Toddler,$110.40,Free,Brand: Bright Starts,Color: Red,Age: Toddler
https://www.ebay.com/itm/Evenflo-Mega-Splash-Exersaucer-Fish-with-Spinning-Rings-Toy-Replacement-Part/163912785327?hash=item2629f69daf:g:1JkAAOSwOFZdrJ72,Evenflo Mega Splash Exersaucer Fish with Spinning Rings Toy Replacement Part,$5.99,$4.50,Brand: Evenflo,Color: Multicolor,Age: Infant
https://www.ebay.com/itm/Evenflo-Exersaucer-Megasaucer-Lot-of-3-Replacement-Metal-Springs-4-5/264493080229?hash=item3d95041ea5:g:qqAAAOSwp2VdneKe,"Evenflo Exersaucer Megasaucer Lot of 3 Replacement Metal Springs 4.5""",$13.99,Free,Brand: Evenflo,Color: Silver,Age: Infant
https://www.ebay.com/itm/Bright-Starts-REPLACEMENT-PART-with-brackets-Fish-Penguin-Whale-11064/352691363536?hash=item521e0b1ed0:g:B1YAAOSwsnldAtKq,Bright Starts REPLACEMENT PART with brackets Fish Penguin Whale  11064,$8.25,$6.80,Brand: Bright Starts,Color: Multicolor,Age: Infant
https://www.ebay.com/itm/Baby-Einstein-Rhythm-of-the-Reef-Saucer-Ratcheting-Crab-Replacement-Part/283607641742?hash=item4208552e8e:g:DX4AAOSwzZlddICB,Baby Einstein Rhythm of the Reef Saucer Ratcheting Crab Replacement Part ,$4.99,$3.70,Brand: Baby Einstein,Color: Multicolor,Age: Infant
https://www.ebay.com/itm/Evenflo-Wild-Adventure-Jumperoo-Replacement-Fabric-Covered-Spring-w-Adj-Knob/192956196055?hash=item2ced15e4d7:g:EpMAAOSwljJdCk9H,Evenflo Wild Adventure Jumperoo Replacement Fabric Covered Spring w/ Adj Knob,$9.99,$5.35,Brand: Evenflo,Color: Green,Age: Infant
https://www.ebay.com/itm/Go-Gaga-Infantino-Wrist-Rattles-Fox-Owl/333362425180?hash=item4d9df2ed5c:g:DkgAAOSw1kxdpRGc,Go Gaga Infantino Wrist Rattles Fox & Owl,$14.95,Free,Brand: Infantino,Color: Multicolor,Age: Infant
https://www.ebay.com/itm/Evenflo-Smart-Steps-ABC-123-Exersaucer-Flat-Mirror-Toy-Replacement-Part/282199708063?hash=item41b469d19f:g:It8AAOSwpDdVY8cu,Evenflo Smart Steps ABC/123 Exersaucer Flat Mirror Toy Replacement Part,$7.95,$6.85,Brand: Evenflo,Color: Green,N/A
https://www.ebay.com/itm/Baby-Einstein-Discover-Exersaucer-Animal-Photo-Book-Toy-Replacement-Part/183224391792?hash=item2aa9065870:g:hmoAAOSwPGpa-Kz2,Baby Einstein Discover Exersaucer  Animal Photo Book Toy Replacement Part,$8.99,Free,Brand: Baby Einstein,Age: Infant,N/A
https://www.ebay.com/p/1621915621?iid=332611306544&rt=nc,Graco Mix and Move Soft Dragonfly Toy,$14.95,Free,Brand: Graco,Color: Blue,Age: Infant
https://www.ebay.com/itm/Gender-Reveal-Party-Baseballs-Pink-and-blue-balls-included-Free-shipping/163815144256?hash=item262424bb40:g:UYEAAOSwevtcy4D3,Gender Reveal Party Baseballs - Pink and blue balls included.  Free shipping!,$15.99,Free,Brand: Handmade,Color: Blue,N/A
https://www.ebay.com/itm/Foldable-Play-Gym-Frame-Wooden-Activity-Gym-Hanging-Bar-Baby-Toy/383084349251?hash=item59319b4743:m:m5Yk16W73h5YwoRSplY5axw&var=651674153876,Foldable Play Gym Frame Wooden Activity Gym Hanging Bar Baby Toy ,$21.66,Free,Brand: Unbranded,Color: Green,N/A
https://www.ebay.com/itm/Evenflo-Mega-Splash-Exersaucer-Toy-Snack-Tray-Replacement-Part/182877284214?hash=item2a9455e776:g:VUQAAOSwTO9Z~dXC,Evenflo Mega Splash Exersaucer Toy/Snack Tray Replacement Part,$8.88,Free,Brand: Evenflo,Color: Orange,Age: Infant
https://www.ebay.com/itm/Evenflo-Exersaucer-Lot-of-3-Pink-Purple-Replacement-Stabilizer-Feet-VGUC/202703454599?hash=item2f32114187:g:FUkAAOSw3u5c~j0w,Evenflo Exersaucer Lot of 3 Pink Purple Replacement Stabilizer Feet VGUC,$8.99,$4.53,Brand: Evenflo,Color: Pink,N/A
https://www.ebay.com/p/1567468491?iid=332971124221&rt=nc,Evenflo Sweet Tea Party Exersaucer Switch A Roo Flip Book Toy 4237,$11.99,Free,Brand: Evenflo,Color: Multicolor,Age: Infant
https://www.ebay.com/itm/Baby-Einstein-Rhythm-of-The-Reef-Activity-Saucer-Baby-Toys-Music-Learning-Center/283588180864?hash=item42072c3b80:g:o~AAAOSw8ttdXei8,Baby Einstein Rhythm of The Reef Activity Saucer Baby Toys Music Learning Center,$77.68,Free,Brand: Baby Einstein,Color: Blue,Age: Infant
https://www.ebay.com/itm/Evenflo-123-Sweet-Tea-Party-Exersaucer-Birthday-Cake-Toy-Replacement-Party/222539781859?hash=item33d06796e3:g:3DwAAOSwMvtZOgj5,Evenflo 123  Sweet Tea Party Exersaucer Birthday Cake Toy Replacement Party,$7.00,$3.75,Brand: Evenflo,Color: Multicolor,Age: Infant
https://www.ebay.com/itm/Baby-Einstein-Exersaucer-Sunshine-Plush-Toy-Replacement-Part-Piece-Orange-Rattle/202758959689?hash=item2f35603249:g:G7oAAOSwyixdWFW9,Baby Einstein Exersaucer Sunshine Plush Toy Replacement Part Piece Orange Rattle,$9.00,Free,Brand: Baby Einstein,Color: Orange,Age: Infant
https://www.ebay.com/itm/Baby-Einstein-Discover-Play-Exersaucer-Spinning-Globe-Toy-Replacement-Part/202760143338?hash=item2f357241ea:g:Zt4AAOSwxINdWFZ6,Baby Einstein Discover Play Exersaucer Spinning Globe Toy Replacement Part,$6.00,$2.68,Brand: Baby Einstein,Age: Infant,N/A
https://www.ebay.com/itm/Bright-Starts-3-in-1-Around-We-Go-Activity-Center-Multi-Color/264392290613?hash=item3d8f023135:g:MUoAAOSw3QldI-GY,"Bright Starts 3-in-1 Around We Go Activity Center, Multi-Color",$90.00,$22.95,Brand: Bright Starts,Color: Multicolor,N/A
https://www.ebay.com/itm/Evenflo-Smart-Steps-ABC-123-Exersaucer-Set-of-3-Springs-Replacement-Part/183951958958?hash=item2ad46423ae:g:KhQAAOSwJj9cwIYv,Evenflo Smart Steps ABC/123 Exersaucer Set of 3 Springs Replacement Part,$14.99,Free,Brand: Evenflo,Color: Silver,Age: Infant
https://www.ebay.com/itm/Baby-Einstein-Around-the-World-Exersaucer-Spinning-Discs-Toy-Replacement-Part/171236027158?hash=item27de766b16:g:DgUAAOSwRLZT9MZ3,Baby Einstein Around the World Exersaucer Spinning Discs Toy Replacement Part,$6.33,Free,Brand: Baby Einstein,Color: Blue,N/A
https://www.ebay.com/itm/Gabriel-G52390-Ultra-Struts-1-Pack/312057411728?epid=0&hash=item48a8123890:g:~fsAAOSwE7Jaci3B,Gabriel G52390 Ultra Struts - 1 Pack,$22.77,Free,N/A,N/A,N/A
https://www.ebay.com/itm/Wooden-Activity-Center-Gym-with-3-Baby-Gym-Toys-Handmade-Foldable-Blue/202753311058?hash=item2f350a0152:g:rbQAAOSwyyBdTaVw,Wooden Activity Center Gym with  3 Baby Gym Toys Handmade Foldable Blue,$19.07,Free,Brand: Unbranded,Color: Blue,N/A
https://www.ebay.com/itm/Little-Tikes-Activity-Garden-Replacement-Part-Purple-Telescope-Screw/183918577815?hash=item2ad266c897:g:vDwAAOSwCTddUj8Z,Little Tikes Activity Garden Replacement Part Purple Telescope Screw,$13.95,Free,Brand: Little Tikes,Color: Purple,N/A
https://www.ebay.com/itm/Baby-Einstein-Discover-Play-Exersaucer-Starfish-Star-Fish-Toy-Replacement-Part/174026491218?hash=item2884c98552:g:dS8AAOSw3G1c~X9O,Baby Einstein Discover Play Exersaucer Starfish Star Fish Toy Replacement Part,$9.95,Free,Brand: Baby Einstein,Color: Multicolor,Age: Infant
https://www.ebay.com/itm/Baby-Einstein-Around-the-World-Exersaucer-Set-of-3-Toy-Caps-Replacement-Part/183997560913?hash=item2ad71bf851:g:VxYAAOSwFPRZ2SGn,Baby Einstein Around the World Exersaucer Set of 3 Toy Caps Replacement Part,$11.99,Free,Brand: Baby Einstein,Color: Blue,Age: Infant
https://www.ebay.com/itm/Baby-Einstein-Rhythm-of-the-Reef-Exersaucer-Push-Discs-Toy-Replacement-Part/183927136570?hash=item2ad2e9613a:g:dDEAAOSwz1RdXvY7,Baby Einstein Rhythm of the Reef Exersaucer Push Discs Toy Replacement Part,$9.99,Free,Brand: Baby Einstein,Age: Infant,N/A
https://www.ebay.com/itm/Evenflo-Exersaucer-Replacement-Spring-6-x2-for-3-in-1-Triple-Fun-Pond-Activity/223511475977?hash=item340a527709:g:6gIAAOSwio1Zl0b8,"Evenflo Exersaucer Replacement Spring 6"" x2"" for 3-in-1 Triple Fun Pond Activity",$10.50,Free,Brand: Evenflo,N/A,N/A
https://www.ebay.com/itm/Evenflo-Smart-Steps-ABC-123-Exersaucer-Set-of-3-Springs-Replacement-Part/264462981155?hash=item3d9338d823:g:nrEAAOSwAQZden~-,Evenflo Smart Steps ABC/123 Exersaucer Set of 3 Springs Replacement Part,$9.99,$4.39,Brand: Evenflo,Color: Silver,Age: Infant
https://www.ebay.com/itm/Baby-Einstein-2-in-1-Lights-Sea-Activity-Gym-Saucer-REPLACEMENT-FISH-TOY/352819595958?hash=item5225afcab6:g:LPUAAOSwKB9dn4lF,Baby Einstein 2 in 1 Lights & Sea Activity Gym & Saucer ~ REPLACEMENT FISH TOY,$13.49,$3.18,Brand: Baby Einstein,Age: Infant,N/A
https://www.ebay.com/itm/Exersaucer-Bounce-and-Learn-Tea-Party-Stimulating-Visuals-Sounds-And-Touch/383137014742?hash=item5934bee3d6:g:VVkAAOSwm0ldcExT," Exersaucer Bounce and Learn Tea Party, Stimulating Visuals, Sounds And Touch",$56.80,Free,Brand: Evenflo,Age: Infant,N/A
https://www.ebay.com/itm/High-Quality-Education-Game-Center-Musical-Learning-Activity-Table-Baby-Kid-Gift/223590872811?hash=item340f0df6eb:g:PNQAAOSweSddL353,High Quality Education Game Center Musical Learning Activity Table Baby Kid Gift,$32.00,Free,Color: Green,Age: Toddler,N/A
https://www.ebay.com/itm/Baby-Foldable-Wooden-Play-Gym-with-3-Theething-Gym-Toys-Frame-Activity-Gym/183907616389?hash=item2ad1bf8685:m:miPwWI_NAfEpNKjHxVALEvg&var=691598989123,Baby Foldable Wooden Play Gym with 3 Theething Gym Toys Frame Activity Gym ,$21.59,Free,Brand: Unbranded,Color: Pink,N/A
https://www.ebay.com/itm/Little-Tikes-Activity-Garden-Replacement-Part-Yellow-Left-L-Window-Shutter/183918571352?hash=item2ad266af58:g:2PoAAOSwgsFdUjxE,Little Tikes Activity Garden Replacement Part Yellow Left L Window Shutter ,$13.95,Free,Brand: Little Tikes,Color: Yellow,N/A
https://www.ebay.com/itm/Bright-Starts-Exersaucer-Bounce-Blue-Toy-Cap-Replacement-Part/173969077017?hash=item28815d7319:g:44EAAOSwhVFc9~-Q,Bright Starts Exersaucer Bounce Blue Toy Cap  Replacement Part,$6.99,Free,Brand: Bright Starts,Color: Blue,Age: Infant
https://www.ebay.com/itm/Stabilizers-for-Evenflo-Triple-Fun-Exersaucer-Replacement-Part-Lot-of-4/283640693933?hash=item420a4d84ad:g:eVUAAOSwUY9c~Iy2,Stabilizers for Evenflo Triple Fun  Exersaucer Replacement Part Lot of 4 ,$6.22,$3.70,Brand: Evenflo,Color: Red,Age: Infant
https://www.ebay.com/itm/Evenflo-Mega-Splash-Exersaucer-Fish-with-Spinning-Rings-Toy-Replacement-Part/163855208593?hash=item2626881091:g:ulEAAOSwok1dM5zl,Evenflo Mega Splash Exersaucer Fish with Spinning Rings Toy Replacement Part,$5.99,$4.50,Brand: Evenflo,Color: Multicolor,Age: Infant
https://www.ebay.com/p/14031748182?iid=283602453439&rt=nc,Tiny Love Meadow Days Here I Grow 4-in-1 Baby Walker Mobile Activity Center,$68.22,Free,Brand: Tiny Love,Age: Infant,N/A
