URL,Title,Price,Shipping,Dynamic Attribute 1,Dynamic Attribute 2,Dynamic Attribute 3
https://www.ebay.com/itm/Fisher-Price-Rainforest-Jumperoo-Baby-Blue-Frog-Leaf-Toy-Replacement-Part/174051066294?hash=item28864081b6:g:di0AAOSw8OtdlMAD,Fisher Price Rainforest Jumperoo Baby Blue Frog / Leaf  Toy Replacement Part,$14.99,Free,Brand: Fisher-Price,Color: Green,Age: Infant
https://www.ebay.com/itm/Fisher-Price-Luv-U-Zoo-Jumperoo-Hanging-Hippo-Monkey-Leaf-Toy-Replacement-Part/173979495853?hash=item2881fc6dad:g:aFIAAOSwMPBdPcdf,Fisher Price Luv U Zoo Jumperoo Hanging Hippo & Monkey Leaf Toy Replacement Part,$28.95,Free,Brand: Fisher-Price,Color: Purple,Age: Infant
https://www.ebay.com/itm/Disney-Finding-Nemo-Sea-Activities-Jumper-Squirt-Turtle-Replacement-Part/392446688369?hash=item5b5fa53c71:g:TLoAAOSwdDhdiZYG,Disney Finding Nemo Sea Activities Jumper Squirt Turtle Replacement Part,$34.05,$18.92,Brand: Disney,N/A,N/A
https://www.ebay.com/itm/Rainforest-Jumperoo-Pole-Frame-straight-Tube-Bar-24-5-Fisher-Price-replacement/264254273518?hash=item3d86c837ee:g:dPsAAOSwihVb-aoL,"Rainforest Jumperoo Pole Frame straight Tube Bar  24.5"" Fisher Price replacement",$22.99,Free,Brand: Fisher-Price,Color: Brown,N/A
https://www.ebay.com/itm/Baby-Einstein-Musical-Motion-Activity-Jumperoo-REPLACEMENT-4pc-base-poles/254154762515?hash=item3b2ccde913:g:9CIAAOSw1GtcgXaV,Baby Einstein Musical Motion Activity Jumperoo REPLACEMENT 4pc base poles,$16.95,$9.83,Brand: Baby Einstein,N/A,N/A
https://www.ebay.com/itm/Baby-Einstein-Neighborhood-Friends-Jumper-CENTER-HUB-Tray-Replacement-Part/254253653050?hash=item3b32b2dc3a:g:2b0AAOSwOwJc9rSx,Baby Einstein Neighborhood Friends Jumper CENTER HUB Tray Replacement Part,$12.99,$12.98,Brand: Baby Einstein,Color: Green,N/A
https://www.ebay.com/p/20034702851?iid=323820734359&rt=nc,"Evenflo Exersaucer Door Jumper, Marianna",$19.99,Free,Brand: Evenflo,Color: Pink,N/A
https://www.ebay.com/p/1300844641?iid=352810076642&rt=nc,Evenflo ExerSaucer Mega Farmyard Replacement ~ SEAT PAD ~ COVER ~ Universal,$13.49,$3.18,Brand: Evenflo,Color: Yellow,Type: Activity Center Jumper
https://www.ebay.com/itm/Jolly-Jumper-Exerciser-with-Stand-Musical-Matt-Gift-Pack/291922583616?hash=item43f7f12040:g:JioAAOSwDNdVoWME,Jolly Jumper Exerciser with Stand+Musical Matt(Gift Pack),$118.05,$34.05,N/A,N/A,N/A
https://www.ebay.com/itm/Fisher-Price-Luv-U-Zoo-Jumperoo-Hanging-Monkey-Toy-Replacement-Part/174013025104?hash=item2883fc0b50:g:xLcAAOSwZf9bZJmv,Fisher Price Luv U Zoo Jumperoo Hanging Monkey Toy Replacement Part,$14.77,Free,Brand: Fisher-Price,Color: Brown,Age: Infant
https://www.ebay.com/itm/Disney-Finding-Nemo-Sea-Of-Activities-Jumper-Starfish-2-Toy-Replacement-Part-Z/193037594865?hash=item2cf1eff0f1:g:BP4AAOSw72JdS1B4,Disney Finding Nemo Sea Of Activities Jumper Starfish (2)Toy Replacement Part *Z,$18.90,$4.50,Brand: Disney,N/A,N/A
https://www.ebay.com/itm/FISHER-PRICE-Twirlin-Whirlin-Garden-Playset-Playset-Only-No-Accessories/283641820317?hash=item420a5eb49d:g:nMUAAOSwRu5doojf,FISHER PRICE Twirlin Whirlin Garden Playset--Playset Only--No Accessories,$14.99,$25.00,Brand: Fisher-Price,N/A,N/A
https://www.ebay.com/itm/Baby-Einstein-Neighborhood-Friends-Jumperoo-Toy-Hooks-Replacement-Part/183957900754?hash=item2ad4becdd2:g:QdkAAOSwWkpdf7hY,Baby Einstein Neighborhood Friends Jumperoo Toy Hooks  Replacement Part,$10.99,Free,Brand: Baby Einstein,Color: Multicolor,Age: Infant
https://www.ebay.com/itm/Baby-Einstein-Jumper-Neighborhood-Friends-Fabric-Seat-Cover-Replacement-Part/174048962600?hash=item2886206828:g:YaQAAOSwVXRbzzgV,Baby Einstein Jumper Neighborhood Friends Fabric Seat Cover Replacement Part,$21.95,$2.95,Brand: Baby Einstein,Color: Blue,Age: Infant
https://www.ebay.com/itm/Fisher-Price-Rainforest-Jumperoo-Replacement-Jump-for-Lights-Music-Toy/283609449247?hash=item420870c31f:g:vAwAAOSwcWtddq1U,Fisher Price Rainforest Jumperoo Replacement Jump for Lights & Music Toy,$13.99,$7.51,Brand: Fisher-Price,Color: Multicolor,Age: Infant
https://www.ebay.com/itm/Baby-Einstein-Musical-Motion-Jumperoo-Fabric-Spring-Replacement-Part/174017358916?hash=item28843e2c44:g:ASQAAOSweS9dbX0g,Baby Einstein Musical Motion Jumperoo Fabric Spring Replacement Part,$13.99,Free,Brand: Baby Einstein,Color: Blue,Age: Infant
https://www.ebay.com/itm/Lot-of-3-Fisher-Price-Rainforest-Friends-Jumperoo-Replacement-Fabric-Springs/254194885287?hash=item3b2f3222a7:g:QsUAAOSwRcZcrS4A,Lot of 3 Fisher Price Rainforest Friends Jumperoo Replacement Fabric Springs,$18.99,Free,Brand: Fisher-Price,Age: Infant,N/A
https://www.ebay.com/itm/Disney-Finding-Nemo-Sea-Of-Activities-Jumper-Starfish-STAR-Toy-Replacement-Part/183930034929?hash=item2ad3159af1:g:wTQAAOSwlQ5c3WBF,Disney Finding Nemo Sea Of Activities Jumper Starfish STAR Toy Replacement Part,$14.95,Free,Brand: Disney,N/A,N/A
https://www.ebay.com/itm/Andador-para-bebe-ayuda-del-asiento-actividad-juguete-infancia-baby-seat-walker/312533085556?hash=item48c46c6d74:m:mY2Si5V1_d8oaV_FEwCdTVw&var=611234330473,Andador para bebe ayuda del asiento actividad juguete infancia baby seat walker,$64.95,Free,Brand: Unbranded,N/A,N/A
https://www.ebay.com/itm/Fisher-Price-Rainforest-Jumperoo-Hanging-Parrot-Bird-Replacement-Red-Green-Leaf/283609422966?hash=item4208705c76:g:vAoAAOSwJUtddqcp,Fisher Price Rainforest Jumperoo Hanging Parrot Bird Replacement Red Green Leaf,$13.49,$3.00,Brand: Fisher-Price,Color: Multicolor,Age: Infant
https://www.ebay.com/itm/Lindam-Jump-About-Plus-Baby-Door-Bouncer-Red-Blue-MK0042/113893683880?hash=item1a8497b2a8:g:8dcAAOSwFBFdgoRK,Lindam Jump About Plus Baby Door Bouncer Red / Blue MK0042,$28.00,Free,Color: Red,Age: Infant,N/A
https://www.ebay.com/itm/Baby-Einstein-Jumper-Neighborhood-Friends-Seat-Cover-Replacement-Part-w-CLIPS/174048129666?hash=item288613b282:g:CycAAOSw4yJdRxHH,Baby Einstein Jumper Neighborhood Friends Seat Cover Replacement Part w/ CLIPS,$20.95,$2.95,Brand: Baby Einstein,Color: Blue,Age: Infant
https://www.ebay.com/itm/Fisher-Price-Rainforest-Jumperoo-Replacement-Part-Jump-Lights-Music-Toy/183932891817?hash=item2ad34132a9:g:x2MAAOSw8I5dZnUf,Fisher Price Rainforest Jumperoo Replacement Part Jump Lights Music Toy,$9.95,$8.30,Brand: Fisher-Price,Color: Multicolor,Age: Infant
https://www.ebay.com/itm/Replacement-Spring-Baby-Einstein-Neighborhood-Friends-Activity-Jumper-Part/283547849334?hash=item4204c4d276:g:KLsAAOSwxapcv0aW,Replacement Spring Baby Einstein Neighborhood Friends Activity Jumper Part,$7.99,$4.44,Brand: Baby Einstein,Color: Purple,Age: Infant
https://www.ebay.com/itm/Fisher-Price-Precious-Planet-Jumperoo-LIghts-Music-Toy-Replacement-Part/174077457835?hash=item2887d335ab:g:NqAAAOSwVbhco6zz,Fisher Price Precious Planet Jumperoo LIghts & Music Toy Replacement Part,$26.99,Free,Brand: Fisher-Price,Color: Green,Age: Infant
https://www.ebay.com/itm/Baby-Einstein-Musical-Activity-Jumper-Electronic-Piano-Toy-Replacement-Part/183928253757?hash=item2ad2fa6d3d:g:VrUAAOSwfGxcq-XD,Baby Einstein Musical Activity Jumper Electronic Piano Toy Replacement Part,$24.95,Free,Brand: Baby Einstein,N/A,N/A
https://www.ebay.com/p/24034888362?iid=283626669988&rt=nc,Seahorse Bead Chaser Replacement Finding Nemo Bright Starts Sea Activity Jumper ,$8.89,$5.78,Brand: Bright Starts,Color: Multicolor,Age: Infant
https://www.ebay.com/itm/Evenflo-ExerSaucer-Ultra-2-in-1-Tropical-Teething-Cup-Toy-Replacement-Part/401687810976?hash=item5d867593a0:g:OXIAAOSw97hcP17a,Evenflo ExerSaucer Ultra 2-in-1 Tropical Teething Cup Toy Replacement Part,$8.79,$9.45,Brand: Baby Einstein,Color: Blue,N/A
https://www.ebay.com/p/16026721951?iid=382860247210&rt=nc,Evenflo ExerSaucer Jump and Learn Jumper Jungle Quest REPLACEMENT TOY GIRAFFE 🦓,$7.99,$4.94,Brand: Evenflo,Color: Green,Age: Infant
https://www.ebay.com/itm/Jolly-Jumper-Exerciser-with-Super-Stand-Door-Clamp-Included-LIMITED-TIME/293011520738?hash=item4438d8fce2:g:97MAAOSw9N1VoVoS,Jolly Jumper Exerciser with Super Stand-Door Clamp Included-LIMITED TIME,$149.83,$41.62,N/A,N/A,N/A
https://www.ebay.com/itm/Fisher-Price-Luv-U-Zoo-Jumperoo-Zoo-Animal-Seat-Cover-Replacement-Part/183752104644?hash=item2ac87a9ac4:g:fPIAAOSwPUZbZJue,Fisher Price Luv U Zoo Jumperoo Zoo Animal Seat Cover  Replacement Part,$19.99,Free,Brand: Fisher-Price,Color: Multicolor,Age: Infant
https://www.ebay.com/itm/Baby-Einstein-Musical-Motion-Jumperoo-Blue-Seat-Cover-Replacement-Part/174016988296?hash=item2884388488:g:imgAAOSwdJtdbSj0,Baby Einstein Musical Motion Jumperoo Blue Seat Cover Replacement Part,$19.99,Free,Brand: Baby Einstein,Color: Multicolor,Age: Infant
https://www.ebay.com/itm/Fisher-Price-Rainforest-Friends-Jumperoo-Plastic-Seat-Base-Replacement-Part/183908799338?hash=item2ad1d1936a:g:SnYAAOSw5SNdRcLE,Fisher Price Rainforest Friends Jumperoo Plastic Seat Base  Replacement Part,$14.99,Free,Brand: Fisher-Price,Color: White,Age: Infant
https://www.ebay.com/itm/Replacement-Sun-Toy-Baby-Einstein-Neighborhood-Friends-Activity-Jumper-Parts/283620483051?hash=item4209191feb:g:MN0AAOSwmiFc9Tay,Replacement Sun Toy Baby Einstein Neighborhood Friends Activity Jumper Parts,$6.99,$4.44,Brand: Baby Einstein,Color: Multicolor,Age: Infant
https://www.ebay.com/p/2035903839?iid=283626092653&rt=nc,Fisher-Price K6070 Rainforest Jumperoo Infant Baby Activity Bouncer Jumper,$51.55,Free,Brand: Fisher-Price,Type: Activity Center Jumper,Age: Infant
https://www.ebay.com/p/23031755075?iid=283620424634&rt=nc,Jolly Jumper Stand for Jumpers Rockers Baby Exerciser Baby Jumper Easy Storage,$57.37,Free,Brand: Jolly Jumper,Color: White,Type: Jumper Walker
https://www.ebay.com/itm/New-ERGONOMIC-Age-2-mo-Jumper-Merry-Muscles-Jolly-Bounce-Doorway-Baby-Exerciser/401903345899?hash=item5d934e60eb:g:rRsAAOSwnDRcbeUJ,New ERGONOMIC Age 2 mo+ Jumper Merry Muscles Jolly Bounce Doorway Baby Exerciser,$60.16,$13.58,Type: Doorway Jumper,Age: Infant,N/A
https://www.ebay.com/itm/Baby-Einstein-Neighborhood-Friends-Activity-Jumper-Base-Poles-Replacement-Part/133158207431?hash=item1f00d8ffc7:g:C-UAAOSwWkxdWGc4,Baby Einstein Neighborhood Friends Activity Jumper Base Poles Replacement Part,$9.99,$10.13,Brand: Baby Einstein,Color: White,Age: Infant
https://www.ebay.com/itm/SET-OF-4-Baby-Einstein-Activity-Jumper-Jumperoo-Spring-Replacement-Part-Springs/174003630248?hash=item28836cb0a8:g:dscAAOSwarpbctST,SET OF 4 Baby Einstein Activity Jumper Jumperoo Spring Replacement Part Springs,$29.95,Free,Brand: Baby Einstein,N/A,N/A
https://www.ebay.com/itm/Fisher-Price-Rainforest-Jumperoo-Replacement-Jump-for-Lights-Music-Toy/283625575970?hash=item420966d622:g:vAwAAOSwcWtddq1U,Fisher Price Rainforest Jumperoo Replacement Jump for Lights & Music Toy,$12.59,$7.51,Brand: Fisher-Price,Color: Multicolor,Age: Infant
https://www.ebay.com/itm/Hanging-Pearl-Toy-Replacement-Finding-Nemo-Bright-Starts-Sea-of-Activity-Jumper/283626700000?hash=item420977fce0:g:KOQAAOSwvnFdjksP,Hanging Pearl Toy Replacement Finding Nemo Bright Starts Sea of Activity Jumper ,$9.99,$3.70,Brand: Bright Starts,Color: Multicolor,Age: Infant
https://www.ebay.com/itm/Fisher-Price-Go-Wild-Jumperoo-Jumper-Seat-Cover-Replacement-Part-Brown-EUC/174071384853?hash=item2887768b15:g:ONYAAOSwWOJdrK5J,Fisher Price Go Wild Jumperoo Jumper Seat Cover Replacement Part Brown EUC,$17.95,$2.95,Brand: Fisher-Price,Color: Multicolor,Age: Infant
https://www.ebay.com/itm/Fisher-Price-Rainforest-Jumperoo-Baby-Jump-for-Lights-Music-Toy-Replacement-Part/174050154202?hash=item28863296da:g:1jEAAOSwaolcxc7D,Fisher Price Rainforest Jumperoo Baby Jump for Lights/Music Toy Replacement Part,$24.99,Free,Brand: Fisher-Price,Color: Green,Age: Infant
https://www.ebay.com/itm/Fisher-Price-Rainforest-Jumperoo-Replacement-Part-Green-Fabric-Spring/183899707963?hash=item2ad146da3b:g:~dYAAOSwspRc5HY~,Fisher Price Rainforest Jumperoo Replacement Part Green Fabric Spring,$9.29,Free,Brand: Fisher-Price,Color: Green,N/A
https://www.ebay.com/itm/FISHER-PRICE-LUV-U-ZOO-JUMPEROO-SWIVEL-SEAT-RING-REPLACEMENT-PART/174038462029?hash=item2885802e4d:g:ZY8AAOSwfwFccGrg,FISHER PRICE LUV U ZOO JUMPEROO SWIVEL SEAT RING REPLACEMENT PART,$13.95,Free,Brand: Fisher-Price,N/A,N/A
https://www.ebay.com/itm/Fisher-Price-Rainforest-Jumperoo-Rainbow-Sun-Spinner-Toy-Replacement-Part/174002416097?hash=item28835a29e1:g:OFsAAOSw8xhdUdCI,Fisher Price Rainforest Jumperoo Rainbow / Sun Spinner Toy Replacement Part,$5.95,$8.30,Brand: Fisher-Price,Age: Infant,N/A
https://www.ebay.com/itm/Fisher-Price-Discover-n-Grow-Jumperoo-B-W-Striped-Springs-Replacement-Part/173996078610?hash=item2882f97612:g:vZQAAOSwPuhdUwZS,Fisher Price Discover n Grow Jumperoo B&W Striped Springs Replacement Part,$15.99,Free,Brand: Fisher-Price,Color: White,Age: Infant
https://www.ebay.com/itm/Baby-Einstein-Neighborhood-Symphony-Jumper-Caterpillar-Ring-Toy-Replacement-Part/183944209333?hash=item2ad3ede3b5:g:aZAAAOSwcc9dc8c2,Baby Einstein Neighborhood Symphony Jumper Caterpillar Ring Toy Replacement Part,$9.95,$2.95,Brand: Baby Einstein,Color: Green,Age: Infant
https://www.ebay.com/itm/Baby-Einstein-Musical-Motion-Jumperoo-Seat-Cover-Replacement-Part/174042365893?hash=item2885bbbfc5:g:lesAAOSwv7ldimD3,Baby Einstein Musical Motion Jumperoo  Seat Cover Replacement Part,$19.99,Free,Brand: Baby Einstein,Color: Multicolor,Age: Infant
https://www.ebay.com/itm/Fisher-Price-Go-Wild-Jumperoo-Seat-Cover-Replacement-Part-Brown/283632563733?hash=item4209d17615:g:gxYAAOSwqwhdlnfr,Fisher Price Go Wild Jumperoo Seat Cover Replacement Part Brown,$17.99,Free,Brand: Fisher-Price,Color: Multicolor,Age: Infant
https://www.ebay.com/itm/Fisher-Price-Rainforest-Jumperoo-Replacement-Part-Jump-Lights-Music-Toy/174002415425?hash=item28835a2741:g:CLYAAOSwSGtdWsNI,Fisher Price Rainforest Jumperoo Replacement Part Jump Lights Music Toy,$9.95,$8.30,Brand: Fisher-Price,Age: Infant,N/A
https://www.ebay.com/itm/Fisher-Price-Luv-U-Zoo-Seat-Cover-Replacement-Part-Jumperoo-Brown/283632552365?hash=item4209d149ad:g:-44AAOSwXq5dlnYJ,Fisher Price Luv U Zoo Seat Cover Replacement Part Jumperoo Brown,$17.79,Free,Brand: Fisher-Price,Color: Multicolor,Age: Infant
https://www.ebay.com/itm/Fisher-Price-Discover-n-Grow-Jumperoo-Plastic-Seat-Base-Replacement-Part/173996094799?hash=item2882f9b54f:g:MycAAOSw94JdUwwn,Fisher Price Discover n Grow Jumperoo Plastic Seat Base Replacement Part,$14.99,Free,Brand: Fisher-Price,Color: White,Age: Infant
https://www.ebay.com/itm/Spring-Pole-Open-Top-Disney-Minnie-Mouse-PeekABoo-Activity-Jumper-Replacement/283644112023?hash=item420a81ac97:g:nIcAAOSw6ABdpcn3,Spring Pole Open Top Disney Minnie Mouse PeekABoo Activity Jumper Replacement,$14.99,$7.89,Brand: Bright Starts,Color: Multicolor,Type: Activity Center Jumper
https://www.ebay.com/itm/Baby-Einstein-Jumper-Purple-Toy-Hooks-Musical-Motion-Activity-Replacement-Parts/283623327405?hash=item42094486ad:g:hYoAAOSwOKldPR0V,Baby Einstein Jumper Purple Toy Hooks Musical Motion Activity Replacement Parts,$3.99,$3.70,Brand: Baby Einstein,Color: Purple,Age: Infant
https://www.ebay.com/itm/Baby-Einstein-Musical-Motion-Activity-Jumper-Red-Bird-Toy-Replacement-Part/223669155753?hash=item3413b877a9:g:uNEAAOSwVEFb9XHs,Baby Einstein Musical Motion Activity Jumper Red Bird Toy Replacement Part,$13.99,Free,Brand: Baby Einstein,Color: Multicolor,Age: Infant
https://www.ebay.com/itm/Baby-Einstein-Musical-Motion-Activity-Jumper-Red-Bird-Toy-Replacement-Part/223669155753?hash=item3413b877a9:g:uNEAAOSwVEFb9XHs,Baby Einstein Musical Motion Activity Jumper Red Bird Toy Replacement Part,$13.99,Free,Brand: Baby Einstein,Color: Multicolor,Age: Infant
https://www.ebay.com/itm/Fisher-Price-Luv-U-Zoo-Jumperoo-Hanging-Monkey-Toy-Replacement-Part/293287407313?hash=item44494aaed1:g:3FEAAOSwh8pdkVwj,Fisher Price Luv U Zoo Jumperoo Hanging Monkey Toy Replacement Part,$14.99,Free,Brand: Fisher-Price,Color: Green,Age: Infant
https://www.ebay.com/itm/Replacement-Springs-Baby-Einstein-Jumper-Lot-of-4-Purple-Red/283629122616?hash=item42099cf438:g:HuoAAOSwLgFcyjKE,Replacement Springs Baby Einstein Jumper Lot of 4 Purple & Red,$24.99,$8.00,Brand: Baby Einstein,Color: Multicolor,Age: Infant
https://www.ebay.com/itm/NEW-Baby-Einstein-Musical-Motion-Activity-Jumper-Replacement-Pole-Junction-Box/172684219948?hash=item2834c8162c:g:gzYAAOSw53NY9mQd,NEW Baby Einstein Musical Motion Activity Jumper Replacement Pole Junction Box,$14.50,Free,Brand: Baby Einstein,Color: Multicolor,Age: Infant
https://www.ebay.com/itm/Fisher-Price-Rainforest-Friends-Jumperoo-Replacement-Seat-Part-Red-Frog-Yellow/123906996056?hash=item1cd96eb758:g:8vUAAOSwB2xdfT1U,Fisher Price Rainforest Friends Jumperoo Replacement Seat Part Red Frog Yellow,$14.99,$4.99,Brand: Fisher-Price,Color: Yellow,Type: Activity Center Jumper
https://www.ebay.com/itm/Baby-Einstein-Journey-of-Discovery-Jumperoo-Musical-Globe-Toy-Replacement-Part/173946501096?hash=item288004f7e8:g:vIoAAOSw-ZBdFNek,Baby Einstein Journey of Discovery Jumperoo Musical Globe Toy Replacement Part,$24.99,Free,Brand: Baby Einstein,Color: Multicolor,Age: Infant
https://www.ebay.com/itm/Baby-Einstein-Musical-Motion-Jumperoo-Star-Teether-Toy-Replacement-Part/183970290254?hash=item2ad57bda4e:g:gzYAAOSwu25di9rb,Baby Einstein Musical Motion Jumperoo Star Teether Toy Replacement Part,$10.99,Free,Brand: Baby Einstein,Color: Orange,Age: Infant
https://www.ebay.com/itm/Bubble-Replacement-Finding-Nemo-Bright-Starts-Sea-of-Activity-Jumper/133212742590?hash=item1f041923be:g:aGoAAOSw0fZdr8Ha,Bubble Replacement Finding Nemo Bright Starts Sea of Activity Jumper ,$16.75,Free,Brand: Bright Starts,Color: Multicolor,Age: Infant
https://www.ebay.com/itm/Baby-Einstein-Activity-Jumper-Jumperoo-4-Bottom-Base-Poles-Replacement-Part/183962559537?hash=item2ad505e431:g:9EAAAOSwW8RbCBB3,Baby Einstein Activity Jumper Jumperoo 4 Bottom Base Poles Replacement Part,$7.95,$10.85,Brand: Baby Einstein,Color: White,Age: Infant
https://www.ebay.com/itm/Fisher-Price-Laugh-Learn-Puppy-Jumper-Jumperoo-Replacement-Part-Seat-Cover-EUC/173906704674?hash=item287da5b922:g:9e8AAOSwa45c4BSV,Fisher Price Laugh & Learn Puppy Jumper Jumperoo Replacement Part Seat Cover EUC,$24.95,Free,Brand: Fisher-Price,Color: Yellow,Age: Infant
https://www.ebay.com/itm/Baby-Einstein-Replacement-Seat-Clip-Model-Neptunes-Ocean-Discovery-Jumper/283607543753?hash=item420853afc9:g:EPgAAOSwso9ddFSs,Baby Einstein Replacement Seat Clip Model Neptune's Ocean Discovery Jumper,$24.99,Free,Brand: Baby Einstein,Color: Multicolor,Age: Infant
https://www.ebay.com/itm/Baby-Einstein-Neighborhood-Friends-Jumperoo-2-Fabric-Springs-Replacement-Part/183728203946?hash=item2ac70de8aa:g:0hEAAOSwNTNcK8nw,Baby Einstein Neighborhood Friends Jumperoo 2 Fabric Springs Replacement Part,$18.79,Free,Brand: Baby Einstein,Color: Red,Age: Infant
https://www.ebay.com/itm/Baby-Einstein-Musical-Motion-Jumperoo-Seat-Cover-Replacement-Part/184008898150?hash=item2ad7c8f666:g:2UsAAOSwWZVds0ld,Baby Einstein Musical Motion Jumperoo Seat Cover Replacement Part,$26.99,Free,Brand: Baby Einstein,Color: Blue,Age: Infant
https://www.ebay.com/itm/Fisher-Price-Rainforest-Friends-Jumperoo-Set-of-3-Springs-Replacement-Part/184004789427?hash=item2ad78a44b3:g:xTAAAOSwul9dRcIO,Fisher Price Rainforest Friends Jumperoo Set of 3 Springs  Replacement Part,$15.99,Free,Brand: Fisher-Price,Color: Green,Age: Infant
https://www.ebay.com/itm/Fisher-Price-Rainforest-Jumperoo-Mr-Bee-Toy-Bendable-Replacement-Part/174011785115?hash=item2883e91f9b:g:7A0AAOSw8I5dZqOv,Fisher Price Rainforest Jumperoo Mr Bee Toy Bendable Replacement Part,$11.95,Free,Brand: Fisher-Price,Color: Blue,Age: Infant
https://www.ebay.com/itm/Evenflo-ExerSaucer-Seat-cover-Replacement-Part-Orange-Blue/113926183061?hash=item1a86879895:g:wdIAAOSw4mxdIN-2,Evenflo ExerSaucer Seat cover Replacement Part Orange Blue,$12.99,$4.99,Brand: Evenflo,Color: Blue,Type: Activity Center Jumper
https://www.ebay.com/itm/Fisher-Price-Rainforest-Jumperoo-Replacement-Frame-Base-Tube-Part/333259517168?hash=item4d97d0acf0:g:bWEAAOSwIJZdBFua,Fisher Price￼ Rainforest Jumperoo Replacement Frame Base Tube Part,$10.00,$7.78,Brand: Fisher-Price,Age: Infant,N/A
https://www.ebay.com/itm/Bright-Starts-Bounce-Bounce-Baby-Jumper-Light-Up-Music-Toy-Replacement-Part/183796447027?hash=item2acb1f3733:g:bKUAAOSwuFxcy0bA,Bright Starts Bounce Bounce Baby Jumper Light Up Music Toy Replacement Part,$14.99,Free,Brand: Bright Starts,Color: Multicolor,Age: Infant
https://www.ebay.com/itm/Fisher-Price-Discover-n-Grow-Jumperoo-Frog-Teether-Toy-Replacement-Part/173996108436?hash=item2882f9ea94:g:QuQAAOSw4DJdUw-E,Fisher Price Discover n Grow Jumperoo Frog Teether Toy Replacement Part,$6.99,Free,Brand: Fisher-Price,Color: Green,Age: Infant
https://www.ebay.com/itm/Baby-Einstein-Lot-of-4-Spring-Replacement-Parts-for-Neighborhood-Friends-Jumper/163855339772?hash=item26268a10fc:g:ORAAAOSwWIdddwMn,Baby Einstein Lot of 4 Spring Replacement Parts for Neighborhood Friends Jumper,$29.99,Free,Brand: Baby Einstein,N/A,N/A
https://www.ebay.com/itm/Baby-Einstein-Musical-Motion-Jumper-Frog-Mirror-Beads-Toy-Replacement-Part/183932432223?hash=item2ad33a2f5f:g:jQwAAOSwtThdDPpu,Baby Einstein Musical Motion Jumper Frog Mirror Beads Toy Replacement Part,$9.95,Free,Brand: Baby Einstein,Color: Blue,Age: Infant
https://www.ebay.com/itm/Replacement-Spring-Baby-Einstein-Neighborhood-Friends-Activity-Jumper-Part/283591362462?hash=item42075cc79e:g:KLsAAOSwxapcv0aW,Replacement Spring Baby Einstein Neighborhood Friends Activity Jumper Part,$7.99,$4.44,Brand: Baby Einstein,Color: Purple,Age: Infant
https://www.ebay.com/itm/Fisher-Price-Rainforest-Jumperoo-Set-of-3-Springs-Replacement-Part/183919933870?hash=item2ad27b79ae:g:0KkAAOSw3hFdVC7V,Fisher Price Rainforest Jumperoo Set of 3 Springs  Replacement Part,$15.33,Free,Brand: Fisher-Price,Color: Orange,Age: Infant
https://www.ebay.com/itm/Fisher-Price-Luv-U-Zoo-Jumperoo-Hanging-Hippo-Leaf-Toy-Replacement-Part/293287407301?hash=item44494aaec5:g:JxQAAOSwrj9dkWEn,Fisher Price Luv U Zoo Jumperoo Hanging Hippo/Leaf Toy Replacement Part,$14.99,Free,Brand: Fisher-Price,Color: Green,Age: Infant
https://www.ebay.com/itm/Fisher-Price-Discover-n-Grow-Jumperoo-Seat-Cover-Replacement-Part/183919179024?hash=item2ad26ff510:g:iG8AAOSwkJJdUwhQ,Fisher Price Discover n Grow Jumperoo Seat Cover Replacement Part,$19.99,Free,Brand: Fisher-Price,Color: Multicolor,Age: Infant
https://www.ebay.com/itm/Fisher-Price-Rainforest-Jumperoo-Mr-Bee-Toy-Bendable-Replacement-Part/174002226831?hash=item288357468f:g:UAoAAOSwbe1dWXuM,Fisher Price Rainforest Jumperoo Mr Bee Toy Bendable Replacement Part,$11.95,Free,Brand: Fisher-Price,Age: Infant,N/A
https://www.ebay.com/itm/Fisher-Price-Rainforest-Jumperoo-Replacement-Spring-Set/283609433140?hash=item4208708434:g:-8MAAOSwZRZddqj4,Fisher Price Rainforest Jumperoo Replacement Spring Set,$13.34,$5.00,Brand: Fisher-Price,Color: Green,Age: Infant
https://www.ebay.com/itm/Disney-Finding-Nemo-Sea-Of-Activities-Jumper-Starfish-STAR-Toy-Replacement-Part/173969092447?hash=item28815daf5f:g:wTQAAOSwlQ5c3WBF,Disney Finding Nemo Sea Of Activities Jumper Starfish STAR Toy Replacement Part,$14.95,Free,Brand: Disney,N/A,N/A
https://www.ebay.com/itm/Fisher-Price-Pink-Pedals-Jumperoo-Lights-Music-Toy-Replacement-Part/264423505967?hash=item3d90de802f:g:bSIAAOSw0G9dSyJO,Fisher Price Pink Pedals Jumperoo Lights & Music Toy Replacement Part,$11.89,$11.20,Brand: Fisher-Price,Color: Yellow,Age: Infant
https://www.ebay.com/itm/Baby-Einstein-Neighborhood-Symphony-Jumper-Green-Hanging-Toy-Replacement-Part/183867268395?hash=item2acf57dd2b:g:~1kAAOSwKzVdGhRY,Baby Einstein Neighborhood Symphony Jumper Green Hanging Toy Replacement Part,$9.95,Free,Brand: Baby Einstein,Age: Infant,N/A
https://www.ebay.com/itm/Baby-Einstein-Neighborhood-Friends-Jumperoo-Red-Bird-Toy-Replacement-Part/183983821146?hash=item2ad64a515a:g:5E0AAOSwqxha08DB,Baby Einstein Neighborhood Friends Jumperoo Red Bird Toy Replacement Part,$8.99,$7.85,Brand: Baby Einstein,Color: Blue,Age: Infant
https://www.ebay.com/itm/Bright-Starts-Disney-Nemo-Sea-of-Activities-Jumper-Starfishes-Replacement-Part/143367365526?hash=item21615c6396:g:pAkAAOSwsH5dZsVo,Bright Starts Disney Nemo Sea of Activities Jumper Starfishes Replacement Part,$12.99,Free,N/A,N/A,N/A
https://www.ebay.com/itm/FISHER-PRICE-RAIN-FOREST-JUMPER-JUMPEROO-SWIVEL-SEAT-RING-REPLACEMENT-PART/173872167932?hash=item287b96bbfc:g:t50AAOSwGkVa-03g,FISHER PRICE RAIN FOREST JUMPER JUMPEROO SWIVEL SEAT RING REPLACEMENT PART,$13.95,Free,Brand: Fisher-Price,N/A,N/A
https://www.ebay.com/itm/Baby-Einstein-Activity-Jumper-Lot-of-2-Sun-Toy-Red-Bird-Spins-Replacement-Part/183915362808?hash=item2ad235b9f8:g:jj4AAOSwlCFdTfPL,Baby Einstein Activity Jumper Lot of 2 Sun Toy & Red Bird Spins Replacement Part,$24.95,Free,Brand: Baby Einstein,Color: Multicolor,Age: Infant
https://www.ebay.com/itm/Fisher-Price-Rainforest-Jumperoo-Blue-Frog-Leaf-Mobile-Toy-Replacement-Part/173996999658?hash=item28830783ea:g:ZfwAAOSwB4FdVCvn,Fisher Price Rainforest Jumperoo Blue Frog/Leaf Mobile Toy Replacement Part,$14.88,Free,Brand: Fisher-Price,Color: Green,Age: Infant
https://www.ebay.com/itm/Evenflo-ExerSaucer-Replacement-SEAT-PAD-Cover-Safari-Jungle-Universal/383184784340?hash=item593797cbd4:g:S7AAAOSwSxtdklNc,Evenflo ExerSaucer Replacement ~ SEAT PAD ~ Cover ~ Safari Jungle ~ Universal,$13.49,$3.18,Brand: Evenflo,Color: Purple,Age: Infant
https://www.ebay.com/itm/3-Fisher-Price-Rainforest-Rain-Forest-Jumperoo-Springs-Spring-Replacement-Part/174015858512?hash=item2884274750:g:Y58AAOSwnoVbAYyx,3 Fisher Price Rainforest Rain Forest Jumperoo Springs~ Spring Replacement Part,$15.75,Free,Brand: Fisher-Price,Color: Green,Age: Infant
https://www.ebay.com/itm/Baby-Einstein-Replacement-Seat-for-Musical-Motion-Activity-Jumper/163855348663?hash=item26268a33b7:g:sW4AAOSwXMBddwXj,Baby Einstein Replacement Seat for Musical Motion Activity Jumper,$26.99,Free,Brand: Baby Einstein,N/A,N/A
