URL,Title,Price,Shipping,Dynamic Attribute 1,Dynamic Attribute 2,Dynamic Attribute 3
https://www.ebay.com/itm/Baby-Excersaucer-Toy-Mirror-Replacement-Part/153720085803?hash=item23ca6e5d2b:g:UioAAOSwMudbjKV6,Baby  Excersaucer  Toy Mirror Replacement Part,$3.99,$5.66,Age: Infant,N/A,N/A
https://www.ebay.com/itm/Evenflo-Exersaucer-Lizard-Replacement-Triple-Fun-Life-in-the-Amazon-Jungle/293313514797?hash=item444ad90d2d:g:YKwAAOSwk5FdwH9n,Evenflo Exersaucer Lizard Replacement Triple Fun Life in the Amazon Jungle,$15.50,$4.49,Brand: Evenflo,Color: Multicolor,Age: Infant
https://www.ebay.com/itm/Evenflo-Life-in-the-Amazon-Exersaucer-Dragonfly-Toy-Replacement-Part/143391401713?hash=item2162cb26f1:g:zIMAAOSw50Bdh-Gr,Evenflo Life in the Amazon Exersaucer Dragonfly Toy Replacement Part,$5.10,$4.44,Brand: Evenflo,Color: Purple,Age: Infant
https://www.ebay.com/itm/Baby-Einstein-Discover-Exersaucer-Animal-Photo-Book-Toy-Replacement-Part/133180404324?hash=item1f022bb264:g:NCYAAOSwmexdh-pE,Baby Einstein Discover Exersaucer  Animal Photo Book Toy Replacement Part,$5.30,$7.70,Brand: Baby Einstein,Color: Multicolor,Age: Infant
https://www.ebay.com/itm/Evenflo-Triple-Fun-Jungle-Exersaucer-Animal-Globe-Toy-Replacement-Part/133180403626?hash=item1f022bafaa:g:7V8AAOSwD95dh-nb,Evenflo Triple Fun Jungle Exersaucer Animal Globe Toy  Replacement Part,$8.99,$7.70,Brand: Evenflo,Color: Yellow,Age: Infant
https://www.ebay.com/p/2254626957?iid=113878424459&rt=nc,"Summer Infant 3-Stage Deluxe SuperSeat, Wild Safari",$31.00,Free,Brand: Summer Infant,Age: Infant,N/A
https://www.ebay.com/itm/Evenflo-Exersaucer-Globe-Replacement-Triple-Fun-Life-in-the-Amazon-Jungle/293313523603?hash=item444ad92f93:g:h74AAOSw6NVdwH~i,Evenflo Exersaucer Globe Replacement Triple Fun Life in the Amazon Jungle,$5.50,$3.74,Brand: Evenflo,Color: Multicolor,Age: Infant
https://www.ebay.com/itm/bright-starts-replacement-parts-balls/333347644441?hash=item4d9d116419:g:JrUAAOSwNtldlDDN,bright starts replacement parts balls,$6.00,$6.00,Brand: Bright Starts,N/A,N/A
https://www.ebay.com/p/22031750717?iid=223695323536&rt=nc,Baby Einstein Neptune's Ocean Discovery Jumper Toy,$61.00,$7.85,Brand: Baby Einstein,Color: Blue,Age: Infant
https://www.ebay.com/itm/Evenflo-Triple-Fun-Jungle-Exersaucer-Spinning-Parrot-Toy-Replacement-Part/133180362045?hash=item1f022b0d3d:g:EDoAAOSwTF9dh93v,Evenflo Triple Fun Jungle Exersaucer Spinning Parrot Toy  Replacement Part,$6.90,$7.70,Brand: Evenflo,Color: Brown,Age: Infant
https://www.ebay.com/itm/Bright-Starts-Exersaucer-EUC/143404821197?hash=item216397eacd:g:a2oAAOSw--hdaalm,Bright Starts Exersaucer  EUC,$10.00,$15.00,Brand: Bright Starts,N/A,N/A
https://www.ebay.com/itm/Evenflo-Life-in-the-Amazon-Exersaucer-Dragonfly-Toy-Replacement-Part/143404332533?hash=item21639075f5:g:zIMAAOSw50Bdh-Gr,Evenflo Life in the Amazon Exersaucer Dragonfly Toy Replacement Part,$6.50,$4.44,Brand: Evenflo,Color: Blue,Age: Infant
https://www.ebay.com/itm/EVENFLO-EXERSAUCER-ACTIVITY-FISH-POND-SPINNING-FISH-TOY-REPLACEMENT/133227997035?hash=item1f0501e76b:g:J~UAAOSwIWBdmh7B,EVENFLO EXERSAUCER ACTIVITY FISH POND SPINNING FISH TOY REPLACEMENT,$4.90,$5.24,Brand: Evenflo,N/A,N/A
https://www.ebay.com/itm/Bright-Starts-Exersaucer-EUC/143369157905?hash=item216177bd11:g:a2oAAOSw--hdaalm,Bright Starts Exersaucer  EUC,$15.50,$15.00,Brand: Bright Starts,N/A,N/A
https://www.ebay.com/itm/Evenflo-Triple-Fun-Jungle-Exersaucer-Seat-Cover-Replacement-Part/143431196802?hash=item21652a6082:g:D~kAAOSwsy5dmiEX,Evenflo Triple Fun Jungle Exersaucer Seat Cover Replacement Part,$8.50,$4.44,Brand: Evenflo,Color: Blue,Age: Infant
https://www.ebay.com/itm/Replacement-Fabric-Seat-for-Evenflo-Triple-Fun-Exersaucer-Jungle-VGUC/193194168796?hash=item2cfb4511dc:g:JbUAAOSwRBFdwXoo,Replacement Fabric Seat for Evenflo Triple Fun Exersaucer Jungle VGUC,$9.99,$4.53,Brand: Evenflo,Color: Blue,Age: Infant
https://www.ebay.com/itm/fisher-price-activity-table-sit-or-stand-used/133187722651?hash=item1f029b5d9b:g:X9EAAOSwoGVdkfnB,fisher price activity table sit or stand used ,$10.00,$7.00,Brand: Fisher-Price,Age: Infant,N/A
https://www.ebay.com/p/21027542833?iid=202816230584&rt=nc,"Evenflo ExerSaucer Activity Center, Mega Splash NEW",$52.91,Free,Brand: Evenflo,Color: Blue,Age: Infant
https://www.ebay.com/itm/Exersaucer-Replacement-6-X-2-5-Blue-Spring/133147308695?hash=item1f0032b297:g:6h4AAOSwUvldGNRN,"Exersaucer Replacement 6"" X 2.5” Blue Spring",$2.30,$3.70,N/A,N/A,N/A
https://www.ebay.com/itm/Evenflo-Life-in-the-Amazon-Exersaucer-Blue-Lizard-Light-Up-Toy-Replacement-Part/143391429880?hash=item2162cb94f8:g:iNUAAOSwRn9dh-wd,Evenflo Life in the Amazon Exersaucer Blue Lizard Light Up Toy Replacement Part,$5.00,$5.78,Brand: Evenflo,Color: Brown,Age: Infant
https://www.ebay.com/itm/6-Spring-Evenflo-Exersaucer-Replacement-Part-Triple-Fun-Jungle/283583972734?hash=item4206ec057e:g:OLIAAOSwUPxc~JVb,"6"" Spring Evenflo Exersaucer Replacement Part Triple Fun Jungle",$4.99,$3.70,Brand: Evenflo,Color: Silver,Age: Infant
https://www.ebay.com/itm/Mickey-Mouse-Helping-Hands-Feeding-And-Activity-Seat/274017951385?hash=item3fccbe1e99:g:-zoAAOSw6CxdaaMn,Mickey Mouse Helping Hands Feeding And Activity Seat,$14.99,$12.30,N/A,N/A,N/A
https://www.ebay.com/p/2199518304?iid=392397695500&rt=nc,Bright Starts Around We Go 3-in-1 Activity Center Accessories,$4.99,$4.95,Brand: Bright Starts,Age: Infant,N/A
https://www.ebay.com/itm/Mamas-Papas-Baby-Snug-Activity-Tray-Infant-Positioning-Seat/123943621384?hash=item1cdb9d9308:m:mGOflGqKw8zfzon1ex0MCPw&var=424731108141,Mamas & Papas Baby Snug & Activity Tray Infant Positioning Seat ,$59.99,Free,Brand: mamas & papas,Color: Blue,Age: Infant
https://www.ebay.com/itm/Nutramigen-12-6oz-7-cans/123964092990?hash=item1cdcd5f23e:g:8CIAAOSww5ZdwMXz,Nutramigen 12.6oz 7 cans,$0.99,$5.00,Color: Multicolor,N/A,N/A
https://www.ebay.com/itm/Evenflo-Life-in-the-Amazon-Exersaucer-Musical-Alligator-Toy-Replacement-Part/173776785950?hash=item2875e7521e:g:N0IAAOSwzSdbzJrp,Evenflo Life in the Amazon Exersaucer Musical Alligator Toy Replacement Part,$18.99,Free,Brand: Evenflo,Color: Green,Age: Infant
https://www.ebay.com/itm/Evenflo-Triple-Fun-Jungle-Exersaucer-Metal-Spring-Replacement-Part/173997198749?hash=item28830a8d9d:g:Z9EAAOSwsW9YzY9V,Evenflo Triple Fun Jungle Exersaucer Metal Spring  Replacement Part,$7.99,Free,Brand: Evenflo,Color: Silver,Age: Infant
https://www.ebay.com/itm/Evenflo-Exersaucer-Replacement-Part-Toy-Triple-Fun-Duck-Pond-123-Mirror-Beads/123909095188?hash=item1cd98ebf14:g:QAMAAOSwFxhdgBGc,Evenflo Exersaucer Replacement Part Toy Triple Fun Duck Pond 123 Mirror Beads,$14.99,$9.85,Brand: Evenflo,Color: Yellow,Age: Infant
https://www.ebay.com/itm/Genio-baby/123911783610?hash=item1cd9b7c4ba:g:5SwAAOSwL8BdTC3t,Genio baby,$0.99,$3.82,Color: Multicolor,N/A,N/A
https://www.ebay.com/p/10026658705?iid=352845318165&rt=nc,Bright Starts Around We Go 3-in-1 Activity Center Zippity Zoo,$87.99,Free,Brand: Bright Starts,Color: Red,Age: Infant
https://www.ebay.com/itm/Evenflo-Ultra-Exersaucer-Castle-Theme-Apple-Mirror-Toy-Replacement-Part/153683807814?hash=item23c844ce46:g:dcgAAOSwvW9do5x3,Evenflo Ultra Exersaucer Castle Theme Apple Mirror Toy Replacement Part,$5.99,$3.99,Brand: Evenflo,Color: Red,Age: Infant
https://www.ebay.com/itm/Evenflo-Mega-Splash-Exersaucer-Sand-Bucket-Dollar-Toy-Replacement-Part/183950548103?hash=item2ad44e9c87:g:SQsAAOSws~BdeTUm,Evenflo Mega Splash Exersaucer Sand Bucket/Dollar Toy Replacement Part,$9.77,Free,Brand: Evenflo,Color: Multicolor,Age: Infant
https://www.ebay.com/itm/Summer-Infant-3-Stage-Deluxe-SuperSeat-Wild-Safari/254373233625?hash=item3b39d383d9:g:hckAAOSwx6pdhpR8,"Summer Infant 3-Stage Deluxe SuperSeat, Wild Safari",$24.00,$16.70,Brand: Summer Infant,Color: Green,Age: Infant
https://www.ebay.com/itm/Evenflo-Exersaucer-Classic-Spinning-Twin-Toy-Replacement-Part-Multicolor/153691978469?hash=item23c8c17ae5:g:ZGMAAOSwpNxdrK5Q,Evenflo Exersaucer Classic Spinning Twin Toy Replacement Part Multicolor,$5.99,$4.50,Brand: Evenflo,Color: Multicolor,Age: Infant
https://www.ebay.com/itm/Baby-Einstein-Around-the-World-Exersaucer-Push-Penguin-Toy-Replacement-Part/174037782439?hash=item288575cfa7:g:MoYAAOSwQTNdB9ZW,Baby Einstein Around the World Exersaucer Push Penguin Toy Replacement Part,$14.99,Free,Brand: Baby Einstein,Color: Blue,Age: Infant
https://www.ebay.com/itm/6-Spring-Evenflo-Exersaucer-Replacement-Part-Triple-Fun-Jungle/133228265314?hash=item1f0505ff62:g:MUgAAOSwUvhdkRiB,"6"" Spring Evenflo Exersaucer Replacement Part Triple Fun Jungle",$4.10,$3.70,Brand: Evenflo,Color: Silver,Age: Infant
https://www.ebay.com/p/27011371440?iid=223695202582&rt=nc,New Bright Starts Safari Beats Musical ToY 3+ NIB,$7.99,$4.39,Brand: Bright Starts,Age: Infant,N/A
https://www.ebay.com/itm/Evenflo-Triple-Fun-Exersaucer-Replacement-Lizard-Iguana-Light-Up-Musical-Piece/184002812206?hash=item2ad76c192e:g:OyoAAOSwFwNdrNSD,Evenflo Triple Fun Exersaucer Replacement Lizard Iguana Light Up Musical Piece,$18.99,Free,Brand: Evenflo,Color: Blue,Age: Infant
https://www.ebay.com/itm/Baby-Einstein-Lion-Puppet-Replacement-Around-The-World-Activity-Saucer/283659334047?hash=item420b69f19f:g:oGQAAOSweRpduf8J,Baby Einstein Lion Puppet Replacement Around The World Activity Saucer,$8.00,$3.70,Brand: Baby Einstein,Color: Multicolor,Age: Infant
https://www.ebay.com/itm/Summer-Infant-3-Stage-SuperSeat-Deluxe-Giggles-Island-Positioner-Booster-and-Ac/333321132951?hash=item4d9b7cdb97:g:vOoAAOSwhJJdcoAk,"Summer Infant 3-Stage SuperSeat Deluxe Giggles Island Positioner, Booster and Ac",$35.65,Free,Brand: Summer Infant,Age: Infant,N/A
https://www.ebay.com/itm/Baby-Einstein-Around-the-World-Exersaucer-Spinning-Bird-Toy-Replacement-Part/174053651902?hash=item288667f5be:g:yfMAAOSwl1pbq~Au,Baby Einstein Around the World Exersaucer Spinning Bird Toy Replacement Part,$11.88,Free,Brand: Baby Einstein,Color: Multicolor,N/A
https://www.ebay.com/p/21016107098?iid=283600112226&rt=nc,Baby Einstein 5-in-1 Journey of Discovery Activity Gym FREE Shipping,$38.00,Free,Brand: Baby Einstein,Color: Yellow,N/A
https://www.ebay.com/itm/Evenflo-ExerSaucer-Triple-Fun-Animal-Planet-Jungle-koala-Replacement-Part/173998370881?hash=item28831c7041:g:VSEAAOSweIla9M0g,Evenflo ExerSaucer Triple Fun Animal Planet  Jungle koala Replacement Part,$10.49,$8.95,Brand: Evenflo,Color: Green,Age: Infant
https://www.ebay.com/itm/NWT-Baby-CRATE-KIDS-Deep-Space-Activity-Chair-Cotton-Tray-Seat-Support-Infant/254412577785?hash=item3b3c2bdbf9:g:bGAAAOSwSgFdrywQ,NWT Baby CRATE & KIDS Deep Space Activity Chair Cotton Tray Seat Support Infant,$99.00,$16.50,Color: Multicolor,Age: Infant,N/A
https://www.ebay.com/itm/Evenflo-Mega-Splash-Exersaucer-Smiling-Mr-Sun-Toy-Replacement-Part/183950546264?hash=item2ad44e9558:g:dEAAAOSwJAddeTR1,Evenflo Mega Splash Exersaucer Smiling Mr Sun Toy Replacement Part,$9.77,Free,Brand: Evenflo,Color: Multicolor,Age: Infant
https://www.ebay.com/itm/Evenflo-Exersaucer-3-RED-FEET-Legs-Props-Set-Lot-of-THREE-Replacement-Parts-Mega/143417241403?hash=item2164556f3b:g:2M4AAOSw50VdmiAe,Evenflo Exersaucer 3 RED FEET Legs Props Set Lot of THREE Replacement Parts Mega,$3.50,$4.44,Brand: Evenflo,Color: Red,N/A
https://www.ebay.com/itm/Bendy-Leaf-Teether-Baby-Einstein-Rhythm-of-the-Reef-Saucer-Activity/283607648050?hash=item4208554732:g:cRsAAOSwGVRddIMe,Bendy Leaf Teether Baby Einstein Rhythm of the Reef Saucer Activity,$6.99,$3.70,Brand: Baby Einstein,Color: Green,Age: Infant
https://www.ebay.com/itm/Evenflo-Exersaucer-Jump-and-Learn-Stationary-Jumper-Jungle-Quest-Used/333321887638?hash=item4d9b885f96:g:4KMAAOSwDg5dcxOE,Evenflo Exersaucer Jump and Learn Stationary Jumper Jungle Quest Used,$30.00,$108.75,Brand: Evenflo,Age: Infant,N/A
https://www.ebay.com/itm/Baby-Toddler-Kid-Harness-Bouncer-Jumper-Learn-To-Moon-Walk-Walker-Assistant-AA/112813512399?hash=item1a443596cf:m:miQH6x89Q1gomMKkhtq_npw&var=413242506620,Baby Toddler Kid Harness Bouncer Jumper Learn To Moon Walk Walker Assistant AA,$0.83 to $3.71,Free,Brand: Unbranded,Age: Toddler,N/A
https://www.ebay.com/itm/Baby-Einstein-Discover-Play-Exersaucer-Spinning-Globe-Toy-Replacement-Part/183850996318?hash=item2ace5f925e:g:tr0AAOSwR65dB-C-,Baby Einstein Discover Play Exersaucer Spinning Globe Toy Replacement Part,$14.99,Free,Brand: Baby Einstein,Color: Yellow,Age: Infant
https://www.ebay.com/itm/3-in-1-Baby-High-Chair-Interactive-Convertible-Play-Table-Seat-Sit-Jump-Stand/133209994646?hash=item1f03ef3596:g:50gAAOSwIgZdrUYc,"3 in 1 Baby High Chair Interactive Convertible Play Table Seat Sit, Jump & Stand",$88.96,Free,Color: White,Age: Infant,N/A
https://www.ebay.com/itm/Evenflo-Exersaucer-Triple-Fun-Replacement-Part-Light-Up-Arch-Toy-Bar-Colors/254350538724?hash=item3b387937e4:g:yqQAAOSwhbNdcGR-,Evenflo Exersaucer Triple Fun Replacement Part Light Up Arch Toy Bar Colors,$14.99,$15.43,Brand: Evenflo,Color: Multicolor,Age: Infant
https://www.ebay.com/itm/Tropical-Fish-Stalk-Toy-Replacement-Baby-Einstein-Rhythm-of-the-Reef-Saucer/283620464781?hash=item420918d88d:g:rUUAAOSwt-xc43WA,Tropical Fish Stalk Toy Replacement Baby Einstein Rhythm of the Reef Saucer,$6.99,$3.70,Brand: Baby Einstein,Color: Multicolor,Age: Infant
https://www.ebay.com/itm/Baby-Einstein-Around-The-World-Activity-Saucer-Replacement-Piano-With-Mirror/283607475481?hash=item420852a519:g:iAwAAOSwOuNddDqN,Baby Einstein Around The World Activity Saucer Replacement Piano With Mirror ,$14.99,$7.18,Brand: Baby Einstein,Color: Multicolor,Age: Infant
https://www.ebay.com/itm/Evenflo-Pink-Bumbly-Bees-Exersaucer-Lights-Music-Toy-Replacement-Part/173911917728?hash=item287df544a0:g:xeIAAOSwsIFcW2t3,Evenflo Pink Bumbly Bees Exersaucer Lights/ Music Toy Replacement Part,$17.99,Free,Brand: Evenflo,Color: Multicolor,Age: Infant
https://www.ebay.com/p/5014767745?iid=264425755604&rt=nc,Baby Einstein Neptune's Ocean Discovery Jumper,$100.00,Free,Brand: Baby Einstein,Color: Blue,Age: Infant
https://www.ebay.com/itm/Summer-Infant-3-Stage-Deluxe-SuperSeat-Wild-Safari/223644903243?hash=item341246674b:g:pUwAAOSwwB5dagfH,"Summer Infant 3-Stage Deluxe SuperSeat, Wild Safari",$30.00,$4.39,Brand: Summer Infant,Color: Green,Age: Infant
https://www.ebay.com/itm/Baby-Einstein-Exersaucer-toy-push-penguin-Around-the-World-Replacement-Part/163797328186?hash=item262314e13a:g:MF8AAOSwjSpdQE26,Baby Einstein Exersaucer toy push penguin Around the World Replacement Part,$17.49,Free,Brand: Baby Einstein,Color: Blue,Age: Infant
https://www.ebay.com/itm/Baby-Einstein-Around-the-World-Exersaucer-Music-Sounds-Toy-Replacement-Part/174037787343?hash=item288575e2cf:g:nLYAAOSwUv1clpGO,Baby Einstein Around the World Exersaucer Music/Sounds Toy Replacement Part,$24.99,Free,Brand: Baby Einstein,Color: Multicolor,Age: Infant
https://www.ebay.com/itm/Baby-Einstein-Lights-Sea-Activity-Exersaucer-Whale-Toy-Replacement-Part/183934301737?hash=item2ad356b629:g:5nEAAOSwyItdaB~D,Baby Einstein Lights & Sea Activity Exersaucer Whale Toy Replacement Part,$14.99,Free,Brand: Baby Einstein,Color: Multicolor,Age: Infant
https://www.ebay.com/p/21027542833?iid=383236053297&rt=nc,Evenflo ExerSaucer Baby Gear Activity Center Toy Fun Learning Toys Mega Splash,$65.50,Free,Brand: Evenflo,Color: Blue,Age: Infant
https://www.ebay.com/itm/Evenflo-Triple-Fun-Jungle-Exersaucer-Alligator-123-Colors-Replacement-Part-Toy/264413627593?hash=item3d9047c4c9:g:tCEAAOSwxOBdP2et,Evenflo Triple Fun Jungle Exersaucer Alligator 123 Colors Replacement Part Toy,$11.99,$9.32,Brand: Evenflo,Color: Multicolor,N/A
https://www.ebay.com/itm/Evenflo-Triple-Fun-Exersaucer-Replacement-Lizard-Iguana-Light-Up-Musical-Toy/264507672993?hash=item3d95e2c9a1:g:hSwAAOSwyMVdr0Yw,Evenflo Triple Fun Exersaucer Replacement Lizard Iguana Light Up Musical Toy,$12.99,$4.00,Brand: Evenflo,Color: Blue,Age: Infant
https://www.ebay.com/itm/Bright-Starts-Sweet-Safari-Bounce-Exersaucer-Lion-Push-Toy-Replacement-Part/174018236764?hash=item28844b915c:g:lT8AAOSwjpldbn1f,Bright Starts Sweet Safari Bounce Exersaucer Lion Push Toy Replacement Part,$14.99,Free,Brand: Bright Starts,Color: Multicolor,Age: Infant
https://www.ebay.com/itm/Evenflo-Triple-Fun-Jungle-Exersaucer-Toy-Arch-Replacement-Part/173997193749?hash=item28830a7a15:g:bOAAAOSwvCJc5AO0,Evenflo Triple Fun Jungle Exersaucer Toy Arch  Replacement Part,$14.99,$7.85,Brand: Evenflo,Age: Infant,N/A
https://www.ebay.com/itm/Evenflo-Exersaucer-Stationary-Jumper-Jungle-Quest-Replacement-Toy-Part-Giraffe/254240096879?hash=item3b31e4026f:g:P90AAOSwc9Nc5Yty,Evenflo Exersaucer Stationary Jumper Jungle Quest Replacement Toy Part Giraffe,$9.99,$5.99,Brand: Evenflo,N/A,N/A
https://www.ebay.com/itm/Baby-Einstein-Around-the-World-Exersaucer-Music-Sounds-Toy-Replacement-Part/183841680445?hash=item2acdd16c3d:g:sOcAAOSw9aJc~UcX,Baby Einstein Around the World Exersaucer Music Sounds Toy Replacement Part,$23.95,Free,Brand: Baby Einstein,Color: Blue,Age: Infant
https://www.ebay.com/itm/Evenflo-Exersaucer-Bird-Replacement-Triple-Fun-Life-in-the-Amazon-Jungle-Toucan/283652323382?hash=item420afef836:g:vQUAAOSwHaddtbiH,Evenflo Exersaucer Bird Replacement Triple Fun Life in the Amazon Jungle Toucan,$9.99,$5.78,Brand: Evenflo,Color: Multicolor,Age: Infant
https://www.ebay.com/itm/Evenflo-Triple-Fun-Jungle-Exersaucer-Dragonfly-Toy-Replacement-Part/173997194887?hash=item28830a7e87:g:FeQAAOSwDRxc5AHa,Evenflo Triple Fun Jungle Exersaucer Dragonfly Toy  Replacement Part,$13.99,Free,Brand: Evenflo,Color: Purple,Age: Infant
https://www.ebay.com/itm/Evenflo-Smart-Steps-ABC-123-Exersaucer-Lights-Music-Toy-Replacement-Part/174067325485?hash=item2887389a2d:g:L24AAOSwk-Bdp1Vw,Evenflo Smart Steps ABC/123 Exersaucer Lights/Music Toy Replacement Part,$23.99,Free,Brand: Evenflo,Color: Multicolor,Age: Infant
https://www.ebay.com/itm/Bright-Starts-Around-We-Go-3-in-1-Activity-Center-Accessories/392397696797?hash=item5b5cb9af1d:g:0BMAAOSwG1Nc3Yve,Bright Starts Around We Go 3-in-1 Activity Center Accessories,$5.70,$7.35,Brand: Bright Starts,N/A,N/A
https://www.ebay.com/itm/Evenflo-Triple-Fun-Exersaucer-3-Monkey-Arch-Toy-Bar-Replacement-Part/293149307674?hash=item44410f731a:g:z6kAAOSwAvFcw~PD,Evenflo Triple Fun Exersaucer 3 Monkey Arch / Toy Bar - Replacement Part,$17.75,Free,Brand: Evenflo,Color: Yellow,Age: Infant
https://www.ebay.com/itm/Evenflo-Triple-Fun-Jungle-Exersaucer-Light-Up-Frog-Toy-Replacement-Part/173997195784?hash=item28830a8208:g:QvMAAOSwfMlcWzu5,Evenflo Triple Fun Jungle Exersaucer Light Up Frog Toy  Replacement Part,$18.99,Free,Brand: Evenflo,Color: Brown,Age: Infant
https://www.ebay.com/itm/Evenflo-Triple-Fun-Exersaucer-Replacement-Lizard-Iguana-Light-Up-Musical-Piece/233321906845?hash=item365311c29d:g:A~wAAOSwBYddYaAW,Evenflo Triple Fun Exersaucer Replacement Lizard Iguana Light Up Musical Piece,$18.88,Free,Brand: Evenflo,Color: Green,Age: Infant
https://www.ebay.com/itm/Replacement-Globe-Animal-Sounds-Lights-Toy-4-Evenflo-Triple-Fun-Exersaucer-WORKS/193194232247?hash=item2cfb4609b7:g:UYcAAOSwP-9dwYTB,Replacement Globe Animal Sounds Lights Toy 4 Evenflo Triple Fun Exersaucer WORKS,$12.99,$8.00,Brand: Evenflo,Color: White,Age: Infant
https://www.ebay.com/itm/Evenflo-Triple-Fun-Jungle-Exersaucer-Animal-Globe-Toy-Replacement-Part/183920143607?hash=item2ad27eacf7:g:g~IAAOSw8mtccafN,Evenflo Triple Fun Jungle Exersaucer Animal Globe Toy  Replacement Part,$19.99,Free,Brand: Evenflo,Color: Yellow,Age: Infant
https://www.ebay.com/itm/Evenflo-Triple-Fun-Jungle-Exersaucer-Seat-Cover-Replacement-Part-Used/163808642273?hash=item2623c184e1:g:dBQAAOSwIMxdS1nK,Evenflo Triple Fun Jungle Exersaucer Seat Cover Replacement Part Used,$8.89,$7.35,Brand: Evenflo,Color: Multicolor,Age: Infant
https://www.ebay.com/itm/Baby-Einstein-2-in-1-Lights-Sea-Activity-Gym-Saucer-REPLACEMENT-SEAT-PAD/352819564327?hash=item5225af4f27:g:wpYAAOSwMkldn3vv,Baby Einstein 2 in 1 Lights & Sea Activity Gym & Saucer ~ REPLACEMENT SEAT PAD,$22.49,$3.18,Brand: Baby Einstein,Age: Infant,N/A
https://www.ebay.com/itm/Evenflo-Ultra-Exersaucer-Triple-Fun-Jungle-Rainforest-Replacement-Part-Toucan/293031764264?hash=item443a0de128:g:7W0AAOSwWYtcos6P,Evenflo Ultra Exersaucer Triple Fun Jungle / Rainforest Replacement Part-Toucan ,$18.99,$6.00,Brand: Evenflo,N/A,N/A
https://www.ebay.com/itm/Evenflo-Triple-Fun-Jungle-Exersaucer-Spinning-Parrot-Toy-Replacement-Part/173997194335?hash=item28830a7c5f:g:1o0AAOSwjyZc5AKa,Evenflo Triple Fun Jungle Exersaucer Spinning Parrot Toy  Replacement Part,$14.99,Free,Brand: Evenflo,Color: Brown,Age: Infant
https://www.ebay.com/itm/Evenflo-Triple-Fun-Jungle-Exersaucer-Animal-Globe-Toy-Replacement-Part/183970256546?hash=item2ad57b56a2:g:g~IAAOSw8mtccafN,Evenflo Triple Fun Jungle Exersaucer Animal Globe Toy  Replacement Part,$17.99,Free,Brand: Evenflo,Color: Multicolor,Age: Infant
https://www.ebay.com/itm/Baby-Einstein-Around-the-World-Exersaucer-Lion-Puppet-Toy-Replacement-Part/174067279992?hash=item288737e878:g:u14AAOSwRD5dhjQN,Baby Einstein Around the World Exersaucer Lion Puppet Toy  Replacement Part,$13.99,Free,Brand: Baby Einstein,Color: Brown,Age: Infant
https://www.ebay.com/itm/Evenflo-ExerSaucer-Jump-and-Learn-Jumper-Jungle-Quest/233366568168?hash=item3655bb3ce8:g:lHAAAOSw2UJde6j6,"Evenflo ExerSaucer Jump and Learn Jumper, Jungle Quest",$52.00,$33.17,Brand: Evenflo,Color: Multicolor,Age: Infant
https://www.ebay.com/itm/Baby-Einstein-Exersaucer-toy-penguin-On-Igloo-Around-the-World-Replacement-Part/254346436893?hash=item3b383aa11d:g:9EgAAOSwdeNdarHT,Baby Einstein Exersaucer toy penguin On Igloo Around the World Replacement Part,$13.59,$3.74,Brand: Baby Einstein,Color: Blue,Age: Infant
https://www.ebay.com/p/22031750717?iid=362771168020&rt=nc,Baby Einstein 10455 - Neptune's Ocean Discovery Jumper,$59.69,Free,Brand: Baby Einstein,Color: Blue,Age: Infant
https://www.ebay.com/itm/Baby-Einstein-Lights-Sea-Activity-Exersaucer-Leaf-Stalk-Toy-Replacement-Part/174013007999?hash=item2883fbc87f:g:TMkAAOSwrbFdaCH0,Baby Einstein Lights & Sea Activity Exersaucer Leaf Stalk Toy Replacement Part,$11.88,Free,Brand: Baby Einstein,Color: Green,Age: Infant
https://www.ebay.com/itm/Evenflo-Smart-Steps-ABC-123-Exersaucer-Light-Up-Toy-Arch-Replacement-Part/174028912864?hash=item2884ee78e0:g:-nkAAOSwu8hdeqvr,Evenflo Smart Steps ABC/123 Exersaucer Light Up Toy Arch Replacement Part,$14.99,$7.85,Brand: Evenflo,Color: Multicolor,Age: Infant
https://www.ebay.com/itm/Evenflo-Mega-Jungle-Safari-Exersaucer-Giraffe-Teether-Toy-Replacement-Part/183971552750?hash=item2ad58f1dee:g:~I8AAOSwSOJdjQfY,Evenflo Mega Jungle Safari Exersaucer Giraffe Teether Toy Replacement Part,$10.99,Free,Brand: Evenflo,Color: Green,Age: Infant
https://www.ebay.com/itm/Baby-Einstein-Lights-Sea-Activity-Exersaucer-Clam-Shell-Toy-Replacement-Part/174012987821?hash=item2883fb79ad:g:azEAAOSwRrNdaB2u,Baby Einstein Lights & Sea Activity Exersaucer Clam Shell Toy Replacement Part,$12.99,Free,Brand: Baby Einstein,Color: Multicolor,Age: Infant
https://www.ebay.com/itm/Evenflo-Bouncin-Barnyard-Farm-Exersaucer-Soft-Toy-Arch-Replacement-Part/183957843325?hash=item2ad4bded7d:g:Jw4AAOSwHeFdf6gN,Evenflo Bouncin Barnyard Farm Exersaucer Soft Toy Arch Replacement Part,$19.99,Free,Brand: Evenflo,Color: Multicolor,Age: Infant
https://www.ebay.com/itm/Evenflo-Life-in-the-Amazon-Exersaucer-Activity-Toy-Monkey-Arch-Replacement-Part/183615770699?hash=item2ac05a504b:g:5yIAAOSwVH9cK8L6,Evenflo Life in the Amazon Exersaucer Activity Toy Monkey Arch Replacement Part,$13.99,Free,Brand: Evenflo,Color: Blue,Age: Infant
https://www.ebay.com/itm/Baby-Einstein-Rhythm-of-the-Reef-Exersaucer-Seat-Cover-Replacement-Part/174005989524?hash=item288390b094:g:B3MAAOSw11BdXvbU,Baby Einstein Rhythm of the Reef Exersaucer Seat Cover Replacement Part,$21.88,Free,Brand: Baby Einstein,Age: Infant,N/A
https://www.ebay.com/itm/Evenflo-Exersaucer-Jump-and-Learn-Jumper-Jungle-Quest-REPLACEMENT-Toy-LION/113827738620?hash=item1a80a973fc:g:aZ4AAOSwWs9dNif7,Evenflo Exersaucer Jump and Learn Jumper Jungle Quest REPLACEMENT Toy LION,$9.99,$5.35,Brand: Evenflo,Color: Multicolor,N/A
https://www.ebay.com/itm/Evenflo-Exersaucer-Lizard-Replacement-Triple-Fun-Life-in-the-Amazon-Jungle/283652383823?hash=item420affe44f:g:HqcAAOSwmexdsK~N,Evenflo Exersaucer Lizard Replacement Triple Fun Life in the Amazon Jungle ,$12.99,$5.78,Brand: Evenflo,Color: Multicolor,Age: Infant
https://www.ebay.com/itm/Evenflo-Exersaucer-Globe-Replacement-Triple-Fun-Life-in-the-Amazon-Jungle/283652388655?hash=item420afff72f:g:n-0AAOSwkARdsLFo,Evenflo Exersaucer Globe Replacement Triple Fun Life in the Amazon Jungle,$9.99,$5.78,Brand: Evenflo,Color: Multicolor,Age: Infant
https://www.ebay.com/p/21027542833?iid=202808062577&rt=nc,"Evenflo ExerSaucer Activity Center, Mega Splash NEW",$52.91,Free,Brand: Evenflo,Color: Blue,Age: Infant
https://www.ebay.com/itm/Exersaucer-Replacement-6-X-2-5-Blue-Spring/133210615139?hash=item1f03f8ad63:g:6h4AAOSwUvldGNRN,"Exersaucer Replacement 6"" X 2.5” Blue Spring",$2.30,$3.70,Brand: Evenflo,Color: Multicolor,N/A
https://www.ebay.com/itm/6-Spring-Evenflo-Exersaucer-Replacement-Part/283608641759?hash=item42086470df:g:OLIAAOSwUPxc~JVb,"6"" Spring Evenflo Exersaucer Replacement Part ",$4.99,$3.70,Brand: Evenflo,Color: Silver,Age: Infant
https://www.ebay.com/p/22031750717?iid=113948571481&rt=nc,baby einstein neptune jumper,$35.00,$14.35,Brand: Baby Einstein,Color: Blue,Age: Infant
https://www.ebay.com/itm/Bright-Starts-Around-We-Go-3-in-1-Activity-Center-Accessories/392397697239?hash=item5b5cb9b0d7:g:~rIAAOSwMNZc3Yzc,Bright Starts Around We Go 3-in-1 Activity Center Accessories,$6.70,$8.00,Brand: Bright Starts,Age: Infant,N/A
https://www.ebay.com/itm/Baby-Einstein-Around-the-World-Exersaucer-Push-Penguin-Toy-Replacement-Part/173991933527?hash=item2882ba3657:g:MoYAAOSwQTNdB9ZW,Baby Einstein Around the World Exersaucer Push Penguin Toy Replacement Part,$14.99,Free,Brand: Baby Einstein,Age: Infant,N/A
