URL,Title,Price,Shipping,Dynamic Attribute 1,Dynamic Attribute 2,Dynamic Attribute 3
https://www.ebay.com/itm/Baby-Einstein-Musical-Activity-Jumper-Toy-Station-Blue-Cloud-Replacement-Piece/323751661901?hash=item4b611a514d:g:CdsAAOSwjXZcmBeI,Baby Einstein Musical Activity Jumper Toy Station Blue Cloud Replacement Piece,$9.50,Free,Brand: Baby Einstein,Color: Blue,N/A
https://www.ebay.com/itm/Fisher-Price-Luv-U-Zoo-Jumperoo-Teether-Lion-Replacement-Part-4340/332971124226?hash=item4d86a02602:g:YdkAAOSw6WdXiUg3,Fisher Price Luv U Zoo Jumperoo Teether Lion Replacement Part 4340,$7.99,Free,Brand: Fisher-Price,Age: Infant,N/A
https://www.ebay.com/itm/Replacement-Mirror-Part-Disney-Baby-Finding-Nemo-Sea-of-Activities-Jumper/153621409643?hash=item23c48caf6b:g:ftYAAOSwAMJdZsHS,Replacement Mirror Part • Disney Baby • Finding Nemo Sea of Activities Jumper,$10.99,Free,N/A,N/A,N/A
https://www.ebay.com/itm/Listing-for-kevt97-Only/283649431235?hash=item420ad2d6c3:g:v0QAAOSwPk1drL32,Listing for kevt97 Only,$13.50,Free,Brand: Fisher-Price,Color: Multicolor,Age: Infant
https://www.ebay.com/itm/Baby-Einstein-Neighborhood-Friends-Activity-Jumper-Replacement-Seat-WHEELS-ONLY/223623676908?hash=item34110283ec:g:8YMAAOSwxzdaOHDX,Baby Einstein Neighborhood Friends Activity Jumper Replacement Seat WHEELS ONLY,$5.99,$3.50,Brand: Baby Einstein,Color: Red,N/A
https://www.ebay.com/itm/Fisher-Price-Luv-U-Zoo-Jumperoo-Jumper-Fabric-Pad-Seat-Cover-Replacement-Part/153577841366?hash=item23c1f3e2d6:g:Ix8AAOSwyqddN3fv,Fisher Price Luv U Zoo Jumperoo Jumper Fabric Pad Seat Cover Replacement Part,$7.00,$5.00,Brand: Fisher-Price,Age: Infant,N/A
https://www.ebay.com/p/1889458255?iid=183919946705&rt=nc,Evenflo Exersaucer Door Jumper / Marianna,$24.45,Free,Brand: Evenflo,Color: Pink,Type: Doorway Jumper
https://www.ebay.com/itm/Evenflo-Seat-Car-Convertible-Doorway-Curtain-Door-Jumper-Pink-Star-Power/401877931825?hash=item5d91ca9731:g:gI8AAOSwQ8dddR0u,Evenflo Seat Car Convertible   Doorway Curtain Door Jumper (Pink Star Power),$30.40,Free,Brand: Evenflo,Color: Pink,Type: Doorway Jumper
https://www.ebay.com/itm/Fisher-Price-Rainforest-Jumperoo-Spinning-Reptile-Toy-Replacement-Part/171962178279?hash=item2809be9ae7:g:CiMAAOSw3qVc1ID~,Fisher Price Rainforest Jumperoo Spinning Reptile Toy Replacement Part,$6.33,Free,Brand: Fisher-Price,Color: Green,N/A
https://www.ebay.com/itm/EVENFLOW-BABY-DOORWAY-JUMPER/264499055023?hash=item3d955f49af:g:PmIAAOSwjqJdpR70,EVENFLOW BABY DOORWAY JUMPER,$9.99,$9.83,Brand: Evenflo,Color: Green,Type: Doorway Jumper
https://www.ebay.com/itm/Arctic-Puppy-Bead-Toy-Replacement-Baby-Einstein-Journey-of-Discovery-Jumper/283515009548?hash=item4202cfba0c:g:Z4MAAOSwH3ddAcxt,Arctic Puppy Bead Toy Replacement Baby Einstein Journey of Discovery Jumper,$8.99,$5.78,Brand: Baby Einstein,Age: Infant,N/A
https://www.ebay.com/itm/Fisher-Price-Luv-U-Zoo-Jumperoo-Color-Wheel-Toy-Replacement-Part/172964563834?hash=item28457dcb7a:g:1fQAAOSw~vpZ~jX0,Fisher Price Luv U Zoo Jumperoo Color Wheel Toy Replacement Part,$6.49,Free,Brand: Fisher-Price,Color: Green,Age: Infant
https://www.ebay.com/itm/Fisher-Price-Farm-ABC-Laugh-Learn-Jumperoo-Base-Foot-Plastic-Part-Green-5122/233062401661?hash=item36439a067d:g:LxIAAOSwTuJYxeTY,Fisher Price Farm ABC Laugh & Learn Jumperoo Base Foot Plastic Part Green 5122,$12.99,Free,Brand: Fisher-Price,Color: Green,N/A
https://www.ebay.com/itm/Baby-Einstein-Neighborhood-Friends-Activity-Jumper-Pole-Junction-Box-Replacement/223592357071?hash=item340f249ccf:g:whIAAOSwjvxdMS1G,Baby Einstein Neighborhood Friends Activity Jumper Pole Junction Box Replacement,$4.99,$8.00,Brand: Baby Einstein,Color: Blue,Age: Infant
https://www.ebay.com/itm/Baby-Einstein-Hook-for-buyer-lbsnj470/283614719878?hash=item4208c12f86:g:JwIAAOSwHppdfYiw,Baby Einstein Hook for buyer lbsnj470,$2.99,$3.70,Brand: Baby Einstein,Color: Purple,Age: Infant
https://www.ebay.com/itm/Fisher-Price-Roarin-Rainforest-Jumperoo-Spinning-Lion-Toy-Replacement-Part/322830682080?hash=item4b2a3547e0:g:07kAAOSwS0lZ49ta,Fisher Price Roarin' Rainforest Jumperoo Spinning Lion Toy Replacement Part,$5.50,Free,Brand: Fisher-Price,Color: Yellow,N/A
https://www.ebay.com/itm/Fisher-Price-Luv-U-Zoo-Jumperoo-Hanging-Lion-Teether-Replacement-Part/171829295926?hash=item2801d2fb36:g:~AAAAOSwyQtVgc1R,Fisher Price Luv U Zoo Jumperoo Hanging Lion Teether Replacement Part,$5.99,Free,Brand: Fisher-Price,Color: Brown,N/A
https://www.ebay.com/itm/Fisher-Price-Rainforest-Jumperoo-Replacement-Part-Pole-End-Cap-Giraffe-5163/323235870237?hash=item4b425bf61d:g:ChYAAOSwFTNa6SOS,Fisher-Price Rainforest Jumperoo Replacement Part Pole End Cap Giraffe 5163,$9.99,Free,Brand: Fisher-Price,Color: Multicolor,N/A
https://www.ebay.com/itm/Disney-Finding-Nemo-Baby-Jumper-Replacement-Side-Leg-Pole-w-Spring-Support-Part/183757460104?hash=item2ac8cc5288:g:8coAAOSwajRceuIZ,Disney Finding Nemo Baby Jumper Replacement Side Leg Pole w Spring Support Part,$4.95,$8.30,Brand: Disney,N/A,N/A
https://www.ebay.com/itm/Fisher-Price-Jumperoo-Laugh-Learn-Replacement-Toy-Spinning-Ducks-Rattle/174050059049?hash=item2886312329:g:ZogAAOSw2Whdk4kr,Fisher Price Jumperoo Laugh & Learn Replacement Toy Spinning Ducks Rattle,$10.75,Free,Brand: Fisher-Price,Color: Multicolor,N/A
https://www.ebay.com/itm/Replacement-Leaf-Topper-Disney-Minnie-Mouse-PeekABoo-Activity-Blue-Teal-Aqua/283638240276?hash=item420a281414:g:sK4AAOSwPfRdnemv,Replacement Leaf Topper Disney Minnie Mouse PeekABoo Activity Blue Teal Aqua,$7.99,$3.70,Brand: Bright Starts,Color: Blue,Type: Activity Center Jumper
https://www.ebay.com/itm/Baby-Einstein-Dark-Blue-Friends-Activity-Jumper-Pole-Junction-Box-Replacement/113811741892?hash=item1a7fb55cc4:g:s3UAAOSw~9Rci6w0,Baby Einstein Dark Blue Friends Activity Jumper Pole Junction Box Replacement,$3.99,$10.40,Brand: Baby Einstein,Color: White,Age: Infant
https://www.ebay.com/itm/Replacement-Wheels-Baby-Einstein-Activity-Jumper-Part-Lot-of-6/283526004124?hash=item4203777d9c:g:VXgAAOSw7Khcv0xK,Replacement Wheels Baby Einstein Activity Jumper Part Lot of 6,$5.99,$3.70,Brand: Baby Einstein,Color: Red,Age: Infant
https://www.ebay.com/itm/Fisher-Price-Rainforest-Jumperoo-Replacement-Part-Green-Fabric-Spring/264431448542?hash=item3d9157b1de:g:MFkAAOSwnalc-Gdm,Fisher Price Rainforest Jumperoo Replacement Part Green Fabric Spring,$7.25,Free,Brand: Fisher-Price,Color: Green,N/A
https://www.ebay.com/itm/Baby-Einstein-Pole-Cover-Replacement-Parts-Hardware-for-Activity-Jumper/283533211078?hash=item4203e575c6:g:iCcAAOSwBBRcyjxr,Baby Einstein Pole Cover Replacement Parts & Hardware for Activity Jumper,$8.89,Free,Brand: Baby Einstein,Color: Multicolor,Age: Infant
https://www.ebay.com/itm/Fisher-Price-Rain-Forest-Jumperoo-Short-Base-Curved-Silver-Pole-Replacement-Part/183937721344?hash=item2ad38ae400:g:BXoAAOSwo-ldUsLl,Fisher Price Rain Forest Jumperoo Short Base Curved Silver Pole Replacement Part,$12.95,Free,Brand: Fisher-Price,Color: Brown,Age: Infant
https://www.ebay.com/itm/Bright-Starts-or-Baby-Einstein-Bouncer-Replacement-Rotating-Seat-Ring-Rollers/312562341786?hash=item48c62ad79a:g:PFcAAOSweDhaiPhx,Bright Starts or Baby Einstein Bouncer Replacement Rotating Seat Ring Rollers,$4.95,$2.85,Brand: Bright Starts,Color: White,N/A
https://www.ebay.com/p/2254813875?iid=303288190288&rt=nc,Baby Johnny Jump Up Doorway Jumper Kids Entertainment Exerciser Door Frame Clamp,$30.50,Free,Brand: Evenflo,Type: Doorway Jumper,Age: Infant
https://www.ebay.com/itm/Disney-Finding-Nemo-Baby-Jumper-Replacement-Side-Leg-Pole-w-Spring-Support-Part/183941658568?hash=item2ad3c6f7c8:g:uXEAAOSwj3VbcbHx,Disney Finding Nemo Baby Jumper Replacement Side Leg Pole w Spring Support Part,$4.95,$8.30,Brand: Disney,N/A,N/A
https://www.ebay.com/itm/Disney-Finding-Nemo-Sea-Activity-Jumper-STAR-Hook-Toy-Replacement-Part/223534456376?hash=item340bb11e38:g:vjwAAOSwYnhcn09k,Disney Finding Nemo Sea Activity Jumper STAR Hook Toy Replacement Part,$9.99,Free,Brand: Disney,N/A,N/A
https://www.ebay.com/itm/Fisher-Price-Precious-Planet-Jumperoo-Replacement-Metal-Leg-Arm-Pole-white-d1/133023072778?hash=item1ef8cb020a:g:PeYAAOSwVtta-HYV,Fisher Price Precious Planet Jumperoo Replacement Metal Leg Arm Pole white (d1),$16.99,Free,Brand: Fisher-Price,Color: White,Age: Infant
https://www.ebay.com/itm/Fisher-Price-Luv-U-Zoo-Jumperoo-Hanging-Monkey-leaf-Toy-Replacement-Part-side-R/173990971951?hash=item2882ab8a2f:g:l8UAAOSwdmRdC9to,Fisher Price Luv U Zoo Jumperoo Hanging Monkey leaf Toy Replacement Part side R,$13.50,Free,Brand: Fisher-Price,Color: Brown,Age: Infant
https://www.ebay.com/itm/BRITE-STARTS-Spinning-Flower-Toy-Replacement-Part-5077-Bounce-Bounce-BABY/401710137379?hash=item5d87ca4023:g:RcoAAOSwmThcaiQ3,BRITE STARTS ~ Spinning Flower Toy Replacement Part 5077  Bounce Bounce BABY,$8.99,Free,Brand: Bright Starts,N/A,N/A
https://www.ebay.com/itm/2-Baby-Einstein-Jumperoo-Purple-Toy-Hook-Hooks-Replacement-Part-Jumper/113883918062?hash=item1a8402aeee:g:VnwAAOSwANddeAyo,2 Baby Einstein Jumperoo~ Purple Toy Hook Hooks Replacement Part Jumper,$7.99,Free,Brand: Baby Einstein,Color: Purple,Age: Infant
https://www.ebay.com/itm/Fisher-Price-Precious-Planet-Jumperoo-Orange-Polka-Dot-Spring-Replacement-5131/332971124230?hash=item4d86a02606:g:7CUAAOSwFBRZbX4G,Fisher Price Precious Planet Jumperoo Orange Polka Dot Spring Replacement 5131,$12.99,Free,Brand: Fisher-Price,Color: Orange,N/A
https://www.ebay.com/itm/Bright-Starts-Pink-Baby-Girl-Bounce-a-Round-Replacement-Push-Bug-Spinner-Part/163514574128?hash=item26123a6530:g:8RAAAOSwFGNcUJzP,Bright Starts Pink Baby Girl Bounce a Round Replacement Push Bug Spinner Part ,$12.99,Free,Brand: Bright Starts,Color: Green,N/A
https://www.ebay.com/itm/Fisher-Price-Luv-U-Zoo-Jumperoo-Jumper-Blue-Fabric-Spring-Replacement-Part-BA/132923552183?hash=item1ef2dc71b7:g:sAYAAOSwksBbUo0T,Fisher Price Luv U Zoo Jumperoo Jumper Blue Fabric Spring Replacement Part (BA),$8.57,Free,Brand: Fisher-Price,Color: Blue,N/A
https://www.ebay.com/itm/Replacement-Wheels-Baby-Einstein-Activity-Jumper-Part-Lot-of-6/113883916658?hash=item1a8402a972:g:3xYAAOSwvGZdeAt0,Replacement Wheels Baby Einstein Activity Jumper Part Lot of 6,$3.99,$4.53,Brand: Baby Einstein,Color: Red,Age: Infant
https://www.ebay.com/itm/Fisher-Price-wood-land-space-saver-jumperoo-replacement-seat-cover/153607929507?hash=item23c3befea3:g:yb0AAOSwFOVdWIGC,Fisher-Price wood land space saver jumperoo replacement seat cover,$10.00,Free,Brand: Fisher-Price,Color: Green,N/A
https://www.ebay.com/itm/Fisher-Price-Rainforest-Jumperoo-Replacement-Part-Green-Fabric-Spring/352747217639?hash=item52215f62e7:g:PZ4AAOSwKm1c-Gln,Fisher Price Rainforest Jumperoo Replacement Part Green Fabric Spring,$7.25,Free,Brand: Fisher-Price,Color: Green,N/A
https://www.ebay.com/itm/Evenflo-ExerSaucer-123-Tea-for-Me-Replacement-Flower-Toy-Universal/383190560249?hash=item5937efedf9:g:hH8AAOSw-~tdlgBX,Evenflo ExerSaucer 123 Tea for Me Replacement ~ Flower Toy ~ Universal,$8.99,$3.18,Brand: Evenflo,Color: Multicolor,Age: Infant
https://www.ebay.com/itm/Replacement-Green-Elastic-Band-for-Bright-Starts-Bounce-Bounce-Baby-Platform/192473421319?hash=item2cd04f5607:g:xnQAAOSw88hanI-J,Replacement Green Elastic Band for Bright Starts Bounce Bounce Baby Platform,$6.99,$4.53,Brand: Bright Starts,Color: Green,Age: Infant
https://www.ebay.com/itm/Evenflo-Mega-Splash-Exersaucer-Toy-Switch-a-Roo-Part-Sand-Bucket-Teether-4942/233062401664?hash=item36439a0680:g:Q7oAAOSwol5Y3EtU,Evenflo Mega Splash Exersaucer Toy Switch a Roo Part Sand Bucket Teether 4942,$12.99,Free,Brand: Evenflo,N/A,N/A
https://www.ebay.com/itm/Baby-Einstein-Rhythm-of-the-Reef-Activity-Exersaucer-Replacement-Purple-Leg/322690808127?hash=item4b21def93f:g:XT0AAOSwOsBZpL4t,Baby Einstein Rhythm of the Reef Activity Exersaucer Replacement Purple Leg,$5.99,Free,Brand: Baby Einstein,Color: Multicolor,N/A
https://www.ebay.com/p/18003300871?iid=254394044184&rt=nc,Fisher- Rainforest Jumperoo Baby Activity Jumper - Model K6070 -,$43.00,N/A,Brand: Fisher-Price,Type: Jumper Walker,Age: Infant
https://www.ebay.com/p/1739584373?iid=202644822877&rt=nc,LIME GREEN LEG w/PAD 60245 for Bright Starts*Bounce Baby Jungle Activity Zone,$4.95,$8.30,Brand: Bright Starts,Color: Green,Age: Infant
https://www.ebay.com/itm/Jolly-Jumper-Musical-Matt-for-Jolly-Jumper/303127360175?hash=item4693cc72af:g:biQAAOSwDNdVoWYB,Jolly Jumper-Musical Matt for Jolly Jumper,$24.21,$7.57,N/A,N/A,N/A
https://www.ebay.com/itm/Fisher-Price-Rainforest-Jumperoo-Baby-Activity-Jumper/123928404515?hash=item1cdab56223:g:vMQAAOSwunNdlzxy,Fisher Price  Rainforest Jumperoo Baby Activity Jumper,$34.00,N/A,Brand: Jumperoo,N/A,N/A
https://www.ebay.com/itm/Fisher-Price-Rainforest-Jumperoo-Blue-Frog-Leaf-Mobile-Toy-Replacement-Part/293200012555?hash=item444415250b:g:BvkAAOSwgHRdYZyV,Fisher Price Rainforest Jumperoo Blue Frog/Leaf Mobile Toy Replacement Part,$5.00,$7.00,Brand: Fisher-Price,Color: Green,Age: Infant
https://www.ebay.com/itm/2-Baby-Einstein-Jumperoo-Purple-Toy-Hook-Hooks-Replacement-Part-Jumper/174047744149?hash=item28860dd095:g:5KsAAOSwZ8pcONwO,2 Baby Einstein Jumperoo~ Purple Toy Hook Hooks Replacement Part Jumper,$6.95,Free,Brand: Baby Einstein,Color: Purple,Age: Infant
https://www.ebay.com/itm/Disney-Finding-Nemo-Baby-Jumper-Replacement-Side-Leg-Pole-w-Spring-Support-Part/173851578950?hash=item287a5c9246:g:uXEAAOSwj3VbcbHx,Disney Finding Nemo Baby Jumper Replacement Side Leg Pole w Spring Support Part,$4.95,$8.30,Brand: Disney,N/A,N/A
https://www.ebay.com/itm/Disney-Nemo-Sea-of-Activities-Baby-Jumper-Replacement-Side-Leg-Pole-Support-Part/183938489770?hash=item2ad3969daa:g:8coAAOSwajRceuIZ,Disney Nemo Sea of Activities Baby Jumper Replacement Side Leg Pole Support Part,$4.95,$8.30,Brand: Disney,N/A,N/A
https://www.ebay.com/p/16026721951?iid=392491272878&rt=nc,Evenflo 61731197 Safari Friends Stationary Jumper,$25.00,N/A,Brand: Evenflo,Color: Green,Age: Infant
https://www.ebay.com/itm/Fisher-Price-Animal-Activity-Jumperoo-Blue/312518734168?hash=item48c3917158:g:LaoAAOSwDSRcgIPc,"Fisher-Price Animal Activity Jumperoo, Blue",$77.47,Free,Brand: Jumperoo,Color: Blue,N/A
https://www.ebay.com/itm/Fisher-Price-Rainforest-Jumperoo-Replacement-Part-Jump-Lights-Music-Toy/293200010376?hash=item4444151c88:g:0BIAAOSwi5FdYZug,Fisher Price Rainforest Jumperoo Replacement Part Jump Lights Music Toy,$5.00,$14.00,Brand: Fisher-Price,Color: Multicolor,Age: Infant
https://www.ebay.com/itm/Fisher-Price-Roarin-Rainforest-Jumperoo-NewFreeShip/362738322133?hash=item5474e38ad5:g:VOcAAOSwdAJdXVzY,Fisher-Price Roarin' Rainforest Jumperoo - NewFreeShip,$76.79,Free,Brand: Jumperoo,N/A,N/A
https://www.ebay.com/p/19023207301?iid=264296259520&rt=nc,Baby Jumper Toy Bouncer Bouncy Seat Exerciser Child Safety Play  Animal Toys Bar,$61.20,Free,Brand: Creative Baby,Color: Multicolor,Type: Activity Center Jumper
https://www.ebay.com/p/1385727981?iid=283651179469&rt=nc,Baby Einstein Neighborhood Friends Activity Jumper,$50.00,N/A,Brand: Baby Einstein,Age: Infant,N/A
https://www.ebay.com/p/22026702283?iid=223613025338&rt=nc,Baby Einstein Neighborhood Friends Activity Jumper PICK-UP ONLY,$33.00,N/A,Brand: Baby Einstein,Color: Multicolor,Type: Activity Center Jumper
https://www.ebay.com/itm/Baby-Jumper-Fisher-Price-Animal-Activity-Jumperoo-Walker-Bouncer-Seat-Fun/254377607465?hash=item3b3a164129:g:k5MAAOSwfopdlYuk,Baby Jumper Fisher Price Animal Activity Jumperoo Walker Bouncer Seat Fun,$86.80,Free,Brand: Fisher-Price,Color: Multicolor,Type: Jumper Walker
https://www.ebay.com/itm/Fisher-Price-First-Steps-Jumperoo-Rainforest-Theme/153678849426?hash=item23c7f92592:g:r1QAAOSwqlNdgdee,Fisher Price First Steps Jumperoo Rainforest Theme,$34.99,N/A,Brand: Fisher-Price,Color: Multicolor,Age: Infant
https://www.ebay.com/p/23031755075?iid=312761103942&rt=nc,Jolly Jumper Exerciser with Portable Stand in White- Brand New - Free Shipping,$75.00,Free,Brand: Jolly Jumper,Color: White,Type: Jumper Walker
https://www.ebay.com/p/8009622434?iid=173975655368&rt=nc,Baby Bouncer Activity Center Jumper with 360 Degree Rotating Seat Play Toy Bar,$44.58,Free,Brand: Creative Baby,Color: Green,Type: Activity Center Jumper
https://www.ebay.com/p/15031752108?iid=254368286902&rt=nc,Johnny Jump Up Doorway Jumper Up Toddler Baby Exersaucer Swings Jumpers Bouncers,$28.10,Free,Brand: Evenflo,Type: Doorway Jumper,Age: Toddler
https://www.ebay.com/itm/The-Original-Jolly-Jumper-with-Super-Stand/202780473135?epid=0&hash=item2f36a8772f:g:VKQAAOSwLppdTG3p,The Original Jolly Jumper with Super Stand,$70.99,Free,Brand: Jolly Jumper,N/A,N/A
https://www.ebay.com/itm/Fisher-Rainforest-Jumperoo-Baby-Activity-Jumper-Model-K6070/312716180583?hash=item48cf563c67:g:sYQAAOSwlQddPpWP,Fisher- Rainforest Jumperoo Baby Activity Jumper - Model K6070 -,$25.00,N/A,Brand: Jumperoo,N/A,N/A
https://www.ebay.com/p/18003300871?iid=143313082741&rt=nc,Fisher- Rainforest Jumperoo Baby Activity Jumper - Model K6070 -,$45.00,N/A,Brand: Fisher-Price,Type: Jumper Walker,Age: Infant
https://www.ebay.com/p/9032346140?iid=174001736531&rt=nc,Baby Bouncer Jumper Activity Play ,$45.00,N/A,Brand: Baby Einstein,Color: Multicolor,Type: Activity Center Jumper
https://www.ebay.com/itm/fisher-price-luv-u-zoo-jumperoo-freestanding-jumper-Very-gently-used/162765145241?hash=item25e58f0499:g:KG0AAOSw-olaEn-R,"fisher-price luv u zoo jumperoo, freestanding jumper. Very gently used",$40.00,N/A,Brand: Fisher-Price,N/A,N/A
https://www.ebay.com/itm/Skip-Hop-Explore-More-Jumpscape-Foldaway-Activity-Center-Baby-Jumper-White-NEW/202731446398?hash=item2f33bc607e:g:Mq4AAOSwR11dJ9oI,Skip Hop Explore & More Jumpscape Foldaway Activity Center Baby Jumper White NEW,$25.00,N/A,Brand: Skip Hop,Color: White,Type: Activity Center Jumper
https://www.ebay.com/p/2292427206?iid=323909140828&rt=nc,Baby Einstein Neighborhood Symphony Walker,$47.07,Free,Brand: Baby Einstein,Type: Jumper Walker,Age: Infant
https://www.ebay.com/p/1300119683?iid=173998984655&rt=nc,Fisher- Jump A Roo,$50.00,N/A,Age: Infant,N/A,N/A
https://www.ebay.com/p/22012034754?iid=153362219263&rt=nc,Creative Baby Walker Caterpillar Baby The Very Hungry Jumper Activity Center New,$68.97,Free,Color: Green,Type: Activity Center Jumper,Age: Infant
https://www.ebay.com/itm/New-Infant-Jumper-Woodland-Friends-SpaceSaver-Jumperoo/223719253986?hash=item3416b4e7e2:g:iYkAAOSwHVhdsbA8,"New Infant Jumper, Woodland Friends SpaceSaver Jumperoo",$61.63,Free,Color: White,Age: Infant,N/A
https://www.ebay.com/p/2193499719?iid=264522380051&rt=nc,"Graco Doorway Bumper Jumper, Little Jungle",$30.54,Free,Brand: Graco,Type: Doorway Jumper,N/A
https://www.ebay.com/itm/Graco-Bumper-Jumper/283581808657?hash=item4206cb0011:m:mVri37jrTyqsXm3yDx8xhOw&var=584830869239,Graco Bumper Jumper,$29.99,Free,Brand: Graco,N/A,N/A
https://www.ebay.com/itm/Fisher-Price-Jumpers-Animal-Wonders-Jumperoo-Baby/401856226687?hash=item5d907f657f:g:0uMAAOSwB-ZdXW8P,Fisher-Price Jumpers Animal Wonders Jumperoo Baby,$79.00,Free,Brand: Fisher-Price,N/A,N/A
https://www.ebay.com/p/16026721951?iid=133210030264&rt=nc,Exersaucer Evenflo Jump & Learn Baby Stationary Jumper (Safari Friends),$69.37,Free,Brand: Evenflo,Color: Green,Age: Infant
https://www.ebay.com/itm/Walker-Activity-Assistant-Jumper-Baby-Toy-Play-Bouncer-Seat-Adjustable-Green/303219970759?hash=item46995192c7:g:vg8AAOSwLSBdJmZa,Walker Activity Assistant Jumper Baby Toy Play Bouncer Seat Adjustable Green,$42.99,Free,Brand: Bright Starts,Color: Green,Type: Jumper Walker
https://www.ebay.com/p/2255477465?iid=174030817362&rt=nc,"Evenflo ExerSaucer Door Jumper, Roo",$19.74,Free,Brand: Evenflo,Color: Brown,Type: Doorway Jumper
https://www.ebay.com/c/2254321822,Baby Doorway Jumper Bouncer Swing Lightweight Nautical Themed Buoyantly Bouncy,$25.99,Free,Color: Green,Type: Doorway Jumper,Age: Toddler
https://www.ebay.com/itm/Fisher-Price-Rainforest-Jumperoo-Rainbow-Sun-Toy-Replacement-Part-Peekaboo-Tiger/133208467179?hash=item1f03d7e6eb:g:aEwAAOSwP45dj6O~,Fisher Price Rainforest Jumperoo Rainbow Sun Toy Replacement Part Peekaboo Tiger,$2.90,$7.70,Brand: Fisher-Price,Color: Multicolor,Age: Infant
https://www.ebay.com/c/12016094056,Fisher-Price Rainforest Music & Lights Deluxe Gym,$42.60,Free,Brand: Fisher-Price,Age: Infant,N/A
https://www.ebay.com/p/6032166066?iid=254327544171&rt=nc,Fisher Price Rainforest Music & Lights Deluxe Newborn Baby Toddler Gym,$47.64,Free,Brand: Fisher-Price,Type: Activity Center Jumper,Age: Toddler
https://www.ebay.com/itm/Graco-Jump-N-Jive-Doorway-Jumper-NO-MAT/273999860438?hash=item3fcbaa12d6:g:1lEAAOSwMmhddRiQ,Graco Jump N Jive Doorway Jumper  NO MAT,$9.70,$7.81,Brand: Graco,Color: Multicolor,Type: Doorway Jumper
https://www.ebay.com/itm/Fisher-Price-Safari-Jumperoo-REPLACEMENT-PARTS-PICK-ONE/113923020583?hash=item1a86575727:m:mBuO4Mo-tdV6v1U5rpaUcNA&var=414205180914,Fisher Price Safari Jumperoo / REPLACEMENT PARTS - PICK ONE,$9.99,Free,Brand: Fisher-Price,N/A,N/A
https://www.ebay.com/itm/Fisher-Luv-U-Zoo-Jumperoo-V0206/283474634202?hash=item420067a5da:g:ge0AAOSwM8Nczx0g,Fisher- Luv U Zoo Jumperoo V0206,$120.99,Free,Brand: Jumperoo,N/A,N/A
https://www.ebay.com/p/27031745837?iid=264384376808&rt=nc,Fisher Price Jumperoo Animal Activity Blue Machine Washable Seat Pad Music Light,$101.79,Free,Brand: Fisher-Price,Color: Blue,Type: Activity Center Jumper
https://www.ebay.com/itm/Disney-Baby-Activity-Center-Jumper-Bouncer-Child-Infant-Toy-Station-Exersaucer/273778690280?hash=item3fbe7b48e8:g:AugAAOSw23FcrCJZ,Disney Baby Activity Center  Jumper Bouncer Child Infant Toy Station  Exersaucer,$140.33,Free,Brand: Disney,Color: Multicolor,Type: Activity Center Jumper
https://www.ebay.com/p/2254325097?iid=133180761221&rt=nc,Evenflo New Exersaucer Baby Doorway Jumper (Marianna),$22.99,Free,Brand: Evenflo,Color: Pink,Type: Doorway Jumper
https://www.ebay.com/p/691198666?iid=253426509728&rt=nc,Baby Bouncer Activity Center Walker Learning Jumper Girl Seat Sweet Tea Party,$77.89,Free,Color: Pink,Type: Activity Center Jumper,Age: Infant
https://www.ebay.com/itm/Graco-Duet-Sway-Baby-Swing-with-Portable-Rocker-Maxton/193165361962?hash=item2cf98d832a:g:bEkAAOSwgV1dqp-L,"Graco Duet Sway Baby Swing with Portable Rocker, Maxton",$82.38,Free,N/A,N/A,N/A
https://www.ebay.com/itm/Fisher-Price-Jumpers-Animal-Wonders-Jumperoo-Baby/254209047056?hash=item3b300a3a10:g:YuAAAOSwhmNcvyn~,Fisher-Price Jumpers Animal Wonders Jumperoo Baby,$116.99,Free,Brand: Fisher-Price,N/A,N/A
https://www.ebay.com/p/2255919560?iid=152833689061&rt=nc,Walker Activity Assistant Jumper Baby Toy Play Bouncer Seat Adjustable Green,$69.57,Free,Brand: Bright Starts,Color: Green,Type: Jumper Walker
https://www.ebay.com/p/26016569787?iid=283623404725&rt=nc,Creative Baby Woodland Activity Center Multicolor For Adventurous  And Fun Play ,$54.50,Free,Brand: Creative Baby,Color: Green,Type: Activity Center Jumper
https://www.ebay.com/p/21027565122?iid=254394622699&rt=nc,Evenflo Electronic ExerSaucer Jump and Learn Stationary Jumper Music Jam Session,$99.96,Free,Brand: Evenflo,Type: Activity Center Jumper,Age: Infant
https://www.ebay.com/p/2164364645?iid=263638069395&rt=nc,Baby Activity Jumper Bumper Doorway Hanging Chair Secure Bouncer Kids Exerciser,$48.99,Free,Brand: Bright Starts,Color: Green,Type: Doorway Jumper
https://www.ebay.com/p/26012069916?iid=264441308464&rt=nc,Creative Baby Safari Jumper,$56.31,Free,Brand: Creative Baby,Color: Multicolor,Type: Activity Center Jumper
https://www.ebay.com/itm/Baby-Hanging-Jumper-Bouncer-Fun-Jump-Up-Bumper-Kids-Doorway-Jumping-Exerciser/163493716856?hash=item2610fc2378:g:cs4AAOSwcf9cQgVT,Baby Hanging Jumper Bouncer Fun Jump Up Bumper Kids Doorway Jumping Exerciser,$69.81,Free,Type: Doorway Jumper,N/A,N/A
https://www.ebay.com/itm/Baby-Einstein-Neighborhood-Symphony-Jumper-Replacement-Part-Bottom-Frame-Base/173901139761?hash=item287d50cf31:g:J5oAAOSwpRJc2GOW,Baby Einstein Neighborhood Symphony Jumper Replacement Part Bottom Frame Base,$9.95,$9.77,Brand: Baby Einstein,N/A,N/A
https://www.ebay.com/itm/Fisher-Price-Jumpers-Animal-Wonders-Jumperoo-Baby/392391566662?hash=item5b5c5c2546:g:UG0AAOSwIYtdXXJi,Fisher-Price Jumpers Animal Wonders Jumperoo Baby,$78.99,Free,Brand: Fisher-Price,N/A,N/A
https://www.ebay.com/p/27028307969?iid=292826130620&rt=nc,Jolly Jumper - The Original Baby Exerciser with Super Stand for Active Babies...,$156.10,Free,Brand: Jolly Jumper,Color: Black,Type: Activity Center Jumper
https://www.ebay.com/itm/Jumper-Bumper-Jungle-Graco-Little-Baby-Bouncer-Doorway-Toy-Door-Jump-Play/264499691926?hash=item3d95690196:g:~08AAOSwPaBcjnKW,Jumper Bumper Jungle Graco Little Baby Bouncer Doorway Toy Door Jump Play,$39.95,Free,Brand: Graco Baby,Type: Doorway Jumper,N/A
https://www.ebay.com/p/1385727981?iid=323717016090&rt=nc,Baby Einstein Neighborhood Friends Activity Jumper ,$100.40,Free,Brand: Baby Einstein,Age: Infant,N/A
https://www.ebay.com/itm/Jolly-Jumper-Exerciser-With-Door-Clamp-Black/183903766232?hash=item2ad184c6d8:g:GjQAAOSwfe5dP~Co,"Jolly Jumper Exerciser With Door Clamp, Black",$96.99,Free,Brand: Jolly Jumper,Color: Black,N/A
https://www.ebay.com/p/23031755075?iid=223543760694&rt=nc,Jolly Jumper - Stand for Jumpers and Rockers - Baby Exerciser - Baby Jumper,$94.99,Free,Brand: Jolly Jumper,Color: White,Type: Jumper Walker
https://www.ebay.com/p/537013651?iid=173900397091&rt=nc,Ingenuity Cozy Kingdom Portable Swing,$75.28,Free,Brand: Ingenuity,Color: White,Age: Infant
https://www.ebay.com/p/8009622434?iid=133212774350&rt=nc,Creative Baby Woodland Activity Center Multicolor For Adventurous  And Fun Play ,$53.70,Free,Color: Green,Type: Activity Center Jumper,Age: Infant
https://www.ebay.com/itm/Doorway-Jumper-Baby-Door-Bouncer-Infant-Exercise-Jumping-Seat-Swing-Jump-Babies/323908300285?hash=item4b6a706dfd:g:ZVkAAOSwXD1ddHRP,Doorway Jumper Baby Door Bouncer Infant Exercise Jumping Seat Swing Jump Babies,$34.98,Free,Brand: Evenflo,Type: Doorway Jumper,Age: Infant
