URL,Title,Price,Shipping,Dynamic Attribute 1,Dynamic Attribute 2,Dynamic Attribute 3
https://www.ebay.com/itm/Fisher-Price-Woodland-Friends-SpaceSaver-Jumperoo-with-Lights-Sounds/392521019345?hash=item5b64136fd1:g:wvEAAOSwjZFdwo~6,Fisher-Price Woodland Friends SpaceSaver Jumperoo with Lights & Sounds,$44.89,Free,Brand: Unbranded,N/A,N/A
https://www.ebay.com/p/26012069916?iid=392464350405&rt=nc,Baby Jumper 10 Activity Sensory Play Toy Seat Bouncer Infant Exerciser Center,$65.24,Free,Brand: Creative Baby,Color: Green,Type: Activity Center Jumper
https://www.ebay.com/itm/Evenflo-Exersaucer-Door-Jumper/153700672791?hash=item23c9462517:g:6skAAOSwC99drLI6,Evenflo Exersaucer Door Jumper,$11.50,$5.00,Brand: Evenflo,N/A,N/A
https://www.ebay.com/p/2292738373?iid=392506381378&rt=nc,Fisher Price Roarin' Rainforest Colorful Spinning Jumperoo Entertainer | CBV63 ,$70.00,Free,Brand: Fisher-Price,Color: Multicolor,Age: Infant
https://www.ebay.com/itm/Baby-Door-Jumper-Doorway-Bouncer-Swing-Jump-Babies-Infant-Exercise-Jumping-Seat/143360869895?hash=item2160f94607:g:vQsAAOSw3VpdXEzI,Baby Door Jumper Doorway Bouncer Swing Jump Babies Infant Exercise Jumping Seat,$5.00,$8.99,Brand: Evenflo,Type: Doorway Jumper,Age: Infant
https://www.ebay.com/p/2254419243?iid=233382176753&rt=nc,Fisher-Price Laugh Learn Jumperoo Baby Bouncer ,$25.00,$29.00,Brand: Fisher-Price,Type: Activity Center Jumper,Age: Infant
https://www.ebay.com/itm/Fisher-Price-Jumperoo-Animal-Activity-Blue-New-In-Box/163919543649?hash=item262a5dbd61:g:nfEAAOSwHVhdtHXm,"Fisher-Price Jumperoo: Animal Activity, Blue - New In Box",$57.00,$4.49,Brand: Fisher-Price,Color: Blue,N/A
https://www.ebay.com/p/16011373014?iid=283630695455&rt=nc,Skip Hop Explore & More Jumpscape Foldaway Activity Center Baby Jumper White NEW,$50.00,$13.24,Brand: Skip Hop,Color: White,Type: Activity Center Jumper
https://www.ebay.com/itm/baby-toy-FISHER-PRICE-activity-jumper-Safari-animals/254366609292?hash=item3b396e6f8c:g:wWAAAOSw99ddbYC0,baby toy FISHER PRICE activity jumper Safari animals,$33.00,$15.00,Brand: Fisher-Price,N/A,N/A
https://www.ebay.com/itm/Jumper-Bumper-Jungle-Graco-Little-Baby-Bouncer-Doorway-Toy-Door-Jump-Play/333375926260?hash=item4d9ec0eff4:g:PSwAAOSwOxJdqyv2,Jumper Bumper Jungle Graco Little Baby Bouncer Doorway Toy Door Jump Play,$14.60,$9.80,Brand: Graco Baby,Type: Doorway Jumper,N/A
https://www.ebay.com/p/8009622434?iid=392334036849&rt=nc,Baby Bouncer Activity Center Jumper with 360 Degree Rotating Seat Play Toy Bar,$62.33,Free,Brand: Creative Baby,Color: Multicolor,Type: Activity Center Jumper
https://www.ebay.com/p/1385727981?iid=312800532053&rt=nc,"Baby Einstein Activity Jumper Special Edition, Neighborhood Friends",$65.00,Free,Brand: Baby Einstein,Type: Activity Center Jumper,Age: Infant
https://www.ebay.com/p/1524539063?iid=383158997092&rt=nc,"Jolly Jumper Exerciser with Door Clamp, Black",$39.00,$10.40,Brand: Jolly Jumper,Color: Black,Type: Doorway Jumper
https://www.ebay.com/itm/Merry-Muscles-Baby-Exerciser-Red/202778162167?hash=item2f368533f7:g:EBsAAOSwU4xde-~i,Merry Muscles Baby Exerciser - Red,$19.99,Free,Color: Red,N/A,N/A
https://www.ebay.com/itm/Jolly-Jumper-harness-and-Stand-for-Baby-exerciser/113939082485?hash=item1a874c6cf5:g:8T8AAOSwCEFdteJG,Jolly Jumper harness and Stand for Baby exerciser ,$25.40,$31.05,Brand: Jolly Jumper,N/A,N/A
https://www.ebay.com/itm/Baby-Exersaucer-REPLACEMENT-Spinning-Ball-Toy/153618131053?hash=item23c45aa86d:g:wSYAAOSwPeNdO6U6,Baby Exersaucer REPLACEMENT Spinning Ball Toy,$4.99,$4.81,N/A,N/A,N/A
https://www.ebay.com/p/8020022944?iid=312794278965&rt=nc,Bright Starts 2-In-1 Lights N Learn Activity Gym And Saucer,$20.00,$25.00,Brand: Bright Starts,Color: Multicolor,Type: Activity Center Jumper
https://www.ebay.com/itm/Johnny-Jump-Up/113940252400?hash=item1a875e46f0:g:T4YAAOSw9gxdrg5~,Johnny Jump Up,$3.20,$12.60,N/A,N/A,N/A
https://www.ebay.com/itm/Fisher-Price-Rainforest-Jumperoo-Replacement-Part-FROG-PARROT-Leaf-Plush-Toys/143409675193?hash=item2163e1fbb9:g:1ksAAOSwWQVdj6Uk,Fisher Price Rainforest Jumperoo Replacement Part FROG & PARROT Leaf Plush Toys,$15.50,$5.24,Brand: Fisher-Price,Color: Blue,N/A
https://www.ebay.com/itm/Fisher-Price-Rainforest-Jumperoo-Replacement-Part-FROG-PARROT-Leaf-Plush-Toys/143397053365?hash=item21632163b5:g:1ksAAOSwWQVdj6Uk,Fisher Price Rainforest Jumperoo Replacement Part FROG & PARROT Leaf Plush Toys,$19.27,$5.24,Brand: Fisher-Price,Color: Blue,N/A
https://www.ebay.com/itm/BRAND-NEW-IN-BOX-Disney-Baby-Finding-Nemo-Sea-of-Activities-Jumper/264520578988?hash=item3d96a7b7ac:g:A6IAAOSws65dt4z9,**BRAND NEW IN BOX** Disney Baby Finding Nemo Sea of Activities Jumper,$71.00,$19.60,Brand: Disney,Color: Multicolor,Age: Infant
https://www.ebay.com/itm/Exersaucer-Fisherprice/153710431419?hash=item23c9db0cbb:g:-IQAAOSwxIldoJ4f,Exersaucer Fisherprice,$25.00,$10.00,Brand: Fisher-Price,N/A,N/A
https://www.ebay.com/p/18003300871?iid=401792252785&rt=nc,Fisher-Price Rainforest Jumperoo Activity Toy for Toddlers,$91.49,Free,Brand: Fisher-Price,Type: Jumper Walker,Age: Toddler
https://www.ebay.com/itm/Fisher-Price-Rainforest-Jumperoo-Red-Frog-Seat-Cover-Replacement-Part/133159017577?hash=item1f00e55c69:g:qIYAAOSwpWddbW2V,Fisher Price Rainforest Jumperoo Red Frog Seat Cover Replacement Part,$11.00,$4.44,Brand: Fisher-Price,Color: Yellow,Age: Infant
https://www.ebay.com/itm/Baby-Einstein-Musical-Motion-Activiy-Jumper-Blue/303285421220?hash=item469d3844a4:g:FJsAAOSwy2pdazu5,"Baby Einstein Musical Motion Activiy Jumper,Blue",$26.00,$10.50,Brand: Baby Einstein,Color: Blue,N/A
https://www.ebay.com/itm/Bright-Starts-Bounce-N-Spring-Deluxe-Door-Jumper-Blue/382965648241?hash=item592a880b71:g:X7UAAOSwvaxc5Mtx,"Bright Starts Bounce 'N Spring Deluxe Door Jumper, Blue",$28.91,Free,Brand: Bright Starts,Color: Blue,N/A
https://www.ebay.com/p/2254501947?iid=163879037471&rt=nc,Walker Bouncer Jumper Baby Toddler Light Music Learn Play Fun Exercise Toy Bar,$13.00,$7.85,Brand: Fisher-Price,Type: Jumper Walker,Age: Toddler
https://www.ebay.com/p/15031752108?iid=233361052608&rt=nc,Evenflo 60411676 Exersaucer Owl Door Jumper,$4.25,$9.83,Brand: Evenflo,Color: Multicolor,Type: Doorway Jumper
https://www.ebay.com/itm/Fisher-Price-Rainforest-Jumperoo-Red-Frog-Seat-Cover-Replacement/143403258920?hash=item2163801428:g:HeEAAOSwtgNdj6RL,Fisher Price Rainforest Jumperoo Red Frog Seat Cover Replacement,$14.99,$4.44,Brand: Fisher-Price,Color: Multicolor,Age: Infant
https://www.ebay.com/itm/Graco-Doorway-Jumper-Cloud-Print/113936585789?hash=item1a8726543d:g:lQ8AAOSwc5xdnifa,Graco Doorway Jumper Cloud Print,$8.00,$7.89,Brand: Graco,Type: Doorway Jumper,Age: Infant
https://www.ebay.com/itm/Jolly-Jumper-Exerciser-with-Door-Clamp-Black/383141534532?hash=item593503db44:g:IyIAAOSwn8Vdcmg-,"Jolly Jumper Exerciser with Door Clamp, Black",$39.00,$10.40,Brand: Jolly Jumper,Color: Black,Type: Doorway Jumper
https://www.ebay.com/itm/Jolly-Jumper-110-The-Original-Baby-Exerciser-w-Super-Stand-Grey/392388768966?hash=item5b5c3174c6:g:Gt8AAOSwhpBdWuWr,Jolly Jumper 110 The Original Baby Exerciser w/ Super Stand - Grey,$82.56,$18.56,Brand: Jolly Jumper,Color: Gray,N/A
https://www.ebay.com/p/12031071793?iid=283624198944&rt=nc,"Jolly Jumper with Stand - Baby Exerciser, Used, Mint Condition",$40.00,$45.60,Brand: Jolly Jumper,Color: Black,Age: Infant
https://www.ebay.com/itm/The-Original-Jolly-Jumper-Baby-Exerciser-with-Door-Clamp/333338529699?hash=item4d9c864fa3:g:G7wAAOSwjINdiT3C,The Original Jolly Jumper Baby Exerciser with Door Clamp,$34.00,$17.61,Brand: Jolly Jumper,Color: Blue,Type: Doorway Jumper
https://www.ebay.com/itm/fisher-price-jumperoo-girls/392524354860?hash=item5b6446552c:g:aYwAAOSwi7Rdu7YR,fisher price jumperoo girls ,$50.00,$3.78,Brand: Fisher-Price,N/A,N/A
https://www.ebay.com/p/18026511863?iid=303292661998&rt=nc,"Infantino Go Gaga Up, Up Away Deluxe Doorway Jumper - Multi-Color",$15.50,Free,Brand: Infantino,Color: Multicolor,Type: Doorway Jumper
https://www.ebay.com/p/4030250531?iid=163877280911&rt=nc,Disney Baby Finding Nemo Sea of Activities Jumper,$60.00,$10.00,Brand: Disney,Color: Blue,N/A
https://www.ebay.com/itm/Graco-Doorway-Baby-Bouncer/352830730429?hash=item522659b0bd:g:uDUAAOSwX5hdr5IJ,Graco Doorway Baby Bouncer,$4.44,Free,Brand: Graco Baby,Type: Doorway Jumper,N/A
https://www.ebay.com/p/1122812770?iid=303309843107&rt=nc,Graco Bumper Jumper Johnny Jump Up Doorway Swing Infant Exerciser Seat,$9.99,$24.29,Brand: Graco,Color: White,Type: Doorway Jumper
https://www.ebay.com/itm/Disney-baby-Finding-Nemo-Door-Jumper-Bright-Stars/323914888195?hash=item4b6ad4f403:g:RREAAOSwNP5dV036,Disney baby Finding Nemo Door Jumper. Bright  Stars,$25.00,$9.25,Brand: Disney,N/A,N/A
https://www.ebay.com/itm/Baby-Johnny-Jump-Up-Doorway-Jumper-Entertainment-Exerciser-Door-Frame-Clamp/183934496954?hash=item2ad359b0ba:g:RIMAAOSwbe1daGiI,Baby Johnny Jump-Up Doorway Jumper Entertainment Exerciser Door Frame Clamp ,$2.95,$11.15,Brand: Evenflo,Color: Multicolor,Type: Doorway Jumper
https://www.ebay.com/p/11027559380?iid=333307033555&rt=nc,MINNIE MOUSE PeekABoo Activity Jumper,$61.00,Free,Brand: Disney,Color: Pink,N/A
https://www.ebay.com/itm/Evenflo-Exersaucer-Adjustable-Door-Jumper-Baby-Exercise-Gone-Fishin/143368206357?hash=item2161693815:g:b8YAAOSw2YpdaA75,Evenflo Exersaucer Adjustable Door Jumper Baby Exercise Gone Fishin,$5.00,$7.00,Brand: Evenflo,Color: Multicolor,Age: Infant
https://www.ebay.com/itm/Fisher-Price-Rainforest-Jumperoo-Red-Frog-Seat-Cover-Replacement-Part/153639433900?hash=item23c59fb6ac:g:tFMAAOSwepNdK-3l,Fisher Price Rainforest Jumperoo Red Frog Seat Cover Replacement Part,$10.00,$5.00,Brand: Fisher-Price,Color: Yellow,Age: Infant
https://www.ebay.com/p/710134419?iid=352762039359&rt=nc,Fisher-Price CBV63 Roarin Rainforest Jumperoo,$30.00,N/A,Brand: Fisher-Price,Type: Activity Center Jumper,Age: Infant
https://www.ebay.com/p/12031071793?iid=392480196748&rt=nc,Jolly Jumper Baby Exerciser - Black - Used Only A Handful Of Times,$30.00,$11.95,Brand: Jolly Jumper,Color: Black,Age: Infant
https://www.ebay.com/itm/Fisher-Price-Rainforest-Jumperoo-Red-Frog-Seat-Cover-Replacement-Part/293197809598?hash=item4443f387be:g:TYgAAOSwmAJdXuGl,Fisher Price Rainforest Jumperoo Red Frog Seat Cover Replacement Part,$10.00,$7.00,Brand: Fisher-Price,Color: Yellow,Age: Infant
https://www.ebay.com/itm/Fisher-Rainforest-Jumperoo-Baby-Activity-Jumper-Model-K6070/123893645065?hash=item1cd8a2ff09:g:v9sAAOSwphhcxvLe,Fisher- Rainforest Jumperoo Baby Activity Jumper - Model K6070 -,$15.80,$50.30,Brand: Jumperoo,N/A,N/A
https://www.ebay.com/p/23031755075?iid=383124808521&rt=nc,Jolly Jumper - Stand for Jumpers and Rockers - Baby Exerciser - Baby Jumper,$65.00,Free,Brand: Jolly Jumper,Color: White,Type: Jumper Walker
https://www.ebay.com/itm/Fisher-Rainforest-Jumperoo-Baby-Activity-Jumper-Model-K6070/143426515962?hash=item2164e2f3fa:g:v9sAAOSwphhcxvLe,Fisher- Rainforest Jumperoo Baby Activity Jumper - Model K6070 -,$50.00,Free,Brand: Jumperoo,N/A,N/A
https://www.ebay.com/itm/Baby-Door-Jumper-Doorway-Bouncer-Swing-Jump-Up-Toddler-Infant-Exercise-Seat/174087038735?hash=item288865670f:g:bFAAAOSwsjZdwYro,Baby Door Jumper Doorway Bouncer Swing Jump Up Toddler Infant Exercise Seat,$23.29,Free,Color: Multicolor,Type: Doorway Jumper,Age: Infant
https://www.ebay.com/itm/ExerSaucer-Doorway-Jumper-Soft-Cuddly-Moo-Cow/254373372403?hash=item3b39d5a1f3:g:C~QAAOSwkaddkAzz,ExerSaucer Doorway Jumper Soft & Cuddly Moo Cow,$4.50,$17.68,Brand: Evenflo,Color: Multicolor,Type: Doorway Jumper
https://www.ebay.com/p/26027053028?iid=233230645154&rt=nc,Evenflo 61731198 ExerSaucer Jump & Learn Jungle Quest Stationary Baby Jumper,$124.99,Free,Brand: Evenflo,Age: Infant,N/A
https://www.ebay.com/p/2254501947?iid=352718297169&rt=nc,"New Infant Jumper, Woodland Friends SpaceSaver Jumperoo",$60.03,$1.99,Brand: Fisher-Price,Age: Infant,N/A
https://www.ebay.com/itm/Fisher-Price-Rainforest-Jumperoo-Replacement-Jump-for-Lights-Music-Toy/133208466093?hash=item1f03d7e2ad:g:BJMAAOSw31ldj6Nt,Fisher Price Rainforest Jumperoo Replacement Jump for Lights & Music Toy,$7.99,$8.30,Brand: Fisher-Price,Color: Multicolor,Age: Infant
https://www.ebay.com/itm/Jumper-Bumper-Jungle-Graco-Little-Baby-Bouncer-Doorway-Toy-Door-Jump-Play/352787834635?hash=item5223cb270b:g:2zQAAOSwXD1depNM,Jumper Bumper Jungle Graco Little Baby Bouncer Doorway Toy Door Jump Play,$9.00,$61.30,Brand: Graco Baby,Type: Doorway Jumper,N/A
https://www.ebay.com/itm/Evenflo-ExerSaucer-Delux-Baby-Jumping-Exerciser-Activity-Center-Mega-Circus/174064036843?hash=item2887066beb:g:qT4AAOSwCtFdminw,Evenflo ExerSaucer Delux Baby Jumping Exerciser Activity Center Mega Circus,$22.00,$53.30,Brand: Evenflo,N/A,N/A
https://www.ebay.com/itm/Disney-baby-Finding-Nemo-Door-Jumper-Bright-Stars/323923887098?hash=item4b6b5e43fa:g:FgsAAOSwgHFdhsFb,Disney baby Finding Nemo Door Jumper. Bright  Stars,$14.80,$9.25,Brand: Disney,N/A,N/A
https://www.ebay.com/itm/Original-Johnny-Jump-Up-Baby-Swing-VERY-NICE/283605217647?hash=item420830316f:g:cwQAAOSw8VFdb7LW,Original Johnny Jump-Up Baby Swing VERY NICE,$0.01,$14.99,N/A,N/A,N/A
https://www.ebay.com/p/15031752108?iid=264520562972&rt=nc,Baby Door Jumper Doorway Bouncer Swing Jump Up Toddler Infant Exercise Seat ,$29.95,Free,Brand: Evenflo,Type: Doorway Jumper,Age: Infant
https://www.ebay.com/itm/Baby-Active-Exersaucer-2-In-1-Door-Jumper-Newborn-To-Walking-Age/362725636034?hash=item547421f7c2:g:dwUAAOSwFcxdUz9F,Baby Active - Exersaucer - 2 In 1 - Door Jumper - Newborn To Walking Age,$5.00,$5.00,N/A,N/A,N/A
https://www.ebay.com/p/1385727981?iid=264460924611&rt=nc,"Baby Einstein Activity Jumper Special Edition, Neighborhood Friends",$97.88,Free,Brand: Baby Einstein,Age: Infant,N/A
https://www.ebay.com/p/2088082281?iid=352826547657&rt=nc,"Bright Starts Pattern Pals Walker, Green",$37.99,Free,Brand: Bright Starts,Color: Green,Age: Infant
https://www.ebay.com/itm/Evenflo-ExerSaucer-Door-Jumper-Pink-Floral-Design/174032821750?hash=item28852a1df6:g:WgwAAOSw-FJdZBgK,"Evenflo ExerSaucer Door Jumper, Pink Floral Design",$10.00,$8.00,Brand: Evenflo,Color: Pink,Type: Doorway Jumper
https://www.ebay.com/itm/Evenflo-ExerSaucer-Seat-cover-Replacement-Part-Yellow-Blue-Green/143423553412?hash=item2164b5bf84:g:qf0AAOSwlTldtIkr,Evenflo ExerSaucer Seat cover Replacement Part Yellow Blue Green,$2.99,$4.44,Brand: Evenflo,Color: Green,Type: Activity Center Jumper
https://www.ebay.com/p/3030528362?iid=392423540665&rt=nc,Bright Starts Playful Parade Door Jumper - 11619-3-W11,$0.99,$14.95,Brand: Bright Starts,Color: Gray,Age: Infant
https://www.ebay.com/p/5014767745?iid=174008299407&rt=nc,Baby Einstein Neptune's Ocean Discovery Jumper  ,$50.00,Free,Brand: Baby Einstein,Color: Blue,Age: Infant
https://www.ebay.com/p/26033166771?iid=362686138242&rt=nc,FISHER PRICE ANIMAL WONDERS JUMPEROO,$69.99,Free,Brand: Jumperoo,Type: Jumper Walker,Age: Infant
https://www.ebay.com/p/21024940443?iid=264473279637&rt=nc,Baby Door Jumper Doorway Bouncer Swing Jump Up Toddler Infant Seat Exercise.,$5.50,$10.50,Brand: Evenflo,Color: Multicolor,Type: Doorway Jumper
https://www.ebay.com/itm/Baby-Johnny-Jump-Up-Doorway-Jumper-Entertainment-Exerciser-Door-Frame-Clamp-NEW/383128193883?hash=item5934384b5b:g:9csAAOSwJPVdaKYg,Baby Johnny Jump-Up Doorway Jumper Entertainment Exerciser Door Frame Clamp NEW,$7.00,$8.30,Brand: Evenflo,Color: Multicolor,Type: Doorway Jumper
https://www.ebay.com/itm/New-Bright-Starts-Door-Baby-Jumper/372812141354?hash=item56cd55d32a:g:ZMEAAOSwIU5dpMwn,New Bright Starts Door Baby Jumper,$10.00,$19.95,Brand: Bright Starts,N/A,N/A
https://www.ebay.com/itm/Baby-Door-Jumper-Doorway-Bouncer-Swing-Jump-Babies-Infant-Exercise-Jumping-Seat/193063740982?hash=item2cf37ee636:g:K9QAAOSwY3BdX~xY,Baby Door Jumper Doorway Bouncer Swing Jump Babies Infant Exercise Jumping Seat,$9.00,$14.00,Brand: Evenflo,Type: Doorway Jumper,Age: Infant
https://www.ebay.com/itm/baby-toy-FISHER-PRICE-activity-jumper-Safari-animals/254348522766?hash=item3b385a750e:g:wWAAAOSw99ddbYC0,baby toy FISHER PRICE activity jumper Safari animals,$26.00,$15.00,Brand: Fisher-Price,N/A,N/A
https://www.ebay.com/p/1524539063?iid=193086366606&rt=nc,"Jolly Jumper Baby Exerciser with Door Clamp, Black (#104) *NEW",$59.99,Free,Brand: Jolly Jumper,Color: Black,Type: Doorway Jumper
https://www.ebay.com/p/23023708193?iid=163937109681&rt=nc,"Evenflo Exersaucer Door Jumper, Owl",$19.79,Free,Brand: Evenflo,Type: Doorway Jumper,Age: Infant
https://www.ebay.com/itm/Baby-bouncer-jumper/401903586255?hash=item5d93520bcf:g:-zgAAOSwt95dj5nI,Baby bouncer jumper,$50.00,Free,Color: Multicolor,N/A,N/A
https://www.ebay.com/p/16026721951?iid=312797011397&rt=nc,Evenflo 61731197 Safari Friends Stationary Jumper,$60.00,Free,Brand: Evenflo,Color: Green,Age: Infant
https://www.ebay.com/p/14021426464?iid=303325582318&rt=nc,FISHER PRICE GALLOPING Fun JUMPEROO TOY.   RARE!  Great pre-owned condition ,$88.00,$38.95,Brand: Fisher-Price,Color: Multicolor,N/A
https://www.ebay.com/itm/Fisher-Prince-Jumperoo-Pink-Petals/392507152903?hash=item5b633fda07:g:S2oAAOSwUJNduNeK,Fisher Prince Jumperoo Pink Petals,$50.00,$25.05,Brand: Jumperoo,Color: Pink,N/A
https://www.ebay.com/itm/Jolly-jumper-exerciser-with-door-clamp-black/392487559648?hash=item5b6214e1e0:g:MYwAAOSwAPpdqjGj,Jolly jumper exerciser with door clamp black,$45.00,$14.20,Brand: Jolly Jumper,Color: Black,Age: Infant
https://www.ebay.com/p/18003300871?iid=123960007718&rt=nc,Fisher- Rainforest Jumperoo Baby Activity Jumper - Model K6070 -,$25.00,$29.71,Brand: Fisher-Price,Type: Jumper Walker,Age: Infant
https://www.ebay.com/itm/Baby-Door-Jumper-Doorway-Bouncer-Swing-Jump-Babies-Infant-Exercise-Jumping-Seat/264381386477?hash=item3d8e5bceed:m:msM61hZ5xX9HZbPsMHiaeHQ&var=563995365510,Baby Door Jumper Doorway Bouncer Swing Jump Babies Infant Exercise Jumping Seat,$25.41 to $42.59,Free,Brand: Evenflo,Type: Doorway Jumper,Age: Infant
https://www.ebay.com/itm/Jolly-Jumper-Stand-for-Jumpers-and-Rockers-Baby-Exerciser-Baby-Jumper/312697727518?hash=item48ce3caa1e:g:QOkAAOSwsWddKTfA,Jolly Jumper - Stand for Jumpers and Rockers - Baby Exerciser - Baby Jumper,$85.99,Free,Brand: Jolly Jumper,N/A,N/A
https://www.ebay.com/itm/Evenflo-Exersaucer-Doorway-Jumper-Gone-Fishin/283653410389?hash=item420b0f8e55:g:coQAAOSwW1Ndsg6s,"Evenflo Exersaucer Doorway Jumper, Gone Fishin",$10.00,$5.00,Brand: Evenflo,Color: Pink,Type: Doorway Jumper
https://www.ebay.com/itm/Disney-Baby-Finding-Nemo-Sea-of-Activities-Jumper/293283415506?hash=item44490dc5d2:g:OKEAAOSw9ltdqLPg,Disney Baby Finding Nemo Sea of Activities Jumper,$99.99,Free,Brand: Disney,Color: Blue,Age: Infant
https://www.ebay.com/itm/Baby-Einstein-Musical-Motion-Activity-Jumper-Seat-Cover-Replacement-Part/283637175294?hash=item420a17d3fe:g:TmsAAOSwbX9dE4AJ,Baby Einstein Musical Motion Activity Jumper Seat Cover Replacement Part,$26.99,Free,Brand: Baby Einstein,Color: Multicolor,Age: Infant
https://www.ebay.com/itm/Replacement-Piano-Baby-Einstein-Neighborhood-Friends-Activity-Jumper-Part/283620489396?hash=item42091938b4:g:WT0AAOSw7Khcv1Qf, Replacement Piano Baby Einstein Neighborhood Friends Activity Jumper Part,$19.99,$7.51,Brand: Baby Einstein,Color: Multicolor,Age: Infant
https://www.ebay.com/p/26033166771?iid=283633629208&rt=nc,Fisher-Price Jumperoo Animal Wonders w Music Lights & Sounds Spins 360 Degrees,$54.58,Free,Brand: Fisher-Price,Type: Jumper Walker,Age: Infant
https://www.ebay.com/p/19023207301?iid=401880570977&rt=nc,Baby Jumper Toy Bouncer Bouncy Seat Exerciser Child Safety Play  Animal Toys Bar,$67.99,Free,Brand: Creative Baby,Color: Multicolor,Type: Activity Center Jumper
https://www.ebay.com/itm/Baby-Einstein-Musical-Motion-Jumperoo-Fabric-Spring-Replacement-Part/183938557793?hash=item2ad397a761:g:klUAAOSwR5ldbXx8,Baby Einstein Musical Motion Jumperoo Fabric Spring Replacement Part,$13.99,Free,Brand: Baby Einstein,Color: Blue,Age: Infant
https://www.ebay.com/p/2254419243?iid=233347903106&rt=nc,Fisher-Price Laugh Learn Jumperoo Baby Bouncer ,$25.00,$29.00,Brand: Fisher-Price,Type: Activity Center Jumper,Age: Infant
https://www.ebay.com/p/26012069916?iid=401946105647&rt=nc,Baby Jumper Bouncer Seat Safari Jumper Exerciser Safe Play Toy No Spill Tray,$38.99,Free,Brand: Creative Baby,Color: Green,Type: Activity Center Jumper
https://www.ebay.com/itm/Fisher-Price-Rainforest-Jumperoo-Replacement-Part-FROG-PARROT-Leaf-Plush-Toys/133217732054?hash=item1f046545d6:g:1ksAAOSwWQVdj6Uk,Fisher Price Rainforest Jumperoo Replacement Part FROG & PARROT Leaf Plush Toys,$15.50,$5.24,Brand: Fisher-Price,Color: Blue,N/A
https://www.ebay.com/p/2254501947?iid=163819378481&rt=nc,Walker Bouncer Jumper Baby Toddler Light Music Learn Play Fun Exercise Toy Bar,$30.00,$7.85,Brand: Fisher-Price,Type: Jumper Walker,Age: Toddler
https://www.ebay.com/itm/BRAN-NEW-IN-BOX-Disney-Baby-Finding-Nemo-Sea-of-Activities-Jumper/264514358448?hash=item3d9648ccb0:g:A6IAAOSws65dt4z9,**BRAN NEW IN BOX** Disney Baby Finding Nemo Sea of Activities Jumper,$67.00,$14.80,Brand: Disney,N/A,N/A
https://www.ebay.com/itm/Fisher-Price-Rainforest-Jumperoo-Red-Frog-Seat-Cover-Replacement/133186106597?hash=item1f0282b4e5:g:HeEAAOSwtgNdj6RL,Fisher Price Rainforest Jumperoo Red Frog Seat Cover Replacement,$14.99,$4.44,Brand: Fisher-Price,Color: Multicolor,Age: Infant
https://www.ebay.com/itm/Fisher-Price-Rainforest-Jumperoo-Red-Frog-Seat-Cover-Replacement-Part/153630749545?hash=item23c51b3369:g:tFMAAOSwepNdK-3l,Fisher Price Rainforest Jumperoo Red Frog Seat Cover Replacement Part,$10.50,$5.00,Brand: Fisher-Price,Color: Yellow,Age: Infant
https://www.ebay.com/p/8009622434?iid=233361246422&rt=nc,BABY BOUNCER ACTIVITY Center Jumper with 360 Degree Rotating Seat Play Toy Bar,$59.95,Free,Brand: Creative Baby,Color: Multicolor,Type: Activity Center Jumper
https://www.ebay.com/p/18003300871?iid=192630378383&rt=nc,Fisher Price Rainforest Jumperoo Baby Jumper Walker Bouncer Activity 3DAYSHIP,$98.77,Free,Brand: Fisher-Price,Type: Jumper Walker,Age: Infant
https://www.ebay.com/p/1524539063?iid=383209515989&rt=nc,"Jolly Jumper Exerciser with Door Clamp, Black",$39.00,$10.40,Brand: Jolly Jumper,Color: Black,Type: Doorway Jumper
https://www.ebay.com/itm/Baby-Door-Jumper-Doorway-Bouncer-Swing-Jump-Babies-Infant-Exercise-Jumping-Seat/193149575655?hash=item2cf89ca1e7:g:K9QAAOSwY3BdX~xY,Baby Door Jumper Doorway Bouncer Swing Jump Babies Infant Exercise Jumping Seat,$9.00,$14.00,Brand: Evenflo,Type: Doorway Jumper,Age: Infant
https://www.ebay.com/p/2256193842?iid=174029009249&rt=nc,Baby Einstein Neighborhood Symphony Jumper ( READ DISCRIPTION,$59.99,Free,Brand: Baby Einstein,Age: Infant,N/A
https://www.ebay.com/itm/Jumper-Bumper-Little-Baby-Bouncer-Doorway-Toy-Door-Jump-Play/293215377220?hash=item4444ff9744:g:Gi0AAOSw3nRdZDkZ,Jumper Bumper Little Baby Bouncer Doorway Toy Door Jump Play,$6.50,$11.20,Brand: Unbranded,Type: Doorway Jumper,N/A
https://www.ebay.com/itm/Baby-Johnny-Jump-Up-Doorway-Jumper-Kids-Entertainment-Exercise-Door-Frame-Clamp/184001473626?hash=item2ad757ac5a:g:cXYAAOSwUYtdrO~G,Baby Johnny Jump Up Doorway Jumper Kids Entertainment Exercise Door Frame Clamp,$24.99,Free,Brand: Evenflo,Type: Doorway Jumper,N/A
https://www.ebay.com/itm/Jolly-Jumper-Original-With-Stand/264509892861?hash=item3d9604a8fd:g:khgAAOSwROldsei8,Jolly Jumper Original With Stand,$55.00,$22.60,Brand: Jolly Jumper,N/A,N/A
https://www.ebay.com/itm/Jolly-Jumper-Baby-Exerciser-Black/401864142642?hash=item5d90f82f32:g:qGEAAOSwcQVdYyIs,Jolly Jumper Baby Exerciser - Black,$30.00,$4.57,Brand: Jolly Jumper,Color: Black,N/A
https://www.ebay.com/itm/Fisher-Luv-U-Zoo-Jumperoo-V0206/183936443200?hash=item2ad3776340:g:FnAAAOSwepJXYafz,Fisher- Luv U Zoo Jumperoo V0206,$28.00,$51.30,Brand: Jumperoo,N/A,N/A
https://www.ebay.com/itm/Baby-Einstein-activity-jumper/173997321945?hash=item28830c6ed9:g:Fr8AAOSwwRVdVHhc,Baby Einstein activity jumper,$35.00,$61.30,Brand: Baby Einstein,N/A,N/A
https://www.ebay.com/p/21024940443?iid=143347840836&rt=nc,Baby Door Jumper Doorway Bouncer Swing Jump Up Toddler Infant Exercise Seat NEW,$29.94,Free,Brand: Unbranded,Type: Doorway Jumper,Age: Infant
https://www.ebay.com/itm/VINTAGE-JOHNNY-JUMP-UP-BABY-EXERCISER-Swing-Infant-doorway-jumper/254385611538?hash=item3b3a906312:g:m0UAAOSwQMZdcqqe,VINTAGE JOHNNY JUMP UP BABY EXERCISER  Swing Infant doorway jumper,$8.00,$14.88,Brand: Evenflo,Color: Yellow,Type: Doorway Jumper
https://www.ebay.com/p/22031750717?iid=174061049174&rt=nc,Baby Einstein Neptune's Ocean Discovery Jumper  ,$40.00,$25.00,Brand: Baby Einstein,Color: Blue,Age: Infant
https://www.ebay.com/p/8018901225?iid=163819362518&rt=nc,Baby Einstein Bouncer Seat - Neighborhood Symphony,$5.50,$15.61,Age: Infant,N/A,N/A
https://www.ebay.com/p/2298955347?iid=382964275526&rt=nc,"Evenflo Exersaucer Door Jumper, Owl",$20.37,Free,Brand: Evenflo,N/A,N/A
https://www.ebay.com/itm/Replacement-Spring-Baby-Einstein-Activity-Jumper-Part/283623320534?hash=item4209446bd6:g:KLsAAOSwxapcv0aW,Replacement Spring Baby Einstein Activity Jumper Part,$8.99,$4.44,Brand: Baby Einstein,Color: Red,Age: Infant
https://www.ebay.com/itm/Disney-Baby-Finding-Nemo-Sea-of-Activities-Jumper/202803030862?hash=item2f3800ab4e:g:klgAAOSw9MpdOg2m,Disney Baby Finding Nemo Sea of Activities Jumper,$105.95,Free,Brand: Disney,Color: Multicolor,N/A
https://www.ebay.com/c/17013072433,Baby Einstein Neighborhood Symphony Activity Jumper,$48.00,$26.87,Brand: Baby Einstein,Color: Multicolor,Type: Activity Center Jumper
https://www.ebay.com/itm/Bright-Starts-Disney-Nemo-Sea-of-Activities-Jumper-Bubbles-Replacement-Part/113954366716?hash=item1a8835a4fc:g:hlQAAOSw3vpdsbAA,Bright Starts Disney Nemo Sea of Activities Jumper Bubbles Replacement Part,$11.30,$3.78,Brand: Bright Starts,N/A,N/A
