URL,Title,Price,Shipping,Dynamic Attribute 1,Dynamic Attribute 2,Dynamic Attribute 3
https://www.ebay.com/itm/Baby-Delight-Snuggle-Nest-Harmony-Infant-Sleeper-Baby-Bed-with-Incline-Wedge/383215325544?hash=item593969d168:g:P3sAAOSwV51dY8qH,Baby Delight Snuggle Nest Harmony Infant Sleeper/Baby Bed with Incline Wedge ...,$16.50,Free,Brand: Baby Delight,Features: Portable,Color: Silver
https://www.ebay.com/p/24030513800?iid=163916323498&rt=nc,Baby Delight Beside Me Dreamer Bassinet & Bedside Sleeper,$117.50,Free,Brand: Baby Delight,Features: Height Adjustment,Color: Gray
https://www.ebay.com/itm/Baby-Delight-Snuggle-Nest-Harmony-Infant-Sleeper-Incline-Wedge-Garden-Dreams/113956759983?hash=item1a885a29af:g:u3cAAOSwTphdxdn4,Baby Delight Snuggle Nest Harmony Infant Sleeper Incline Wedge Garden Dreams,$11.10,$9.45,Brand: Baby Delight,Features: Portable,Color: Pink
https://www.ebay.com/itm/NEW-Baby-Delight-SNUGGLE-NEST-Surround-XL-Harmony-Infant-Sleeper-Grey-Clouds/264498782483?hash=item3d955b2113:g:VwkAAOSwY7lczIAe,NEW Baby Delight SNUGGLE NEST Surround XL Harmony Infant Sleeper  Grey Clouds!,$12.00,$14.00,Brand: Baby Delight,Features: Portable,Color: Gray
https://www.ebay.com/itm/SwaddleMe-By-Your-Side-Sleeper-White/312812782414?hash=item48d518434e:g:Ig8AAOSww31dm4H2,SwaddleMe By Your Side Sleeper White,$9.00,$27.80,Brand: SwaddleMe,Color: White,N/A
https://www.ebay.com/itm/Arms-reach-co-sleeper-bassinet-mini-Leg-extensions/312798045997?hash=item48d437672d:g:E48AAOSwmexdnjJV,Arm's reach co sleeper bassinet mini + Leg extensions,$59.99,$32.56,Brand: Arm's Reach,Features: Height Adjustment,Color: Brown
https://www.ebay.com/p/737551434?iid=143427338351&rt=nc,Bedside Baby/Infant Sleeper Bassinet SwaddleMe By Your Bed Inclined Adjustable,$67.00,$4.49,Brand: SwaddleMe,Features: Portable,Type: Convertible Bedside Sleeper
https://www.ebay.com/c/5021770993,Baby Delight Snuggle Nest Harmony Portable snuggle  NEW,$37.00,Free,Brand: Baby Delight,Features: Portable,Color: Silver
https://www.ebay.com/itm/SwaddleMe-By-Your-Bed-Sleeper/184022608765?hash=item2ad89a2b7d:g:SokAAOSwo-ldN2jF,SwaddleMe By Your Bed Sleeper,$34.99,$22.07,Brand: SwaddleMe,N/A,N/A
https://www.ebay.com/itm/SwaddleMe-By-Your-Bed-Sleeper/183956131354?hash=item2ad4a3ce1a:g:SokAAOSwo-ldN2jF,SwaddleMe By Your Bed Sleeper,$51.00,$22.07,Brand: SwaddleMe,N/A,N/A
https://www.ebay.com/itm/Summer-Infant-Rest-Assured-Sleeper-Baby-Infant-Travel-Bed-Fun-Toybar/143429422595?hash=item21650f4e03:g:q0sAAOSwhe9dvKO3,Summer Infant Rest Assured Sleeper Baby Infant Travel Bed Fun Toybar,$8.90,$9.50,Brand: Summer Infant,Features: Portable,Color: Beige
https://www.ebay.com/itm/BABY-DELIGHT-SNUGGLE-NEST-GREEN-PORTABLE-INFANT-SLEEPER/254383395042?hash=item3b3a6e90e2:g:7T4AAOSwCX5dk6zn,BABY DELIGHT SNUGGLE NEST -- GREEN -- PORTABLE INFANT SLEEPER,$10.50,$11.10,Brand: Baby Delight,Features: Portable,Color: Green
https://www.ebay.com/p/21027050740?iid=323917938652&rt=nc,SwaddleMe By Your Side Sleeper,$8.80,$27.80,Brand: SwaddleMe,Color: Gray,N/A
https://www.ebay.com/itm/Arms-Reach-Clear-Vue-Co-Sleeper-Bassinet/264507464365?hash=item3d95df9aad:g:r6QAAOSwCHhdpdgC,Arms Reach Clear Vue Co Sleeper Bassinet ,$66.00,$20.17,Brand: Arm's Reach,Color: Clear,N/A
https://www.ebay.com/itm/Doc-A-Tot-Deluxe/183977461836?hash=item2ad5e9484c:g:CYIAAOSwZIVdkmPS,Doc-A-Tot Deluxe,$93.00,$4.39,Brand: DockATot,Color: White,N/A
https://www.ebay.com/itm/The-Mini-Classic-Co-Sleeper-Bedside-Bassinet-by-Arms-Reach/174070629106?hash=item28876b02f2:g:HnEAAOSw5uddmR3S,The Mini Classic Co-Sleeper Bedside Bassinet by Arms Reach,$49.99,$34.09,Brand: Arm's Reach,N/A,N/A
https://www.ebay.com/itm/Baby-Delight-Snuggle-Nest-Surround-XL-Portable-Co-sleeper-New-open-box-Gray/323893583518?epid=0&hash=item4b698fde9e:g:4UAAAOSwAbpdYcS9,Baby Delight Snuggle Nest Surround XL Portable Co-sleeper New (open box) Gray,$20.50,$10.40,Brand: Baby Delight,Features: Portable,Color: Gray
https://www.ebay.com/p/2255705427?iid=303330893531&rt=nc,Arm's Reach Mini Ezee 2 IN 1 Baby Co-Sleeper Bedside Bassinet Natural NEW,$51.00,$9.00,Brand: Arm's Reach,Color: Beige,N/A
https://www.ebay.com/itm/Baby-Delight-Snuggle-Nest-Traveler-Portable-Infant-Sleeper-XL-NIB/312774541887?hash=item48d2d0c23f:g:U5gAAOSwbWhdYqDb,Baby Delight Snuggle Nest Traveler Portable Infant Sleeper XL NIB,$23.70,$11.50,Brand: Baby Delight,Features: Portable,N/A
https://www.ebay.com/itm/Arm-s-Reach-Mini-Co-sleeper-Bassinet-Natural/183995508446?hash=item2ad6fca6de:g:x9QAAOSwE4hdkqM1,Arm’s Reach Mini Co-sleeper Bassinet - Natural,$23.00,N/A,Brand: Arm's Reach,N/A,N/A
https://www.ebay.com/itm/Dockatot-deluxe-cover-Chevron-pattern/323953456557?hash=item4b6d2175ad:g:o1cAAOSwTvNdq~IF,Dockatot deluxe cover Chevron pattern,$38.00,$7.00,Brand: DockATot,Color: White,N/A
https://www.ebay.com/itm/Baby-Delight-Snuggle-Nest-Harmony-Portable-Infant-Sleeper-white-tan-Preowned/352803281324?hash=item5224b6d9ac:g:xYwAAOSwQSJdi~NZ,Baby Delight Snuggle Nest Harmony Portable Infant Sleeper  white & tan Preowned,$9.10,$10.55,Brand: Baby Delight,Features: Portable,Color: Beige
https://www.ebay.com/p/691396635?iid=233336812835&rt=nc,Baby Delight Snuggle Nest Harmony Portable snuggle surround XL EUC,$13.00,$10.55,Brand: Baby Delight,Features: Portable,Color: Silver
https://www.ebay.com/itm/New-Summer-Infant-Bed-Side-Sleeper/153604224569?hash=item23c3867639:g:rPAAAOSwKeldN36w,New Summer Infant Bed Side Sleeper,$30.00,$11.10,Brand: Summer Infant,Features: Height Adjustment,Color: Beige
https://www.ebay.com/p/8024309876?iid=283595898671&rt=nc,Baby Delight Beside Me Dreamer Bassinet & Bedside Sleeper Height Adjustable,$114.21,Free,Brand: Baby Delight,Features: Height Adjustment,Color: Gray
https://www.ebay.com/itm/Portable-Baby-Crib-Bassinet-Folding-Travel-Nursery-Infant-Cradle-Sleeping-Bed/112951196029?hash=item1a4c6a797d:m:mIPOJQk-1Yc_rWmjGsZll-w&var=413331941547,Portable Baby Crib Bassinet Folding Travel Nursery Infant Cradle Sleeping Bed,$14.16,Free,Brand: Unbranded,Features: Portable,Color: Gray
https://www.ebay.com/itm/SwaddleMe-By-Your-Side-Sleeper-White/254410927908?hash=item3b3c12af24:g:ZFwAAOSwGfJdiPxk,SwaddleMe By Your Side Sleeper White,$8.50,$14.95,Brand: SwaddleMe,Color: White,N/A
https://www.ebay.com/itm/SwaddleMe-By-Your-Side-Sleeper-Deluxe-100-Polyester-Soft-Comfortable-Fabrics/163849714594?hash=item2626343ba2:g:NlcAAOSwUGddYctE,"SwaddleMe By Your Side Sleeper, Deluxe, 100% Polyester,Soft, Comfortable Fabrics",$4.99,$14.99,Brand: SwaddleMe,Features: Portable,N/A
https://www.ebay.com/p/2292427204?iid=383089473066&rt=nc,Baby Delight Snuggle Nest Afterglow Infant Sleeper/Baby Bed | Sweet Dream Cat...,$20.50,Free,Brand: Baby Delight,Features: Portable,Type: Travel Bedside Sleeper
https://www.ebay.com/p/2180898148?iid=113886195655&rt=nc,DockATot® Deluxe+ Cover in Pristine White (Dock Sold Separately) Dock A Tot,$51.00,$15.00,Brand: DockATot,Features: Portable,Color: White
https://www.ebay.com/p/13025169868?iid=133184402930&rt=nc,Baby Delight Snuggle Nest Harmony Infant Sleeper Waterproof Mattress Travel,$39.99,Free,Brand: Baby Delight,Features: Portable,Color: Gray
https://www.ebay.com/itm/DockATot-10201-Grand-Dock-White-With-Toy-Arch-And-Toy-Set/372818098109?hash=item56cdb0b7bd:g:jUYAAOSwEgRdtR7c,DockATot 10201 Grand Dock - White With Toy Arch And Toy Set,$95.00,$15.00,Brand: DockATot,Features: Portable,Color: White
https://www.ebay.com/itm/Baby-Delight-Snuggle-Nest-Bed-Sleeper/274000145491?hash=item3fcbae6c53:g:6DAAAOSwYr9dbCI2,Baby Delight Snuggle Nest/Bed Sleeper,$8.00,$12.30,Brand: Baby Delight,Features: Breathable Mesh Side,Color: Gray
https://www.ebay.com/itm/Baby-Delight-Snuggle-Nest-Traveler-Portable-Infant-Sleeper-XL-NIB/113848769173?hash=item1a81ea5a95:g:BEkAAOSwBh9dO2oe,Baby Delight Snuggle Nest Traveler Portable Infant Sleeper XL NIB,$39.99,$12.30,Brand: Baby Delight,Features: Portable,N/A
https://www.ebay.com/itm/Dockatot-Deluxe-Flower-Print/264457054120?hash=item3d92de67a8:g:h0AAAOSwIKddc9Yf,Dockatot Deluxe Flower Print,$75.00,$10.50,Brand: DockATot,N/A,N/A
https://www.ebay.com/p/920237837?iid=153663264469&rt=nc,Summer Infant SwaddleMe By Your Side Comfort Sleeper,$9.80,$27.80,Brand: Summer Infant,Features: Portable,Color: White
https://www.ebay.com/itm/DocATot-Deluxe-with-carrying-case-and-extra-cover/223649563460?hash=item34128d8344:g:~18AAOSw4x5dbo~w,DocATot Deluxe+ with carrying case and extra cover,$102.50,$15.00,Brand: DockATot,N/A,N/A
https://www.ebay.com/itm/Arms-Reach-Clear-Vue-Co-Sleeper-Bassinet-Cocoa-with-Mattress-Pad-and-Sheets/264528995081?hash=item3d97282309:g:5DAAAOSwQG9dvurw,"Arms Reach Clear Vue Co Sleeper Bassinet, Cocoa, with Mattress Pad and Sheets ",$39.99,$20.17,Brand: Arm's Reach,Features: Breathable Mesh Side,Color: Brown
https://www.ebay.com/p/555330697?iid=133110538180&rt=nc,Baby Delight Snuggle Nest Traveler Portable Infant Sleeper Grey Diamond Canopy,$49.99,Free,Brand: Baby Delight,Features: Portable,Color: Gray
https://www.ebay.com/itm/Dockatot-deluxe-cover-Plain-Baby-Pink-Used-Once/264510104842?hash=item3d9607e50a:g:LagAAOSwM0hdshsl,Dockatot deluxe cover Plain Baby Pink Used Once,$36.00,$5.50,Brand: DockATot,Color: Pink,N/A
https://www.ebay.com/itm/NUNA-SENA-AIRE-PLAYARD-Safari-Color/303331998562?hash=item469ffefb62:g:MqgAAOSwiB9doya0,NUNA SENA AIRE PLAYARD -Safari Color,$131.50,$31.02,Features: Portable,Color: Gray,N/A
https://www.ebay.com/itm/Baby-Delight-Beside-Me-Dreamer-2-in-1-Bassinet-Bedside-Sleeper/352820944469?hash=item5225c45e55:g:FCUAAOSwMH9dXdDF,Baby Delight Beside Me Dreamer 2 in 1 Bassinet Bedside Sleeper,$191.99,Free,Brand: Baby Delight,Color: Gray,N/A
https://www.ebay.com/p/15011369255?iid=133198967474&rt=nc,"Baby Delight BD3004 Snuggle Nest Harmony Infant Sleeper with Incline Wedge, Pink",$15.00,$7.85,Brand: Baby Delight,Features: Portable,Color: Pink
https://www.ebay.com/itm/DockATot-Grand-Spare-Cover-in-Strawberry-Cream-Dock-Sold-Separately/283646498234?hash=item420aa615ba:g:KD8AAOSwePpdqL~F,DockATot® Grand Spare Cover in Strawberry Cream (Dock Sold Separately),$23.50,Free,Brand: DockATot,N/A,N/A
https://www.ebay.com/p/20011421768?iid=383064307892&rt=nc,"SwaddleMe by Your Side Sleeper, Deluxe",$34.36,Free,Brand: SwaddleMe,Color: Gray,N/A
https://www.ebay.com/itm/Baby-Delight-SNUGGLE-NEST-Infant-SLEEPER-Light-Beige-Geometric-Print-W-Wedge/323928057421?hash=item4b6b9de64d:g:jIwAAOSwFRtdYttB,Baby Delight SNUGGLE NEST Infant SLEEPER Light Beige Geometric Print W/ Wedge,$7.50,$31.05,Brand: Baby Delight,Features: Portable,Color: Beige
https://www.ebay.com/p/16030743273?iid=254305156439&rt=nc,Baby Delight Snuggle Nest Adventure Portable Infant Sleeper | Travel Bed & Bassi,$104.55,Free,Brand: Baby Delight,Features: Portable,Color: Gray
https://www.ebay.com/itm/Arms-Reach-Co-Sleeper-Bassinet-w-mattress-pad-and-strap/123885702823?hash=item1cd829cea7:g:DZEAAOSwAQhdT11Y,Arm's Reach Co-Sleeper Bassinet w/ mattress pad and strap,$70.00,$12.00,Brand: Arm's Reach,Color: White,N/A
https://www.ebay.com/p/21027050740?iid=293149369265&rt=nc,SwaddleMe By Your Side Sleeper,$30.36,Free,Brand: SwaddleMe,Color: Gray,N/A
https://www.ebay.com/itm/Baby-Delight-Snuggle-Nest-Harmony-Infant-Sleeper-Baby-Bed-with-Incline/401937996413?hash=item5d955f1a7d:g:tz8AAOSwjONdtzH5,Baby Delight Snuggle Nest Harmony Infant Sleeper/Baby Bed with Incline,$33.71,Free,Brand: Baby Delight,Features: Portable,Color: Silver
https://www.ebay.com/p/564797684?iid=293208451835&rt=nc,DockATot Deluxe+ The All in One Baby Lounger - Pristine White,$40.00,$22.70,Brand: DockATot,Features: Portable,Color: White
https://www.ebay.com/itm/Dockatot-deluxe-cover-Chevron-pattern-Used-Once/264510103710?hash=item3d9607e09e:g:nJsAAOSw1Rpdshqk,Dockatot deluxe cover Chevron pattern Used Once,$24.99,$5.50,Brand: DockATot,Color: Multicolor,N/A
https://www.ebay.com/itm/Nuna-Sena-Aire-Mini-Playyard-In-Graphite/113858117323?hash=item1a8278fecb:g:a1kAAOSw~QNdWb1l,Nuna Sena Aire Mini Playyard In Graphite,$119.95,$52.60,Color: Gray,N/A,N/A
https://www.ebay.com/p/15011369255?iid=264468397742&rt=nc,Baby Delight Snuggle Nest Harmony Infant Sleeper Baby Bed w Incline Wedge - Pink,$29.99,Free,Brand: Baby Delight,Features: Portable,Color: Pink
https://www.ebay.com/itm/Baby-Delight-Beside-Me-Dreamer-2-in-1-Bassinet-Bedside-Sleeper-Adjustable-Crib/233395458754?epid=0&hash=item36577412c2:g:Y5cAAOSw7cldMkD-,Baby Delight Beside Me Dreamer 2 in 1 Bassinet Bedside Sleeper Adjustable Crib,$100.00,$38.96,Brand: Baby Delight,Color: Gray,N/A
https://www.ebay.com/p/2255705427?iid=202789371084&rt=nc,Arm's Reach Mini Ezee 2 IN 1 Baby Co-Sleeper Bedside Bassinet Natural NEW,$119.98,Free,Brand: Arm's Reach,Color: Beige,N/A
https://www.ebay.com/itm/SWADDLEME-BY-YOUR-BED-BEDSIDE-SLEEPER-BY-SUMMER-INFANT-GRAY-BLUE/401907560438?hash=item5d938eaff6:g:9ZkAAOSw3~VdgGAN,SWADDLEME® BY YOUR BED™ BEDSIDE SLEEPER BY SUMMER INFANT® - GRAY/BLUE,$70.00,Free,Brand: SwaddleMe,Color: Gray,N/A
https://www.ebay.com/p/22026515131?iid=163891016009&rt=nc,SnuggleNest Harmony/Surround XL Portable Infant Sleeper,$8.10,$25.45,Brand: The First Years,Features: Portable,Color: White
https://www.ebay.com/itm/Baby-Delight-Snuggle-Nest-Traveler-Portable-Infant-Sleeper-XL-NIB/113857377899?hash=item1a826db66b:g:BEkAAOSwBh9dO2oe,Baby Delight Snuggle Nest Traveler Portable Infant Sleeper XL NIB,$39.99,$8.00,Brand: Baby Delight,Features: Portable,N/A
https://www.ebay.com/itm/Milliard-Side-Sleeper-Bedside-Bassinet/303306782341?hash=item469e7e3685:g:PT8AAOSwGrZdcpQO,Milliard Side Sleeper Bedside Bassinet ,$120.00,Free,N/A,N/A,N/A
https://www.ebay.com/itm/Baby-Delight-Snuggle-Nest-Surround-XL/183919318972?hash=item2ad27217bc:g:bVUAAOSwTFRdE~kK,Baby Delight Snuggle Nest Surround XL ,$5.50,$14.80,Brand: Baby Delight,N/A,N/A
https://www.ebay.com/itm/Babys-Journey-Serta-iComfort-Premium-Infant-Sleeper/133159897858?hash=item1f00f2cb02:g:uSgAAOSwm3ldbsYn,Baby's Journey Serta iComfort Premium Infant Sleeper,$0.99,$13.95,Color: Gray,N/A,N/A
https://www.ebay.com/c/25018231097,SwaddleMe By Your Side Sleeper Safe & Comfortable Sturdy Metal Frame 91310,$23.28,Free,Brand: SwaddleMe,Color: Gray,N/A
https://www.ebay.com/p/2254488845?iid=163862363576&rt=nc,Baby Delight Snuggle Nest Harmony Infant Sleeper/Baby Bed w/ Waterproof Mattress,$39.95,$6.57,Brand: Baby Delight,Features: Portable,Color: Green
https://www.ebay.com/p/737551434?iid=202808348392&rt=nc,SwaddleMe By Your Bed Sleeper ,$85.00,Free,Brand: SwaddleMe,Features: Portable,Type: Convertible Bedside Sleeper
https://www.ebay.com/p/2254419558?iid=283611862204&rt=nc,Baby Delight Snuggle Nest Harmony Infant Sleeper Baby Bed Incline Wedge Grey,$23.79,Free,Brand: Baby Delight,Features: Portable,Color: Gray
https://www.ebay.com/itm/Snuggle-Me-Organic-Baby-Lounger-Co-Sleeping-Cushion-Bassinet-Mattress-0-6-Mos/382466494777?hash=item590cc79139:g:bU0AAOSwqVJa~uzc,Snuggle Me Organic Baby Lounger/Co-Sleeping Cushion/Bassinet Mattress 0-6 Mos,$84.95,Free,N/A,N/A,N/A
https://www.ebay.com/itm/Baby-Delight-Snuggle-Nest-Portable-Harmony-Infant-Sleeper-Baby-Sound-Light-Bed/174054521980?hash=item2886753c7c:g:3GEAAOSwEGVdmNd8,Baby Delight Snuggle Nest Portable Harmony Infant Sleeper Baby Sound & Light Bed,$21.98,$7.88,Brand: Baby Delight,Features: Portable,Color: Gray
https://www.ebay.com/p/18005584934?iid=283642605967&rt=nc,SwaddleMe 91360 by Your Side Sleeper Deluxe Collapsible Frame w Mesh Siding,$21.50,Free,Brand: SwaddleMe,Color: Gray,N/A
https://www.ebay.com/itm/BABY-DELIGHT-SNUGGLE-NEST-GREEN-PORTABLE-INFANT-SLEEPER/133142060852?hash=item1effe29f34:g:m7gAAOSwZ75dU1a7,BABY DELIGHT SNUGGLE NEST -- GREEN -- PORTABLE INFANT SLEEPER,$14.99,$11.10,Brand: Baby Delight,Features: Portable,Color: Beige
https://www.ebay.com/itm/Arm-s-Reach-Mini-Co-Sleeper-Bassinet-w-Mattress-Pad/303330874008?hash=item469fedd298:g:aHUAAOSwPuVdrk2G,Arm’s Reach Mini Co-Sleeper Bassinet w Mattress Pad,$40.00,$7.85,Brand: Arm's Reach,N/A,N/A
https://www.ebay.com/itm/Arms-Reach-Original-Co-Sleeper-Bassinet-large-Natural-Color/303330876677?hash=item469feddd05:g:iw8AAOSwX-Zdrk5W,"Arm's Reach Original Co-Sleeper Bassinet,  -large Natural Color",$35.00,$20.05,Brand: Arm's Reach,Features: Foldable,Color: Beige
https://www.ebay.com/p/28017188524?iid=283624265740&rt=nc,Baby Delight Snuggle Nest Harmony Infant Sleeper Incline Wedge Garden Dreams,$22.38,Free,Brand: Baby Delight,Features: Portable,Color: Yellow
https://www.ebay.com/itm/The-First-Years-Close-and-Secure-Sleeper-Blue/174051605221?hash=item288648bae5:g:8a8AAOSwHX5djAom,The First Years Close and Secure Sleeper - Blue,$5.50,$10.85,Brand: The First Years,Color: Blue,N/A
https://www.ebay.com/itm/Arm-s-reach-mesh-canopy-bassinet-crib-cover/312762956249?hash=item48d21ff9d9:g:MxwAAOSwa~ldbdM3,Arm’s reach mesh canopy (bassinet / crib cover),$14.50,$7.85,Brand: Arm's Reach,Features: With Mosquito Net,Color: White
https://www.ebay.com/c/5021770993,Baby Delight Snuggle Nest Harmony Infant Sleeper Baby Bed Incline Wedge BD3003,$22.38,Free,Brand: Baby Delight,Features: Portable,Color: Silver
https://www.ebay.com/itm/NUNA-SENA-AIRE-PLAYARD-Black-no-stains-No-changing-table-has-travel-bag/323897346024?hash=item4b69c947e8:g:S3YAAOSwWL1daU2k,"NUNA SENA AIRE PLAYARD Black, no stains. No changing table, has travel bag",$152.50,$43.37,Brand: Unbranded,Color: Black,N/A
https://www.ebay.com/c/1200279814,Arms Reach Co-Sleeper Bassinet Leg Extension Kit 9818 Natural Mini And Original,$24.99,Free,Brand: Arm's Reach,Features: Height Adjustment,Color: Beige
https://www.ebay.com/itm/Arms-Reach-Mini-Co-Sleeper-Bassinet-w-box-extra-sheets-Very-good-condition/293260587765?hash=item4447b172f5:g:B2cAAOSwpZJdaCbM,Arm's Reach Mini Co-Sleeper Bassinet w/ box & extra sheets Very good condition!,$59.99,$36.30,Brand: Arm's Reach,Features: Foldable,N/A
https://www.ebay.com/c/28028331718,"Mika Micky Bedside Sleeper Easy Folding Portable Crib,Grey",$90.00,Free,Features: Portable,Color: Gray,N/A
https://www.ebay.com/itm/Dock-A-Tot-Deluxe-Plus-Dock-Brand-New-color-all-white/333324336893?hash=item4d9badbefd:g:za8AAOSwkJ5c2YqM,Dock-A-Tot Deluxe Plus Dock Brand New  color all white,$130.00,$14.00,Brand: DockATot,Color: White,N/A
https://www.ebay.com/itm/Arms-Reach-Original-Co-Sleeper-Bassinet-Natural/163826594075?hash=item2624d3711b:g:8lwAAOSwKs1dB89u,"Arm's Reach Original Co-Sleeper Bassinet,  Natural",$25.00,$47.35,Brand: Arm's Reach,Features: Foldable,Color: Beige
https://www.ebay.com/p/24030513800?iid=113856155256&rt=nc,Baby Delight Beside Me Dreamer Bassinet & Bedside Sleeper,$139.78,Free,Brand: Baby Delight,Color: Gray,Type: Convertible Bedside Sleeper
https://www.ebay.com/itm/Dock-A-Tot-Deluxe-Plus-White-Used-Pristine-Baby/283577913942?hash=item42068f9256:g:WKgAAOSwsvJdUOhE,Dock-A-Tot Deluxe+ Plus White Used Pristine Baby,$99.00,$29.11,Brand: DockATot,Color: White,N/A
https://www.ebay.com/itm/Arms-Reach-Co-Sleeper-Bassinet-w-mattress-pad-and-strap/183938742061?hash=item2ad39a772d:g:nI8AAOSwFmtdbc5l,Arm's Reach Co-Sleeper Bassinet w/ mattress pad and strap,$75.00,$9.45,Brand: Arm's Reach,Color: White,N/A
https://www.ebay.com/c/5021770993,Baby Delight Snuggle Nest Harmony Portable snuggle  NEW,$37.00,Free,Brand: Baby Delight,Features: Portable,Color: Silver
https://www.ebay.com/p/737551434?iid=123892034396&rt=nc,Bedside Baby/Infant Sleeper Bassinet SwaddleMe By Your Bed Inclined Adjustable,$109.99,Free,Brand: SwaddleMe,Features: Portable,Type: Convertible Bedside Sleeper
https://www.ebay.com/itm/The-Mini-Classic-Co-Sleeper-Bedside-Bassinet-by-Arms-Reach/174077692470?hash=item2887d6ca36:g:HnEAAOSw5uddmR3S,The Mini Classic Co-Sleeper Bedside Bassinet by Arms Reach,$49.99,$34.09,Brand: Arm's Reach,Color: Beige,N/A
https://www.ebay.com/p/2292427204?iid=383091165086&rt=nc,Baby Delight Snuggle Nest Afterglow Infant Sleeper/Baby Bed | Sweet Dream Cat...,$27.00,Free,Brand: Baby Delight,Features: Portable,Type: Travel Bedside Sleeper
https://www.ebay.com/itm/NUNA-SENA-AIRE-PLAYARD-Safari-Color/303320136726?hash=item469f49fc16:g:MqgAAOSwiB9doya0,NUNA SENA AIRE PLAYARD -Safari Color,$129.99,$31.02,Features: Portable,Color: Gray,N/A
https://www.ebay.com/p/21027050740?iid=283651622394&rt=nc,SwaddleMe By Your Side Sleeper Folding w Sturdy Metal Frame & Mattress Pad,$22.48,Free,Brand: SwaddleMe,Color: Gray,N/A
https://www.ebay.com/p/8024309876?iid=233349525049&rt=nc,Baby Delight Beside Me Dreamer 2 in 1 Bassinet Bedside Sleeper Adjustable Crib,$108.00,$38.96,Brand: Baby Delight,Features: Height Adjustment,Color: Gray
https://www.ebay.com/c/25018231097,SwaddleMe 91310 By Your Side Sleeper Collapsible Metal Frame w Mesh Siding,$25.63,Free,Brand: SwaddleMe,Features: Portable,Color: Gray
https://www.ebay.com/itm/Doc-A-Tot-Deluxe-Plus-Dock-Pristine-White-new-never-been-used/174050175981?hash=item288632ebed:g:jBUAAOSw6SNdk6Jd,"Doc-A-Tot Deluxe Plus Dock Pristine White - new, never been used ",$125.00,$24.65,Brand: DockATot,Color: White,N/A
https://www.ebay.com/itm/Arm-s-Reach-Mini-Co-sleeper-Bassinet-Natural/153617652623?hash=item23c4535b8f:g:A~YAAOSw0TxdYqiS,Arm’s Reach Mini Co-sleeper Bassinet - Natural,$70.00,$20.00,Brand: Arm's Reach,N/A,N/A
https://www.ebay.com/itm/Baby-Delight-Snuggle-Nest-Harmony-Infant-Sleeper-Baby-Bed-w-Waterproof-Mattress/163872525813?hash=item2627904df5:g:9UUAAOSwD8BdfRen,Baby Delight Snuggle Nest Harmony Infant Sleeper/Baby Bed w/ Waterproof Mattress,$39.95,$6.97,Brand: Baby Delight,Features: Portable,Color: Green
https://www.ebay.com/itm/Baby-Delight-Snuggle-Nest/163903567137?hash=item262969f521:g:628AAOSwqh9dol9M,Baby Delight Snuggle Nest,$25.00,$7.85,Brand: Baby Delight,Features: Portable,Color: Gray
https://www.ebay.com/p/751299667?iid=401855199231&rt=nc,SwaddleMe 91394 - by Your Bed Sleeper,$70.69,Free,Brand: SwaddleMe,Features: Height Adjustment,N/A
https://www.ebay.com/itm/Arm-s-Reach-Mini-Co-Sleeper-Bassinet/293212644197?hash=item4444d5e365:g:ZA4AAOSwxBldYYj4,Arm’s Reach Mini Co-Sleeper Bassinet,$50.00,$31.95,Brand: Arm's Reach,Color: Brown,N/A
https://www.ebay.com/itm/Baby-Delight-Beside-Me-Dreamer-Bassinet-Bedside-Sleeper-NEW-Box-Damage/392469342838?hash=item5b60feea76:g:S54AAOSwKhpdm9m5,Baby Delight Beside Me Dreamer Bassinet & Bedside Sleeper NEW (Box Damage),$191.99,Free,Brand: Baby Delight,Features: Breathable Mesh Side,Color: Blue
https://www.ebay.com/itm/Doc-A-Tot-Deluxe-White-Unisex-Baby-Bed/153693761573?hash=item23c8dcb025:g:IrQAAOSw~AFdrodV,Doc-A-Tot Deluxe White Unisex Baby Bed,$125.00,$15.00,Brand: DockATot,Color: White,N/A
https://www.ebay.com/p/21015095900?iid=113886844109&rt=nc,"Snuggle Nest Dream Portable Infant Sleeper, Free Shipping!!",$33.99,Free,Brand: Baby Delight,Features: Portable,Color: Gray
https://www.ebay.com/p/13030610286?iid=143358038843&rt=nc,Halo Bassinest Swivel Sleeper LUXE PLUS Gray Melange - Infant Baby Crib ,$75.00,N/A,Brand: Halo,Features: Height Adjustment,Color: Gray
https://www.ebay.com/p/24018873063?iid=202764813174&rt=nc,Baby Delight Nestle Nook Portable Infant Napper - Gray NEW IN BOX,$99.95,Free,Brand: Baby Delight,Features: Portable,Color: Gray
https://www.ebay.com/p/28017188524?iid=362309522939&rt=nc,Baby Delight Snuggle Nest Harmony Portable Infant Bed Sleeper Garden Dreams NEW,$59.99,Free,Brand: Baby Delight,Features: Portable,Color: Yellow
https://www.ebay.com/p/2254419558?iid=273991738653&rt=nc,Baby Delight Snuggle Nest Portable Harmony Infant Sleeper Baby Sound & Light Bed,$30.00,$15.00,Brand: Baby Delight,Features: Portable,Color: Gray
https://www.ebay.com/itm/NEW-Arms-Reach-Co-Sleeper-Bassinet-Canopy-Only-Mini-Clear-Vue/392315567646?hash=item5b57d47e1e:g:Y3EAAOSwYd1dB8yZ,NEW Arm's Reach Co-Sleeper Bassinet~Canopy Only~Mini Clear Vue,$35.00,$10.00,Brand: Arm's Reach,Features: Portable,Color: Clear
https://www.ebay.com/p/13010548155?iid=392034261006&rt=nc,Baby Delight Snuggle Nest Harmony Portable Infant Sleeper Bed Silver Blossom NEW,$59.99,Free,Brand: Baby Delight,Features: Portable,Color: Silver
https://www.ebay.com/p/2254543085?iid=401824867394&rt=nc,Baby Delight Snuggle Nest Afterglow Infant Sleeper Baby Bed Misty Dandelions NEW,$35.00,$9.90,Brand: Baby Delight,Features: Portable,Color: Gray
https://www.ebay.com/c/14032275338,SwaddleMe By Your Side Sleeper,$30.00,$15.00,Brand: SwaddleMe,Color: Clear,N/A
https://www.ebay.com/p/13025169868?iid=254393033304&rt=nc,Baby Delight Snuggle Nest Harmony Infant Sleeper Travel bassinet bed ,$38.99,Free,Brand: Baby Delight,Features: Portable,Color: Gray
https://www.ebay.com/itm/Baby-Delight-Snuggle-Nest-Harmony-Infant-Sleeper-Incline-Wedge-Garden-Dreams/133175154195?hash=item1f01db9613:g:zfQAAOSwPWNdaBrp,Baby Delight Snuggle Nest Harmony Infant Sleeper Incline Wedge Garden Dreams,$34.99,Free,Brand: Baby Delight,Features: Portable,Color: Pink
https://www.ebay.com/c/28028331718,"Mika Micky Bedside Sleeper Easy Folding Portable Crib, Grey",$129.99,$26.89,Features: Portable,Color: Gray,N/A
https://www.ebay.com/itm/Baby-Delight-Snuggle-Nest-Infant-Baby-Bed-Portable-Bassinet-Sleeper/173986975523?hash=item28826e8f23:g:0tYAAOSwLppdR5oM,Baby Delight Snuggle Nest Infant Baby Bed Portable Bassinet Sleeper,$9.99,$16.44,Brand: Baby Delight,Features: Portable,N/A
https://www.ebay.com/itm/Arm-s-Reach-Mini-Co-Sleeper-Bassinet-w-sheet/143266341528?hash=item215b56e298:g:ZkAAAOSwtbdc6CA5,Arm’s Reach Mini Co-Sleeper Bassinet w sheet,$109.99,Free,Brand: Arm's Reach,N/A,N/A
https://www.ebay.com/itm/SwaddleMe-By-Your-Side-Sleeper-for-infants/233366823844?hash=item3655bf23a4:g:1ikAAOSw1y1doPTb,SwaddleMe By Your Side Sleeper for infant's. ,$10.99,$10.55,Brand: SwaddleMe,N/A,N/A
https://www.ebay.com/p/20011421768?iid=401946733262&rt=nc,"SwaddleMe by Your Side Sleeper, Deluxe",$30.00,$10.00,Brand: SwaddleMe,Color: Gray,N/A
https://www.ebay.com/p/14034759626?iid=123944802394&rt=nc,"Milliard Side Sleeper Bedside Bassinet, Used",$130.00,Free,Features: Height Adjustment,Type: Convertible Bedside Sleeper,N/A
