URL,Title,Price,Shipping,Dynamic Attribute 1,Dynamic Attribute 2,Dynamic Attribute 3
https://www.ebay.com/itm/Fisher-Price-Rainforest-Jumperoo-Replacement-Part-FROG-PARROT-Leaf-Plush-Toys/273993763800?hash=item3fcb4d0bd8:g:~UQAAOSwl11db5tu,Fisher Price Rainforest Jumperoo Replacement Part FROG & PARROT Leaf Plush Toys,$24.99,$3.99,Brand: Fisher-Price,Color: Blue,N/A
https://www.ebay.com/itm/Bright-Starts-Bounce-N-Spring-Deluxe-Door-Jumper-baby-bouncer/264439366329?hash=item3d91d082b9:g:fJEAAOSwq05dXwPE,Bright Starts Bounce 'N Spring Deluxe Door Jumper baby bouncer,$23.99,Free,Brand: Bright Starts,N/A,N/A
https://www.ebay.com/itm/The-Original-Jolly-Jumper-Baby-Exerciser-with-Door-Clamp/293281802824?hash=item4448f52a48:g:YcsAAOSwWEddp0P0,The Original Jolly Jumper Baby Exerciser with Door Clamp,$39.96,$10.85,Brand: Jolly Jumper,Color: Black,Type: Doorway Jumper
https://www.ebay.com/itm/Fisher-Price-Color-Climbers-Jumperoo/401935209258?hash=item5d9534932a:g:GnAAAOSwljFds-Gi,Fisher-Price Color Climbers Jumperoo,$50.00,$20.00,Brand: Fisher-Price,N/A,N/A
https://www.ebay.com/itm/Disney-Baby-Finding-Nemo-Sea-of-Activities-Jumper/202797804908?hash=item2f37b0ed6c:g:b8MAAOSwxYpdoG3C,Disney Baby Finding Nemo Sea of Activities Jumper,$99.95,Free,Brand: Disney,Color: Green,N/A
https://www.ebay.com/itm/Disney-Baby-Finding-Nemo-Sea-of-Activities-Jumper-BRAND-NEW-FREE-SHIPPING/303328089714?hash=item469fc35672:g:KV0AAOSwUQRdq1RT,Disney Baby Finding Nemo Sea of Activities Jumper - BRAND NEW - FREE SHIPPING,$98.00,Free,Brand: Disney,Color: Blue,Age: Infant
https://www.ebay.com/p/2255422718?iid=153670599521&rt=nc,Graco Bumper Jumper Doorway Jumper Model 1964386 ** Stratus **,$36.99,Free,Brand: Graco,Type: Doorway Jumper,Age: Infant
https://www.ebay.com/itm/Baby-Einstein-Neighborhood-Friends-Activity-Jumper/264250832665?hash=item3d8693b719:g:LEQAAOSwlS1clT0P,Baby Einstein Neighborhood Friends Activity Jumper,$104.50,Free,Brand: Baby Einstein,Color: Multicolor,Age: Infant
https://www.ebay.com/p/14021426464?iid=123272508353&rt=nc,FISHER PRICE GALLOPING Fun JUMPEROO TOY rare,$110.00,$20.00,Brand: Fisher-Price,N/A,N/A
https://www.ebay.com/itm/Fisher-Price-Rainforest-Jumperoo-Replacement-Part-FROG-PARROT-Leaf-Plush-Toys/183937287219?hash=item2ad3844433:g:vU4AAOSwulJdFQt2,Fisher Price Rainforest Jumperoo Replacement Part FROG & PARROT Leaf Plush Toys,$28.95,Free,Brand: Fisher-Price,Color: Blue,N/A
https://www.ebay.com/itm/Fisher-Price-Rainforest-Jumperoo-Baby-Jumper-Walker-Bouncer-Activity-Seat-New/223711398171?hash=item34163d091b:g:v9sAAOSwphhcxvLe,Fisher Price Rainforest Jumperoo Baby Jumper Walker Bouncer Activity Seat New,$65.00,$10.00,Brand: Jumperoo,Type: Jumper Walker,N/A
https://www.ebay.com/p/2255919560?iid=174027436430&rt=nc,Infant Walker Music Adjustable Fold Up Activity Assistant Toy Play Bouncer Seat,$58.99,Free,Brand: Bright Starts,Color: Green,Type: Jumper Walker
https://www.ebay.com/itm/Baby-Einstein-Cloud-Toy-Replacement-Part-for-Musical-Motion-Activity-Jumper/283531791164?hash=item4203cfcb3c:g:~wQAAOSwW2RdGW0l,Baby Einstein Cloud Toy Replacement Part for Musical Motion Activity Jumper ,$8.89,Free,Brand: Baby Einstein,Color: Blue,Age: Infant
https://www.ebay.com/itm/Evenflo-ExerSaucer-Doorway-Jumper-Johnny-Jump-Up/362743432292?hash=item5475318464:g:KdMAAOSwYYZdbfZp,Evenflo ExerSaucer Doorway Jumper Johnny Jump Up,$7.90,$19.05,Brand: Evenflo,Type: Doorway Jumper,N/A
https://www.ebay.com/itm/Fisher-Price-Jumperoo-Baby-Activity-Jumper-Model-Animal-krackers/113883652623?hash=item1a83fea20f:g:ZCoAAOSwb~1dd6ze,Fisher Price Jumperoo Baby Activity Jumper - Model Animal krackers,$40.00,$19.95,Brand: Jumperoo,N/A,N/A
https://www.ebay.com/p/18003300871?iid=143357099084&rt=nc,Fisher Price Rainforest Jumperoo Baby Activity Jumper - Model K6070 Pre-Owned ,$44.99,$29.93,Brand: Fisher-Price,Type: Jumper Walker,Age: Infant
https://www.ebay.com/itm/New-in-Box-Bright-Starts-Pattern-Pals-Walker-Green/163902880701?hash=item26295f7bbd:g:4iMAAOSwfzJdoYsU,New in Box Bright Starts Pattern Pals Walker (Green),$35.95,Free,Brand: Bright Starts,Color: Green,N/A
https://www.ebay.com/p/1300119683?iid=333380583350&rt=nc,Fisher Price LUV U ZOO Jumperoo V0206-9993,$68.00,$27.97,Brand: Fisher-Price,Type: Activity Center Jumper,Age: Infant
https://www.ebay.com/p/691334860?iid=293181212143&rt=nc,Fisher-Price Jumperoo: Luv U Zoo,$53.56,Free,Brand: Fisher-Price,Age: Infant,N/A
https://www.ebay.com/itm/Tiger-Design-Baby-Jumper-Rotating-Seat-Soft-Animals-Display-Music-Lights-Sounds/401840935991?hash=item5d8f961437:g:Q~sAAOSwLzxdS6Ba,Tiger Design Baby Jumper Rotating Seat Soft Animals Display Music Lights Sounds,$100.00,$9.50,Brand: Fisher-Price,Age: Infant,N/A
https://www.ebay.com/itm/Baby-Einstein-Musical-Motion-Activity-Jumper-Light-Up-Piano-Replacement-Part/174011782923?hash=item2883e9170b:g:km0AAOSwAItdZqM9,Baby Einstein Musical Motion Activity Jumper Light Up Piano Replacement Part,$14.95,$8.30,Brand: Baby Einstein,Color: Multicolor,N/A
https://www.ebay.com/itm/Fisher-Rainforest-Jumperoo-Baby-Activity-Jumper-Model-K6070/283609266529?hash=item42086df961:g:8S8AAOSwpVxdeiJc,Fisher- Rainforest Jumperoo Baby Activity Jumper - Model K6070 -,$40.00,$37.60,Brand: Jumperoo,N/A,N/A
https://www.ebay.com/itm/Fisher-Rainforest-Jumperoo-Baby-Activity-Jumper-Model-K6070/133092845579?hash=item1efcf3a80b:g:v9sAAOSwphhcxvLe,Fisher- Rainforest Jumperoo Baby Activity Jumper - Model K6070 -,$34.00,$79.90,Brand: Jumperoo,N/A,N/A
https://www.ebay.com/p/1385727981?iid=401869499607&rt=nc,Baby Einstein Neighborhood Friends Activity Jumper Excellent Used Condition,$50.00,$45.65,Brand: Baby Einstein,Type: Activity Center Jumper,Age: Infant
https://www.ebay.com/p/26033166771?iid=283589361219&rt=nc,Fisher-Price FWY41 Jumperoo Animal Wonders 360 degree Spinning Seat 3 Heights,$55.53,Free,Brand: Jumperoo,Type: Jumper Walker,Age: Infant
https://www.ebay.com/itm/Fisher-Price-Go-Wild-Jumperoo/133115055532?hash=item1efe468dac:g:POcAAOSwqeVdL5ky,Fisher-Price Go Wild Jumperoo,$100.00,$25.00,Brand: Fisher-Price,N/A,N/A
https://www.ebay.com/itm/Fisher-Horse-Pony-Jumperoo-Baby-Activity-Jumper-Vintage-Rare/153634290349?hash=item23c5513aad:g:hmEAAOSwzJ9dcviP,Fisher- Horse Pony Jumperoo Baby Activity Jumper- Vintage - Rare,$55.00,$66.85,Brand: Jumperoo,N/A,N/A
https://www.ebay.com/itm/Jumper-Bumper-Jungle-Graco-Little-Baby-Bouncer-Doorway-Toy-Door-Jump-Play/273964582073?hash=item3fc98fc4b9:g:HHcAAOSwYNVdUbHk,Jumper Bumper Jungle Graco Little Baby Bouncer Doorway Toy Door Jump Play,$25.00,$9.02,Brand: Graco Baby,Type: Doorway Jumper,N/A
https://www.ebay.com/itm/Evenflo-Exersaucer-Door-Jumper-Johnny-Jump-Up-Doorway-Bouncer-Seat-EUC/323875734674?hash=item4b687f8492:g:sc8AAOSwmUhdRhtH,Evenflo Exersaucer Door Jumper Johnny Jump Up Doorway Bouncer Seat EUC,$16.00,$12.00,Brand: Evenflo,Type: Doorway Jumper,N/A
https://www.ebay.com/p/1753236677?iid=293234420224&rt=nc,Bright Starts Bounce Bounce Baby,$37.95,Free,Brand: Bright Starts,Type: Activity Center Jumper,Age: Infant
https://www.ebay.com/itm/Baby-Einstein-Musical-Motion-Activity-Jumper-Seat-Cover-Replacement-Part/283591283427?hash=item42075b92e3:g:TmsAAOSwbX9dE4AJ,Baby Einstein Musical Motion Activity Jumper Seat Cover Replacement Part,$27.99,Free,Brand: Baby Einstein,Color: Multicolor,Age: Infant
https://www.ebay.com/p/2211077940?iid=254355615086&rt=nc,Fisher-Price Jumperoo: Woodland Friends SpaceSaver,$55.29,Free,Brand: Fisher-Price,N/A,N/A
https://www.ebay.com/itm/Replacement-Piano-Baby-Einstein-Neighborhood-Friends-Activity-Jumper-Part/323884470774?hash=item4b6904d1f6:g:AJQAAOSw6CxdMS3Z,Replacement Piano Baby Einstein Neighborhood Friends Activity Jumper Part,$19.99,$8.00,Brand: Baby Einstein,Age: Infant,N/A
https://www.ebay.com/p/2211077940?iid=254355615086&rt=nc,Fisher-Price Jumperoo: Woodland Friends SpaceSaver,$55.29,Free,Brand: Fisher-Price,N/A,N/A
https://www.ebay.com/itm/Replacement-Piano-Baby-Einstein-Neighborhood-Friends-Activity-Jumper-Part/323884470774?hash=item4b6904d1f6:g:AJQAAOSw6CxdMS3Z,Replacement Piano Baby Einstein Neighborhood Friends Activity Jumper Part,$19.99,$8.00,Brand: Baby Einstein,Age: Infant,N/A
https://www.ebay.com/itm/eGraco-Bumper-Baby-Jumper-Little-Jungle-Male-Female-All-Ages-Interactive-Toys/264455359459?hash=item3d92c48be3:g:HBIAAOSwNCNdcfbu,eGraco Bumper Baby Jumper Little Jungle Male Female All Ages Interactive Toys,$43.77,Free,Brand: Graco Baby,N/A,N/A
https://www.ebay.com/p/8009622434?iid=362706774584&rt=nc,Baby Bouncer Activity Center Jumper with 360 Degree Rotating Seat Play Toy Bar,$62.06,Free,Brand: Creative Baby,Color: Multicolor,Type: Activity Center Jumper
https://www.ebay.com/itm/Fisher-Price-Rainforest-Jumperoo-Hanging-Frog-Replacement-Part-Blue-Green-Leaf/283617649577?hash=item4208ede3a9:g:jsUAAOSwK1NddqV0,Fisher Price Rainforest Jumperoo Hanging Frog Replacement Part Blue Green Leaf,$14.99,$3.00,Brand: Fisher-Price,Color: Multicolor,Age: Infant
https://www.ebay.com/itm/Baby-Einstein-Musical-Motion-Jumperoo-Green-Seat-Cover-and-Seat/254383253520?hash=item3b3a6c6810:g:VWsAAOSwOFFdi7AJ,Baby Einstein Musical Motion Jumperoo Green Seat Cover and Seat,$24.99,$9.99,Brand: Baby Einstein,Color: Green,N/A
https://www.ebay.com/itm/Graco-Doorway-Bumper-Jolly-Jumper-Blue-Theme-And-White/123823406752?hash=item1cd4733ea0:g:zUYAAOSws9tc99KW,Graco Doorway Bumper Jolly Jumper Blue Theme And White,$15.00,$30.00,Brand: Jolly Jumper,Color: White,Type: Doorway Jumper
https://www.ebay.com/itm/Fisher-Price-Jumperoo-Replacement-Seat-Pad-Part-Blue-Yellow-Red/113894792407?hash=item1a84a89cd7:g:xRYAAOSwxY9dg56w,Fisher Price Jumperoo Replacement Seat Pad Part Blue Yellow Red,$14.99,$4.99,Brand: Fisher-Price,Color: Orange,Type: Activity Center Jumper
https://www.ebay.com/p/10025526887?iid=273978769300&rt=nc,Baby Einstein Neighborhood Friends Activity Jumper Springs 4 pack,$20.00,$8.00,Brand: Baby Einstein,N/A,N/A
https://www.ebay.com/itm/Baby-Einstein-Musical-Activity-Jumper-Electronic-Piano-Toy-Replacement-Part/133140247836?hash=item1effc6f51c:g:G9UAAOSwtOVdQetd,Baby Einstein Musical Activity Jumper Electronic Piano Toy Replacement Part,$17.95,$8.35,Brand: Baby Einstein,Color: Orange,N/A
https://www.ebay.com/itm/Baby-Einstein-Activity-Jumper-Red-Bird-Spins-Spinner-Toy-Replacement-Part/173992049402?hash=item2882bbfafa:g:s9IAAOSwsIBdTfPv,Baby Einstein Activity Jumper Red Bird Spins Spinner Toy Replacement Part,$13.95,Free,Brand: Baby Einstein,Age: Infant,N/A
https://www.ebay.com/itm/Baby-Einstein-Musical-Motion-Jumper-Caterpillar-Leaf-Sun-Toy-Replacement-Part/183928239585?hash=item2ad2fa35e1:g:faoAAOSwIr1dYE3B,Baby Einstein Musical Motion Jumper Caterpillar  Leaf Sun Toy Replacement Part,$19.95,Free,Brand: Baby Einstein,Color: Multicolor,Age: Infant
https://www.ebay.com/itm/Baby-Einstein-Neighborhood-Symphony-Jumper/202797800462?hash=item2f37b0dc0e:g:eMMAAOSwGRNdoGvM, Baby Einstein Neighborhood Symphony Jumper,$84.95,Free,Brand: Baby Einstein,Color: Multicolor,Age: Infant
https://www.ebay.com/p/1300119683?iid=254383622088&rt=nc,FISHER PRICE LUV U ZOO JUMPEROO V0206 *NEW*,$86.50,$81.47,Brand: Fisher-Price,Age: Infant,N/A
https://www.ebay.com/p/2255654079?iid=383100173177&rt=nc,Bright Stars Disney Baby Finding Nemo Sea of Activities Jumper Bouncer Great Con,$49.99,$26.25,Brand: Disney,Color: Blue,Age: Infant
https://www.ebay.com/p/12031071793?iid=183943374432&rt=nc,"The Original Jolly Jumper with Super Stand, JOLLY JUMPER, ",$134.82,Free,Brand: Jolly Jumper,Color: Black,Age: Infant
https://www.ebay.com/p/2035903839?iid=283640896527&rt=nc,Fisher Price K6070 Rainforest Jumperoo Activity Center & Exerciser w Comfy Seat,$47.36,Free,Brand: Fisher-Price,Type: Activity Center Jumper,Age: Infant
https://www.ebay.com/itm/Fisher-Luv-U-Zoo-Jumperoo-V0206/202805927297?hash=item2f382cdd81:g:FnAAAOSwepJXYafz,Fisher- Luv U Zoo Jumperoo V0206,$97.00,$58.90,Brand: Jumperoo,N/A,N/A
https://www.ebay.com/c/24022496102,Fisher-Price Jumperoo: Jumperoo,$41.97,Free,Brand: Fisher-Price,Color: Brown,N/A
https://www.ebay.com/itm/Bright-Starts-2-in-1-Laugh-Lights-Activity-Gym-Saucer/333207089720?hash=item4d94b0b238:g:VkYAAOSwBmdc5XTY,Bright Starts 2 - in -1 Laugh & Lights Activity Gym & Saucer ,$71.99,Free,Brand: Bright Starts,Color: Beige,N/A
https://www.ebay.com/itm/Fisher-Price-Rainforest-Jumperoo-Durable-Frame-Lights-Sounds-Seat-spins-360/283607478275?hash=item420852b003:g:L6QAAOSwMJVddD0X,Fisher-Price Rainforest Jumperoo Durable Frame Lights Sounds Seat spins 360,$41.73,Free,Brand: Fisher-Price,Age: Infant,N/A
https://www.ebay.com/itm/BRIGHT-STARTS-BOOSTER-SEAT-NICE-COND/264502185592?hash=item3d958f0e78:g:7REAAOSwEYpb6bna,BRIGHT STARTS BOOSTER SEAT NICE COND.,$6.50,$18.75,Brand: Bright Starts,Color: Pink,N/A
https://www.ebay.com/itm/Fisher-Price-Rainforest-Jumperoo-Replacement-Part-Jump-Lights-Music-Toy/183963031184?hash=item2ad50d1690:g:HQQAAOSw1EBdg-2W,Fisher Price Rainforest Jumperoo Replacement Part Jump Lights Music Toy,$9.95,$8.30,Brand: Fisher-Price,Color: Multicolor,Age: Infant
https://www.ebay.com/itm/Fisher-Rainforest-Jumperoo-Baby-Activity-Jumper-Model-K6070/143372246475?hash=item2161a6ddcb:g:IMkAAOSwM6BdebO3,Fisher- Rainforest Jumperoo Baby Activity Jumper - Model K6070 -,$55.00,$65.30,Brand: Jumperoo,N/A,N/A
https://www.ebay.com/p/18003300871?iid=254338260926&rt=nc,Fisher-Price® Rainforest™ Jumperoo™,$110.99,Free,Brand: Fisher-Price,Type: Jumper Walker,Age: Infant
https://www.ebay.com/itm/Fisher-Price-Replacement-Hanging-Leaf-and-Monkey-Luv-U-Zoo-Jumperoo/283636510092?hash=item420a0dad8c:g:-o8AAOSww8tdm8Zk,Fisher Price Replacement Hanging Leaf and Monkey Luv U Zoo Jumperoo,$12.99,$4.00,Brand: Fisher-Price,Color: Multicolor,Age: Infant
https://www.ebay.com/itm/Fisher-Price-Luv-U-Zoo-Jumperoo-Lights-Music-Toy-Replacement-Part/173962848806?hash=item2880fe6a26:g:kTcAAOSwJStbp9Fl,Fisher Price Luv U Zoo Jumperoo Lights & Music Toy Replacement Part,$28.99,Free,Brand: Fisher-Price,Age: Infant,N/A
https://www.ebay.com/itm/Baby-Einstein-Neighborhood-Friends-Jumperoo-Seat-Cover-Replacement-Part/183983820152?hash=item2ad64a4d78:g:0GsAAOSw2WZbuogi,Baby Einstein Neighborhood Friends Jumperoo Seat Cover Replacement Part,$26.99,Free,Brand: Baby Einstein,Color: Blue,Age: Infant
https://www.ebay.com/p/1385727981?iid=352792663613&rt=nc,"Baby Einstein Activity Jumper Special Edition, Neighborhood Friends",$55.00,$42.80,Brand: Baby Einstein,Age: Infant,N/A
https://www.ebay.com/itm/Fisher-Price-Rainforest-Jumperoo-Baby-Bouncer-Jumping-Exercise-3DAYSHIP/202116578186?hash=item2f0f163b8a:g:dhUAAOSwuchdRKRA,Fisher-Price Rainforest Jumperoo Baby Bouncer Jumping Exercise 3DAYSHIP,$97.85,Free,Brand: Jumperoo,N/A,N/A
https://www.ebay.com/itm/Fisher-Price-Luv-U-Zoo-Jumperoo-Lights-Music-Toy-Replacement-Part/183902122203?hash=item2ad16bb0db:g:hhYAAOSwlONdPeWi,Fisher Price Luv U Zoo Jumperoo Lights & Music Toy Replacement Part,$28.95,Free,Brand: Fisher-Price,Age: Infant,N/A
https://www.ebay.com/itm/Lot-of-3-Fisher-Price-Rainforest-Jumperoo-Replacement-Springs-Toy/264493091390?hash=item3d95044a3e:g:mBAAAOSwGJldnebJ,Lot of 3 Fisher Price Rainforest Jumperoo Replacement Springs & Toy,$18.99,Free,Brand: Fisher-Price,Color: Green,Age: Infant
https://www.ebay.com/itm/Kids-II-Bright-Starts-Jumperoo-Replacement-Seat-Pad-Part-Blue-Green-Yellow/123925246043?hash=item1cda85305b:g:SxUAAOSw509dk3tF,Kids II Bright Starts Jumperoo Replacement Seat Pad Part Blue Green Yellow,$12.50,$4.99,Color: Green,Type: Activity Center Jumper,Age: Infant
https://www.ebay.com/p/16026721951?iid=113764919948&rt=nc,"Evenflo 61731197 Safari Friends Stationary Jumper & Learning Activi,Lightly Used",$49.00,$64.29,Brand: Evenflo,Color: Green,Type: Activity Center Jumper
https://www.ebay.com/itm/The-Original-Jolly-Jumper-with-Super-Stand-JOLLY-JUMPER-Open-Box/303339023847?hash=item46a06a2de7:g:MVEAAOSwhY1dtwEe,"The Original Jolly Jumper with Super Stand, JOLLY JUMPER, Open Box ",$59.96,$26.25,Brand: Jolly Jumper,N/A,N/A
https://www.ebay.com/itm/Jumper-Bumper-Jungle-Graco-Little-Baby-Bouncer-Doorway-Toy-Door-Jump-Play/174061783746?hash=item2886e40ac2:g:uTIAAOSwG4ZdnpsX,Jumper Bumper Jungle Graco Little Baby Bouncer Doorway Toy Door Jump Play,$18.99,$5.00,Brand: Graco Baby,Type: Doorway Jumper,N/A
https://www.ebay.com/p/22031750717?iid=283623255712&rt=nc,Baby Einstein 10455 Neptunes Ocean 4 Height Discovery Jumper w 360 Degree Frame,$66.37,Free,Brand: Baby Einstein,Color: Blue,Age: Infant
https://www.ebay.com/itm/Baby-Einstein-Neighborhood-Symphony-Jumper-Seat-Cover-Pad-Replacement-Part/183941878325?hash=item2ad3ca5235:g:B~QAAOSwZ3lczKiA,Baby Einstein Neighborhood Symphony Jumper Seat Cover Pad Replacement Part,$22.95,$2.95,Brand: Baby Einstein,Color: Blue,Age: Infant
https://www.ebay.com/itm/Super-Fun-Jumperoo-with-Toys-and-Lights-Jungle-Baby/303103626715?hash=item4692624ddb:g:02QAAOSwL1RclAUa,Super Fun Jumperoo with Toys and Lights Jungle Baby,$99.99,Free,Brand: Unbranded,Color: Blue,Type: Activity Center Jumper
https://www.ebay.com/p/2254551482?iid=192952363523&rt=nc,"Bright Starts Bounce 'N Spring Deluxe Door Jumper, Blue Open Box New",$11.99,$11.60,Brand: Bright Starts,Color: Blue,Type: Doorway Jumper
https://www.ebay.com/itm/baby-einstein-jumper-activity/143404108777?hash=item21638d0be9:g:3ccAAOSwhfNdmiHK,baby einstein jumper activity ,$35.00,$8.30,Brand: Baby Einstein,N/A,N/A
https://www.ebay.com/itm/Fisher-Price-Rainforest-Jumper-Jumperoo-Replacement-Part-Red-Frog-Seat-Cover/173983828484?hash=item28823e8a04:g:H8oAAOSwd2tdGNAz,Fisher Price Rainforest Jumper Jumperoo Replacement Part Red Frog Seat Cover,$26.95,Free,Brand: Fisher-Price,Color: Yellow,Age: Infant
https://www.ebay.com/itm/Baby-Einstein-Musical-Motion-Activity-Jumperoo-4-Fabric-Springs-Replacement/223569319586?hash=item340dc516a2:g:sD0AAOSwybZdOptw,Baby Einstein Musical Motion Activity Jumperoo 4 Fabric Springs Replacement,$22.00,$11.00,Brand: Baby Einstein,N/A,N/A
https://www.ebay.com/itm/Fisher-Price-Go-Wild-Jumperoo-Free-Standing-Steel-Frame-Adjustable-White-Green/283646534705?hash=item420aa6a431:g:GIwAAOSwXKddqMk9,Fisher-Price Go Wild Jumperoo Free Standing Steel Frame Adjustable White Green,$42.93,Free,Brand: Fisher-Price,Color: Green,N/A
https://www.ebay.com/itm/Fisher-Price-Replacement-Hanging-Leaf-and-Hippo-Luv-U-Zoo-Jumperoo/283636510696?hash=item420a0dafe8:g:bTMAAOSwg5Jdm8g2,Fisher Price Replacement Hanging Leaf and Hippo Luv U Zoo Jumperoo,$12.99,$4.00,Brand: Fisher-Price,Color: Multicolor,Age: Infant
https://www.ebay.com/itm/Fisher-Price-Jumperoo-Baby-Activity-Jumper-Model-Animal-krackers/113893565626?hash=item1a8495e4ba:g:ZCoAAOSwb~1dd6ze,Fisher Price Jumperoo Baby Activity Jumper - Model Animal krackers,$25.00,$49.95,Brand: Jumperoo,N/A,N/A
https://www.ebay.com/itm/Replacement-Piano-Baby-Einstein-Neighborhood-Friends-Activity-Jumper-Part/223641731728?hash=item3412160290:g:AJQAAOSw6CxdMS3Z,Replacement Piano Baby Einstein Neighborhood Friends Activity Jumper Part,$19.99,$8.00,Brand: Baby Einstein,Color: Multicolor,Age: Infant
https://www.ebay.com/c/28024377046,Fisher-Price Color Climbers Jumperoo 360 Degrees Of Play & 3 Different Heights,$47.54,Free,Brand: Fisher-Price,Color: Green,Type: Activity Center Jumper
https://www.ebay.com/p/18026511863?iid=264337427423&rt=nc,"Infantino Go GaGa Up, Up & Away Deluxe Doorway Jumper",$39.99,Free,Brand: Infantino,Type: Doorway Jumper,Age: Infant
https://www.ebay.com/itm/Fisher-Price-Animal-Activity-Jumperoo-NEW/174026337159?hash=item2884c72b87:g:SRYAAOSwOWtdd6Mw,Fisher-Price Animal Activity Jumperoo NEW,$72.99,Free,Brand: Fisher-Price,N/A,N/A
https://www.ebay.com/itm/Fisher-Price-Rainforest-Jumperoo-Replacement-Frame-Large-Base-Part/333368239245?hash=item4d9e4ba48d:g:USEAAOSwgZtdq1TX,Fisher Price Rainforest Jumperoo Replacement Frame Large Base Part,$10.00,$13.69,Brand: Fisher-Price,Age: Infant,N/A
https://www.ebay.com/itm/Bright-Starts-Bounce-Bounce-Baby-Jumper-Platform-Replacement-Part/223681856233?hash=item34147a42e9:g:AUcAAOSwzpxdjJXY,Bright Starts Bounce Bounce Baby Jumper Platform Replacement Part,$14.99,$10.40,Brand: Bright Starts,Color: Orange,Age: Infant
https://www.ebay.com/itm/BRIGHT-STARTS-BOOSTER-SEAT-NICE-COND/264502185592?hash=item3d958f0e78:g:7REAAOSwEYpb6bna,BRIGHT STARTS BOOSTER SEAT NICE COND.,$6.50,$18.75,Brand: Bright Starts,Color: Pink,N/A
https://www.ebay.com/p/6032166066?iid=293202681080&rt=nc,Fisher-Price Rainforest Music & Lights Deluxe Gym,$34.36,Free,Brand: Fisher-Price,Type: Activity Center Jumper,Age: Infant
https://www.ebay.com/p/18003300871?iid=283584019402&rt=nc,Fisher-Price Rainforest Jumperoo K7198 - Preowned,$73.07,Free,Brand: Fisher-Price,Type: Jumper Walker,Age: Infant
https://www.ebay.com/p/5014767745?iid=174007831609&rt=nc,Baby Einstein Neptune's Ocean Discovery Jumper  ,$48.00,Free,Brand: Baby Einstein,Color: Blue,Age: Infant
https://www.ebay.com/p/11033136634?iid=153570474989&rt=nc,"Jolly Jumper Exerciser with Door Clamp, Black",$73.99,Free,Brand: Jolly Jumper,Color: Black,Type: Doorway Jumper
https://www.ebay.com/itm/Baby-Einstein-Neighborhood-Friends-Activity-Jumper-Piano-Station-replacement/273978822170?hash=item3fca690e1a:g:00cAAOSw~6ddYcts,Baby Einstein Neighborhood Friends Activity Jumper Piano Station replacement,$12.50,$9.30,Brand: Baby Einstein,N/A,N/A
https://www.ebay.com/itm/Bright-Starts-Bounce-Bounce-Baby-Jumper-Platform-Pad-Replacement-Part/174067246036?hash=item28873763d4:g:wmoAAOSwm2pdpzo6,Bright Starts Bounce Bounce Baby Jumper Platform Pad Replacement Part,$14.99,$7.85,Brand: Bright Starts,Color: Green,Age: Infant
https://www.ebay.com/p/9034035794?iid=293259243131&rt=nc,"Graco Doorway Bumper Jumper, Caravan",$34.15,Free,Brand: Graco,Type: Doorway Jumper,N/A
https://www.ebay.com/itm/Fisher-Price-Jumperoo-Replacement-Seat-Pad-Part-Blue-Yellow-Red/123873791400?hash=item1cd7740da8:g:wrkAAOSw-hVdUxt4,Fisher Price Jumperoo Replacement Seat Pad Part Blue Yellow Red,$12.99,$4.99,Brand: Fisher-Price,Color: Orange,Type: Activity Center Jumper
https://www.ebay.com/p/23033784486?iid=401879317903&rt=nc,"Skip Hop Explore and More Baby's View 3-Stage Activity Center, Multi, 4 Months",$69.69,Free,Brand: Skip Hop,N/A,N/A
https://www.ebay.com/itm/Baby-Einstein-Musical-Motion-Jumperoo-Leaf-Sun-Toy-Replacement-Part/183938553090?hash=item2ad3979502:g:FgQAAOSwy9VdbXpx,Baby Einstein Musical Motion Jumperoo Leaf/Sun Toy Replacement Part,$11.99,$7.85,Brand: Baby Einstein,Color: Green,Age: Infant
https://www.ebay.com/itm/4-Baby-Einstein-Activity-Jumper-Jumperoo-Replacement-Part-Springs-Orange-Blue/183928194943?hash=item2ad2f9877f:g:bN4AAOSwEHldYEPE,4 Baby Einstein Activity Jumper Jumperoo Replacement Part Springs Orange & Blue!,$29.95,Free,Brand: Baby Einstein,Color: Orange,N/A
https://www.ebay.com/itm/Baby-Einstein-Musical-Motion-Activity-Jumper-Seat-Cover-Replacement-Part/323906249896?hash=item4b6a5124a8:g:EfUAAOSwNIddcf0y,Baby Einstein Musical Motion Activity Jumper Seat Cover Replacement Part,$21.00,$4.25,Brand: Baby Einstein,Color: Yellow,Age: Infant
https://www.ebay.com/p/8009622434?iid=202741927181&rt=nc,Baby Woodland Activity Center with 360 Degree Rotating Seat Play Creative Toy,$62.05,Free,Brand: Creative Baby,Type: Activity Center Jumper,Age: Infant
https://www.ebay.com/itm/Baby-Einstein-Musical-Motion-Jumper-Jumperoo-Green-Seat-Cover-Replacement-Part/183928844733?hash=item2ad30371bd:g:1NcAAOSwFzxdYUT6,Baby Einstein Musical Motion Jumper Jumperoo Green Seat Cover Replacement Part,$12.95,$2.95,Brand: Baby Einstein,Color: Multicolor,Age: Infant
https://www.ebay.com/p/1872179795?iid=274001707225&rt=nc,Evenflo  New Exersaucer Baby Doorway Jumper Johnny Jump-up,$14.00,$11.10,Brand: Evenflo,Color: Black,Type: Doorway Jumper
https://www.ebay.com/itm/Fisher-Price-Rainforest-Jumperoo-Red-Frog-Seat-Cover-Replacement-Part/273983044576?hash=item3fcaa97be0:g:zyoAAOSw1MBdZd-2,Fisher Price Rainforest Jumperoo Red Frog Seat Cover Replacement Part,$24.89,$3.99,Brand: Fisher-Price,Color: Yellow,Age: Infant
https://www.ebay.com/itm/Baby-Einstein-Neighborhood-Symphony-Jumper-Replacement-Part-Bottom-Frame-Base/323857210788?hash=item4b6764dda4:g:BScAAOSw~E5dKSHk,Baby Einstein Neighborhood Symphony Jumper Replacement Part Bottom Frame Base,$5.99,$13.40,Brand: Baby Einstein,N/A,N/A
https://www.ebay.com/itm/Original-Johnny-Jump-Up-Baby-Swing/254353102057?hash=item3b38a054e9:g:x54AAOSw9m5ddBe6,Original Johnny Jump-Up Baby Swing,$30.00,Free,N/A,N/A,N/A
https://www.ebay.com/itm/Baby-Einstein-Musical-Motion-Jumperoo-Blue-Seat-Cover-Replacement-Part/173988476193?hash=item2882857521:g:SaQAAOSwNYVdSZNm,Baby Einstein Musical Motion Jumperoo Blue Seat Cover Replacement Part,$21.95,Free,Brand: Baby Einstein,Color: Blue,Age: Infant
https://www.ebay.com/itm/Disney-Baby-Jumper-in-Orginal-box/312818664800?hash=item48d5720560:g:r9QAAOSw~AFds6Ej,Disney Baby Jumper in Orginal box,$39.00,$25.00,Brand: Disney,N/A,N/A
https://www.ebay.com/itm/Replacement-Piano-Baby-Einstein-Neighborhood-Friends-Activity-Jumper-Part/113883905203?hash=item1a84027cb3:g:3uIAAOSwL1xdeAfv,Replacement Piano Baby Einstein Neighborhood Friends Activity Jumper Part,$19.99,$10.40,Brand: Baby Einstein,Color: Multicolor,Age: Infant
https://www.ebay.com/itm/Bright-Starts-Laugh-Lights-Exersaucer-Toy-Arch-Replacement-Part/183873116434?hash=item2acfb11912:g:PSUAAOSwB5pdIN5Z,Bright Starts Laugh & Lights Exersaucer Toy Arch Replacement Part,$11.99,$19.15,Brand: Bright Starts,Color: Multicolor,Age: Infant
https://www.ebay.com/itm/Baby-Einstein-Activity-Jumper-Sun-Flower-Toy-Replacement-Part/174008704597?hash=item2883ba1e55:g:vKEAAOSw~fpdYrQJ,Baby Einstein Activity Jumper Sun Flower Toy Replacement Part,$13.95,Free,Brand: Baby Einstein,Color: Multicolor,Age: Infant
