URL,Title,Price,Shipping,Dynamic Attribute 1,Dynamic Attribute 2,Dynamic Attribute 3
https://www.ebay.com/p/1717966603?iid=192452985122&rt=nc,"Graco Affix Youth Booster Seat with Latch System Car Safety, Grapeade 3DAYSHIP",$66.70,Free,Brand: Graco,Color: Purple,Features: Cup Holder
https://www.ebay.com/p/1457612792?iid=163858158599&rt=nc,Harmony Youth Booster Car Seat 628922001044,$13.99,$8.99,Brand: Harmony,Color: Pink,Features: Removable Washable Cover
https://www.ebay.com/p/4027048701?iid=193142752238&rt=nc,Mifold Grab and Go Car Booster Seat Slate Grey,$20.00,Free,Brand: mifold,Color: Gray,Gender: Unisex
https://www.ebay.com/p/22017193643?iid=223720824390&rt=nc,MiFold Grab-and-Go Car Booster Seat Pearl Grey New Free Shipping,$22.99,Free,Brand: mifold,Color: Gray,Finish: Limed
https://www.ebay.com/p/2256086643?iid=133169240374&rt=nc,"New KidsEmbrace High-Back Booster Car Seat, Marvel Spider-Man 2 IN 1 For Boys",$92.99,Free,Brand: KidsEmbrace,Color: Red,Finish: Aniline
https://www.ebay.com/p/8024752917?iid=401718557618&rt=nc,Baby Convertible Car Seat 2in1 Toddler Highback Booster Travel Safety Kids Chair,$56.07,Free,Brand: Cosco,Color: Multicolor,Features: Cup Holder
https://www.ebay.com/itm/Graco-TurboBooster-Highback-Booster-Car-Seat/293294141061?hash=item4449b16e85:g:yNQAAOSwROldsQED,Graco TurboBooster Highback Booster Car Seat,$53.49,Free,Brand: Graco,Features: Cup Holder,Gender: Unisex
https://www.ebay.com/p/21030067162?iid=184004953751&rt=nc,mifold Grab-n-Go Portable Booster Seat Slate Gray free priority shipping,$25.50,Free,Brand: mifold,Color: Gray,Gender: Unisex
https://www.ebay.com/p/219504229?iid=283626942829&rt=nc,Britax E9LY76L Frontier Harness Booster Car Seat w 2 Layer Impact Protection,$126.62,Free,Color: Black,Gender: Unisex,N/A
https://www.ebay.com/itm/Mifold-Grab-and-Go-Car-Booster-Seat-Pink-DQ362/323911255391?hash=item4b6a9d855f:g:kgIAAOSwZepdd9wt,Mifold Grab and Go Car Booster Seat Pink (DQ362),$14.99,Free,Brand: mifold,Color: Pink,N/A
https://www.ebay.com/c/1508052395,"Britax Parkway SGL Belt-Positioning Booster Seat, Phantom",$25.00,$94.68,Color: Red,Gender: Girls,N/A
https://www.ebay.com/itm/NEW-High-Back-Booster-No-Back-Booster-Car-Seat-Evenflo-Big-Kid-Sport/283654272085?hash=item420b1cb455:g:hjwAAOSwFwNds0kD,NEW - High Back Booster/No Back Booster Car Seat - Evenflo Big Kid Sport,$42.50,$27.20,Brand: Evenflo,Color: Multicolor,Theme: Sports
https://www.ebay.com/p/28027051361?iid=333380575556&rt=nc,Grab-and-Go Car Booster Seat (Slate Grey)De Carrying Bag,$25.00,Free,Brand: mifold,Color: Gray,Finish: Limed
https://www.ebay.com/p/11019449327?iid=283580790946&rt=nc,"BubbleBum Inflatable Backless Booster Car Seat, Black",$25.99,Free,Brand: BubbleBum,Color: Black,Features: Inflatable
https://www.ebay.com/p/21031751759?iid=401886601658&rt=nc,"Cosco Finale DX 2-in-1 Booster Car Seat, Sport Blue ",$67.19,Free,Brand: Cosco,Color: Blue,Theme: Sports
https://www.ebay.com/p/18027980279?iid=392226135500&rt=nc,Britax Highpoint Booster Car Seat in Cool Flow Teal Brand New!! Free Shipping!,$169.99,Free,Color: Blue,N/A,N/A
https://www.ebay.com/p/20032133828?iid=193036846823&rt=nc,"Evenflo Maestro Sport Harness Booster Car Seat, Whitney Safety 3DAYSHIP",$82.99,Free,Brand: Evenflo,Theme: Sports,N/A
https://www.ebay.com/p/1901284304?iid=183975653005&rt=nc,"Harmony Juvenile Youth Booster Car Seat, Hot Rod",$9.99,$13.40,Brand: Harmony,Gender: Boys,N/A
https://www.ebay.com/itm/Kids-Embrace-Disney-Cinderella-Platinum-Combo-Harness-Booster-Car-Seat-2-Pack/392150213143?hash=item5b4df96217:g:accAAOSwWotbx6wB,Kids Embrace Disney Cinderella Platinum Combo Harness Booster Car Seat (2 Pack),$234.99,Free,Brand: KidsEmbrace,Color: Multicolor,Gender: Unisex
https://www.ebay.com/p/4010657051?iid=223646861306&rt=nc,"Graco TurboBooster Backless Car Seat, Deena",$23.50,Free,Brand: Graco,Features: Cup Holder,Gender: Girls
https://www.ebay.com/c/1600018065,"Britax Parkway SGL Booster Seat, Nutmeg",$30.00,$94.68,Color: Black,Gender: Unisex,N/A
https://www.ebay.com/itm/Booster-Seat-For-Car-With-Latch-System-Youth-Kids-Children-Truck-Safe-Safety/293186613456?hash=item444348b0d0:g:MCYAAOSwRJZdUoHI,Booster Seat For Car With Latch System Youth Kids Children Truck Safe Safety ,$77.99,Free,Brand: Graco,Color: Black,Gender: Unisex
https://www.ebay.com/p/19007404664?iid=264424470769&rt=nc,Britax Frontier Clicktight Cowmooflage Combo Harness-2-Booster Car seat NEW NIB,$239.00,Free,N/A,N/A,N/A
https://www.ebay.com/itm/Backless-Baby-Booster-Car-Seat-Travel-Safety-Harness-Breathable-Durable-For-Kids/352768994044?hash=item5222abaafc:m:mW9o4B-fDvZQYOJ37TCSnCg&var=622075133661,Backless Baby Booster Car Seat Travel Safety Harness Breathable Durable For Kids,$31.67,Free,Brand: Unbranded,Color: Red,Gender: Unisex
https://www.ebay.com/p/15028315168?iid=362756940260&rt=nc,BubbleBum Inflatable Travel Booster Car Seat Bubble Bum - Black,$23.99,Free,Brand: BubbleBum,Color: Black,Features: Inflatable
https://www.ebay.com/p/17021534308?iid=153648239512&rt=nc,Graco TurboBooster TakeAlong Backless Booster In Sonic w/Carry Bag Children 4-10,$24.99,$23.05,Brand: Graco,Color: Black,Features: Cup Holder
https://www.ebay.com/itm/Baby-Car-Seat-Booster-Britax-Pinnacle-ClickTight-up-to-90-lbs-FREE-SHIPPING/352752158697?hash=item5221aac7e9:g:xqwAAOSwfDtdSxv6,Baby Car Seat Booster Britax Pinnacle ClickTight up to 90 lbs + FREE SHIPPING! ,$249.99,Free,Gender: Unisex,N/A,N/A
https://www.ebay.com/p/1075462070?iid=254336178884&rt=nc,"Mifold Grab and Go Booster Seat 4+ 49lbs-100lbs 40""-57"" MF01-US/GRN Green New +",$32.00,Free,Brand: mifold,Color: Green,Finish: Limed
https://www.ebay.com/p/1192712234?iid=372794230266&rt=nc,"Ride Safer Delight Travel Vest, Small Yellow –Includes Tether and Neck Pillow b4",$99.95,Free,Color: Yellow,Gender: Unisex,N/A
https://www.ebay.com/p/2255204836?iid=223696470335&rt=nc,"BubbleBum Backless Inflatable Travel Booster Car Seat, Pink Chevron",$14.99,Free,Brand: BubbleBum,Color: Pink,Features: Inflatable
https://www.ebay.com/itm/Graco-1875292-Affix-Youth-Booster-Safety-Seat-w-Latch-System-Grapeade-BOX-DMG/163880474886?hash=item2628099906:g:Gd4AAOSwTF9djNtB,"Graco 1875292 Affix Youth Booster Safety Seat w/Latch System, Grapeade BOX DMG",$44.05,Free,Brand: Graco,Color: Black,Gender: Unisex
https://www.ebay.com/itm/Chicco-MyFit-Zip-Air-Harness-Booster-Car-Seat-Atmos-Free-Shipping/143349593233?hash=item21604d3491:g:iGgAAOSw0eNdSvmM,Chicco MyFit Zip Air Harness + Booster Car Seat - Atmos Free Shipping,$299.99,Free,Brand: Chicco,Color: Multicolor,Features: LATCH Compatible
https://www.ebay.com/itm/Evenflo-Big-Kid-AMP-High-Back-Booster-Car-Seat-Static-Black-3DAYSHIP/202628168593?hash=item2f2d947b91:g:H-EAAOSwvtBcjuql,"Evenflo Big Kid AMP High Back Booster Car Seat, Static Black  3DAYSHIP",$46.99,Free,Brand: Graco,Color: Green,N/A
https://www.ebay.com/itm/Convertible-Kids-2in1-Car-Seat-Baby-Highback-Booster-Toddler-Travel-Safety-Chair/323870206265?hash=item4b682b2939:m:mkf5BcLsErEO6092fgNpd4w&var=512895430504,Convertible Kids 2in1 Car Seat Baby Highback Booster Toddler Travel Safety Chair,$44.38,Free,Brand: Evenflo,Gender: Unisex,N/A
https://www.ebay.com/p/2269561046?iid=383242084395&rt=nc,Convertible Safety Car Seat 2 in1 Toddler Booster Kid Travel Highback Camo Brown,$54.64,Free,Brand: Cosco,Color: Brown,Theme: Vehicles
https://www.ebay.com/itm/BUBBLEBUM-Inflatable-Backless-Booster-Car-Seat-in-Black/303250700570?epid=0&hash=item469b26791a:g:z~8AAOSwSQRdUHTR,BUBBLEBUM Inflatable Backless Booster Car Seat in Black,$17.00,$9.45,Brand: BubbleBum,Color: Black,Features: Inflatable
https://www.ebay.com/itm/Convertible-Safety-Car-Seat-2-in1-Toddler-Booster-Kid-Travel-Highback-Camo-Brown/133202319135?hash=item1f037a171f:g:9NwAAOSwveNdo8A5,Convertible Safety Car Seat 2 in1 Toddler Booster Kid Travel Highback Camo Brown,$55.15,Free,Brand: Unbranded,Color: Brown,Gender: Unisex
https://www.ebay.com/itm/Cosco-Topside-Backless-Booster-Car-Seat-Leo/383015246428?hash=item592d7cda5c:g:xsIAAOSwVXRdCzJi,Cosco Topside Backless Booster Car Seat (Leo),$26.82,Free,Brand: Cosco,N/A,N/A
https://www.ebay.com/itm/Graco-Nautilus-80-Elite-3-in-1-Car-Seat-Barely-Used-SEE-PICS-DESCRIPTION/401791409276?hash=item5d8ca25c7c:g:wXYAAOSwW1JdC8gt,Graco Nautilus 80 Elite 3-in-1 Car Seat ; Barely Used!! SEE PICS & DESCRIPTION!!,$55.00,$78.22,Brand: Graco,N/A,N/A
https://www.ebay.com/itm/Mifold-2018-Childs-Booster-Seat-4-Yrs-40-100-Lbs-Kids-Car-Seat-Restraint-Red/283661600534?hash=item420b8c8716:g:24QAAOSwTqtdvK96,Mifold 2018 Childs Booster Seat 4 Yrs 40-100 Lbs Kids Car Seat Restraint Red,$23.78,$5.00,Brand: mifold,Color: Multicolor,Features: LATCH Compatible
https://www.ebay.com/itm/Evenflo-Belt-Positioning-Booster/173884269594?hash=item287c4f641a:g:R88AAOSwLdpcwf37,Evenflo Belt Positioning Booster,$25.20,Free,Brand: Evenflo,N/A,N/A
https://www.ebay.com/p/505294715?iid=283666030037&rt=nc,Graco 1893805 Affix Backless Youth Secure Booster Car Seat w Latch System Pierce,$27.12,Free,Brand: Graco,Color: Black,Features: Cup Holder
https://www.ebay.com/itm/Custom-Baby-Trend-Hybrid-LX-3-in-1-BRIDE-FABRIC-baby-toddler-car-seat/133141082729?hash=item1effd3b269:g:PhsAAOSwdg5dUexf,Custom Baby Trend Hybrid LX 3-in-1 - BRIDE FABRIC baby toddler car seat,$300.00,Free,Brand: Baby Trend,Features: Cup Holder,Gender: Unisex
https://www.ebay.com/itm/Child-Car-Seat-Toddler-Youth-System-Affix-Latch-Backless-Belt-30-100-lbs-New/283470513236?hash=item420028c454:g:yXIAAOSw0KdcyrCx,Child Car Seat Toddler Youth System Affix Latch Backless Belt 30 - 100 lbs New,$88.90,Free,N/A,N/A,N/A
https://www.ebay.com/itm/Evenflo-Belt-Positioning-Booster/173884269594?hash=item287c4f641a:g:R88AAOSwLdpcwf37,Evenflo Belt Positioning Booster,$25.20,Free,Brand: Evenflo,N/A,N/A
https://www.ebay.com/p/505294715?iid=283666030037&rt=nc,Graco 1893805 Affix Backless Youth Secure Booster Car Seat w Latch System Pierce,$27.12,Free,Brand: Graco,Color: Black,Features: Cup Holder
https://www.ebay.com/itm/Custom-Baby-Trend-Hybrid-LX-3-in-1-BRIDE-FABRIC-baby-toddler-car-seat/133141082729?hash=item1effd3b269:g:PhsAAOSwdg5dUexf,Custom Baby Trend Hybrid LX 3-in-1 - BRIDE FABRIC baby toddler car seat,$300.00,Free,Brand: Baby Trend,Features: Cup Holder,Gender: Unisex
https://www.ebay.com/itm/Child-Car-Seat-Toddler-Youth-System-Affix-Latch-Backless-Belt-30-100-lbs-New/283470513236?hash=item420028c454:g:yXIAAOSw0KdcyrCx,Child Car Seat Toddler Youth System Affix Latch Backless Belt 30 - 100 lbs New,$88.90,Free,N/A,N/A,N/A
https://www.ebay.com/itm/Graco-Galaxy-Booster-Car-Seat/383176618951?hash=item59371b33c7:g:tPIAAOSwBw1ZcMb7,Graco Galaxy Booster Car Seat,$12.00,$7.50,Brand: Graco,Color: Gray,Gender: Unisex
https://www.ebay.com/p/25004754179?iid=264346708308&rt=nc,New Pink High Back Kid Booster Girl Car Seat Child Vehicle Chair Toddler Seating,$51.88,Free,Brand: Evenflo,Color: Pink,Theme: Vehicles
https://www.ebay.com/itm/Graco-Affix-Backless-Booster-Car-Seat-Pierce/183952999412?hash=item2ad47403f4:g:jZ4AAOSwdolde0jX,"Graco Affix Backless Booster Car Seat, Pierce",$24.99,Free,Brand: Unbranded,N/A,N/A
https://www.ebay.com/p/1417935253?iid=312767892485&rt=nc,Baby Trend 3-in-1 Booster Car Seat Hybrid Harness Blue Moon Safety Travel Chair,$94.85,Free,Brand: Baby Trend,Color: Blue,Finish: Aniline
https://www.ebay.com/itm/Bubble-Bum-Backless-Inflatable-Booster-Seat-RS103/174079820224?hash=item2887f741c0:g:WdkAAOSwRfRcoG5d,Bubble Bum Backless Inflatable Booster Seat (RS103),$24.01,$9.95,Brand: BubbleBum,Color: Black,Gender: Unisex
https://www.ebay.com/itm/Chicco-GoFit-Plus-Backless-No-Back-Booster-Kids-Car-Seat-Rain-drop-June-2018/223646841181?hash=item341263f95d:g:sVEAAOSwThdda9QV,Chicco GoFit Plus Backless No Back Booster Kids Car Seat - Rain drop .June 2018,$39.99,Free,Brand: Chicco,Gender: Unisex,N/A
https://www.ebay.com/p/182494427?iid=153683829804&rt=nc,"Graco Backless TurboBooster Car Seat, Galaxy Free Shipping",$32.49,Free,Brand: Graco,N/A,N/A
https://www.ebay.com/itm/Evenflo-Big-Kid-High-Back-Booster-Car-Seat-Pink-Leopard-Brand-New-Out-of-Box/303289659726?hash=item469d78f14e:g:KSMAAOSwwZtdSJi-,Evenflo Big Kid High-Back Booster Car Seat -Pink Leopard-Brand New Out of Box,$50.00,$18.20,Brand: Evenflo,Color: Pink,Theme: Sports
https://www.ebay.com/itm/bubble-bum-inflatable-and-portable-child-booster-seat-for-autos-black/303263740650?hash=item469bed72ea:g:aNcAAOSwlWBdYerL,bubble bum inflatable and portable child booster seat for autos black,$11.62,$8.50,Brand: BubbleBum,Color: Black,Features: Inflatable
https://www.ebay.com/p/28027051361?iid=233330516292&rt=nc,Mifold MF01-US/GRY Grab-and-Go Car Booster Seat (Slate Grey),$20.99,$7.35,Brand: mifold,Color: Gray,Finish: Limed
https://www.ebay.com/p/172723828?iid=401886607223&rt=nc,"Evenflo Big Kid AMP Booster Car Seat, Sprocket ",$119.97,Free,Brand: Evenflo,Color: Black,Gender: Unisex
https://www.ebay.com/itm/CB7BB7-BubbleBum-Backless-Inflatable-Travel-Booster-Car-Seat/113916803025?hash=item1a85f877d1:g:uYUAAOSw-a5dnAtB,CB7BB7 BubbleBum Backless Inflatable Travel Booster Car Seat,$15.99,Free,Brand: BubbleBum,Features: Inflatable,N/A
https://www.ebay.com/p/4027048701?iid=312001582438&rt=nc,Mifold MF01-US/GRY Grab-and-Go Car Booster Seat (Slate Grey),$29.99,Free,Brand: mifold,Color: Gray,Finish: Limed
https://www.ebay.com/p/1075930267?iid=312001582448&rt=nc,Mifold MF01-US/COM Grab-and-Go Car Booster Seat (Pearl Grey),$29.99,Free,Brand: mifold,Color: Gray,Gender: Unisex
https://www.ebay.com/p/2255204836?iid=392423507502&rt=nc,"BubbleBum Inflatable Backless Booster Car Seat, Pink Chevron (A91)",$19.99,Free,Brand: BubbleBum,Color: Pink,Features: Inflatable
https://www.ebay.com/p/1901284304?iid=123890055067&rt=nc,"Harmony Juvenile Youth Booster Car Seat, Hot Rod!! NICE 👍 ITEM!!!",$15.00,$10.00,Brand: Harmony,Gender: Boys,N/A
https://www.ebay.com/itm/Bubble-Bum-Booster-Car-Seat-BB0004US-2019-02-20/123956991218?hash=item1cdc6994f2:g:VHIAAOSwgFlduMRv,Bubble Bum Booster Car Seat - BB0004US 2019-02-20,$18.99,Free,Brand: BubbleBum,N/A,N/A
https://www.ebay.com/p/15028315168?iid=233359016131&rt=nc,BubbleBum BB0004-W2 Travel Booster Car Seat - Black,$27.50,Free,Brand: BubbleBum,Color: Black,N/A
https://www.ebay.com/p/13031088953?iid=153591954873&rt=nc,Baby Convertible Safety Car Seat 2in1 Kids Chair Toddler Highback Booster Travel,$51.98,Free,Brand: Cosco,Color: Blue,Theme: Vehicles
https://www.ebay.com/itm/Convertible-Kids-2in1-Car-Seat-Baby-Highback-Booster-Toddler-Travel-Safety-Chair/133161092697?hash=item1f01050659:g:3w4AAOSwnTZdcKXI,Convertible Kids 2in1 Car Seat Baby Highback Booster Toddler Travel Safety Chair,$50.00,$4.39,Brand: Evenflo,Color: Pink,Gender: Girls
https://www.ebay.com/p/21027564922?iid=183933056303&rt=nc,Chicco - KidFit 2-in-1 Booster Seat - April 2018,$76.99,$24.43,Brand: Chicco,Features: Cup Holder,Gender: Unisex
https://www.ebay.com/p/2254347055?iid=123761987869&rt=nc,Graco Affix Backless Youth Booster Car Seat Latch System Pierce Baby Larch New,$32.99,$9.99,Brand: Graco,Color: Gray,Theme: Vehicles
https://www.ebay.com/itm/Hugaboo-Infant-Sitting-Chair-Snuggle-Buns-Blue-Green-3-10-Months/233149228636?epid=0&hash=item3648c6e65c:g:shoAAOSw14Fcdw41,"Hugaboo Infant Sitting Chair, Snuggle Buns/Blue/Green, 3-10 Months ",$38.47,Free,Color: Green,N/A,N/A
https://www.ebay.com/p/5017653984?iid=183908483431&rt=nc,Maxi-Cosi Pria 85 Convertible Car Seat,$138.59,$34.46,Color: Black,Gender: Unisex,N/A
https://www.ebay.com/p/1692084218?iid=293277755824&var=592139940888&rt=nc,Baby Safety Car Seat 2 in 1 Toddler Booster Kids Travel Chair Kid Sport Highback,$45.49 to $75.99,Free,Brand: Evenflo,Color: Pink,Theme: Sports
https://www.ebay.com/itm/Mifold-Grab-and-Go-Car-Booster-Seat-Color-Blue-Brand-NEW-In-Box/123911190640?hash=item1cd9aeb870:g:y~IAAOSw6B1dgq-U,"Mifold Grab-and-Go Car Booster Seat, Color Blue -Brand NEW In Box",$17.90,$14.20,Brand: mifold,Color: Blue,Gender: Unisex
https://www.ebay.com/p/500878633?iid=123342729640&rt=nc,KidsEmbrace Fun Ride Backless Booster - Wonder Woman Brand New! Free Shipping!!,$29.99,Free,Brand: KidsEmbrace,Color: Blue,Theme: Superheroes
https://www.ebay.com/p/2255344624?iid=392383068471&rt=nc,"Graco Affix Youth Booster Seat with Latch System, Atomic",$83.99,Free,Brand: Graco,Color: Black,Features: Cup Holder
https://www.ebay.com/itm/57-in-Tall-Graco-Affix-Highback-Booster-Car-Seat-Baby-Toddler-Travel-Safety-Red/143184253055?hash=item215672507f:g:S5oAAOSwmPFcbPCl,57 in Tall Graco Affix Highback Booster Car Seat Baby Toddler Travel Safety Red,$69.99,$9.99,Brand: Graco,Color: Red,Gender: Unisex
https://www.ebay.com/c/1883792933,"Britax S05322100 Frontier ClickTight Harness-2-Booster Car Seat Cover Set, Vibe",$55.01,Free,Color: Black,Gender: Boys,N/A
https://www.ebay.com/c/14017272102,"Cosco Rise Booster Car Seat safety kids, Island Tide ***NEW in BOX",$25.00,Free,Brand: Cosco,Color: Blue,Finish: Waxed
https://www.ebay.com/itm/Finale-Booster-Car-Seat-2-1-Xtra-Highback-5-Point-Harness-Kids-Safety-Travel/352732527663?hash=item52207f3c2f:g:cPMAAOSwprpdOkf0,Finale Booster Car Seat 2 1 Xtra Highback 5 Point Harness Kids Safety Travel ,$62.79,Free,Brand: Unbranded,N/A,N/A
https://www.ebay.com/p/7016056929?iid=223706092310&rt=nc,BubbleBum Inflatable Backless Booster Car Seat in Black - Brand New!,$22.00,Free,Brand: BubbleBum,Color: Black,Features: Inflatable
https://www.ebay.com/itm/Asiento-elevador-para-automovil-KidsEmbrace-sin-respaldo-Marvel-Spider-Man-fa/333190802582?hash=item4d93b82c96:g:4dEAAOSwpUVc1Yl9,"Asiento elevador para automóvil KidsEmbrace, sin respaldo, Marvel Spider-Man, fa",$49.95,Free,Brand: Unbranded,N/A,N/A
https://www.ebay.com/p/219504229?iid=382341922806&rt=nc,Britax Frontier ClickTight G1.1 Booster Car Seat Vibe Brand New!! Free Ship,$279.99,Free,Color: Black,Gender: Unisex,N/A
https://www.ebay.com/itm/Graco-TurboBooster-Backless-Car-Seat-Dinorama/383014401277?hash=item592d6ff4fd:g:V4oAAOSw-ZBdCnIg,"Graco TurboBooster Backless Car Seat, Dinorama",$29.20,Free,Brand: Graco,N/A,N/A
https://www.ebay.com/p/906848289?iid=352830757206&rt=nc,BubbleBum Inflatable Backless Booster Car Seat - Stars & Stripes,$27.85,Free,Brand: BubbleBum,Color: Gray,Features: Inflatable
https://www.ebay.com/itm/Diono-32102-Solana-2-Growing-No-Back-Child-Booster-Seat-120-lbs-Capacity-Pink/283613917897?hash=item4208b4f2c9:g:6PMAAOSwOqpdfFXM,Diono 32102 Solana 2  Growing No Back Child Booster Seat 120 lbs Capacity Pink,$40.42,Free,Brand: diono,Color: Pink,N/A
https://www.ebay.com/p/1455446123?iid=293222455397&rt=nc,"KidsEmbrace Spider-Man Booster Car Seat, Marvel Youth Backless Red  ",$89.97,Free,Brand: KidsEmbrace,Color: Red,Theme: Superheroes
https://www.ebay.com/c/22010094780,"Graco TurboBooster LX High Back Car Seat, Matrix Latch System Safety 3DAYSHIP",$72.53,Free,Brand: Graco,N/A,N/A
https://www.ebay.com/p/1692084218?iid=163574451276&rt=nc,Baby Safety Car Seat 2 in 1 Toddler Booster Kids Travel Chair Kid Sport Highback,$114.54,Free,Brand: Evenflo,Color: Pink,Theme: Sports
https://www.ebay.com/p/4027048701?iid=392430583084&rt=nc,Mifold MF01-US/GRY Grab-and-Go Car Booster Seat (Slate Grey),$27.58,Free,Brand: mifold,Color: Gray,Finish: Limed
https://www.ebay.com/p/9008020531?iid=233306828500&rt=nc,"BubbleBum Backless Booster Car Seat, Twin Stars & Stripes Bundle",$53.98,Free,Brand: BubbleBum,Color: Gray,Features: Inflatable
https://www.ebay.com/p/1886815542?iid=264430013720&rt=nc,New Pink Baby High Back Booster Car Seat Girl Child Toddler Safety Vehicle Chair,$89.99,Free,Brand: Baby Trend,Color: Pink,Finish: High Polish
https://www.ebay.com/itm/Harmony-Juvenile-Youth-Booster-Seat-Camo-Removeable-slip-cover-30-100-pds/401778281161?hash=item5d8bda0ac9:g:aTEAAOSwzgdc8n0A, Harmony Juvenile  Youth Booster Seat Camo Removeable slip cover 30-100 pds,$15.10,$11.95,Brand: Harmony,Features: Removable Washable Cover,Gender: Unisex
https://www.ebay.com/c/224724370,Graco Baby Nautilus 65 LX 3-in-1 Harness Booster Car Seat Child Safety Pierce,$179.99,Free,Brand: Graco,Gender: Unisex,N/A
https://www.ebay.com/p/2254418992?iid=312777381205&rt=nc,Safety Travel Backless Booster Car Seat Nickelodeon Teenage Mutant Ninja Turtles,$35.41,Free,Brand: KidsEmbrace,Color: Green,Gender: Unisex
https://www.ebay.com/itm/Mifold-Grab-and-Go-Car-Booster-Seat-Gray-Red-MF01-US-Folding-Compact-Travel/233315284888?hash=item3652acb798:g:qoMAAOSwpIJdV221,Mifold Grab and Go Car Booster Seat Gray Red MF01-US Folding Compact Travel,$17.50,$7.99,Brand: mifold,Color: Gray,N/A
https://www.ebay.com/c/1580838319,Safety 1st Grow and Go EX Air 3-in-1 Convertible Car Seat in Storm 2,$138.59,$33.50,Gender: Unisex,N/A,N/A
https://www.ebay.com/itm/Baby-Safety-Convertible-Car-Seat-2in1-Toddler-Kids-Travel-Chair-Booster-Highback/293268364957?hash=item4448281e9d:g:kIYAAOSwfW5dnGxi,Baby Safety Convertible Car Seat 2in1 Toddler Kids Travel Chair Booster Highback,$56.51,Free,Brand: Disney,Color: Multicolor,N/A
https://www.ebay.com/itm/2-in-1-Booster-Car-Seat-Dual-Modes-Kids-Secure-Travel-Lightweight-Realtree-Xtra/193164538505?hash=item2cf980f289:g:CIYAAOSw5K5dqd87,2-in-1 Booster Car Seat Dual Modes Kids Secure Travel Lightweight Realtree Xtra,$54.65,Free,Brand: Unbranded,Gender: Unisex,N/A
https://www.ebay.com/p/2274081202?iid=133065141072&rt=nc,Baby Convertible Car Seat Booster 2in1 Toddler Highback Safety Travel Girl Chair,$52.87,Free,Brand: Cosco,Color: Pink,Finish: Aniline
https://www.ebay.com/p/219476106?iid=173550877679&rt=nc,Graco High Back Booster Car Seat Kid Child Baby Toddler Chair Backless Green,$59.99,Free,Brand: Graco,Color: Green,Gender: Unisex
https://www.ebay.com/itm/Cosco-Finale-2-in-1-Highback-Booster-Car-Seat-5-Point-Harness-Multiple-Colors/312783305252?hash=item48d3567a24:m:mohVbZWw4x3xLdrmoZ9EIoQ&var=611512664373,"Cosco Finale 2-in-1 Highback Booster Car Seat, 5 Point Harness, Multiple Colors",$54.40,Free,Brand: Cosco,Gender: Unisex,N/A
https://www.ebay.com/itm/Hugaboo-Infant-Sitting-Chair-Snuggle-Buns-Blue-Green-3-11-Months-NEW-Baby-GIFT/143354615608?hash=item216099d738:g:VnIAAOSwSwVdUffx,"Hugaboo Infant Sitting Chair, Snuggle Buns/Blue/Green, 3-11 Months NEW Baby GIFT",$42.79,Free,Color: Green,Gender: Boys,N/A
https://www.ebay.com/p/10018598504?iid=293143865600&rt=nc,BABY TREND - Secure Snap Gear 35 Infant Car Seat  Base  Model #  CS66B19B   ,$49.99,Free,Brand: Baby Trend,Color: Blue,N/A
https://www.ebay.com/p/15028315168?iid=153686751764&rt=nc,BubbleBum BB0004-W2 Travel Booster Car Seat - Black,$29.99,Free,Brand: BubbleBum,Color: Black,Gender: Unisex
https://www.ebay.com/p/2255204836?iid=174031830408&rt=nc,"BubbleBum Inflatable Backless Booster Car Seat, Pink Chevron - NEW in Open Box",$21.89,Free,Brand: BubbleBum,Color: Pink,Features: Inflatable
https://www.ebay.com/itm/Used-Britax-Marathon-car-seats-2-of-them-one-blue-other-light-brown/163907262581?hash=item2629a25875:g:VAgAAOSwkfRdpoat,Used Britax Marathon car seats . 2 of them one blue other light brown,$100.00,$16.59,Color: Blue,N/A,N/A
https://www.ebay.com/p/19033926709?iid=254336481757&rt=nc,BubbleBum Inflatable Backless Booster Car Seat - Irish Shamrock,$24.99,Free,Brand: BubbleBum,Features: Inflatable,N/A
https://www.ebay.com/p/28027051361?iid=303281039735&rt=nc,"mifold grab-and-go car booster seat, Slate Grey MFG 2018/10/12",$26.05,Free,Brand: mifold,Color: Gray,Theme: Vehicles
https://www.ebay.com/c/14017272102,Cosco Rise Booster Car Seat Safety Kids Island Tide,$21.83,Free,Brand: Cosco,Color: Blue,Finish: Waxed
https://www.ebay.com/p/10009470963?iid=283583876433&rt=nc,Cosco Topside Backless Booster Car Seat (Leo) - Preowned,$19.99,Free,Color: Black,Finish: Matte,Theme: Beach & Tropical
https://www.ebay.com/itm/Harmony-Youth-Booster-Car-Seat-30-100-Pound-Child-Boy-Camouflage-Removable-Cover/143111129161?hash=item2152168849:g:fRIAAOSws7VcUz7Z,Harmony Youth Booster Car Seat 30-100 Pound Child Boy Camouflage Removable Cover,$19.99,$23.90,Brand: Harmony,Gender: Boys,N/A
https://www.ebay.com/p/182494427?iid=183994032733&rt=nc,"Graco Backless TurboBooster Car Seat, Galaxy - Free Shipping",$21.49,Free,Brand: Graco,N/A,N/A
https://www.ebay.com/itm/Chicco-MyFit-Zip-Air-Harness-Booster-Car-Seat-Atmos-Free-Shipping/143429147931?hash=item21650b1d1b:g:iGgAAOSw0eNdSvmM,Chicco MyFit Zip Air Harness + Booster Car Seat - Atmos Free Shipping,$299.99,Free,Brand: Chicco,Color: Multicolor,Features: LATCH Compatible
https://www.ebay.com/p/13031088953?iid=401758282710&rt=nc,Baby Convertible Safety Car Seat 2in1 Kids Chair Toddler Highback Booster Travel,$51.68,Free,Brand: Cosco,Color: Blue,Theme: Vehicles
https://www.ebay.com/itm/Graco-Backless-Turbobooster-Tansy/383022277488?hash=item592de82370:g:phIAAOSweX1dEP88,"Graco Backless Turbobooster, Tansy",$26.59,Free,Brand: Graco,N/A,N/A
https://www.ebay.com/p/3014409745?iid=183561399970&rt=nc,"Graco TurboBooster TakeAlong Highback Booster, Lark",$34.64,$22.76,Brand: Graco,Color: Black,Gender: Unisex
https://www.ebay.com/c/224679352,"Evenflo Maestro Booster Car Seat, Taylor with Car Seat Kick Mat with Storage ...",$99.00,Free,Brand: Evenflo,Color: Black,Gender: Unisex
https://www.ebay.com/p/224730734?iid=283564173126&rt=nc,Graco TurboBooster LX Booster Car Seat - Matrix,$60.00,Free,Brand: Graco,Features: Inflatable,Gender: Unisex
https://www.ebay.com/itm/New-Evenflo-Gray-High-Back-Booster-Car-Seat-Boy-Toddler-Kid-Baby-Vehicle-Chair/264490055173?hash=item3d94d5f605:g:MJMAAOSwrW5cpq~A,New Evenflo Gray High Back Booster Car Seat Boy Toddler Kid Baby Vehicle Chair,$47.88,Free,Brand: Evenflo,Color: Gray,Theme: Vehicles
https://www.ebay.com/itm/Mifold-Grab-and-Go-Car-Booster-Seat-Pink-Compact-Small-Portable-On-The-Go-Safety/264462771099?hash=item3d9335a39b:g:GDMAAOSwQaBdelO2,Mifold Grab-and-Go Car Booster Seat Pink Compact Small Portable On The Go Safety,$14.00,$8.30,Brand: mifold,Color: Pink,Gender: Unisex
