URL,Title,Price,Shipping,Dynamic Attribute 1,Dynamic Attribute 2,Dynamic Attribute 3
https://www.ebay.com/itm/Boppy-gray-infant-neck-support-insert-for-car-seat-NEW/223649500945?hash=item34128c8f11:g:vbAAAOSwNCRdREwL,Boppy gray infant neck support insert for car seat - NEW,$4.25,$5.95,Brand: Boppy,Color: Gray,Gender: Unisex
https://www.ebay.com/itm/Boppy-Way-to-Go-Head-Support-Grey-Minky-Neck-Ring-infant/183987529203?hash=item2ad682e5f3:g:r5QAAOSw5wVdnOhs,Boppy Way to Go Head Support Grey/ Minky Neck Ring infant,$5.00,$5.30,Brand: Boppy,Color: Gray,N/A
https://www.ebay.com/itm/Original-Baby-Elephant-Ears-Head-Support-Pillow-Free-Shipping/254357235173?hash=item3b38df65e5:g:mUgAAOSwHWtcwMnu,Original Baby Elephant Ears Head Support Pillow Free Shipping,$10.50,Free,Color: Blue,Gender: Unisex,N/A
https://www.ebay.com/itm/Diono-Radian-RXT-Infant-Head-Pillow-and-Body-Support-Gray/174087296985?hash=item28886957d9:g:rDAAAOSwPW9dwdq8,"Diono Radian RXT Infant Head Pillow and Body Support, Gray",$3.90,$14.20,Brand: diono,Color: Gray,N/A
https://www.ebay.com/itm/Boppy-Noggin-Nest-Head-Support-for-Infants-Brown-Wheels/113858125620?hash=item1a82791f34:g:iMEAAOSw-mtdWcJz,Boppy Noggin Nest Head Support for Infants Brown Wheels,$6.00,Free,Brand: Boppy,Color: Brown,Gender: Unisex
https://www.ebay.com/itm/Boppy-Head-and-Neck-Support-Black-and-White-Multi-use/333333756417?hash=item4d9c3d7a01:g:KUEAAOSwrXVdb~gB,Boppy Head and Neck Support Black and White Multi use ,$1.30,$4.57,Brand: Boppy,Color: White,N/A
https://www.ebay.com/itm/NIP-Boppy-Noggin-Nest-Head-Support-Pillow-Elephant-Gray/183943106910?hash=item2ad3dd115e:g:COUAAOSwb1ldcp81,NIP Boppy Noggin Nest Head Support Pillow Elephant Gray,$3.40,$5.19,Brand: Boppy,Color: Gray,N/A
https://www.ebay.com/p/2254305604?iid=254356024888&rt=nc,Summer Infant Snuzzler Head Support for Car Seats and Strollers,$0.99,$6.27,Brand: Summer Infant,Color: Pink,Theme: Sports
https://www.ebay.com/itm/Boppy-Infant-Toddler-Carseat-Head-Neck-Support-Reversible-Fabric-gray-EUC/303249627216?hash=item469b161850:g:f5UAAOSw4DJdMkD3,Boppy Infant & Toddler Carseat Head Neck Support Reversible Fabric gray EUC,$4.99,$6.99,Brand: Boppy,Color: Gray,N/A
https://www.ebay.com/itm/Boppy-Noggin-Nest-Head-Support-Baby-Pillow/153667185383?hash=item23c7472ae7:g:NMIAAOSwdjtdd8fr,Boppy Noggin Nest Head Support Baby Pillow ,$6.00,$3.20,Brand: Boppy,Color: Gray,Gender: Unisex
https://www.ebay.com/c/1636531054,Boppy noggin nest head support,$10.00,$4.39,Brand: Boppy,Color: Gray,Gender: Unisex
https://www.ebay.com/itm/Summer-Infant-Snuzzler-Head-Support-for-Car-Seats-Strollers-White-Black-Unisex/333329167175?hash=item4d9bf77347:g:6kwAAOSwk-pdYEcQ,Summer Infant Snuzzler Head Support for Car Seats Strollers White/Black. Unisex,$4.50,$5.78,Brand: Summer Infant,Color: White,Gender: Unisex
https://www.ebay.com/itm/Boppy-Infant-Head-Support-Grey-Reversible/163824229223?hash=item2624af5b67:g:MeMAAOSwH2ldRy-s,Boppy Infant Head Support Grey Reversible,$1.75,$5.35,Brand: Boppy,Color: Gray,N/A
https://www.ebay.com/itm/Goldbug-Head-Support-for-Baby-for-strollers-bouncers-carseats-B1532-Used/174033031105?hash=item28852d4fc1:g:7kEAAOSwTy1c~XUV,Goldbug Head Support for Baby for strollers bouncers carseats (B1532) Used,$0.99,$5.93,Brand: Goldbug,Color: White,Gender: Unisex
https://www.ebay.com/itm/Eddie-Bauer-Baby-Duo-Head-Support-For-Car-seat-Carrier-Stroller/283613822901?hash=item4208b37fb5:g:VHIAAOSwqUddcvRg,"Eddie Bauer Baby Duo Head Support For Car seat, Carrier, Stroller",$4.00,$4.57,Brand: Eddie Bauer,Color: Gray,Gender: Unisex
https://www.ebay.com/p/2131922493?iid=133205584430&rt=nc,"NEW Summer Infant Snuzzler Support for Car Seats and Strollers, Ivory ",$13.50,Free,Brand: Summer Infant,Gender: Unisex,N/A
https://www.ebay.com/itm/giant-elephant-Ears-Pillow/113853401072?hash=item1a823107f0:g:rdUAAOSw2MBdStxX,giant elephant Ears Pillow,$0.99,$8.00,N/A,N/A,N/A
https://www.ebay.com/itm/Boppy-Head-Neck-Support-Reversible-Unisex-New-In-Package-Infant-to-Toddler/293313484675?hash=item444ad89783:g:nPAAAOSwlFFdwHoe,Boppy Head & Neck Support Reversible Unisex New In Package Infant to Toddler,$8.80,$4.53,Brand: Boppy,Color: Pink,Gender: Unisex
https://www.ebay.com/itm/Baby-Infant-Hugger-Head-Support-Car-Seat-Stroller-Pillow-Neck-newborn-Safety-new/113923139132?hash=item1a8659263c:g:1rsAAOSw4wZdo7xc,Baby Infant Hugger Head Support Car Seat Stroller Pillow Neck newborn Safety new,$22.95,Free,Gender: Girls,N/A,N/A
https://www.ebay.com/itm/Summer-Infant-Snuzzler-Infant-Support-for-Car-Seats-and-Strollers-Yellow/193156540023?hash=item2cf906e677:g:ZSsAAOSwDLhdV3mf,"Summer Infant Snuzzler Infant Support for Car Seats and Strollers, Yellow",$3.14,$5.30,Brand: Summer Infant,Color: Yellow,Gender: Unisex
https://www.ebay.com/itm/Hudson-Baby-Girl-Travel-Neck-Support-Pillow-Miss-Fox/163901492124?hash=item26294a4b9c:g:oBQAAOSwKAFdoBzM,"Hudson Baby Girl Travel Neck Support Pillow, Miss Fox",$10.99,Free,Gender: Girls,N/A,N/A
https://www.ebay.com/itm/Baby-Head-Support-Car-Seat-Stroller-Infant-Pillow-Neck-Travel-Safety-Body-Colors/392245395593?hash=item5b53a5c089:m:mvq6sX9sktQbckaKIEHwxHQ&var=661198579747,Baby Head Support Car Seat Stroller Infant Pillow Neck Travel Safety Body Colors,$15.95 to $17.01,Free,Brand: Summer Infant,Color: Pink,Gender: Unisex
https://www.ebay.com/itm/Grey-Eddie-Bauer-Baby-Duo-Head-Support-For-Car-seat-Carrier-Stroller-Used/223720708345?hash=item3416cb18f9:g:qBMAAOSwetBde7rb,"Grey Eddie Bauer Baby Duo Head Support For Car seat, Carrier, Stroller - Used",$5.50,$4.00,Brand: Eddie Bauer,Color: Gray,Gender: Unisex
https://www.ebay.com/itm/Chicco-Baby-Universal-3-in-1-Full-Body-Support-New-in-package/183928044209?hash=item2ad2f73ab1:g:YyQAAOSw~6Fco-1D,Chicco Baby Universal 3 in 1 Full Body Support New in package,$9.00,$10.00,Brand: Chicco,Color: Gray,N/A
https://www.ebay.com/itm/Infant-and-Toddler-Head-Support-Pram/383134871908?hash=item59349e3164:m:mwBDjbnYW4XrREq17-iB2Pw&var=651695475105,Infant and Toddler Head Support Pram,$10.00,Free,Brand: Handmade,Gender: Unisex,N/A
https://www.ebay.com/itm/Hudson-Baby-Baby-neck-support-Pillow/163665045085?hash=item261b32665d:g:26QAAOSwNSdcbddh,Hudson Baby  Baby neck support Pillow,$8.99,Free,Color: Brown,Gender: Unisex,N/A
https://www.ebay.com/p/691361747?iid=223673653189&rt=nc,PINK JJ Cole Duel Layers Cotton Car Seat Head Support Newborn Infant - Used,$2.99,$4.00,Color: Pink,Theme: Garden,Gender: Girls
https://www.ebay.com/itm/Snuzzler-by-Kiddopotamus-Baby-Head-and-Body-Support-Ivory-New-in-Package/173994929108?hash=item2882e7ebd4:g:4BIAAOSwBHJdUbE6,"""Snuzzler by Kiddopotamus"" Baby Head and Body Support  Ivory New in Package",$11.50,Free,Brand: Kiddopotamus,Gender: Unisex,N/A
https://www.ebay.com/p/5010472362?iid=392399735367&rt=nc,"Boppy Noggin Nest Head Support, Gray Elephants, Head Support for Infants",$7.50,$4.44,Brand: Boppy,Color: Gray,Theme: Novelty
https://www.ebay.com/itm/PINK-JJ-Cole-Duel-Layers-Cotton-Car-Seat-Head-Support-Newborn-Infant-Adjustable/264476997224?hash=item3d940eb668:g:SM4AAOSw7d5dVyB9,PINK JJ Cole Duel Layers Cotton Car Seat Head Support Newborn Infant Adjustable,$5.00,$4.81,Color: Pink,N/A,N/A
https://www.ebay.com/c/1400012654,Winnie the Pooh Plush Infant Head Support and Strap Cover Set Pooh And Piglet,$25.00,$7.85,Brand: Disney,Color: Gold,Gender: Unisex
https://www.ebay.com/itm/Baby-Travel-Pillow-Cushion-Head-Neck-Support-for-Car-Seat-Stroller/153638173971?hash=item23c58c7d13:m:m-hobiNavhvCU6sy9Ze6gOg&var=453659656426,Baby Travel Pillow Cushion Head Neck Support for Car Seat & Stroller,$6.88 to $6.94,Free,Brand: Unbranded,N/A,N/A
https://www.ebay.com/itm/Summer-Infant-Snuzzler-Head-and-Body-Support-for-Carseats-Ivory/293134402354?hash=item44402c0332:g:w~cAAOSwY85dFG2U,Summer Infant Snuzzler Head and Body Support for Carseats - Ivory,$9.99,Free,Brand: Summer Infant,N/A,N/A
https://www.ebay.com/itm/Baby-Neck-Support-Pillow-Infant-Travel-Head-Pillow-for-Car-Seat-Pushchair/142912860296?hash=item2146453088:g:cOkAAOSwqo5bfJzw,"Baby Neck Support Pillow Infant Travel Head Pillow for Car Seat, Pushchair",$11.21,Free,Brand: Unbranded,Color: White,Gender: Unisex
https://www.ebay.com/itm/Baby-Neck-Support-Pillow-Infant-Head-Protection-U-Shape-Headrest-Travel-Pillow/113797020094?hash=item1a7ed4b9be:m:m3EHffwT-bSm6FnfOsl_k4A&var=413971231493,Baby Neck Support Pillow Infant Head Protection U Shape Headrest Travel Pillow,$4.99,Free,Brand: Unbranded,N/A,N/A
https://www.ebay.com/itm/Breathable-Baby-Head-Neck-Support-Travel-Safety-Pillow-Stroller-Head-Support/183832479413?hash=item2acd4506b5:g:NqgAAOSwaDtc8kqt,Breathable Baby Head Neck Support Travel Safety Pillow Stroller Head Support,$4.86,Free,Brand: Unbranded,Gender: Unisex,N/A
https://www.ebay.com/p/20027577630?iid=254343145870&rt=nc,Used Good Condition Boppy Noggin Nest Head Support,$5.60,$4.57,Brand: Boppy,Color: Gray,Gender: Unisex
https://www.ebay.com/itm/The-Original-Snuzzler-By-Summer/113896602741?hash=item1a84c43c75:g:MBQAAOSwqSRdWKP6,The Original Snuzzler By Summer,$5.00,$5.00,N/A,N/A,N/A
https://www.ebay.com/itm/Summer-Infant-Toddler-Kids-Baby-Car-Seat-Cradler-Head-Support-Protection-Q/123512383342?hash=item1cc1e9676e:m:mvi51gxupkfWWASsMS4GhWA&var=424063253636,Summer Infant Toddler/Kids/Baby Car Seat Cradler Head Support Protection Q,$7.56 to $7.95,Free,Brand: Unbranded,Color: White,Gender: Unisex
https://www.ebay.com/itm/Eddie-Bauer-Baby-2-in-1-Head-Support-for-Car-Seats-Strollers-Bouncers/274002531101?hash=item3fcbd2d31d:g:cFwAAOSwhnZdd5NZ,"Eddie Bauer Baby 2-in-1 Head Support for Car Seats, Strollers, Bouncers",$0.99,$5.99,Brand: Eddie Bauer,Color: Gray,Gender: Unisex
https://www.ebay.com/itm/Boppy-Noggin-Nest-Head-Support-For-0-4-Months-Elephant-Pattern/163849543050?hash=item2626319d8a:g:WWwAAOSwQTNdcZ5S,Boppy Noggin Nest Head Support For 0-4 Months Elephant Pattern,$12.00,Free,Brand: Boppy,N/A,N/A
https://www.ebay.com/itm/summer-infant-snuzzler-Unisex-Black-And-White/123879902374?hash=item1cd7d14ca6:g:3igAAOSwkJxdWweu,summer infant snuzzler Unisex Black And White,$13.00,Free,Brand: Summer Infant,Color: White,Gender: Unisex
https://www.ebay.com/itm/Zobo-Infant-Head-Support-Cushion-Pink-And-White-2-Pieces/264498851931?hash=item3d955c305b:g:1YIAAOSwI3JddrSO,Zobo Infant Head Support Cushion Pink And White 2 Pieces.,$1.00,$4.81,Brand: Zobo,Color: Gray,Gender: Unisex
https://www.ebay.com/itm/Boppy-Baby-Infant-0-months-Head-Neck-Support-Pillow-Combo-Gray-Unisex/183977044638?hash=item2ad5e2ea9e:g:poAAAOSw3H1dkgML,Boppy Baby Infant 0+ months Head & Neck Support Pillow Combo Gray Unisex,$21.99,Free,Brand: Boppy,Color: Gray,Gender: Unisex
https://www.ebay.com/p/5018482341?iid=303266354314&rt=nc,GO by Goldbug Southwest Duo Head Support,$12.99,$7.88,Brand: Goldbug,Color: White,Gender: Unisex
https://www.ebay.com/c/21031248064,"Original Baby Elephant Ears Head Support Pillow for Stroller, Swing, Bouncer New",$11.44,$5.30,Gender: Unisex,N/A,N/A
https://www.ebay.com/itm/Original-Baby-Elephant-Ears-Infant-Head-Support-Pillow-Blue-Arrows/184020391157?hash=item2ad87854f5:g:5qUAAOSwLtZdvkrz,Original Baby Elephant Ears Infant Head Support Pillow Blue Arrows,$8.95,$3.45,Color: Blue,Gender: Unisex,N/A
https://www.ebay.com/itm/Baby-Elephant-Ears-Pillow-head-support/283610317135?hash=item42087e014f:g:GOYAAOSwPvVcpST5,Baby Elephant Ears Pillow head support,$6.50,$4.39,Color: Blue,Gender: Unisex,N/A
https://www.ebay.com/itm/US-Infant-Baby-Sleep-Pillow-Car-Seat-Pillow-Travel-Soft-Breathable-Head-Support/392195945157?hash=item5b50b332c5:m:mSgY8wrR_Me0XZqEPckeFbw&var=661131290968,US Infant Baby Sleep Pillow Car Seat Pillow Travel Soft Breathable Head Support,$7.99,$1.99,Brand: Unbranded,Color: Blue,Gender: Unisex
https://www.ebay.com/p/16024772155?iid=312743245467&rt=nc,Original Baby Elephant Ears Head Support Pillow for Stroller Or Carseat,$6.00,$4.39,Color: Blue,Gender: Unisex,N/A
https://www.ebay.com/itm/Summer-Infant-Snuzzler-Head-and-Body-Support-Car-Seat-Stroller-White/133135788481?hash=item1eff82e9c1:g:d48AAOSwiR5c~xQY,Summer Infant Snuzzler Head and Body Support | Car Seat ● Stroller | White,$9.99,$8.30,Brand: Summer Infant,Color: White,N/A
https://www.ebay.com/itm/Blue-Gray-Baby-Car-Seat-Head-Support-Pillow-by-JJCole/264395314917?hash=item3d8f3056e5:g:MasAAOSwRFldJ8F6,Blue & Gray Baby Car Seat Head Support Pillow by JJCole💺,$5.00,$5.00,Color: Gray,Gender: Boys,N/A
https://www.ebay.com/itm/summer-infant-snuzzler-Head-And-Body-Support/143376365345?hash=item2161e5b721:g:Gd4AAOSwdoldc7jX,summer infant snuzzler Head And Body Support,$5.00,$6.27,Brand: Summer Infant,N/A,N/A
https://www.ebay.com/itm/Eddie-Bauer-Baby-Duo-Head-Support-Strap-Covers-For-Car-seat-Carrier-Stroller/233321122938?hash=item365305cc7a:g:-hgAAOSwz9BdYFfb,"Eddie Bauer Baby Duo Head Support & Strap Covers For Car seat, Carrier, Stroller",$11.25,Free,Brand: Eddie Bauer,Color: Gray,Gender: Unisex
https://www.ebay.com/c/13009935789,Trunki Yondi HEAD and NECK SUPPORT 2+,$15.97,Free,Color: Green,N/A,N/A
https://www.ebay.com/itm/Go-by-Goldbug-Monkey-Adjustable-Car-Seat-Head-Support/223630388197?hash=item341168ebe5:g:4~sAAOSwPWNdXDcY,Go by Goldbug Monkey Adjustable Car Seat Head Support,$9.00,$4.53,Brand: Goldbug,Color: Brown,Theme: Jungle
https://www.ebay.com/itm/Goldbug-Infant-Carsest-Head-Support-Baby-Girl-Pink-Gray-2-Piece/133142759246?hash=item1effed474e:g:VbIAAOSwDwJdVCz8,Goldbug Infant Carsest Head Support Baby Girl Pink Gray 2 Piece,$5.99,$5.35,Brand: Goldbug,Color: Gray,Gender: Girls
https://www.ebay.com/p/5010472362?iid=113870558034&rt=nc,"Boppy Noggin Nest Head Support, Gray/Mint Elephants, Head Support for Infants ",$4.44,$4.53,Brand: Boppy,Color: Gray,Theme: Novelty
https://www.ebay.com/itm/Boppy-Noggin-Nest-Head-Support-Gray-Design-Head-Support-for-Infants/223670469046?hash=item3413cc81b6:g:bgIAAOSwBDtdWKph,"Boppy Noggin Nest Head Support, Gray Design Head Support for Infants",$8.00,$4.57,Brand: Boppy,Color: Gray,Gender: Unisex
https://www.ebay.com/p/710081613?iid=123891110564&rt=nc,"JJ Cole Collection Infant Baby Head Support, Graphite, Car Seat Stroller Pillow",$20.20,Free,Color: Gray,Gender: Unisex,N/A
https://www.ebay.com/p/710163780?iid=293222455455&rt=nc,"Summer Snuzzler Infant Support for Car Seats and Strollers, Ivory ",$13.88,Free,Brand: Summer Infant,Gender: Unisex,N/A
https://www.ebay.com/itm/Boppy-Noggin-Nest-Head-Support/283560235272?hash=item420581d108:g:2CAAAOSwbTBdOhKx,Boppy Noggin Nest Head Support. ,$8.00,$4.49,Brand: Boppy,Color: Pink,Gender: Girls
https://www.ebay.com/itm/GO-by-Goldbug-Southwest-Car-Seat-Head-Support-1-Piece/113789368198?hash=item1a7e5ff786:g:R~cAAOSwGM5dCZgO,GO by Goldbug Southwest Car Seat Head Support - 1 Piece,$9.99,Free,Brand: Goldbug,Gender: Unisex,N/A
https://www.ebay.com/itm/Boppy-Infant-Toddler-Carseat-Head-Neck-Support-Reversible-Fabric-gray-EUC/233365656737?hash=item3655ad54a1:g:pu0AAOSwTaFdQxEJ,Boppy Infant & Toddler Carseat Head Neck Support Reversible Fabric gray EUC,$8.00,$5.00,Brand: Boppy,Color: Gray,N/A
https://www.ebay.com/itm/JJ-Cole-Head-Support-Infant-Baby-Multistage-Pink-Gray-Car-Seat-Stroller-New/333258288647?hash=item4d97bdee07:g:zisAAOSwhAJci9vF,JJ Cole Head Support Infant Baby Multistage Pink Gray Car Seat Stroller New,$9.56,$7.85,Color: Gray,Gender: Girls,N/A
https://www.ebay.com/p/2254606153?iid=223649474974&rt=nc,Summer Infant Cradler Head Support,$11.99,Free,Color: Pink,Theme: Sports,Gender: Girls
https://www.ebay.com/itm/Boppy-Baby-Girls-Pink-Noggin-Nest-Head-Rest-Support-Pillow-Cradle-Car-Seat/223472882308?hash=item3408059284:g:NswAAOSwhyZcewGP,Boppy Baby Girls Pink Noggin Nest Head Rest Support Pillow Cradle Car Seat,$10.00,$4.06,Brand: Boppy,Color: Pink,Gender: Girls
https://www.ebay.com/itm/wJJ-Cole-Infant-Car-Seat-Head-Support-Teal-and-Gray-NEW/183954078262?hash=item2ad4847a36:g:ZxMAAOSwNIBdfB9B,wJJ Cole Infant Car Seat Head Support Teal and Gray NEW,$12.95,$7.90,Color: Gray,Gender: Unisex,N/A
https://www.ebay.com/itm/Summer-Infant-Snuzzler-Head-and-Body-Support-for-Carseats-Ivory/163846583028?hash=item26260472f4:g:aekAAOSwzt1dbxdc,Summer Infant Snuzzler Head and Body Support for Carseats - Ivory,$11.99,Free,Brand: Summer Infant,N/A,N/A
https://www.ebay.com/itm/Newborns-Head-Neck-Support-U-Shape-Travel-Pillow-for-Carseat-Stroller-rabbit/143389373813?hash=item2162ac3575:g:IhUAAOSwpZZdhX9M,Newborns Head Neck Support-U Shape Travel Pillow for Carseat Stroller rabbit,$11.65,Free,Brand: Unbranded,Color: White,Gender: Unisex
https://www.ebay.com/itm/Eddie-Bauer-Duo-Head-Support-Cushion-Pillow-for-Baby-Car-Seat-Stroller-Carrier/133060767278?hash=item1efb0a2e2e:g:USsAAOSwNGRc5dvJ,Eddie Bauer Duo Head Support Cushion Pillow for Baby Car Seat Stroller Carrier,$12.49,Free,Brand: Eddie Bauer,Color: Green,Gender: Unisex
https://www.ebay.com/p/2254305604?iid=174013558854&rt=nc,Baby Head Support Car Seat Infant Pillow Neck Stroller Safety Travel Safe Body,$14.98,Free,Brand: Summer Infant,Color: Pink,Theme: Sports
https://www.ebay.com/itm/Original-Baby-Elephant-Ears-Head-Support-Pillow-Choose-Pattern/123202975002?hash=item1caf78351a:m:m2MFF2l6rmSBdQ4O6ObcOOg&var=423613130342,Original Baby Elephant Ears Head Support Pillow ~ Choose Pattern,$24.00 to $32.00,Free,Gender: Unisex,N/A,N/A
https://www.ebay.com/itm/Babymoov-Lovenest-Pillow-PINK-Head-Pillow-Car-Seat-Rest-Support/333329305338?hash=item4d9bf98efa:g:mcgAAOSwgWddfCjC,Babymoov Lovenest Pillow PINK Head Pillow Car Seat Rest Support,$12.59,Free,Brand: Babymoov,Color: Pink,N/A
https://www.ebay.com/itm/Summer-Infant-Snuzzler-Head-and-Body-Support-for-Carseats-Ivory-Brand-New/202776546625?hash=item2f366c8d41:g:AlkAAOSwctNdeQVK,Summer Infant Snuzzler Head and Body Support for Carseats - Ivory Brand New,$8.99,$5.93,Brand: Summer Infant,Gender: Unisex,N/A
https://www.ebay.com/itm/Baby-Elephant-Ears-Arrows-The-Original-Comfy-Head-Support-for-Babies/362645729042?hash=item546f5eaf12:g:XsgAAOSwrX1c1gId,Baby Elephant Ears Arrows The Original Comfy Head Support for Babies,$15.83,Free,Color: Multicolor,Gender: Unisex,N/A
https://www.ebay.com/itm/Summer-Infant-Snuzzler-Head-and-Body-Support-Car-Seat-Stroller-White/223628931125?hash=item341152b035:g:CkAAAOSwzahdWuEb,Summer Infant Snuzzler Head and Body Support | Car Seat ● Stroller | White,$7.99,$5.93,Brand: Summer Infant,Color: White,N/A
https://www.ebay.com/itm/Babymoov-Lovenest-Pillow-Smokey-Head-Pillow-Car-Seat-Rest-Support/333329281354?hash=item4d9bf9314a:g:SPIAAOSwAVRdfCE~,Babymoov Lovenest Pillow Smokey  Head Pillow Car Seat Rest Support,$17.98,Free,Brand: Babymoov,Color: Gray,N/A
https://www.ebay.com/itm/Goldbug-Head-Support-for-Baby-for-strollers-bouncers-carseats/303278461650?hash=item469cce12d2:g:lZwAAOSweMJddYAY,Goldbug Head Support for Baby for strollers bouncers carseats,$15.00,Free,Brand: Goldbug,Color: White,Gender: Girls
https://www.ebay.com/p/8013585283?iid=233291676348&rt=nc,"BENBAT INFANT HEAD, NECK & BODY SUPPORT PILLOW, PINK *DISTRESSED PKG",$24.99,Free,Color: Pink,Theme: Holiday,Gender: Girls
https://www.ebay.com/itm/Diono-2-In-1-Head-Support-For-Children/401851493811?hash=item5d90372db3:g:pQIAAOSwnfFdWN13,Diono 2 In 1 Head Support For Children,$17.50,Free,Brand: diono,N/A,N/A
https://www.ebay.com/itm/Carters-Infant-Head-Support-for-Carseat-Stroller-Etc-Plush-Elephant-Gray/163867283709?hash=item26274050fd:g:yWUAAOSw9XhdgPN9,Carter's Infant Head Support for Carseat Stroller Etc - Plush Elephant - Gray,$12.90,$5.19,Color: Gray,Theme: Safari,Gender: Unisex
https://www.ebay.com/itm/Goldbug-Outer-Head-Neck-Support-Bumper-Strollers-Car-Seats-Bouncer-NIP/292756046767?hash=item44299ec3af:g:0Y8AAOSw8MZbtUW3,Goldbug Outer Head Neck Support  Bumper Strollers Car Seats & Bouncer NIP,$8.00,Free,N/A,N/A,N/A
https://www.ebay.com/itm/Baby-Sleep-Belt-Adjustable-Head-Support-Holder-Safety-Car-Seat-Kids-Nap-Aid-Band/222676542010?hash=item33d88e623a:m:m02GvkjwJZ_TYroYBIOiv4w&var=521530143545,Baby Sleep Belt Adjustable Head Support Holder Safety Car Seat Kids Nap Aid Band,$2.29,$0.59,Brand: Unbranded,Color: Blue,Theme: Novelty
https://www.ebay.com/itm/BABY-ELEPHANT-EARS-Original-Chiropractor-Inspired-Infant-Baby-Pillow-Headrest/113718746492?hash=item1a7a2a5d7c:g:MYAAAOSw1d9bb0Ic,BABY ELEPHANT EARS Original Chiropractor Inspired Infant Baby Pillow Headrest,$18.99,$3.74,Color: Brown,Gender: Unisex,N/A
https://www.ebay.com/itm/Carters-2-in-1-head-support-for-Newborn-use-with-stroller-or-baby-car-seat/223375620504?hash=item3402397998:g:Tq8AAOSw~7JcXRTD,Carter's 2-in-1 head support for Newborn use with stroller or baby car seat,$9.99,$5.66,Color: Gray,Gender: Unisex,N/A
https://www.ebay.com/p/16012046762?iid=323780617137&rt=nc,"Diono 2-in-1 Infant Head Support Pillow, Ivory",$13.77,$5.40,Brand: diono,Theme: Beach & Tropical,Gender: Unisex
https://www.ebay.com/itm/Maison-Chic-Infant-Baby-Alligator-plush-neck-pillow-Support-Car-Seat-Travel-EUC/192714024500?hash=item2cdea6a634:g:m4EAAOSwDJZb4NNJ,Maison Chic Infant Baby Alligator plush neck pillow Support Car Seat Travel EUC,$4.99,$5.00,Brand: Maison Chic,Color: Green,Gender: Unisex
https://www.ebay.com/p/1637215556?iid=323944302956&rt=nc,Eddie Bauer Infant Baby Animal Head Support Bear New In Box,$15.99,$4.39,Brand: Eddie Bauer,Color: White,Gender: Unisex
https://www.ebay.com/itm/Baby-Elephant-Ears-Head-Support-Pillow-Retro-Space-Pattern/174059907513?hash=item2886c769b9:g:WmAAAOSwAEhdnnqH,Baby Elephant Ears Head Support Pillow Retro Space Pattern,$12.00,Free,Color: Blue,N/A,N/A
https://www.ebay.com/p/2255406952?iid=223529130974&rt=nc,"Summer Infant Snuzzler Infant Support for Car Seats and Strollers, Ivory",$16.98,Free,Brand: Summer Infant,Gender: Unisex,N/A
https://www.ebay.com/itm/Diono-2-in-1-head-support-Baby-infant-soft-comfortable-gray/283593010047?hash=item420775eb7f:g:ICQAAOSwWkddYuaf,Diono 2 in 1 head support Baby infant soft comfortable gray,$14.99,Free,Brand: diono,Color: Gray,N/A
https://www.ebay.com/itm/Boppy-Noggin-Nest-Head-Support-Baby-Pillow/153694345973?hash=item23c8e59af5:g:NMIAAOSwdjtdd8fr,Boppy Noggin Nest Head Support Baby Pillow,$6.00,$3.20,Brand: Boppy,Color: Gray,Gender: Unisex
https://www.ebay.com/itm/Boppy-Noggin-Nest-Head-Support-for-Infants-Brown-Wheels/113877818823?hash=item1a83a59dc7:g:iMEAAOSw-mtdWcJz,Boppy Noggin Nest Head Support for Infants Brown Wheels,$5.00,Free,Brand: Boppy,Color: Brown,Gender: Unisex
https://www.ebay.com/itm/Neck-Pillow-Unisex-Infant-Baby-Support-Car-Seat-Travel-Plush-Monkey-Eddie-Bauer/153440606671?hash=item23b9c5d9cf:g:rqEAAOSw6idcpq8g,Neck Pillow Unisex Infant Baby Support Car Seat Travel Plush Monkey Eddie Bauer,$5.00,$4.50,Brand: Eddie Bauer,Color: Brown,Gender: Unisex
https://www.ebay.com/p/16012038889?iid=253871656164&rt=nc,"The First Years Infant Newborn Head Support Baby Stroller, Car Seat, Bouncer",$11.98,Free,Brand: The First Years,Color: Gray,Gender: Unisex
https://www.ebay.com/p/2255443142?iid=152943311332&rt=nc,"Britax Head and Body Support Pillow, Iron/Gray",$14.99,Free,Color: Gray,Gender: Unisex,N/A
https://www.ebay.com/p/2254305604?iid=292719833175&rt=nc,Baby Head Support Car Seat Stroller Infant Pillow Neck Travel Safety Body Pink,$26.35,Free,Color: Pink,Theme: Sports,Gender: Unisex
https://www.ebay.com/itm/boppy-head-neck-support-baby-0-Months-Black-Floral-Pattern-Reversible-Mesh/333344109915?hash=item4d9cdb755b:g:sOQAAOSwUvhdkB6X,boppy head & neck support baby 0+ Months Black Floral Pattern Reversible Mesh,$11.99,$11.20,Brand: Boppy,Color: Black,Theme: Garden
https://www.ebay.com/p/2255332486?iid=293057898749&rt=nc,Britax Head & Body Support Pillow S864900 New,$20.00,Free,Color: Gray,Theme: Sports,Gender: Unisex
https://www.ebay.com/itm/Summer-Infant-Carseat-Head-and-Body-Support-Snuzzler-Ivory-Terry-or-Cotton/362717081775?hash=item54739f70af:g:e~wAAOSwkKJdQSoq,"Summer Infant Carseat Head and Body Support Snuzzler, Ivory Terry or Cotton",$6.99,$5.66,Brand: Kiddopotamus,Gender: Unisex,N/A
https://www.ebay.com/p/710171034?iid=153354934534&rt=nc,Summer Infant Snuzzler Complete Head and Body Support From Birth 1 - Year,$9.50,$5.93,Brand: Summer Infant,Color: Black,Theme: Holiday
https://www.ebay.com/itm/NWT-Blue-Stripe-Dot-Boppy-Nursing-Infant-Support-Pillow-Slipcover-Only/254368707966?hash=item3b398e757e:g:4SgAAOSw8G1diWPS,NWT Blue Stripe/Dot Boppy Nursing & Infant Support Pillow Slipcover Only,$14.20,Free,Brand: Boppy,Color: Blue,N/A
https://www.ebay.com/itm/Baby-Head-Support-Car-Seat-Infant-Stroller-Travel-Pillow-Neck-Safety-Soft-Body/174013544875?hash=item288403f9ab:g:vtAAAOSw-nZdaOHT,Baby Head Support Car Seat Infant Stroller Travel Pillow Neck Safety Soft Body,$16.48,Free,Brand: Summer Infant,Color: Black,Gender: Unisex
https://www.ebay.com/c/2069831193,Boppy Head Support For Infant Amd Toddler Car Seat Stroller Padding Baby,$16.95,Free,Brand: Boppy,Color: Gray,Gender: Unisex
https://www.ebay.com/itm/Disney-Mickey-Mouse-Infant-Head-Support-Blue-Machine-Washable/323897465460?hash=item4b69cb1a74:g:yDMAAOSwljJdWeks,Disney Mickey Mouse Infant Head Support Blue Machine Washable,$24.90,Free,Brand: Disney,Color: Blue,N/A
https://www.ebay.com/itm/Travel-Bug-Baby-2-Piece-Head-Support-Strap-Covers-for-Car-Seats-Stroller/223582391205?hash=item340e8c8ba5:g:0roAAOSwe8ldHq04,"Travel Bug Baby 2 Piece Head Support & Strap Covers for Car Seats, Stroller",$19.99,Free,Color: Pink,N/A,N/A
https://www.ebay.com/p/2302245813?iid=123737742292&rt=nc,Carter's Infant Head Support for Carseat Stroller Etc - Plush Elephant - Gray,$12.99,Free,Color: Gray,Theme: Safari,Gender: Unisex
https://www.ebay.com/p/2131922493?iid=173948833067&rt=nc,"Summer Infant Snuzzler Infant Support for Car Seats and Strollers, Ivory",$9.99,$4.49,Brand: Summer Infant,Gender: Unisex,N/A
