URL,Title,Price,Shipping,Dynamic Attribute 1,Dynamic Attribute 2,Dynamic Attribute 3
https://www.ebay.com/itm/Elephant-Baby-Mobile-For-Crib-Gray-White/223714136680?hash=item341666d268:g:998AAOSwyA1drJx0,Elephant Baby Mobile For Crib Gray White,$14.00,$7.99,Brand: Unbranded,Color: White,N/A
https://www.ebay.com/itm/Lambs-Ivy-Woodland-Tales-Multicolor-Forest-Animals-Musical-Baby-Crib-Mobile/153684503509?hash=item23c84f6bd5:g:GhgAAOSwAzZdpJDq,Lambs & Ivy Woodland Tales Multicolor Forest Animals Musical Baby Crib Mobile,$9.00,$8.30,Brand: Lambs & Ivy,Theme: Woodland,Color: Green
https://www.ebay.com/itm/Tiny-Love-Magical-Night-Light-Up-Musical-Mobil-Baby/362787280970?hash=item5477ce984a:g:87YAAOSwtgxdrfA5,Tiny Love Magical Night Light Up Musical Mobil Baby,$13.90,$7.71,Brand: Tiny Love,Features: Musical,N/A
https://www.ebay.com/itm/Sleepytime-Musical-Mobile/303334180190?hash=item46a020455e:g:yb8AAOSwCtFdsdWM,Sleepytime Musical Mobile,$0.99,$8.30,Brand: Fisher-Price,Features: Musical,N/A
https://www.ebay.com/itm/Baby-Crib-Mobile-Musical-Lullaby-Teddy-Bear/163933548983?hash=item262b3371b7:g:6mkAAOSw6IVdwy6V,Baby Crib Mobile Musical Lullaby Teddy Bear,$19.99,Free,Brand: Unbranded,Color: Multicolor,Features: Musical
https://www.ebay.com/itm/Black-white-stars-mobile-with-SHILOH-Baby-Crib-Musical-Battery-Operated-60-Song/123906866671?hash=item1cd96cbdef:g:0moAAOSw4kZdap3I,Black white stars mobile with SHILOH Baby Crib Musical Battery Operated 60 Song,$15.00,$6.00,Brand: Shiloh,Color: White,Features: Musical
https://www.ebay.com/p/2255280624?iid=174014434674&rt=nc,New Lambs & Ivy Goodnight Sheep Collection Musical Mobile Damaged Box,$12.99,$12.95,Brand: Lambs & Ivy,Theme: Vehicles,Color: Gray
https://www.ebay.com/itm/DISNEY-BABY-PATCHWORK-POOH-WINNIE-THE-POOH-MUSICAL-MOBILE-NIB/143424760059?hash=item2164c828fb:g:-sYAAOSwsQJdtkiy,DISNEY BABY PATCHWORK POOH WINNIE THE POOH MUSICAL MOBILE NIB ,$22.99,$13.75,Brand: Disney Baby,Color: Multicolor,Features: Musical
https://www.ebay.com/itm/Vintage-Sears-Winnie-the-Pooh-Musical-Crib-Mobile-3lb/223641374880?hash=item34121090a0:g:xU0AAOSwfbJdW~ew,Vintage Sears Winnie the Pooh Musical Crib Mobile (3lb),$7.50,$7.61,Brand: Sears,Features: Musical,N/A
https://www.ebay.com/itm/Baby-Girl-Crib-Mobile-Pink-Owls/323964015232?hash=item4b6dc29280:g:EjwAAOSwEX1dsEdU,Baby Girl Crib Mobile Pink Owls,$11.00,$5.00,Color: Pink,N/A,N/A
https://www.ebay.com/itm/Carters-baby-Cloud-Nursery-Crib-Musical-Mobile-Munchkin-bottle-warmer-LOT/123955941864?hash=item1cdc5991e8:g:q9oAAOSwYu9dt3cP,Carter's baby Cloud Nursery Crib Musical Mobile + Munchkin bottle warmer LOT ,$0.99,$8.00,Brand: Carter's,Color: Multicolor,Features: Musical
https://www.ebay.com/itm/Baby-Crib-Mobile-Bed-Bell-Holder-Toy-Hanging-Arm-Bracket-Decoration-Music-Box-US/274025660838?hash=item3fcd33c1a6:m:mOuz_2RGAHwsQP3HDkYFQ9g&var=574061738569,Baby Crib Mobile Bed Bell Holder Toy Hanging Arm Bracket Decoration Music Box US,$20.95,$1.99,Brand: Unbranded,Theme: Princesses & Fairies,Color: Pink
https://www.ebay.com/itm/Tiny-Love-Take-Along-Baby-Mobile/333341530242?hash=item4d9cb41882:g:rSkAAOSwZ7pdjPR9,Tiny Love Take-Along Baby Mobile ,$2.00,$8.30,Brand: Tiny Love,Theme: Jungle,Features: Musical
https://www.ebay.com/itm/pottery-Barn-Mobile-Nursery-Decor-Wooden-Sailboats/133215021730?hash=item1f043beaa2:g:bZ4AAOSwkQJdqOCh,pottery Barn Mobile Nursery Decor Wooden Sailboats,$8.40,$9.25,Brand: Pottery Barn,N/A,N/A
https://www.ebay.com/itm/Musical-Crib-Mobile-Playful-Birds-Olivia-Rose/113895420929?hash=item1a84b23401:g:5CQAAOSwN5hb-1LH,Musical Crib Mobile Playful Birds Olivia Rose,$10.00,$7.51,Color: Pink,Features: Musical,N/A
https://www.ebay.com/itm/Tiny-Love-Classic-Mobile-Into-The-Forest/264514089289?hash=item3d9644b149:g:XjcAAOSw9EldtziA,"Tiny Love Classic Mobile, Into The Forest",$21.50,$7.90,Brand: Tiny Love,N/A,N/A
https://www.ebay.com/itm/Handmade-Baby-Nursery-Mobile-Woodland-Squirrel/352833298801?hash=item522680e171:g:mUUAAOSwslddhSYO,Handmade Baby Nursery Mobile Woodland Squirrel,$9.57,$11.95,Brand: Handmade,Theme: Woodland,N/A
https://www.ebay.com/itm/LEVTEX-BABY-MUSICAL-MOBILE/293303077818?hash=item444a39cbba:g:yjQAAOSwF-FdphgK,LEVTEX BABY MUSICAL MOBILE,$12.00,$10.40,Brand: Levtex Baby,Color: White,Features: Musical
https://www.ebay.com/itm/BlaBla-Sheep-Mobile-Handmade-Knit-Orig-160-Girls-or-Boys-Nursery/153712709029?hash=item23c9fdcda5:g:t0wAAOSwOxJdwjAM,BlaBla Sheep Mobile Handmade Knit Orig. $160 Girls or Boys Nursery,$36.00,$3.78,Color: White,N/A,N/A
https://www.ebay.com/c/20016371600,Lambs & Ivy Woodland Tales Multicolor Forest Animals Musical Baby Crib Mobile,$10.00,$10.40,Brand: Lambs & Ivy,Theme: Woodland,Color: Gray
https://www.ebay.com/p/1940272249?iid=153650119815&rt=nc,Tiny Love Meadow Days Take Along Baby Mobile,$8.80,$8.30,Brand: Tiny Love,Color: Pink,Features: Musical
https://www.ebay.com/itm/Lambs-Ivy-Baby-Love-Pink-Gold-Hearts-and-Arrows-Musical-Baby-Crib-Mobile/174087162531?hash=item2888674aa3:g:jwgAAOSwaCtdnMvp,Lambs & Ivy Baby Love Pink/Gold Hearts and Arrows Musical Baby Crib Mobile,$14.70,$7.85,Brand: Lambs & Ivy,Color: Pink,Features: Musical
https://www.ebay.com/itm/Baby-Crib-Mobile-Nursery-Decor-Felt-Newborn-Kids-Stroller-Play-and-Pack-Unicorn/323962771594?hash=item4b6daf988a:g:oYkAAOSwwFldt~Kt,Baby Crib Mobile Nursery Decor Felt Newborn Kids Stroller Play and Pack Unicorn,$5.50,Free,N/A,N/A,N/A
https://www.ebay.com/itm/US-Baby-Crib-Mobile-Felt-Starry-Woodland-Night-Nursery-Bed-Windbell-Decoration/133198439822?hash=item1f033ee58e:g:lZYAAOSw-qldnul1,US Baby Crib Mobile Felt Starry Woodland Night Nursery Bed Windbell Decoration,$0.06,Free,Brand: Unbranded,Theme: Woodland,N/A
https://www.ebay.com/itm/Restoration-Hardware-Airplane-Mobile/283616293656?hash=item4208d93318:g:CjgAAOSwwuNdf8Cw,Restoration Hardware Airplane Mobile,$39.95,$7.85,N/A,N/A,N/A
https://www.ebay.com/itm/Pottery-Barn-Kids-Wooden-MOBILE-ARM-CRIB-Nursery-Baby-Infant-Color-Soft-Gray/174039613660?hash=item288591c0dc:g:8~YAAOSw4rVdd89Z,Pottery Barn Kids Wooden MOBILE ARM CRIB Nursery Baby Infant - Color Soft Gray,$11.99,$7.99,Brand: Pottery Barn,Color: White,N/A
https://www.ebay.com/itm/Fisher-Price-Precious-Planet-2-in-1-Projection-Mobile-gently-used/264507689005?hash=item3d95e3082d:g:J10AAOSwtgNdnNSU,Fisher-Price Precious Planet 2-in-1 Projection Mobile  (gently used),$12.50,$8.75,Brand: Fisher-Price,N/A,N/A
https://www.ebay.com/itm/New-Restoration-Hardware-Ivory-Felt-Cloud-Baby-Child-Mobile/293279330754?hash=item4448cf71c2:g:aicAAOSwqqRdpSsT,New Restoration Hardware Ivory Felt Cloud Baby & Child Mobile,$13.00,$10.40,N/A,N/A,N/A
https://www.ebay.com/itm/Vintage-1976-Eden-Beatrix-Potter-Peter-Rabbit-Musical-Crib-Mobile-WORKING-VTG/123919817692?hash=item1cda325bdc:g:kBQAAOSwY-NdjR7y,Vintage 1976 Eden Beatrix Potter Peter Rabbit Musical Crib Mobile WORKING VTG,$8.40,$7.85,Brand: Eden,Features: Musical,N/A
https://www.ebay.com/itm/Pottery-Barn-Kids-Crib-Mobile-Arm-In-Simply-White/254361922884?hash=item3b3926ed44:g:bdEAAOSwmq9dgEH1,Pottery Barn Kids Crib Mobile Arm In Simply White,$16.50,$10.40,Brand: Pottery Barn,Color: White,N/A
https://www.ebay.com/itm/Baby-Crib-Mobile-Nursery-Decor-Felt-Newborn-Kids-Stroller-Play-and-Pack-Unicorn/223735864767?hash=item3417b25dbf:g:oYkAAOSwwFldt~Kt,Baby Crib Mobile Nursery Decor Felt Newborn Kids Stroller Play and Pack Unicorn,$4.99,Free,N/A,N/A,N/A
https://www.ebay.com/itm/Pottery-Barn-Wooden-Crib-Mobile-Arm-Simply-White-New-in-Box/333336387921?hash=item4d9c65a151:g:htUAAOSwv5Vde-WQ,Pottery Barn Wooden Crib Mobile Arm (Simply White)- New in Box,$16.00,$9.45,Brand: Pottery Barn,Color: White,Features: Musical
https://www.ebay.com/itm/Precious-Moments-Musical-Mobile/333307038596?hash=item4d9aa5cb84:g:tSYAAOSwrI1dUG3x,Precious Moments Musical Mobile,$8.00,$6.85,Brand: Precious Moments,Features: Musical,N/A
https://www.ebay.com/p/20024954168?iid=163857460695&rt=nc,Tiny Love Classic Developmental Mobile for Baby,$11.50,$10.15,Brand: Tiny Love,N/A,N/A
https://www.ebay.com/p/2255725290?iid=362743877643&rt=nc,Fisher Price Woodland Friends Musical 3 in 1 Mobile Crib Lullaby Music for Baby^,$24.99,Free,Brand: Fisher-Price,Theme: Woodland,Features: Musical
https://www.ebay.com/itm/Cloud-Island-Crib-Mobile-Gray-Clouds-Moon-Star-Baby-Boy-Girl-Music-White-Noise/123904821648?hash=item1cd94d8990:g:7hEAAOSwQMZdelMg,Cloud Island Crib Mobile Gray Clouds Moon Star Baby Boy Girl Music White Noise,$9.99,$7.85,Brand: Cloud Island,Theme: Moon & Stars,Color: Gray
https://www.ebay.com/itm/POTTERY-BARN-KIDS-Crib-Mobile-Wool-Moon-Stars-Mobile-Arm-and-Music-Box/323906698733?hash=item4b6a57fded:g:90MAAOSwTIhdcncr,POTTERY BARN KIDS Crib Mobile Wool Moon & Stars + Mobile Arm and Music Box,$8.00,$7.85,Brand: Pottery Barn,Theme: Moon & Stars,Color: White
https://www.ebay.com/p/27020309463?iid=323949122588&rt=nc,Manhattan Toy Wimmer-Ferguson Infant Stim-Mobile,$7.00,$5.99,Brand: Manhattan Toy,Color: White,N/A
https://www.ebay.com/itm/Shiloh-Mobile/223646830520?hash=item341263cfb8:g:uUAAAOSwn1RdYpka,Shiloh Mobile ,$15.10,$7.85,Brand: Shiloh,N/A,N/A
https://www.ebay.com/itm/Fischer-Price-Rainforest-Friends-Deluxe-Musical-Mobile-Brand-New-In-Box/264516044076?hash=item3d9662852c:g:upYAAOSwSRtduafT,Fischer Price Rainforest Friends Deluxe Musical Mobile Brand New In Box,$13.10,$11.95,Brand: Fisher-Price,Features: Musical,N/A
https://www.ebay.com/p/2254339653?iid=193189276173&rt=nc,VTech Baby Soothing Ocean Slumbers Mobile,$7.50,$13.70,Brand: VTech,Theme: Beach & Tropical,Color: Purple
https://www.ebay.com/itm/Disney-Winnie-The-Pooh-Crib-Mobile/174071504977?hash=item2887786051:g:qqkAAOSwk5FdrNN2,Disney Winnie The Pooh Crib Mobile,$45.00,$10.40,Brand: Disney,N/A,N/A
https://www.ebay.com/itm/Baby-Crib-Mobile-Nursery-Decor-Felt-Newborn-Kids-Stroller-Play-and-Pack-balloon/223734424353?hash=item34179c6321:g:gDYAAOSwWnRdt~gX,Baby Crib Mobile Nursery Decor Felt Newborn Kids Stroller Play and Pack balloon,$5.74,Free,N/A,N/A,N/A
https://www.ebay.com/c/26019077166,Fisher-Price Precious Planet 2-in-1 Projection Mobile  (gently used),$9.49,$10.85,Brand: Fisher-Price,Features: Musical,N/A
https://www.ebay.com/itm/Pottery-Barn-Wooden-Crib-Mobile-Arm-Simply-White/184008006657?hash=item2ad7bb5c01:g:~p8AAOSwJOldhD6w,Pottery Barn Wooden Crib Mobile Arm (Simply White),$15.00,$6.00,Brand: Pottery Barn,Color: White,Features: Musical
https://www.ebay.com/itm/Vintage-1953-Kenner-Nursery-Birds-Babys-First-Plaything-Moblie/323911365113?hash=item4b6a9f31f9:g:CMIAAOSwtpddc~8w,Vintage 1953 Kenner Nursery Birds Baby's First Plaything Moblie,$18.99,$8.30,N/A,N/A,N/A
https://www.ebay.com/itm/Monsters-Inc-Baby-Mobile/174044440018?hash=item2885db65d2:g:V1EAAOSwB3pdg9XO,Monsters Inc Baby Mobile,$10.00,$5.00,Brand: Disney Baby,N/A,N/A
https://www.ebay.com/itm/Circo-Musical-Crib-Mobile-Hot-Air-Balloon-Ride-BABY-NURSERY-PINK-BLUE-Unisex/113885645639?hash=item1a841d0b47:g:V3IAAOSw~kJdZnEP,Circo - Musical Crib Mobile Hot Air Balloon Ride BABY NURSERY PINK/BLUE Unisex,$12.00,$9.45,Brand: Circo,Color: Pink,Features: Musical
https://www.ebay.com/itm/Mobile-Music-Box-Holder-Baby-Crib-Bed-Bell-Children-Infants-Toy-with-Remote-USA/173701379725?hash=item287168b68d:g:gQ0AAOSwSlpcHEII,Mobile Music Box Holder Baby Crib Bed Bell Children Infants Toy with Remote USA,$21.80,$1.90,Brand: Unbranded,Theme: Princesses & Fairies,Color: Pink
https://www.ebay.com/itm/Fisher-Price-2-in-1-Projection-Mobile-Precious-Planet-with-Remote/254379223458?hash=item3b3a2ee9a2:g:em0AAOSwuuVdl4oS,Fisher-Price 2-in-1 Projection Mobile Precious Planet with Remote,$9.99,$14.20,Brand: Fisher-Price,Color: Multicolor,Features: Musical
https://www.ebay.com/p/1324608958?iid=283619473702&rt=nc,NEW Lambs & Ivy Monkeys Giggles Musical Baby Crib Mobile,$14.00,$3.85,Brand: Lambs & Ivy,Theme: Sports,Color: Brown
https://www.ebay.com/p/2255175308?iid=352841637760&rt=nc,Kids Line Road Map Blue Plush Brahams Lullaby Musical Crib Mobile BHFO 5354,$0.99,$6.99,Brand: Kidsline,Theme: Dogs & Puppies,Color: Blue
https://www.ebay.com/itm/Lambs-and-Ivy-Woodland-Tales-Musical-Mobile-Brown/392382759869?hash=item5b5bd5c3bd:g:KWEAAOSwAVldUaC7,"Lambs and Ivy Woodland Tales Musical Mobile, Brown",$40.53,Free,Theme: Woodland,Color: Brown,Features: Musical
https://www.ebay.com/itm/Vintage-Dolly-Toys-Wonderful-World-of-Disney-Musical-Crib-Mobile-Mickey-Mouse/254374160549?hash=item3b39e1a8a5:g:YQYAAOSwNPldbBtd,Vintage Dolly Toys Wonderful World of Disney Musical Crib Mobile Mickey Mouse,$6.20,$8.30,Brand: Disney,"Theme: TV, Movies & Music",Color: Multicolor
https://www.ebay.com/c/1938025595,Baby Crib Mobile Bed Bell Toy Holder Arm Bracket + Wind-up Music Box,$11.99,Free,"Theme: TV, Movies & Music",Features: Musical,N/A
https://www.ebay.com/itm/eden-Peter-rabbit-mobile-vintage-musical-vintage-in-box-plush-animals-potter/293245020199?hash=item4446c3e827:g:T9cAAOSwg9RdiScn,eden Peter rabbit mobile vintage musical vintage in box plush animals potter ,$9.99,$14.00,Brand: Eden,Features: Musical,N/A
https://www.ebay.com/itm/JUST-BORN-ANIMAL-KINGDOM-COLLECTION-MUSICAL-MOBILE-NIB/163846468502?hash=item262602b396:g:HQsAAOSwTOddZVll,**JUST BORN ANIMAL KINGDOM COLLECTION MUSICAL MOBILE NIB**,$12.75,$11.50,Brand: Just Born,Features: Musical,N/A
https://www.ebay.com/c/1201532654,Flensted seahorses  Modern Hanging Baby Mobile Art  NEW,$14.99,$7.75,Color: Blue,N/A,N/A
https://www.ebay.com/p/1940272249?iid=223739790589&rt=nc,Tiny Love Take Along Princess Mobile - New In Box,$25.00,$8.30,Brand: Tiny Love,Color: Pink,Features: Musical
https://www.ebay.com/itm/Vintage-Winnie-The-Pooh-Mobile/283636575007?hash=item420a0eab1f:g:OMIAAOSwmN9dgDIg,Vintage Winnie The Pooh Mobile,$15.00,$15.00,Features: Musical,N/A,N/A
https://www.ebay.com/itm/Baby-Crib-Mobiles-Nursery-Felt-Decoration-Bassinet-Pack-n-Play-Moms-House/323947324852?hash=item4b6cc3e5b4:g:jBwAAOSwUrZdpAjS,Baby Crib Mobiles Nursery Felt Decoration-Bassinet Pack n Play Moms House,$3.99,Free,N/A,N/A,N/A
https://www.ebay.com/itm/Used-Pottery-Barn-Kids-Space-Planet-Ceiling-Mobile/113923228040?hash=item1a865a8188:g:jygAAOSwxEldo9ib,Used Pottery Barn Kids Space Planet Ceiling Mobile,$20.50,$14.41,Brand: Pottery Barn,N/A,N/A
https://www.ebay.com/itm/Lambs-Ivy-Woodland-Forest-Crib-Musical-Mobile-Echo-Owl-And-Raccoon/223645862757?hash=item3412550b65:g:I~kAAOSwOTZdPOJV,Lambs Ivy Woodland/Forest Crib Musical Mobile - Echo - Owl And Raccoon,$12.00,$14.93,Brand: Lambs & Ivy,Theme: Woodland,Features: Musical
https://www.ebay.com/p/2186929968?iid=174015858332&rt=nc,New Cloud Island Musical and white noise baby Crib mobile with forest animals ,$10.00,$10.40,Brand: Cloud Island,Theme: Farm,Color: Pink
https://www.ebay.com/itm/BlaBla-Baby-Mobile-Handmade-Knit-Sheep-Boy-Girl-Nursery/174034972671?hash=item28854aefff:g:I6IAAOSwx4ddglWj,BlaBla Baby Mobile Handmade Knit Sheep Boy Girl Nursery,$20.00,$10.00,Color: Gray,N/A,N/A
https://www.ebay.com/itm/Fisher-Price-Blues-Clues-Crib-Baby-Mobile-NEW-IN-BOX-Sealed-from-the-year-2000/133153337941?hash=item1f008eb255:g:mHAAAOSwAUJdZakY,Fisher Price Blue's Clues Crib Baby Mobile NEW IN BOX Sealed from the year 2000 ,$13.50,$15.00,Brand: Fisher-Price,Color: Multicolor,N/A
https://www.ebay.com/p/21034353060?iid=254375497890&rt=nc,Pottery Barn Kids Monique Lhuillier Crib Mobile Gold Swans NEW IN BOX,$20.10,$10.40,Brand: Pottery Barn,Color: Gold,N/A
https://www.ebay.com/itm/Vintage-Baby-Mobile-Hand-painted-IRMI-NO-809-Nursery-Wooden-Crib-Ornament-Circus/303334136869?hash=item46a01f9c25:g:AbQAAOSwsvVdn1Y4,Vintage Baby Mobile Hand painted IRMI NO 809 Nursery Wooden Crib Ornament Circus,$9.00,$9.50,Brand: Irmi,N/A,N/A
https://www.ebay.com/itm/Pottery-Barn-Kids-The-Emily-Meritt-Star-Ceiling-Mobile/264431916954?hash=item3d915ed79a:g:GJwAAOSwbL1dVX9c,Pottery Barn Kids The Emily & Meritt Star Ceiling Mobile,$23.50,$10.00,Brand: Pottery Barn,N/A,N/A
https://www.ebay.com/itm/Trend-Lab-Musical-Mobile-Sheep/254359484358?hash=item3b3901b7c6:g:eF8AAOSwT8FdRaw9,Trend Lab Musical Mobile Sheep,$6.99,$7.85,Brand: Trend Lab,Features: Musical,N/A
https://www.ebay.com/itm/Pottery-Barn-Kids-Knit-Animal-Musical-Crib-Mobile-Mobile-Arm/193165892744?hash=item2cf9959c88:g:RpAAAOSwINNdndE4,Pottery Barn Kids Knit Animal Musical Crib Mobile & Mobile Arm,$25.00,$8.50,Brand: Pottery Barn,Theme: Jungle,Color: Gray
https://www.ebay.com/itm/Used-Pottery-Barn-Kids-Space-Planet-Ceiling-Mobile/113948511205?hash=item1a87dc4be5:g:jygAAOSwxEldo9ib,Used Pottery Barn Kids Space Planet Ceiling Mobile,$32.00,$14.41,Brand: Pottery Barn,N/A,N/A
https://www.ebay.com/p/2254526310?iid=303288958120&rt=nc,"Disney Finding Nemo Musical Mobile, Blue",$32.00,$7.85,Brand: Disney,Color: Blue,Features: Musical
https://www.ebay.com/c/1190060911,Circo Snooze In Safari Musical Mobile Plays Brahms Lullaby,$8.80,$15.00,Brand: Circo,Theme: Safari,Color: Gray
https://www.ebay.com/itm/North-American-Bear-Co-Baby-Crib-Music-Mobile-ABCs-Alphabet-Teddy-Bear-Unused/362751527591?hash=item5475ad0aa7:g:uw8AAOSwyEVdeLgS,North American Bear Co. Baby Crib Music Mobile ABC's Alphabet Teddy Bear Unused,$4.99,$11.20,Features: Musical,N/A,N/A
https://www.ebay.com/p/1300004666?iid=323931576279&rt=nc,"New, Open Box Winnie the Pooh Disney Baby Musical Mobile Tigger Piglet Eeyore ",$30.00,$9.30,Brand: Disney Baby,"Theme: TV, Movies & Music",Features: Musical
https://www.ebay.com/itm/Pottery-Barn-Kids-Crib-Mobile-Harper-Elephant/123894395451?hash=item1cd8ae723b:g:9B4AAOSw-hVdPu61,Pottery Barn Kids Crib Mobile Harper Elephant,$9.99,$14.20,Brand: Pottery Barn,Features: Musical,N/A
https://www.ebay.com/itm/VTG-Baby-Crib-Mobile-1950-Hand-painted-IRMI-Nursery-Wooden-Musical-Angels-813/401900834880?hash=item5d93281040:g:NVIAAOSwWAldYby9,VTG Baby Crib Mobile 1950 Hand painted IRMI Nursery Wooden Musical Angels #813,$19.99,$13.00,Brand: Irmi,Color: Pink,Features: Musical
https://www.ebay.com/itm/2001-VTG-Beatrix-Potter-Soft-Peter-Rabbit-Friends-Musical-Mobile-for-Crib/323908093930?hash=item4b6a6d47ea:g:3vsAAOSwRjlddB8l, 2001 VTG~Beatrix Potter Soft Peter Rabbit & Friends Musical Mobile for Crib,$29.99,$10.99,Brand: Eden,Features: Musical,N/A
https://www.ebay.com/itm/Pottery-Barn-Baby-Flying-Elephant-Crib-Mobile-Nursery-Decor-Musical/283629434862?hash=item4209a1b7ee:g:aEwAAOSwA61dftFl,Pottery Barn Baby Flying Elephant Crib Mobile Nursery Decor - Musical,$11.74,$7.99,Brand: Pottery Barn,Color: White,Features: Musical
https://www.ebay.com/itm/Crib-Mobile-Monkies-With-Lullabies/174078045640?hash=item2887dc2dc8:g:PccAAOSw3YxdflP1,Crib Mobile Monkies With Lullabies,$6.99,$8.35,N/A,N/A,N/A
https://www.ebay.com/itm/Baby-Mobile-Crib-Toys-Musical-Box-With-Holder-Newborn-Rotating-Bed-Bell-Plush/401732674123?hash=item5d8922224b:g:AUoAAOSwaAlckI9t,Baby Mobile Crib Toys Musical Box With Holder Newborn Rotating Bed Bell Plush,$28.99,Free,Brand: Unbranded,Color: White,Features: Musical
https://www.ebay.com/itm/Musical-Nautical-jungle-themed-Nursery-Mobile-for-Baby-Boy-Crib-Bed-NEW/392457989046?hash=item5b6051abb6:g:x~YAAOSwRwddUvhw,Musical Nautical jungle themed Nursery Mobile for Baby Boy Crib Bed NEW,$10.00,$9.45,Brand: Lambs & Ivy,Theme: Jungle,Color: Multicolor
https://www.ebay.com/itm/Carters-Sea-Collection-Baby-Girl-Plush-Musical-Mobile-Octopus-Seahorse-Fish/274044927133?hash=item3fce59bc9d:g:IFsAAOSwBRhdgh9l,"Carter's Sea Collection Baby Girl Plush Musical Mobile, Octopus Seahorse Fish",$20.50,$11.95,Brand: Carter's,Features: Musical,N/A
https://www.ebay.com/itm/Vintage-Sears-Winnie-the-Pooh-Musical-Crib-Mobile-3lb/223630181294?hash=item341165c3ae:g:xU0AAOSwfbJdW~ew,Vintage Sears Winnie the Pooh Musical Crib Mobile (3lb),$25.00,$7.61,Brand: Sears,N/A,N/A
https://www.ebay.com/itm/Bacati-Musical-Mobile-White-Gold-Hearts/283584728061?hash=item4206f78bfd:g:PScAAOSwPPtcwQu3,Bacati Musical Mobile - White/Gold Hearts,$5.00,Free,Brand: Bacati,Color: White,Features: Musical
https://www.ebay.com/itm/Bedtime-Originals-Jungle-Buddies-Mobile-MINT-GREEN-2day-Delivery/392452784702?hash=item5b6002423e:g:1JkAAOSwCf9dg96h,Bedtime Originals Jungle Buddies Mobile - MINT GREEN 2day Delivery,$10.00,$8.30,Brand: Bedtime Originals,Theme: Jungle,Color: Green
https://www.ebay.com/p/4011031296?iid=254334066400&rt=nc,Fisher Price Precious Planet 2-in-1 Lights & Sounds Projector Mobile Pre-owned,$12.50,$8.75,Brand: Fisher-Price,Theme: Jungle,Features: With Lights
https://www.ebay.com/itm/New-In-Box-Lambs-Ivy-Musical-Baby-Crib-Mobile-Forest-Creatures/274082191642?hash=item3fd092591a:g:J5cAAOSweoRdwHva,New In Box  Lambs & Ivy Musical Baby Crib Mobile  Forest Creatures,$22.00,$11.20,Brand: Lambs & Ivy,Theme: Woodland,Features: Musical
https://www.ebay.com/p/2254339653?iid=163921942564&rt=nc,VTech Baby Soothing Ocean Slumbers Mobile,$7.50,$13.70,Brand: VTech,Theme: Beach & Tropical,Color: Purple
https://www.ebay.com/itm/Vintage-1980-Dolly-Toy-Raggedy-Ann-Andy-Baby-Mobile-Bobbs-Merrill/283654434824?hash=item420b1f3008:g:fikAAOSwDIJds4sO,Vintage 1980 Dolly Toy Raggedy Ann & Andy Baby Mobile Bobbs Merrill,$5.50,$7.35,Brand: Dolly Toy,N/A,N/A
https://www.ebay.com/p/28034821475?iid=184012737884&rt=nc,"Lambs & Ivy Jungle Safari Musical Baby Crib Mobile - Gray, Beige, White, Animals",$23.50,$10.00,Brand: Lambs & Ivy,Theme: Jungle,Color: White
https://www.ebay.com/itm/Baby-Musical-Crib-Mobile-Bed-Bell-Toys-Hanging-Rattles-Light-Flash-Projection/283412713321?hash=item41fcb6cf69:m:mCvs_T-zR41EGvK62i3CtHg&var=584413269985,Baby Musical Crib Mobile Bed Bell Toys Hanging Rattles Light Flash Projection,$19.86,$0.99,Brand: Unbranded,Theme: Beach & Tropical,Color: Pink
https://www.ebay.com/itm/Rotary-Trawley-Mobile-Boat-Ship-Nautical-Baby-Kids-Crib-Bed-Bell-Toy/123904366018?hash=item1cd94695c2:g:SGcAAOSwkwNdFCal,Rotary Trawley Mobile Boat Ship Nautical  Baby Kids Crib Bed Bell Toy ,$14.99,$8.30,Brand: Unbranded,Theme: Nautical,Color: Multicolor
https://www.ebay.com/itm/baby-crib-musical-mobile-Boy/401920986837?hash=item5d945b8ed5:g:zhMAAOSw0v1dfsLV,baby crib musical mobile Boy,$16.00,$9.25,Brand: NoJo,Theme: Sports,Color: Blue
https://www.ebay.com/itm/Carters-Twinkle-Twinkle-Little-Star-Music-Mobile-NIB/293265614819?hash=item4447fe27e3:g:SgQAAOSwNj5dUH4E,Carter's Twinkle Twinkle Little Star Music Mobile NIB,$5.99,$8.30,Brand: Carter's,Features: Musical,N/A
https://www.ebay.com/itm/Fisher-Price-2-in-1-Projection-Mobile-Precious-Planet-with-Remote/293220662678?hash=item4445503d96:g:2KEAAOSw1-Nddwjw,Fisher-Price 2-in-1 Projection Mobile Precious Planet with Remote,$15.50,$9.45,Brand: Fisher-Price,Color: Multicolor,Features: Musical
https://www.ebay.com/itm/Disney-Baby-Minnie-Mouse-Flowers-Pink-Mobile-Plays-Brahms-Lullaby/193131772021?hash=item2cf78cf875:g:R2YAAOSwbv9dkT2z,Disney Baby Minnie Mouse & Flowers Pink Mobile Plays Brahms' Lullaby,$6.00,$8.20,Brand: Disney Baby,Color: Pink,N/A
https://www.ebay.com/p/2255175308?iid=352798242157&rt=nc,Kids Line Road Map Blue Plush Brahams Lullaby Musical Crib Mobile BHFO 5354,$0.99,$6.99,Brand: Kidsline,Theme: Dogs & Puppies,Color: Blue
https://www.ebay.com/itm/Pottery-Barn-Kids-Wooden-MOBILE-ARM-CRIB-Nursery-Baby-Infant-Color-Soft-Gray/174026513998?hash=item2884c9de4e:g:8~YAAOSw4rVdd89Z,Pottery Barn Kids Wooden MOBILE ARM CRIB Nursery Baby Infant - Color Soft Gray,$11.99,$7.99,Brand: Pottery Barn,Color: White,N/A
https://www.ebay.com/itm/Baby-Crib-Mobile-Nursery-Decor-Felt-Newborn-Kids-Stroller-Play-and-Pack-balloon/323962774795?hash=item4b6dafa50b:g:gDYAAOSwWnRdt~gX,Baby Crib Mobile Nursery Decor Felt Newborn Kids Stroller Play and Pack balloon,$5.50,Free,N/A,N/A,N/A
https://www.ebay.com/itm/Pottery-Barn-Wooden-Crib-Mobile-Arm-Simply-White-New-in-Box/333329075850?hash=item4d9bf60e8a:g:htUAAOSwv5Vde-WQ,Pottery Barn Wooden Crib Mobile Arm (Simply White)- New in Box,$16.00,$9.45,Brand: Pottery Barn,Color: White,Features: Musical
https://www.ebay.com/itm/Skyflight-Trout-Fish-Hanging-Baby-Classroom-Mobile-Kinetic-Art-Educational/163846529395?hash=item262603a173:g:EEQAAOSwYdpdIsT7,Skyflight Trout Fish Hanging Baby Classroom Mobile Kinetic Art Educational,$8.50,$4.81,N/A,N/A,N/A
https://www.ebay.com/itm/BRAND-NEW-IN-BOX-TREND-LAB-MUSICAL-MOBILE-FOR-CRIB-PINK-BUTTERFLY/273970929278?hash=item3fc9f09e7e:g:JpgAAOSwhNNdWdQY,BRAND NEW IN BOX TREND LAB MUSICAL MOBILE FOR CRIB PINK BUTTERFLY,$12.50,$6.00,Brand: Trend Lab,Color: Pink,Features: Musical
https://www.ebay.com/itm/IKEA-Leka-Baby-Mobile/133139216098?hash=item1effb736e2:g:BQQAAOSwEwFdTx6I,IKEA Leka Baby Mobile,$5.00,$4.49,Brand: IKEA,N/A,N/A
https://www.ebay.com/itm/LITTLE-BIG-ROOM-BY-DJECO-MOBILE-AUTOMOBILES-NIB/273977688788?hash=item3fca57c2d4:g:nzoAAOSwo51dYJVi,LITTLE BIG ROOM BY DJECO MOBILE AUTOMOBILES NIB,$2.99,$7.95,Brand: Djeco,N/A,N/A
https://www.ebay.com/itm/Pottery-Barn-Kids-Zoo-Elephant-Mobile/123949240079?hash=item1cdbf34f0f:g:oV8AAOSw28pdlT1b,Pottery Barn Kids Zoo/Elephant Mobile,$20.00,$11.95,Brand: Pottery Barn,Color: Gray,N/A
https://www.ebay.com/p/10008190390?iid=352796236779&rt=nc,V TECH LIGHTS AND LULLABIES BABY TRAVEL MOBILE NEW IN BOX ,$18.74,Free,Brand: VTech,Features: Musical,N/A
https://www.ebay.com/p/4011031296?iid=163875124766&rt=nc,Fisher Price Precious Planet 2-in-1 Lights & Sounds Projector Mobile | N8849,$22.50,$22.05,Brand: Fisher-Price,Features: With Lights,N/A
https://www.ebay.com/itm/Vintage-Fisher-Price-Farm-Figures-Crib-Playpen-Mobile-Windup-Music-Box-1973/113939213001?hash=item1a874e6ac9:g:GiUAAOSw9mtdrMXf,Vintage Fisher Price Farm Figures Crib & Playpen Mobile Windup Music Box 1973,$18.80,$7.78,Brand: Fisher-Price,Theme: Farm,Color: Multicolor
https://www.ebay.com/itm/Pottery-Barn-Kids-Butterfly-Musical-Baby-Crib-Mobile/303271856529?hash=item469c694991:g:Q64AAOSweQxdRiGY,Pottery Barn Kids Butterfly Musical Baby Crib Mobile ,$15.99,$7.70,Brand: Pottery Barn,Features: Musical,N/A
