URL,Title,Price,Shipping,Dynamic Attribute 1,Dynamic Attribute 2,Dynamic Attribute 3
https://www.ebay.com/c/3027591570,Lambs & Ivy Yoo-Hoo Blue Multicolor Animal Musical Baby Crib Mobile,$24.99,$8.30,Brand: Lambs & Ivy,Color: Purple,Features: Musical
https://www.ebay.com/p/19024455521?iid=223733549144&rt=nc,"Bedtime Originals Jungle Fun Musical Baby Crib Mobile - Gray, Animals, Jungle",$39.99,Free,Brand: Bedtime Originals,Theme: Jungle,Color: Gray
https://www.ebay.com/itm/Petit-Pehr-Crib-Mobile-Wool-Felt-Circus-Theme/312742168522?hash=item48d0e2c7ca:g:CFAAAOSwPYJdMrDL,Petit Pehr Crib Mobile Wool Felt Circus Theme,$25.00,$6.00,Brand: Pehr,N/A,N/A
https://www.ebay.com/p/5015791873?iid=183946816858&rt=nc,Tiny Love Sweet Island Dreams Mobile CLEAN,$27.99,Free,Brand: Tiny Love,Color: Green,N/A
https://www.ebay.com/itm/Mini-Tudou-Intelligent-Design-Baby-Crib-Mobile-With-Many-Features/382911812987?hash=item592752957b:g:exAAAOSwJZRcu2v-,Mini Tudou Intelligent Design Baby Crib Mobile With Many Features,$25.00,$11.20,N/A,N/A,N/A
https://www.ebay.com/p/11024167199?iid=223602129493&rt=nc,"Lambs & Ivy Milky Way Musical Baby Crib Mobile - Blue, Gray, Modern, Celestial",$54.99,Free,Brand: Lambs & Ivy,Color: Blue,Features: Musical
https://www.ebay.com/itm/Pottery-Barn-Flying-Elephant-Crib-Musical-Mobile-Moblie-Arm-New-in-Boxes/283568784789?hash=item4206044595:g:G2IAAOSwZZpdRNk7,Pottery Barn Flying Elephant Crib Musical Mobile & Moblie Arm/New in Boxes,$30.00,$9.25,Brand: Pottery Barn,Features: Musical,N/A
https://www.ebay.com/itm/KOLCRAFT-Light-Vibes-Music-Mobile-w-3-White-Teddy-Bears-Mobile/223667779111?hash=item3413a37627:g:sfoAAOSwLuldf-Bv,KOLCRAFT Light - Vibes - Music Mobile w/3 White Teddy Bears Mobile,$9.99,$13.77,Theme: Novelty,Color: White,Features: Musical
https://www.ebay.com/itm/NEW-Tiddliwinks-Raspberry-Garden-Musical-Mobile-Brahms-Lullaby-Baby-Nursery-Gir/382986160465?hash=item592bc10951:g:edMAAOxykmZTMKv3,NEW Tiddliwinks Raspberry Garden Musical Mobile Brahm's Lullaby Baby Nursery Gir,$12.99,$10.40,Brand: Tiddliwinks,Theme: Garden,Features: Musical
https://www.ebay.com/c/1530015789,Sweet Jojo Design Musical Mobile For Gray White Chevron Zigzag Baby Crib Bedding,$16.70,Free,Brand: Sweet JoJo Designs,Color: White,Features: Musical
https://www.ebay.com/itm/1984-Vintage-Fisher-Price-Dancing-Animals-Mobile-Music-Box-Crib-Brahms-Lullaby/323891542700?hash=item4b6970baac:g:tRcAAOSwFDpdXude,1984 Vintage Fisher Price Dancing Animals Mobile Music Box Crib Brahms Lullaby,$34.50,$7.85,Brand: Fisher-Price,Color: Multicolor,Features: Musical
https://www.ebay.com/p/2187025618?iid=352753347882&rt=nc,"Crib Mobile Two by Two - Cloud Island - Gray -  Zebra, Elephant, Giraffe & Sheep",$27.99,Free,Brand: Cloud Island,Theme: Jungle,Color: Gray
https://www.ebay.com/itm/EKKO-Elliptical-Desktop-Mobile-Sculpture-Mid-Century-Kinetic-Art/143376573429?hash=item2161e8e3f5:g:lbkAAOSwZ3Bdc~85,EKKO Elliptical Desktop Mobile Sculpture Mid Century Kinetic Art,$34.95,$8.30,N/A,N/A,N/A
https://www.ebay.com/p/4017358129?iid=183794024446&rt=nc,Bedtime Originals Hello Kitty Luv White/Pink Musical Baby Crib Mobile (OPEN BOX),$38.99,Free,Brand: Bedtime Originals,Color: Pink,Features: Musical
https://www.ebay.com/itm/Vintage-60-70s-Musical-Moving-Baby-Crib-Mobile-Plays-Brahms-Lullaby-Works/153422042421?hash=item23b8aa9535:g:lDMAAOSwgu9bR4jK,Vintage 60/70's Musical Moving Baby Crib Mobile Plays Brahms Lullaby Works,$24.00,$8.30,Brand: Unbranded,Features: Musical,N/A
https://www.ebay.com/p/1200495903?iid=401735191858&rt=nc,NEW LIL COWPOKE WESTERN HORSE  BABY CRIB MUSICAL MOBILE IN PACKAGE,$15.99,$12.50,Brand: Dolly,Theme: Horses,Color: Multicolor
https://www.ebay.com/itm/Navy-Digital-Musical-Mobile-With-Elephants-Clouds-Stars-by-The-Peanut-Shell/163887670120?hash=item2628776368:g:mnsAAOSwPW9dk6bM,"Navy Digital Musical Mobile With Elephants, Clouds & Stars by The Peanut Shell",$30.98,$11.20,Brand: The Peanut Shell,Color: White,Features: Musical
https://www.ebay.com/itm/Lambs-Ivy-Sweetheart-Pink-Gold-White-Heart-Musical-Baby-Crib-Mobile/223683285621?hash=item3414901275:g:2MYAAOSwvfRdjfVO,Lambs & Ivy Sweetheart Pink/Gold/White Heart Musical Baby Crib Mobile,$42.99,Free,Brand: Lambs & Ivy,Color: White,Features: Musical
https://www.ebay.com/p/15027050631?iid=223254983930&rt=nc,Bedtime Originals Jungle Buddies Animal Theme Musical Baby Crib Mobile,$39.99,Free,Brand: Bedtime Originals,Theme: Jungle,Color: Brown
https://www.ebay.com/itm/Trend-Lab-Dr-Seuss-ABC-Musical-Mobile-REPLACEMENT-part/173961383373?hash=item2880e80dcd:g:i~kAAOSwXYpdIQVK,Trend Lab Dr. Seuss ABC Musical Mobile REPLACEMENT part,$14.47,Free,Brand: Trend Lab,Color: Multicolor,Features: Musical
https://www.ebay.com/itm/Sunflower-Boho-Floral-Baby-Girl-Yellow-Green-White-Nursery-Musical-Crib-Mobile/383198206168?hash=item59386498d8:g:fqwAAOSwQ8ZdSDA7,Sunflower Boho Floral Baby Girl Yellow Green White Nursery Musical Crib Mobile,$51.99,Free,Brand: Sweet JoJo Designs,Color: White,Features: Musical
https://www.ebay.com/itm/Vintage-Crib-Mobile-Nursery-Decor-Action-Carousel-888-Stahlwood-Toy-1960s-Baby/383189688684?hash=item5937e2a16c:g:paEAAOSwJuZc7r37,Vintage Crib Mobile Nursery Decor Action Carousel 888 Stahlwood Toy 1960s Baby,$23.99,$9.06,Color: Multicolor,N/A,N/A
https://www.ebay.com/p/19031970988?iid=323887742704&rt=nc,Pottery Barn Kids Felted Roses Musical Crib Mobile #4150,$41.30,$1.99,Brand: Pottery Barn,Theme: Garden,Color: Pink
https://www.ebay.com/itm/Tippy-Canoe-Collection-Lambs-And-Ivy-Mobile/264432872515?hash=item3d916d6c43:g:O8kAAOSw4aRdVrod,Tippy Canoe Collection Lambs And Ivy Mobile,$24.00,Free,Brand: Lambs & Ivy,N/A,N/A
https://www.ebay.com/itm/Bedtime-Originals-Rainbow-Unicorn-and-Fox-White-Coral-Musical-Baby-Crib-Mobile/223568018428?hash=item340db13bfc:g:RG0AAOSwDUJdFTiV,Bedtime Originals Rainbow Unicorn and Fox White/Coral Musical Baby Crib Mobile,$39.99,Free,Brand: Bedtime Originals,Color: White,Features: Musical
https://www.ebay.com/p/14025944351?iid=233313546606&rt=nc,"Tiny Love Soothe 'n Groove Mobile, Blue 0-24 months Baby Interactive Toys",$18.95,$13.70,Brand: Tiny Love,Color: Blue,N/A
https://www.ebay.com/itm/Trend-Lab-Grace-Musical-Mobile-Blue-Purple-white/264453872564?hash=item3d92addbb4:g:a-QAAOSwfrddcFi-,"Trend Lab Grace Musical Mobile. Blue, Purple, white",$22.00,Free,Brand: Trend Lab,Color: Purple,Features: Musical
https://www.ebay.com/p/4019925136?iid=223644584121&rt=nc,Bedtime Originals Baby League Monkey and Fox Musical Baby Crib Mobile,$24.99,Free,Brand: Bedtime Originals,"Theme: TV, Movies & Music",Color: Brown
https://www.ebay.com/itm/Vintage-Handpainted-Mobile-for-Baby-By-Irmi-Original-Box-1969/113911007317?hash=item1a85a00855:g:knoAAOSwhEtdk-q8,Vintage Handpainted Mobile for Baby By Irmi~Original Box~1969,$9.99,$7.32,Brand: Irmi,Color: Multicolor,N/A
https://www.ebay.com/itm/Pottery-Barn-Baby-Kids-Harper-Teddy-Bear-Crib-Mobile-White-Arm-Wind-up-Music-Box/163803468386?hash=item2623729262:g:UEMAAOSw0eNdRey8,Pottery Barn Baby Kids Harper Teddy Bear Crib Mobile White Arm Wind-up Music Box,$26.99,$11.95,Brand: Pottery Barn,Color: White,Features: Musical
https://www.ebay.com/itm/Messages-From-The-Heart-Musical-Crib-Mobile-By-Sandra-Magsamen-Pink-Floral/333330950216?hash=item4d9c12a848:g:8~gAAOSwrFBdeqQn,Messages From The Heart Musical Crib Mobile By Sandra Magsamen Pink Floral ,$28.00,Free,Color: Pink,Features: Musical,N/A
https://www.ebay.com/itm/Skip-Hop-Moonlight-Melodies-Safari-Projection-Crib-Baby-Mobile/264454752993?hash=item3d92bb4ae1:g:GwwAAOSwbspdcUeU,Skip Hop Moonlight & Melodies Safari Projection Crib Baby Mobile ,$45.99,$19.80,Brand: Skip Hop,Theme: Safari,Features: Musical
https://www.ebay.com/itm/Infant-Baby-Mobile-Disney-Winnie-the-Pooh-Mini-Nursery-Crib-Musical-Boy-Or-Girl/202790314027?hash=item2f373ea02b:g:7F0AAOSwoRFdG6fu,Infant Baby Mobile Disney Winnie the Pooh Mini Nursery Crib Musical Boy Or Girl,$25.98,$8.35,Brand: Disney,Color: Multicolor,Features: Musical
https://www.ebay.com/p/25016501994?iid=303265753135&rt=nc, Cloud Island Baby Crib Mobile Woodland Forest Frolic Girl Pink New in Box Pink,$20.00,$7.88,Brand: Cloud Island,Theme: Woodland,Color: Pink
https://www.ebay.com/p/691315352?iid=254172953121&rt=nc,Flensted Ugly Duckling Duck Swan Modern Hanging Baby Mobile Nursery Decor Danish,$19.99,Free,Color: Yellow,N/A,N/A
https://www.ebay.com/p/2255356415?iid=174083722754&rt=nc,Manhattan Toy Wimmer-Ferguson Infant Stim-Mobile for Cribs,$19.89,Free,Brand: Manhattan Toy,Color: White,Features: Musical
https://www.ebay.com/itm/Pottery-Barn-Crib-Sweet-Lambie-Musical-Mobile/123937427186?hash=item1cdb3f0ef2:g:9uwAAOSw4tVdloek,Pottery Barn Crib Sweet Lambie Musical Mobile,$7.65,$14.35,Brand: Pottery Barn,Features: Musical,N/A
https://www.ebay.com/p/9024174097?iid=174022197503&rt=nc,VTech Baby Soothing Slumbers Sheep Mobile - NEW in Open Box,$34.99,Free,Brand: VTech,Features: Musical,N/A
https://www.ebay.com/itm/IRMI-Baby-Circus-Mobile-801-Original-Box-Bear-Ballerina-Clown-Vintage-Nursery/113737405575?hash=item1a7b471487:g:x9QAAOSw6w1czixT,IRMI Baby Circus Mobile #801 Original Box Bear Ballerina Clown Vintage Nursery,$14.90,Free,Brand: Irmi,Theme: Clowns & Circus,Color: Multicolor
https://www.ebay.com/p/4031518311?iid=333333940078&rt=nc,Shiloh Baby Crib Musical Mobile Battery-Operated 60 Songs White,$18.99,Free,Brand: Shiloh,Color: White,Features: Musical
https://www.ebay.com/itm/VINTAGE-1950-S-IRMI-HANDPAINTED-WOOD-CRIB-MOBILE-809-ZOO-ORIGINAL-BOX/163701518293?hash=item261d5eefd5:g:DFQAAOSwKptcvdvi,VINTAGE 1950’S IRMI HANDPAINTED WOOD CRIB MOBILE #809 ZOO ORIGINAL BOX,$14.00,$10.40,Brand: Irmi,N/A,N/A
https://www.ebay.com/p/558573825?iid=223671958395&rt=nc,Lambs & Ivy Family Tree Pink/Gray/Tan Owl Musical Baby Crib Mobile,$42.99,Free,Brand: Lambs & Ivy,Color: Gray,Features: Musical
https://www.ebay.com/itm/Cloud-Island-Musical-White-Noise-Crib-Mobile-Neutral-Llama-Lion-Owl-Elephant/143370595432?hash=item21618dac68:g:rSgAAOSww~BdVdq-,"Cloud Island Musical & White Noise Crib Mobile- Neutral-Llama,Lion,Owl,Elephant",$27.98,Free,Brand: Cloud Island,Color: Multicolor,Features: Musical
https://www.ebay.com/p/8022158643?iid=223595202817&rt=nc,"Lambs & Ivy Little Spirit Decorative Pillow - Blue, White, Coral, Hearts, Modern",$21.99,Free,Brand: Lambs & Ivy,Color: White,N/A
https://www.ebay.com/itm/GrowthPic-Forest-Valley-Musical-Baby-Crib-Mobile-Pink-Or-Green-New/333167690114?hash=item4d92578182:m:mY9kN8mbooXl0uJVWSAGMtg&var=542185693593,GrowthPic Forest Valley Musical Baby Crib Mobile Pink Or Green- New,$24.99,Free,Brand: GrowthPic,Color: Green,Features: Musical
https://www.ebay.com/itm/Disney-Baby-Minnie-Mouse-Butterfly-Charm-Musical-Mobile-Crib-Nursery/372789791713?hash=item56cc00cbe1:g:MQAAAOSwZEJdklcI,Disney Baby Minnie Mouse Butterfly Charm Musical Mobile Crib Nursery,$32.00,$11.56,Brand: Disney Baby,Color: Multicolor,Features: Musical
https://www.ebay.com/itm/Disney-Minnie-Mouse-Mobile/264270783747?hash=item3d87c42503:g:DVkAAOSwcP5cp4ot,Disney Minnie Mouse Mobile.,$50.00,$14.20,Brand: Disney,N/A,N/A
https://www.ebay.com/itm/Mascotopia-Philadelphia-Eagles-Baby-Mobile-Philadelphia-Eagles-Crib-Mobile/312759358944?hash=item48d1e915e0:g:rtIAAOSwoIFdU1iA,Mascotopia Philadelphia Eagles Baby Mobile  Philadelphia Eagles Crib Mobile,$15.00,$11.10,Theme: Sports,N/A,N/A
https://www.ebay.com/p/24031722661?iid=143363209172&rt=nc,"USED (AB)Just Born Little Dreamer Musical Mobile, Grey Elephant  Zebra, One Size",$21.95,Free,Brand: Just Born,Color: Gray,Features: Musical
https://www.ebay.com/itm/Tiny-Love-Tiny-Princess-Tales-Take-Along-Mobile-Girl/113832041602?hash=item1a80eb1c82:g:qiUAAOSwEWldOvzq,Tiny Love Tiny Princess Tales Take Along Mobile Girl,$8.00,$7.85,Brand: Tiny Love,N/A,N/A
https://www.ebay.com/p/1637573957?iid=264248480493&rt=nc,Vintage 1976 THE FIRST YEARS SOFT ANIMALS CRIB MOBILE Retro Nursery NIB,$23.99,$10.86,Brand: The First Years,N/A,N/A
https://www.ebay.com/p/19009769264?iid=401678691461&rt=nc,Disney Lion King Circle Of Life Musical Mobile,$29.95,Free,Brand: Disney Baby,Features: Musical,N/A
https://www.ebay.com/p/2168222764?iid=323758057267&rt=nc,Oasis Cocalo Baby Jacana Musical Mobile Jungle Giraffe Elephant Unisex Nursery ,$14.99,$8.24,Brand: CoCaLo,Theme: Jungle,Color: Green
https://www.ebay.com/itm/Vintage-FISHER-PRICE-DANCING-ANIMALS-MUSIC-BOX-MOBILE-Works-1989/223593384705?hash=item340f344b01:g:FJgAAOSw8ttdMji2,"Vintage FISHER PRICE DANCING ANIMALS MUSIC BOX MOBILE Works, 1989 ",$45.00,Free,Brand: Fisher-Price,Features: Musical,N/A
https://www.ebay.com/itm/Vtg-Dolly-Musical-Mobile-Disney-Babies-Mickey-Minnie-Mouse-Infant-Crib-Baby/283601301752?hash=item4207f470f8:g:qlAAAOSw0h1dJQz7,Vtg Dolly Musical Mobile Disney Babies Mickey Minnie Mouse Infant Crib Baby,$20.99,$11.33,Brand: Disney,Features: Musical,N/A
https://www.ebay.com/p/1282694756?iid=382860248633&rt=nc,Fisher-Price Jonathan Adler Sensory Projection Mobile Music Nature Sounds Remote,$38.99,Free,Brand: Fisher-Price,Theme: Jungle,Color: Multicolor
https://www.ebay.com/itm/NEW-Vtg-Dakin-Musical-Mobile-Baby-Nursery-McDonalds-Farm-Mary-Had-a-Little-Lamb/352769592530?hash=item5222b4ccd2:g:81wAAOSwuTNcpPyt,NEW Vtg Dakin Musical Mobile Baby Nursery McDonald's Farm Mary Had a Little Lamb,$15.00,$10.00,Theme: Farm,Features: Musical,N/A
https://www.ebay.com/c/1642211732,Tiny Love Sweet Island Dreams Mobile,$24.00,Free,Brand: Tiny Love,Theme: Jungle,Color: Green
https://www.ebay.com/p/2255454211?iid=302745194791&rt=nc,Disney Baby Infant's Urban Jungle Lion King Musical Mobile ,$29.98,$10.95,Brand: Disney,Theme: Jungle,Color: Multicolor
https://www.ebay.com/itm/Baby-Infant-Boy-Girl-Blue-Brown-Three-Gray-Elephants-Crib-Mobile/273828210936?hash=item3fc16ee8f8:g:BucAAOSw2z1dQHsc,Baby Infant Boy Girl Blue Brown Three Gray Elephants Crib Mobile,$24.99,Free,Brand: Unbranded,Color: Blue,N/A
https://www.ebay.com/itm/Cocalo-Baby-Musical-Mobile-Sugar-Plum-Butterflies/264434876227?hash=item3d918bff43:g:9nIAAOSwFVFdWXxm,Cocalo Baby Musical Mobile Sugar Plum Butterflies,$29.99,$9.45,Brand: CoCaLo,Features: Musical,N/A
https://www.ebay.com/p/8030769995?iid=273773609985&rt=nc,Toddler Baby Mobile Crib Windup Rotating Music Machine Toy Stroller Bed Bell US,$19.99,$0.99,Brand: Unbranded,Theme: Beach & Tropical,Color: Blue
https://www.ebay.com/itm/Pottery-Barn-Kids-Baby-Mobile-Crib-Plush-Kid-Stars-Moon-White-Nursery-Hanger/254328943147?hash=item3b372fb22b:g:21EAAOSw0TxdUeIK,Pottery Barn Kids Baby Mobile Crib Plush Kid Stars Moon White Nursery Hanger,$15.00,$6.29,Brand: Pottery Barn,Theme: Moon & Stars,Color: White
https://www.ebay.com/p/12029031160?iid=372659059445&rt=nc,Pottery Barn Kids Chambray Butterfly Crib Mobile+Chocolate Mobile Arm,$32.99,$25.40,Brand: Pottery Barn,Color: Gray,N/A
https://www.ebay.com/itm/SKYFLIGHT-MOBILES-Handcrafted-5-Hanging-Wilderness-Birds-Duck-Eagle-Brand-New/132994763048?hash=item1ef71b0928:g:c0kAAOSwiqBcQPu-,SKYFLIGHT MOBILES Handcrafted 5 Hanging Wilderness Birds Duck Eagle Brand New,$33.24,Free,Brand: Skyflight Mobiles,N/A,N/A
https://www.ebay.com/itm/2003-Care-Bears-Star-Swing-Musical-Mobile-Funshine-Bedtime-Wish-Cheer-NIP/233336257356?hash=item3653ecbb4c:g:0UkAAOSwjp9ddYhD,2003 Care Bears Star Swing Musical Mobile Funshine Bedtime Wish Cheer NIP,$69.95,Free,Color: Multicolor,Features: Musical,N/A
https://www.ebay.com/itm/Vintage-1960s-Baby-Crib-Mobile/273783985945?hash=item3fbecc1719:g:3cIAAOSwFyhaRmox,Vintage 1960's Baby Crib Mobile,$12.00,$9.50,N/A,N/A,N/A
https://www.ebay.com/itm/Blabla-Kids-Baby-Cotton-Knit-Owl-Mobile/283545328132?hash=item42049e5a04:g:2YEAAOSwuJRcBXPD,Blabla Kids Baby Cotton Knit Owl Mobile,$14.99,$5.66,N/A,N/A,N/A
https://www.ebay.com/p/2255175308?iid=293292672559&rt=nc,Kids Line Road Map Blue Plush Brahams Lullaby Musical Crib Mobile BHFO 5354,$0.99,$6.99,Brand: Kidsline,Theme: Dogs & Puppies,Color: Blue
https://www.ebay.com/itm/Sunflower-Boho-Floral-Baby-Girl-Yellow-Green-White-Nursery-Musical-Crib-Mobile/401848237398?hash=item5d90057d56:g:fqwAAOSwQ8ZdSDA7,Sunflower Boho Floral Baby Girl Yellow Green White Nursery Musical Crib Mobile,$51.99,Free,Brand: Sweet JoJo Designs,Color: White,Features: Musical
https://www.ebay.com/itm/Musical-Mobile-Animal-Shower-Dolly-Wind-up-Crib-Toy-Vintage-Baby-Lullaby-Working/264297911768?hash=item3d896215d8:g:0ZMAAOSwkmJcwb1c,Musical Mobile Animal Shower Dolly Wind-up Crib Toy Vintage Baby Lullaby Working,$27.99,Free,Brand: Dolly Toy,Features: Musical,N/A
https://www.ebay.com/p/22026131356?iid=163818298254&rt=nc,Petit Pehr Designs Hand Crafted Baby Mobile - Noah's Ark New,$38.24,$7.07,Brand: Pehr,N/A,N/A
https://www.ebay.com/p/669732154?iid=133169105802&rt=nc,POTTERY BARN KIDS PURPLE BUTTERFLY NURSERY CRIB MOBILE,$11.00,$9.00,Brand: Pottery Barn,Color: Purple,Features: Musical
https://www.ebay.com/c/1776859993,Baby Crib Mobile Bed Bell Holder Arm Bracket Battery-operated Musical Mobile Box,$11.99 to $18.99,Free,Brand: Unbranded,Color: White,Features: Musical
https://www.ebay.com/itm/New-Pottery-Barn-Kids-Hanging-Cloud-with-Stars-nursery-art-mobile-decor-large/273769505390?hash=item3fbdef226e:g:mrQAAOSwcOtckcQk,New Pottery Barn Kids Hanging Cloud with Stars nursery art mobile decor large,$26.95,Free,Brand: Pottery Barn,N/A,N/A
https://www.ebay.com/itm/Carters-Jungle-Jill-Musical-Mobile-only-pink-Giraffe-new/283458271325?hash=item41ff6df85d:g:VhMAAOSwk9FcVd-q,Carter's Jungle Jill Musical Mobile only  - pink Giraffe  new,$19.99,$9.99,Brand: Carter's,Theme: Sea Life,Color: Multicolor
https://www.ebay.com/itm/1984-Vintage-Fisher-Price-Musical-Mobile-Dancing-Animals-Brahms-Lullaby/133134810611?hash=item1eff73fdf3:g:DUIAAOSw36tdSJEj,1984 Vintage Fisher Price Musical Mobile Dancing Animals - Brahms Lullaby ,$25.00,$12.45,Brand: Fisher-Price,Color: Multicolor,Features: Musical
https://www.ebay.com/p/14020377745?iid=113879561573&rt=nc,Lambs & Ivy Oceania Blue/Gray Whale/Fish Nautical/Ocean Musical Baby Crib Mobile,$33.53,Free,Brand: Lambs & Ivy,Theme: Nautical,Color: Gray
https://www.ebay.com/itm/Bananafish-Leopoard-Diva-Collection-Mobile-Musical-Pink-Black-Perfection/293231435548?hash=item4445f49f1c:g:a~gAAOSwJcVdfnC4,"Bananafish Leopoard Diva Collection Mobile - Musical, Pink & Black Perfection! ",$23.95,Free,Brand: Bananafish,Color: Pink,Features: Musical
https://www.ebay.com/itm/Lot-Vintage-Music-Box-Mobile-and-Switch-Plate-Hand-Painted-by-Irmi/283589415711?hash=item42073f131f:g:ABMAAOSwTW1dKSoB,Lot Vintage Music Box Mobile and Switch Plate Hand Painted by Irmi,$10.95,$8.35,Brand: Irmi,Features: Musical,N/A
https://www.ebay.com/itm/New-Disney-Minnie-Mouse-Musical-Mobile/233331921662?hash=item3653aa92fe:g:L~0AAOSwdXpdb333,New Disney Minnie Mouse Musical Mobile,$22.75,$13.75,Brand: Disney,Color: Multicolor,Features: Musical
https://www.ebay.com/itm/Carters-Jungle-Musical-Mobile/283044010858?hash=item41e6bcdb6a:g:bXcAAOSwVTNbQAV-,Carter's Jungle Musical Mobile,$15.00,$15.00,Brand: Carter's,Theme: Jungle,Color: Green
https://www.ebay.com/itm/Mini-Tudou-Baby-Musical-Mobile-Crib-with-Music-and-Lights-Timing-Function-Proj/254349552917?hash=item3b386a2d15:g:LpEAAOSwAIddbvNr,"Mini Tudou Baby Musical Mobile Crib with Music and Lights, Timing Function, Proj",$25.99,Free,Color: Blue,Features: Musical,N/A
https://www.ebay.com/c/1001014771,"Disney Winnie the Pooh ""Pooh's ABC""  Musical Mobile ",$24.74,$10.95,Brand: Disney,Color: Multicolor,Features: Musical
https://www.ebay.com/itm/Vintage-Crib-Mobile-Dolly-Toy-Co-Musical-Animal-Shower-Baby-Nursery-Decor-Music/223686682705?hash=item3414c3e851:g:qogAAOSw7vBdkWW1,Vintage Crib Mobile Dolly Toy Co Musical Animal Shower Baby Nursery Decor Music,$10.99,$10.00,Brand: Dolly Toy,Color: Multicolor,Features: Musical
https://www.ebay.com/itm/Skyflight-Penguins-Birds-Hanging-Baby-Mobile-Classroom-Decor-Educational-Art/331802869631?hash=item4d40fdff7f:g:zM0AAOSwoBtW5uoB,Skyflight Penguins Birds Hanging Baby Mobile Classroom Decor Educational Art,$38.00,$10.30,N/A,N/A,N/A
https://www.ebay.com/p/8024000055?iid=323759800207&rt=nc,Moulin Roty Les Jolis Pas Beaux Musical Baby Mobile ,$75.00,Free,Brand: Moulin Roty,Theme: Novelty,Features: Musical
https://www.ebay.com/p/1703879527?iid=233235241834&rt=nc,Raggedy Ann and Andy Musical Mobile - Brahms Lullaby - New,$13.97,$8.13,Color: Blue,Features: Musical,N/A
https://www.ebay.com/itm/Baby-Crib-Mobile-by-Sorrel-Fern-Birds-Clouds-Felt-Ceiling-Decor/273749385148?hash=item3fbcbc1fbc:g:GzcAAOSwuDFcgUPL,Baby Crib Mobile by Sorrel & Fern - Birds & Clouds- Felt Ceiling Decor,$26.00,Free,Color: Gray,N/A,N/A
https://www.ebay.com/itm/Wind-up-Toy-Wooden-Baby-Gift-Baby-Crib-Mobile-Bed-Bell-Holder-Arm/362645352222?hash=item546f58ef1e:m:m83mHXw3ZDg4JMuoaZRNSgg&var=631788990070,Wind-up Toy Wooden Baby Gift Baby Crib Mobile Bed Bell Holder Arm ,$13.99,Free,Brand: Unbranded,Color: Pink,N/A
https://www.ebay.com/itm/DISNEY-POOH-AND-FRIENDS-MOBILE-BABY-Crib-Decor-Winnie-The-Pooh-Crib-Mobile/323908404593?hash=item4b6a720571:g:EpEAAOSwcghddJ8R,DISNEY POOH AND FRIENDS MOBILE BABY Crib Decor Winnie The Pooh Crib Mobile,$22.22,$11.00,Brand: Disney,Color: Green,N/A
https://www.ebay.com/itm/Future-Lawyer-Baby-Crib-Mobile/333160367835?hash=item4d91e7c6db:g:UY0AAOSwn6Jb6HD8,Future Lawyer Baby Crib Mobile,$4.00,$10.50,N/A,N/A,N/A
https://www.ebay.com/itm/Vintage-Musical-Playful-Bearss-Crib-Mobile-by-Pansy-Ellen-Productions/184001631247?hash=item2ad75a140f:g:KewAAOSw509dq4IK,Vintage Musical Playful Bears's Crib Mobile by Pansy Ellen Productions,$10.00,$9.45,Features: Musical,N/A,N/A
https://www.ebay.com/itm/Fisher-Price-Soother-Projector-CALMING-SEAS-Music-Ocean-Light-Nature-Sounds/143321261698?hash=item215e9ce682:g:Y6MAAOSwz-ldIJyX,Fisher Price Soother Projector CALMING SEAS - Music Ocean Light & Nature Sounds,$42.90,$9.06,Brand: Fisher-Price,Theme: Beach & Tropical,Color: White
https://www.ebay.com/p/1930402973?iid=143330589340&rt=nc,CARTER’S JUNGLE Collection MUSICAL Mobile Plays Brahams' Lullaby Auto Shut Off,$21.59,$11.55,Brand: Carter's,Theme: Safari,Features: Musical
https://www.ebay.com/p/5018291609?iid=202764403224&rt=nc,Just Born High Seas MUSICAL MOBILE Blue & Grey Whales & Anchors Brahms Lullaby,$35.99,Free,Brand: Just Born,Theme: Nautical,Color: White
https://www.ebay.com/p/5018291609?iid=202764403224&rt=nc,Just Born High Seas MUSICAL MOBILE Blue & Grey Whales & Anchors Brahms Lullaby,$35.99,Free,Brand: Just Born,Theme: Nautical,Color: White
https://www.ebay.com/itm/Pottery-Barn-Baby-Crib-Mobile-Harper-Lamb-Cream-Color/233370789753?hash=item3655fba779:g:zp0AAOSw~bldnedd,Pottery Barn Baby Crib Mobile Harper Lamb Cream Color ,$15.75,$8.95,Brand: Pottery Barn,Color: White,N/A
https://www.ebay.com/c/894402427,Manhattan Toy Wimmer-Ferguson Infant Stimulation Stim Mobile for Cribs,$5.00,$7.85,Brand: Manhattan Toy,N/A,N/A
https://www.ebay.com/p/1940272249?iid=143204194243&rt=nc,Tiny Love® Meadow Days Take Along Mobile,$22.95,Free,Brand: Tiny Love,Color: Pink,Features: Musical
https://www.ebay.com/itm/Moulin-Roty-Musical-Baby-Mobile-Animals/153249203861?hash=item23ae5d4695:g:p54AAOSwFURb4cpy,Moulin Roty Musical Baby Mobile Animals,$18.00,$15.99,Brand: Moulin Roty,Color: Beige,Features: Musical
https://www.ebay.com/itm/Pottery-Barn-Kids-Lamb-Musical-CRIB-MOBILE-Wooden-Arm-Included/392379715941?hash=item5b5ba75165:g:Q0oAAOSwTaFdUWu2,Pottery Barn Kids Lamb Musical CRIB MOBILE Wooden Arm Included,$30.00,$10.40,Brand: Pottery Barn,Color: White,Features: Musical
https://www.ebay.com/p/1310307990?iid=163827913988&rt=nc,Tiny Love Soothe ‘N Groove Mobile,$16.00,$10.85,Brand: Tiny Love,N/A,N/A
https://www.ebay.com/itm/NEW-IKEA-VIMSIG-MOBILE-In-Box-Planet-Star-Moon-Spaceship-Discontinued/153593930251?hash=item23c2e9620b:g:FgUAAOSw7fVdR5Jt,NEW IKEA VIMSIG MOBILE -In Box -Planet - Star - Moon - Spaceship - Discontinued ,$29.99,$14.93,Brand: IKEA,Theme: Moon & Stars,N/A
https://www.ebay.com/itm/Silver-Colored-Modern-Hanging-Mobile-Pottery-Barn/163825501264?hash=item2624c2c450:g:A1cAAOSw~htc1buI,Silver Colored Modern Hanging Mobile - Pottery Barn,$39.99,$15.42,Brand: Pottery Barn,Color: Silver,N/A
https://www.ebay.com/itm/Vintage-1976-Eden-Beatrix-Potter-Peter-Rabbit-Musical-Crib-Mobile-WORKING-VTG/264348678746?hash=item3d8c68ba5a:g:548AAOSwRJZc9eAj,Vintage 1976 Eden Beatrix Potter Peter Rabbit Musical Crib Mobile WORKING VTG,$20.99,$7.71,Brand: Eden,Features: Musical,N/A
https://www.ebay.com/itm/The-Peanut-Shell-Musical-Crib-Mobile-Grey-Elephants-Clouds-Stars/333325932505?hash=item4d9bc617d9:g:iMMAAOSwrm5deDLX,"The Peanut Shell Musical Crib Mobile Grey Elephants, Clouds, Stars",$42.98,Free,Brand: The Peanut Shell,Theme: Jungle,Color: Gray
https://www.ebay.com/itm/Lambs-Ivy-Disney-Baby-Lion-King-Adventure-Musical-Baby-Crib-Mobile-Blue/333343840972?hash=item4d9cd75acc:g:IqYAAOSwk0Bdj7Ti,"Lambs & Ivy Disney Baby Lion King Adventure Musical Baby Crib Mobile, Blue",$29.19,Free,Brand: Lambs & Ivy,Theme: Jungle,Color: Multicolor
https://www.ebay.com/c/1872880723,Sweet Jojo Musical Mobile For Modern Turquoise Elephant Jungle Baby Crib Bedding,$51.99,Free,Brand: Sweet JoJo Designs,Theme: Jungle,Color: Blue
https://www.ebay.com/itm/Pottery-Barn-Kids-Junior-Varsity-Musical-Mobile-Baby-Crib-Sports/223627521223?hash=item34113d2cc7:g:w2kAAOSwDXpdWD6x,Pottery Barn Kids Junior Varsity Musical Mobile - Baby Crib Sports ,$30.40,Free,Brand: Pottery Barn,Theme: Sports,Color: Multicolor
https://www.ebay.com/itm/Vintage-NEW-IN-BOX-Jolly-Jumper-Plush-T-Shirt-Bears-Crib-Mobile/283556809428?hash=item42054d8ad4:g:1JQAAOSw6ktdG-BF,Vintage NEW IN BOX  Jolly Jumper Plush T-Shirt Bears Crib Mobile ,$18.99,Free,Features: Musical,N/A,N/A
https://www.ebay.com/itm/Mascotopia-Clemson-Baby-Mobile-Clemson-Crib-Mobile/312324549541?hash=item48b7fe6ba5:g:ubAAAOSwC45b7-OW,Mascotopia Clemson Baby Mobile - Clemson Crib Mobile,$52.99,$8.30,Theme: Sports,N/A,N/A
