URL,Title,Price,Shipping,Dynamic Attribute 1,Dynamic Attribute 2,Dynamic Attribute 3
https://www.ebay.com/p/1393225710?iid=233311759373&rt=nc,"Skip Hop Baby Crib Mobile Moonlight & Melodies with Projection, Clouds ",$75.99,Free,Brand: Skip Hop,Theme: Moon & Stars,Color: White
https://www.ebay.com/p/1580109977?iid=223676048555&rt=nc,Bedtime Originals Butterfly Meadow Pink/Purple Plush Owl Stuffed Animal - Jewel,$11.99,Free,Brand: Bedtime Originals,Color: Pink,N/A
https://www.ebay.com/p/1378454522?iid=293120098071&rt=nc,"Glenna Jean Maddie Mobile Arm Cover 54"", Crib, Baby Nursery",$8.88,Free,Brand: Glenna Jean,Color: Beige,Features: Musical
https://www.ebay.com/itm/Tiny-Love-Baby-Toy-Take-Along-Mobile-Animal-Friends-Stroller-Crib-Car-Seat/192445763697?hash=item2ccea95071:g:VTUAAOSwhfdaai0E,Tiny Love Baby Toy Take Along Mobile Animal Friends Stroller Crib Car Seat,$8.99,$7.32,Brand: Tiny Love,N/A,N/A
https://www.ebay.com/itm/Peter-Rabbit-Friends-Musical-Mobile-Beatrix-Potter-0-5-months/264435937081?hash=item3d919c2f39:g:IcIAAOSwy9hdWsYu,Peter Rabbit & Friends Musical Mobile - Beatrix Potter - 0-5 months,$40.00,$10.00,Features: Musical,N/A,N/A
https://www.ebay.com/itm/Sweet-Jojo-Musical-Mobile-For-Pink-Grey-Floral-Polka-Dot-Baby-Crib-Bedding-Set/113836921072?hash=item1a813590f0:g:BMkAAOSwIG1dP61M,Sweet Jojo Musical Mobile For Pink Grey Floral Polka Dot Baby Crib Bedding Set,$42.88,Free,Brand: Sweet JoJo Designs,Color: Gray,Features: Musical
https://www.ebay.com/itm/1983-Vintage-Eden-Beatrix-Potter-PETER-RABBIT-Friends-MUSICAL-Crib-MOBILE/333338455138?hash=item4d9c852c62:g:VqUAAOSwTO9diSQ1,1983 Vintage Eden Beatrix Potter PETER RABBIT & Friends MUSICAL Crib MOBILE,$24.99,$10.13,Brand: Eden Toys,Color: Multicolor,Features: Musical
https://www.ebay.com/itm/Rare-Fisher-Price-Rainforest-Peek-A-Boo-Leaves-Musical-Crib-Mobile-With-Remote/163901282043?hash=item26294716fb:g:Xt8AAOSwW1Bdn9xe,Rare Fisher Price Rainforest Peek-A-Boo Leaves Musical Crib Mobile With Remote,$40.00,$22.99,Brand: Fisher-Price,Theme: Jungle,Features: Musical
https://www.ebay.com/itm/Fisher-Price-Discover-N-Grow-Twinkling-Lights-Projector-Mobile/283557359825?hash=item420555f0d1:g:p4EAAOSw99ddNo9s,Fisher Price Discover N Grow Twinkling Lights Projector Mobile,$29.90,$45.15,Brand: Fisher-Price,N/A,N/A
https://www.ebay.com/c/21024454292,Bedtime Originals Rainbow Unicorn Pink/Gold Plush Unicorn Stuffed Animal - Pearl,$11.99,Free,Brand: Bedtime Originals,Color: Pink,N/A
https://www.ebay.com/itm/Boys-Girls-Baby-Crib-Mobile-Woodland-Night-Nursery-Mobile-Felt-Home-Decoration/312676826893?hash=item48ccfdbf0d:g:edQAAOSwqnZdFcQ4,Boys/Girls Baby Crib Mobile Woodland Night Nursery Mobile Felt Home Decoration,$9.01,Free,Brand: Unbranded,Theme: Woodland,N/A
https://www.ebay.com/itm/Koala-Baby-Moon-Cloud-Heart-Musical-Mobile-Twinkle-Twinkle-Little-Star-Pink-HTF/303245500478?hash=item469ad7203e:g:BggAAOSwybZdSNQF,Koala Baby Moon Cloud Heart Musical Mobile Twinkle Twinkle Little Star Pink HTF,$59.95,Free,Brand: Koala Baby,Theme: Moon & Stars,Color: Pink
https://www.ebay.com/itm/Vtg-50s-60s-Handpainted-Wooden-Mobile-by-Irmi-Baby-Zoo-Working-W-Box/153654352549?hash=item23c6835aa5:g:KU0AAOSwE8BdFPwe,Vtg 50s 60s Handpainted Wooden Mobile by Irmi Baby Zoo Working W/ Box,$10.00,$14.20,Brand: Irmi,Color: Multicolor,N/A
https://www.ebay.com/itm/VNTG-70s-Peter-Rabbit-Eden-Musical-Crib-Mobile-In-Box-Beatrix-Potter-Nursery/133169115775?hash=item1f017f727f:g:6~MAAOSwi~VdecnE,VNTG 70s Peter Rabbit Eden Musical Crib Mobile In Box! Beatrix Potter Nursery,$49.95,$12.95,Brand: Eden,Features: Musical,N/A
https://www.ebay.com/itm/Vintage-RARE-1969-Stahlwood-Toys-Mother-Goose-Fairy-Tale-Mobile-Set-Of-4/333195291658?hash=item4d93fcac0a:g:GokAAOSwY3tc2by~,Vintage RARE 1969 Stahlwood Toys Mother Goose Fairy Tale Mobile Set Of 4,$8.00,$7.90,N/A,N/A,N/A
https://www.ebay.com/p/5031107277?iid=283617619862&rt=nc,Tiny Love 33313024 Soothe n Groove Melodies Mobile Nightlight Blue 0-24 months,$22.19,Free,Brand: Tiny Love,Color: Blue,Features: With Lights
https://www.ebay.com/itm/My-Neighbor-Totoro-baby-mobile-Nursery-decoration-crib-mobile-windbell/113793341247?hash=item1a7e9c973f:g:INYAAOSww9xZAZJ7,My Neighbor Totoro baby mobile Nursery decoration crib mobile windbell,$35.99,Free,Brand: Handmade,N/A,N/A
https://www.ebay.com/itm/Ivory-Crib-Mobile-Movement-Lullaby-Song-Musical-Spinner-Many-Colors-Songs/262270088616?hash=item3d1083f5a8:m:mEmRtXKFk9GjjnQPIpFjo5A&var=561017729118,Ivory Crib Mobile Movement- - Lullaby Song Musical Spinner - - Many Colors Songs,$19.75,$4.75,Features: Musical,N/A,N/A
https://www.ebay.com/p/4011031296?iid=392395901018&rt=nc,Fisher Price Precious Planet 2-in-1 Lights & Sounds Projector Mobile | N8849,$40.00,Free,Brand: Fisher-Price,Features: With Lights,N/A
https://www.ebay.com/itm/Themed-Crib-Mobile-Musical-Movement-Spinner-in-Pure-White-Shipping-HPP/253230893228?hash=item3af5bcc8ac:g:OncAAOSwulJc8uIH,Themed Crib Mobile Musical Movement Spinner in Pure White - Shipping - HPP,$19.75,$3.95,"Theme: TV, Movies & Music",Color: White,Features: Musical
https://www.ebay.com/p/24027517343?iid=193147778139&rt=nc,Vintage Vtg Baby Crib Musical Mobile 80's Sleepy Bedtime Teddy Beddy Bear USA,$8.00,$5.95,Brand: Judi's,Features: Musical,N/A
https://www.ebay.com/itm/Butterfly-Mobile-Ceiling-Hanging-Butterflies-Girl-Nursery-Room-Decorations-Swirl/350782871768?hash=item51ac49d8d8:g:q80AAOSwGYVW~YA6,Butterfly Mobile Ceiling Hanging Butterflies Girl Nursery Room Decorations Swirl,$23.99,Free,Brand: Bugs-n-Blooms,Color: Multicolor,N/A
https://www.ebay.com/itm/Skyflight-Gray-Whale-Mobiles/133195926331?hash=item1f03188b3b:g:eyEAAOSwStpdgCVi,Skyflight Gray Whale Mobiles,$2.00,$4.06,Brand: Skyflight Mobiles,Color: Gray,N/A
https://www.ebay.com/c/1601769344,Sweet Jojo Designs Musical Mobile for Forest Animal Jungle Baby Crib Bedding Set,$18.50,Free,Brand: Sweet JoJo Designs,Theme: Jungle,Color: Green
https://www.ebay.com/itm/Baby-Infant-Crib-Mobile-Bed-Bell-Holder-Musical-Toy-Hanger-Arm-Bracket-Stent-Toy/173822384933?hash=item28789f1b25:g:VLQAAOSw18BcffBF,Baby Infant Crib Mobile Bed Bell Holder Musical Toy Hanger Arm Bracket Stent Toy,$20.99,$1.99,Brand: Unbranded,Theme: Princesses & Fairies,Color: Pink
https://www.ebay.com/itm/1997-Fisher-Price-Magic-Motion-Musical-Crib-Mobile-with-Mirror-71153-RARE/292240389311?hash=item440ae274bf:g:UfMAAOSwvv9ZhODa,1997 Fisher Price Magic Motion Musical Crib Mobile with Mirror 71153 RARE,$10.99,$9.45,Brand: Fisher-Price,Color: Multicolor,Features: Musical
https://www.ebay.com/itm/Fisher-Price-2008-Peek-A-Boo-Leaves-Musical-Rainforest-Mobile-NEW/264501040771?hash=item3d957d9683:g:lmEAAOSwf05dp3xF,Fisher-Price 2008 Peek-A-Boo Leaves Musical Rainforest Mobile! NEW!,$69.95,$17.61,Brand: Fisher-Price,Color: Green,Features: Musical
https://www.ebay.com/itm/Baby-Crib-Mobile-Hanging-Bed-Bell-Holder-Toy-Arm-Bracket-Wind-up-Music-Box/163865223095?hash=item262720dfb7:g:784AAOSwVAxdf6dQ,Baby Crib Mobile Hanging Bed Bell Holder Toy Arm Bracket Wind-up Music Box,$7.99,$1.99,Brand: Unbranded,Color: White,Features: Musical
https://www.ebay.com/p/2254424297?iid=163688209972&rt=nc,Tiny Love Take-Along Baby Mobile - 471006,$19.99,$8.00,Brand: Tiny Love,Theme: Jungle,Features: Musical
https://www.ebay.com/p/2255175308?iid=293275808747&rt=nc,Kids Line Road Map Blue Plush Brahams Lullaby Musical Crib Mobile BHFO 5354,$0.99,$6.99,Brand: Kidsline,Theme: Dogs & Puppies,Color: Blue
https://www.ebay.com/itm/Vintage-Baby-Mobile-1950-Hand-painted-IRMI-Nursery-Wooden-Crib-803-Angel-box/202757610668?hash=item2f354b9cac:g:sKIAAOSw8gRdUXK-,Vintage Baby Mobile 1950 Hand painted IRMI Nursery Wooden Crib 803 Angel box,$34.50,$8.60,Brand: Irmi,N/A,N/A
https://www.ebay.com/p/13030558184?iid=223699377477&rt=nc,Lambs & Ivy Blue Camo/Camouflage Gray Bear Musical Baby Crib Mobile Soother Toy,$39.99,Free,Brand: Lambs & Ivy,Color: Blue,Features: Musical
https://www.ebay.com/itm/Brand-New-Eguchi-Stork-Baby-Bird-Wooden-Mobile-Gorgeous/193095210862?hash=item2cf55f176e:g:J2sAAOSwf0dcy2ey,Brand New Eguchi Stork Baby Bird Wooden Mobile!! Gorgeous!,$55.00,$8.30,N/A,N/A,N/A
https://www.ebay.com/itm/Sweet-Jojo-Designs-Musical-Mobile-for-Pink-Black-Polka-Dot-Baby-Crib-Bedding-Set/202700506027?hash=item2f31e443ab:g:zS0AAOSwMzVbtk3m,Sweet Jojo Designs Musical Mobile for Pink Black Polka Dot Baby Crib Bedding Set,$16.91,Free,Brand: Sweet JoJo Designs,Color: Pink,Features: Musical
https://www.ebay.com/itm/Rotary-Baby-Kids-Crib-Mobile-Bed-Bell-Toy-Wind-up-Music-Box-DIY-Hanging-Gidt-US/192917511342?hash=item2ceac79cae:g:8WYAAOSwi0Rc28Ny,Rotary Baby Kids Crib Mobile Bed Bell Toy Wind-up Music Box DIY Hanging Gidt US,$11.69,Free,Brand: Unbranded,Color: Multicolor,Features: Musical
https://www.ebay.com/itm/Winnie-the-Pooh-Classic-Pooh-Deluxe-Musical-Mobile-Nursery-Decor-Original-Box/264451495217?hash=item3d92899531:g:yeEAAOSwwGNdbXL2,"Winnie the Pooh Classic Pooh Deluxe Musical Mobile, Nursery Decor, Original Box",$45.40,$15.41,Features: Musical,N/A,N/A
https://www.ebay.com/p/28026723193?iid=382657249057&rt=nc,Baby Crib Mobile Bed Bell Holder Toy Hanging Arm Bracket Decoration Xmas Gifts,$6.99,$16.99,Brand: Unbranded,Color: White,N/A
https://www.ebay.com/itm/Ekko-Workshop-Modern-Arc-Desktop-Mobile-Stabile-Modern-Tabletop-Kinetic-Art/272549359796?hash=item3f753530b4:m:mDCLgSj95Amhy7VfOfjOsBg&var=571644347981,Ekko Workshop Modern Arc Desktop Mobile Stabile Modern Tabletop Kinetic Art,$69.00,$15.20,Color: Blue,N/A,N/A
https://www.ebay.com/p/22008175360?iid=223716909391&rt=nc,Just Born High Seas Collection Musical Mobile Whale Blue And Grey Anchors *New*,$42.99,Free,Brand: Just Born,Theme: Nautical,Color: White
https://www.ebay.com/itm/Bedtime-Originals-Jungle-Buddies-Mobile-Brown-yellow-2day-Delivery/264431976463?hash=item3d915fc00f:g:z1oAAOSwlGNdVZIS,Bedtime Originals Jungle Buddies Mobile Brown/yellow 2day Delivery,$32.00,$9.25,Brand: Bedtime Originals,Theme: Jungle,Color: Yellow
https://www.ebay.com/itm/35-Songs-Rotary-Bell-Baby-Mobile-Crib-Newborn-Bed-Toy-Clockwork-Movement/133186599083?hash=item1f028a38ab:g:GrAAAOSwhQRbPt3i,35 Songs Rotary Bell Baby Mobile Crib Newborn Bed Toy Clockwork Movement  \,$6.37,Free,Brand: Unbranded,Color: White,N/A
https://www.ebay.com/itm/Circo-Up-We-Go-Crib-Mobile-girls-decor-owl-bird-rabbit-fox-new/273933282529?hash=item3fc7b22ce1:g:sroAAOSwi05dLq-E,Circo Up We Go Crib Mobile girls decor owl bird rabbit fox new,$29.99,Free,Brand: Circo,Color: Black,N/A
https://www.ebay.com/itm/Wooden-mobile-hanger-diy-holder-mobile-6-arms/113728967615?hash=item1a7ac653bf:g:~uQAAOSw76lb~wrU,"Wooden mobile hanger diy, holder mobile 6 arms",$8.37,$4.51,Brand: Handmade,N/A,N/A
https://www.ebay.com/itm/Sweet-Jojo-Musical-Mobile-For-Grey-Black-And-White-Fox-Baby-Crib-Bedding-Set/202458370483?hash=item2f237591b3:g:gWoAAOSw6xJbtk~l,Sweet Jojo Musical Mobile For Grey Black And White Fox Baby Crib Bedding Set,$51.99,Free,Brand: Sweet JoJo Designs,Color: Gray,Features: Musical
https://www.ebay.com/p/28012047741?iid=401930272955&rt=nc,Sweet Jojo Musical Mobile for Wild West Cowboy Horse Western Baby Crib Bedding,$51.99,Free,Brand: Sweet JoJo Designs,Theme: Cowboy,Color: Brown
https://www.ebay.com/c/1110360099,Carter's Owl Musical Mobile New in Package 0-5 months,$12.83,$12.80,Brand: Carter's,Features: Musical,N/A
https://www.ebay.com/itm/Wooden-mobile-hanger-diy-holder-mobile-4-arms/113728968823?hash=item1a7ac65877:g:fpgAAOSwT-pcCP-i,"Wooden mobile hanger diy, holder mobile 4 arms",$6.44,$4.51,Brand: Handmade,N/A,N/A
https://www.ebay.com/p/2254982953?iid=163752879332&rt=nc,Starlight Dreamshow Baby Night Light White Ceiling Projector Lullaby,$18.91,$14.46,Theme: Moon & Stars,Features: With Lights,N/A
https://www.ebay.com/p/24022369903?iid=332780940745&rt=nc,Fiona Walker England Handmade Organic School Of Fishes Nursery Mobile Baby Decor,$114.99,Free,Color: Multicolor,N/A,N/A
https://www.ebay.com/itm/Nursery-Baby-Girl-Mobile-Tiny-Love-Lady-Bug-Butterflies-Pink-Princess-Take-Along/333342725813?hash=item4d9cc656b5:g:1ikAAOSwgsddTatR,Nursery Baby Girl Mobile Tiny Love Lady Bug Butterflies Pink Princess Take Along,$15.00,$7.85,Brand: Tiny Love,Color: Pink,N/A
https://www.ebay.com/p/1209091866?iid=312801904875&rt=nc,Fisher Price Discover 'n Grow Storybook Projection Soother,$15.00,Free,Brand: Fisher-Price,N/A,N/A
https://www.ebay.com/itm/Brand-NEW-in-Box-PRECIOUS-MOMENTS-Musical-Crib-Mobile-Luv-n-Care/173994720261?hash=item2882e4bc05:g:x4QAAOSwGhBdFk5I,Brand NEW in Box * PRECIOUS MOMENTS Musical Crib Mobile * Luv n' Care,$14.95,$12.54,Brand: Love N Care,Color: Multicolor,Features: Musical
https://www.ebay.com/itm/Celestial-baby-mobile-Moon-and-Stars-crib-mobile-Moon-and-Stars-for-Nursery/273500103114?hash=item3fade061ca:g:L2sAAOSwHt1bvDrb,Celestial baby mobile Moon and Stars crib mobile Moon and Stars for Nursery,$112.67,$5.35,Brand: Handmade,Theme: Moon & Stars,Color: White
https://www.ebay.com/itm/Beatrix-Potter-Peter-Rabbit-Musical-Mobile/323873106744?hash=item4b68576b38:g:zkkAAOSwnnpdQcLt,Beatrix Potter - Peter Rabbit Musical Mobile ,$22.00,Free,Brand: Love N Care,Features: Musical,N/A
https://www.ebay.com/itm/Fisher-Price-Rainforest-Mobile-TOYS-Plush-Frog-Monkey-Parrot-LEAVES-Parts-10pc/123942358552?hash=item1cdb8a4e18:g:00cAAOSw6WNdcaMi,Fisher Price Rainforest Mobile TOYS Plush Frog Monkey Parrot LEAVES Parts 10pc,$14.99,$4.49,Brand: Fisher-Price,Color: Green,N/A
https://www.ebay.com/p/1700842301?iid=293051883512&rt=nc,Sports Bear Music Mobile Attaches To Wall Or Baby Crib NIB Nursery Calming,$37.99,Free,Brand: Summer Infant,Theme: Sports,Features: Musical
https://www.ebay.com/p/13031346920?iid=123718039042&rt=nc,NoJo PLAY BALL MUSICAL MOBILE BASEBALL FOOTBALL SOCCER BASKETBALL ADORABLE NIP,$32.99,Free,Brand: NoJo,Theme: Sports,Color: Multicolor
https://www.ebay.com/itm/Vintage-60s-Hand-Painted-Mobile-IRMI-812-Fairytale-Complete-With-Box-Crib-Mount/183952340677?hash=item2ad469f6c5:g:XO0AAOSwUF1dQ3PP,Vintage 60s Hand Painted Mobile IRMI #812 Fairytale Complete With Box Crib Mount,$18.00,$6.27,Brand: Irmi,N/A,N/A
https://www.ebay.com/itm/Vintage-Dolly-Toys-Wonderful-World-of-Disney-Musical-Crib-Mobile-Mickey-Mouse/233217085705?hash=item364cd25109:g:qqsAAOSwVKhczciA,Vintage Dolly Toys Wonderful World of Disney Musical Crib Mobile Mickey Mouse,$23.50,$10.15,Brand: Disney,"Theme: TV, Movies & Music",Color: Multicolor
https://www.ebay.com/itm/Kids-Baby-Wind-Chime-Bracket-Crib-Hanger-Wood-Mobile-Frame-Handmade-Tools-USA/303213181571?hash=item4698e9fa83:m:mDeS8sQ1CICVrUo0SXmM4Uw&var=602191603149,Kids Baby Wind Chime Bracket Crib Hanger Wood Mobile Frame Handmade Tools USA,$3.79 to $6.26,$2.99,Brand: Unbranded,Theme: Holiday,Color: Brown
https://www.ebay.com/itm/Fisher-Price-Rainforest-Baby-Crib-Mobile-3-Replacement-Leaves-Green-Fabric-PART/273977733687?hash=item3fca587237:g:qosAAOSwWFRbdzBs,Fisher Price Rainforest Baby Crib Mobile 3 Replacement Leaves Green Fabric PART ,$9.99,Free,Brand: Fisher-Price,Color: Green,N/A
https://www.ebay.com/p/1411306801?iid=173946074182&rt=nc,Tiny Love Take-Along Mobile 3 in 1 age 0 - 5m 30 minutes of play,$21.99,Free,Brand: Tiny Love,Theme: Bugs & Insects,Color: Pink
https://www.ebay.com/itm/Fisher-Price-Rainforest-Crib-Mobile-Swing-Replacement-Toys-Toucan-Parrot-Leaf/153483463609?hash=item23bc53cbb9:g:qHQAAOSwO~Jc1bvO,Fisher Price Rainforest Crib Mobile Swing Replacement Toys Toucan Parrot & Leaf,$5.00,$3.78,Brand: Fisher-Price,N/A,N/A
https://www.ebay.com/p/2254299413?iid=300783474398&var=600058199062&rt=nc,WOODEN TOY HANGING FLYING FLAPPING SEAGULL PARROT EAGLE NURSERY BABY MOBILE,$25.74,$18.01,N/A,N/A,N/A
https://www.ebay.com/itm/Baby-Kids-Portable-Rotary-Music-Crib-Mobile-Bed-Bell-Holder-Arm-Bracket/392312853676?hash=item5b57ab14ac:g:Z6kAAOSwp~pdAQgB,Baby Kids Portable Rotary Music Crib Mobile Bed Bell Holder Arm Bracket,$13.87,Free,Brand: MagiDeal,Color: White,Features: Musical
https://www.ebay.com/itm/NW-MUSICAL-Pottery-Barn-Kid-CAR-Transportation-Crib-MOBILE-Wood-ARM-nursery-boy/372740335388?hash=item56c90e271c:g:I2gAAOSwaJBdVtG9,NW MUSICAL Pottery Barn Kid CAR Transportation Crib MOBILE Wood ARM nursery boy ,$34.50,$11.55,Brand: Pottery Barn,Theme: Vehicles,Color: Multicolor
https://www.ebay.com/itm/Baby-crib-mobile-Forest-Frolic-Pk-white-Spin-30-min-5-tunes-Auto-off-No-arm/401903610891?hash=item5d93526c0b:g:bqUAAOSwfW5dj6Sm,Baby crib mobile Forest Frolic. Pk/white. Spin 30 min. 5 tunes. Auto off. No arm,$12.00,Free,Color: White,N/A,N/A
https://www.ebay.com/itm/Fisher-Price-Rainforest-Peek-A-Boo-Leaves-Musical-Crib-Mobile-with-remote/183963334924?hash=item2ad511b90c:g:kV0AAOSwVARdhDz1,Fisher Price Rainforest Peek-A-Boo Leaves Musical Crib Mobile with remote,$50.00,$15.00,Brand: Fisher-Price,Theme: Jungle,Color: Multicolor
https://www.ebay.com/itm/Motor-for-Crib-Mobile-Many-Colors-and-Lullabies-Bed-Time-Lullaby-Spinner-DIY/252418622189?hash=item3ac55282ed:m:mCDVq8shdk1Si3TbhPH1jWw&var=551269067503,"Motor for Crib Mobile, Many Colors and Lullabies - -Bed Time Lullaby Spinner DIY",$23.70,Free,Color: Pink,N/A,N/A
https://www.ebay.com/itm/Tiny-Love-Meadow-Days-Soothe-n-Groove-Baby-Mobile-FREE-SHIPPINGG/123950533228?hash=item1cdc070a6c:g:WAkAAOSw~WJdsVJH,Tiny Love Meadow Days Soothe 'n Groove Baby Mobile - FREE SHIPPINGG,$47.29,Free,Brand: Tiny Love,N/A,N/A
https://www.ebay.com/itm/Kids-Line-Gossamer-Wings-Musical-Mobile-pink-green-white-purple-yellow-gift/233293170407?hash=item36515b46e7:g:Vh4AAOSwENNdNN2i,Kids Line Gossamer Wings Musical Mobile pink green white purple yellow gift ,$8.50,$7.51,Brand: Kidsline,Color: White,Features: Musical
https://www.ebay.com/itm/Circo-Up-We-Go-Musical-Crib-Mobile-Pink-Owl-Bird-Fox-Rabbit-NEW-in-Box-Nursery/153470716682?hash=item23bb914b0a:g:NBwAAOSwf0dcyORr,Circo Up We Go Musical Crib Mobile Pink Owl Bird Fox Rabbit NEW in Box Nursery,$15.99,$13.00,Brand: Tiny Love,Color: Multicolor,Features: Musical
https://www.ebay.com/itm/Pottery-Barn-Baby-Jungle-Animal-Friends-Nursery-Mobile-New-w-wooden-crib-arm/153205690746?hash=item23abc5517a:g:cG0AAOSwHb9btgX8,Pottery Barn Baby Jungle Animal Friends Nursery Mobile New w/wooden crib arm,$59.99,$13.40,Brand: Pottery Barn,Theme: Jungle,Color: Brown
https://www.ebay.com/itm/halo-bassinet-swivel-sleeper-mobile-Very-cute-birds-New-in-box-and-sealed/383170381604?hash=item5936bc0724:g:f38AAOSwBzpdiXLg,halo bassinet swivel sleeper mobile. Very cute birds. New in box and sealed. ,$9.99,$8.95,Brand: Halo,N/A,N/A
https://www.ebay.com/p/1324608958?iid=283559802456&rt=nc,Lambs & Ivy Bow Wow Buddies Blue Dog Sports Theme Musical Baby Crib Mobile,$35.00,$7.85,Brand: Lambs & Ivy,Theme: Sports,Color: Blue
https://www.ebay.com/itm/Paddington-Bear-Theme-Nursery-Musical-Mobile-for-Crib/283584602402?hash=item4206f5a122:g:iyMAAOSwOFFdWaf1,Paddington Bear Theme Nursery Musical Mobile for Crib,$12.99,$15.00,Features: Musical,N/A,N/A
https://www.ebay.com/p/2290238256?iid=223121867044&rt=nc,Bedtime Originals Little Rascals Window Valance,$21.99,Free,Brand: Bedtime Originals,Color: White,N/A
https://www.ebay.com/itm/Fisher-Price-Rainforest-Crib-Mobile-Replacement-Frog-Bird-Plush-Hanging-Toys/264493387278?hash=item3d9508ce0e:g:kaEAAOSwFQVdni-g,Fisher Price Rainforest Crib Mobile Replacement Frog Bird Plush Hanging Toys,$9.99,Free,Brand: Fisher-Price,Color: Green,N/A
https://www.ebay.com/c/6032335806,"Authentic Models A-Cup Mobile with 4 Colorful Wood J-Yacht, Sailboats Nautical",$25.89,$7.70,Brand: Authentic Models,Theme: Nautical,Color: Multicolor
https://www.ebay.com/itm/West-Elm-Pottery-Barn-Kids-Crib-Mobile-Multi-Colored-Pom-Pom-s-New-With-Tag/283645506096?hash=item420a96f230:g:r7QAAOSwwS5dp4Ma,West Elm Pottery Barn Kids Crib Mobile Multi Colored Pom Pom’s New With Tag,$17.00,$10.40,Brand: Pottery Barn,Color: Multicolor,N/A
https://www.ebay.com/itm/Baby-Rattles-Crib-Mobiles-Toy-Holder-Rotating-Mobile-Bed-Musical-Box-Projection/392351877200?hash=item5b59fe8850:m:m-tncmKy-XgW7l0Gs-M_N-Q&var=661353644148,Baby Rattles Crib Mobiles Toy Holder Rotating Mobile Bed Musical Box Projection,$39.99,$2.00,Brand: Unbranded,Features: Musical,N/A
https://www.ebay.com/itm/Fisher-Price-Rainforest-Peek-A-Boo-Leaves-Musical-Crib-Mobile-with-remote-jungle/283668838171?hash=item420bfaf71b:g:x5IAAOSw-uhdxYQV,Fisher Price Rainforest Peek-A-Boo Leaves Musical Crib Mobile with remote jungle,$39.99,$19.99,Brand: Fisher-Price,Theme: Jungle,Color: Multicolor
https://www.ebay.com/itm/Baby-Musical-Crib-Mobile-Rattle-w-Timing-Function-Projector-Lights-150-Melodies/264437570453?hash=item3d91b51b95:g:WBQAAOSwxZVdXOQI,Baby Musical Crib Mobile Rattle w/ Timing Function Projector Lights 150 Melodies,$22.98,$0.99,Brand: Unbranded,Theme: Princesses & Fairies,Color: Beige
https://www.ebay.com/itm/Music-Box-Movement-for-Crib-Mobile-Custom-Colors-Many-Lullaby-Children-Songs-2/263033789654?hash=item3d3e091cd6:m:mHAwegqypbboGW5fB3JQZAw&var=562036761404,"Music Box Movement for Crib Mobile, Custom Colors, Many Lullaby Children Songs 2",$19.75,$4.75,Features: Musical,N/A,N/A
https://www.ebay.com/p/3002468884?iid=352710279662&rt=nc,Winfun 3-in-1 Busy Bee Mobile Multi-color,$26.02,Free,Brand: Winfun,Color: Multicolor,Features: Musical
https://www.ebay.com/p/22034964917?iid=153708329966&rt=nc,New Lambs & Ivy Magic Unicorn White/Pink Musical Baby Crib Mobile FREE Shipping,$42.99,Free,Brand: Lambs & Ivy,Theme: Farm,Color: White
https://www.ebay.com/itm/POTTERY-BARN-KIDS-PLANE-AIRPLANE-CRIB-MOBILE-MUSICAL-Music-Works-Great-5-Planes/254370582620?hash=item3b39ab105c:g:n1oAAOSwWZJdi9~h,POTTERY BARN KIDS PLANE AIRPLANE CRIB MOBILE MUSICAL Music Works Great 5 Planes,$49.00,$7.89,Brand: Pottery Barn,Theme: Nautical,Color: Multicolor
https://www.ebay.com/itm/Universal-Wooden-stand-arm-holder-for-Baby-crib-bed-Mobile-Hanger-DIY-kit/171570536506?hash=item27f266a03a:g:DX4AAOSwkNZUgjd0,Universal Wooden stand / arm / holder for Baby crib bed Mobile Hanger - DIY kit,$32.99,$11.99,N/A,N/A,N/A
https://www.ebay.com/p/22034964917?iid=153708329966&rt=nc,New Lambs & Ivy Magic Unicorn White/Pink Musical Baby Crib Mobile FREE Shipping,$42.99,Free,Brand: Lambs & Ivy,Theme: Farm,Color: White
https://www.ebay.com/itm/POTTERY-BARN-KIDS-PLANE-AIRPLANE-CRIB-MOBILE-MUSICAL-Music-Works-Great-5-Planes/254370582620?hash=item3b39ab105c:g:n1oAAOSwWZJdi9~h,POTTERY BARN KIDS PLANE AIRPLANE CRIB MOBILE MUSICAL Music Works Great 5 Planes,$49.00,$7.89,Brand: Pottery Barn,Theme: Nautical,Color: Multicolor
https://www.ebay.com/itm/Universal-Wooden-stand-arm-holder-for-Baby-crib-bed-Mobile-Hanger-DIY-kit/171570536506?hash=item27f266a03a:g:DX4AAOSwkNZUgjd0,Universal Wooden stand / arm / holder for Baby crib bed Mobile Hanger - DIY kit,$32.99,$11.99,N/A,N/A,N/A
https://www.ebay.com/itm/1Set-Mobile-Newborn-Baby-Pram-Hanger-Crib-Wooden-Frame-Crafts-Baby-Room-Decor-US/123809059937?hash=item1cd3985461:m:mDeS8sQ1CICVrUo0SXmM4Uw&var=424489141551,1Set Mobile Newborn Baby Pram Hanger Crib Wooden Frame Crafts Baby Room Decor US,$5.63 to $8.45,$1.59,Brand: Unbranded,N/A,N/A
https://www.ebay.com/itm/Pewter-Guardian-Angel-with-Dangling-Noahs-Ark-Crib-Ornament-3-Inch/312159484656?hash=item48ae27baf0:g:j0IAAOSwE-xbH~K0,"Pewter Guardian Angel with Dangling Noahs Ark Crib Ornament, 3 Inch",$20.37,Free,N/A,N/A,N/A
https://www.ebay.com/itm/Crib-Natural-Wooden-Mobile-Bed-Bell-Baby-Room-Rattle-Toys-Nursery-Decor-Crafts/192895531173?hash=item2ce97838a5:m:mh07XQirgHpZ8rLMUlT1Jpw&var=493057877219,Crib Natural Wooden Mobile Bed Bell Baby Room  Rattle Toys Nursery Decor Crafts,$16.99,Free,Brand: Unbranded,N/A,N/A
https://www.ebay.com/p/2177100828?iid=302463322756&var=601292204788&rt=nc,Red kite Soothing Musical Night Light With Lullabies - Unicorn,$16.67,$16.26,"Theme: TV, Movies & Music",Features: Musical,N/A
https://www.ebay.com/itm/Vintage-Eden-Peter-Rabbit-Friends-Musical-Mobile-Soft-Plush-w-Box-Instruction/303256310033?hash=item469b7c1111:g:DZcAAOSwpIJdWH1s,Vintage Eden Peter Rabbit + Friends Musical Mobile Soft Plush w/ Box Instruction,$44.20,$16.17,Brand: Eden,Features: Musical,N/A
https://www.ebay.com/itm/Wooden-Rotating-Clamp-Arm-Hanging-Wool-Felt-Unicorn-Crib-Mobile-Bed-Bell-Toys/192894110366?hash=item2ce9628a9e:m:mn1DIbU4-DmB4EOHKCW8Cnw&var=493055382380,Wooden Rotating Clamp Arm Hanging Wool Felt Unicorn Crib Mobile Bed Bell Toys,$25.09,Free,Color: Pink,N/A,N/A
https://www.ebay.com/itm/Sweet-Jojo-Designs-Navy-Blue-and-Lime-Green-Stripe-Musical-Baby-Crib-Mobile/333364004143?hash=item4d9e0b052f:g:nR0AAOSw1QpdkPTF,Sweet Jojo Designs Navy Blue and Lime Green Stripe Musical Baby Crib Mobile ,$29.99,$8.75,Brand: Sweet JoJo Designs,Color: Orange,Features: Musical
https://www.ebay.com/itm/Brand-New-Pink-Horse-Carousel-Baby-Mobile-Self-Rotating-Australian-Design/183402743720?hash=item2ab3a7c7a8:g:j~EAAOSw3JRbhMqv,"Brand New Pink Horse Carousel Baby Mobile. Self Rotating, Australian Design",$10.27,$10.27,N/A,N/A,N/A
https://www.ebay.com/itm/Tat-Tat-Circula-Mobile-Color-Multi-colored/254017761724?hash=item3b24a371bc:g:T2MAAOSwusdcDAjc,Tat Tat Circula Mobile Color: Multi-colored,$33.99,Free,Color: Multicolor,N/A,N/A
https://www.ebay.com/p/23014975118?iid=352793112603&rt=nc,Tiny Love Tiny Princess Tales Take Along Mobile Pink,$32.49,Free,Brand: Tiny Love,Theme: Safari,Color: Pink
https://www.ebay.com/p/1900023622?iid=233233659616&rt=nc,Dr. Seuss by Trend Lab Cat in the Hat musical mobile Brahms Lullaby New IOB,$41.00,Free,Brand: Trend Lab,Theme: Cats & Kittens,Color: White
https://www.ebay.com/itm/Ceramic-Teddy-Bears-Mobile-3-bears-5-ea-Baby-Nursery-Circus-Woodland-Decor/113716415695?hash=item1a7a06cccf:g:c-IAAOSw86Nb60gX,"Ceramic Teddy Bears Mobile 3 bears 5"" ea Baby Nursery Circus Woodland Decor ",$10.00,$8.30,Theme: Woodland,Color: Brown,N/A
